COGID	Amharic	Argobba	Chaha	Endegagn	Ezha	Geez	Gumer	Gura	Gyeto	Harari	Inor	Kistane	Mesqan	Muher	Silte	Tigre	Tigrigna	Wolane	Zway
458-7							x a pː a ʒ a												
459-7							ʒ ɨ s ə ə												
486-7							pː s												
607-7							ʒ a ʒ w ɨ												
609-7							ʒ ɨ x ɨ												
10-7							k ɨ k ɨ												
15-7							ʒ ɨ pː ɨ m												
18-7							pː ɨ k g												
73-7							s a ʒ j a ɨ												
76-7							m w j s ɨ												
110-7							x ɨ k												
121-7							ʒ ɨ k a												
152-7							m ɨ												
167-7							ɨ g a												
255-7							k w s s												
297-7							pː a s												
299-7							pː a s												
338-7							m a m ɨ s												
342-7							m e pː ɨ												
344-7							k a s a m												
410-7							s ɨ ɨ ə												
540-7							s k ɨ												
550-7							pː a pː ɨ ɨ s												
153-7							w s s ɨ												
219-7							a pː ɨ x												
250-7							s a k												
301-7							k ə s a s ɨ												
326-7							m ə												
74-7							w a pː a												
120-7							ɨ pː												
122-7							k ɨ s ɨ												
220-7							s a w ɨ s												
245-7							k a s a a												
300-7							x ɨ pː												
341-7							k ə pː ə m ə												
549-7							ʒ a s ɨ k ə												
610-7							m ɨ k ɨ x												
643-7							s												
118-7							s a ʒ a												
221-7							pː ə pː ə ə												
420-7							ʒ ə w ɨ x												
455-7							ʒ m ɨ												
495-7							s k												
61-8								ə m											
63-8								ʔ a b ɨ m											
107-8								g a m r a											
112-8								a m ə g a											
331-8								ɨ g ɨ s											
377-8								b ɨ kʼ ə ə											
381-8								ʔ a s											
417-8								ɨ											
451-8								s ə b a m											
454-8								ʔ a s ɨ											
484-8								s ɨ ə ɨ s m											
535-8								ʔ a s ɨ r											
543-8								s ə s m											
593-8								ʔ a m s											
640-8								m a a											
1-8								ə b ə r ə m											
65-8								b ɨ m											
163-8								s ə s ə											
212-8								ʔ ə											
244-8								ʔ a b ə											
248-8								m ɨ r a											
293-8								b ə ə s											
373-8								kʼ ɨ m a r											
408-8								b ə ɨ ə											
414-8								ɨ b a ə s											
601-8								ʔ ə r ə ə											
642-8								ʔ ɨ b a s											
60-8								ə b ə s ə m											
115-8								ʔ ə a a											
209-8								s ɨ m ɨ											
242-8								ʔ a m ɨ s m											
415-8								s ɨ a a m											
450-8								ɨ ə											
490-8								b ə p s ə											
638-8								s ɨ n ə											
645-8								a a r											
75-8								ʔ a m b ɨ r											
160-8								s ə r ə kʼ											
208-8								ʔ ɨ n ə s ə											
214-8								ʔ a b											
218-8								ʔ ɨ n ɨ ɨ											
378-8								ʔ a n g ə m											
379-8								ʒ ə b ə											
409-8								g m ə ə											
497-8								m ə n											
598-8								b ɨ ə h											
646-8								h a a ə											
164-8								b ə kʼ ə m											
210-8								ʒ ə a a ə											
215-8								ʔ a b h b ə ə											
256-8								m m a											
285-8								m ɨ s a											
332-8								ʔ ə g ɨ r											
380-8								ʔ ə a ɨ a											
412-8								s a h ɨ n											
496-8								s ə r s ə a b m											
64-8								a b ə											
67-8								s ɨ r											
169-8								a ə r ə ɨ ə ə											
251-8								b ɨ h ə											
294-8								m s ə											
461-8								b ə											
547-8								s ɨ ɨ a m											
597-8								ʔ m ə n ə ə a											
655-8								m ɨ ʃ m											
7-8								ʔ a s g a											
158-8								ə ə m s											
168-8								ʔ ɨ m a r											
296-8								s ə h a											
374-8								b ə s s s ə											
385-8								s ɨ b ə m											
500-8								h ɨ m ɨ r											
6-8								m ə r kʼ a m a											
17-8								ʔ ə a ɨ r											
123-8								ʃ ə m ə											
252-8								n ə b ə b ə m											
421-8								b ɨ ʃ ə											
448-8								a ə s a a s ə n b ə ə											
449-8								ʔ a ʒ ə											
545-8								a ɨ n ə											
596-8								n ə g ə											
653-8								b ə s ɨ m											
4-8								g ɨ h ə											
8-8								ə ə b ə s ə											
254-8								ɨ ɨ m a a											
290-8								ʔ a g ə s ə											
339-8								b ə kʼ ɨ r											
460-8								a ɨ a											
489-8								b s ə s s m a a											
552-8								ɨ ɨ											
652-8								ʔ ə g ə ʒ											
3-8								b ɨ n ə											
119-8								ʔ a n g a s a											
298-8								h ɨ m											
340-8								g s ə s ə											
458-8								ə n g ə b ə											
459-8								ʔ a s ə											
607-8								ʔ ə b s a											
609-8								ʔ ɨ g a											
10-8								b ɨ kʼ a											
15-8								ʔ ɨ n ɨ m											
18-8								n ɨ kʼ ə ʃ ə											
73-8								s ə b ə r ə ə											
76-8								m s ə s a											
121-8								g ɨ kʼ ə											
167-8								g ɨ s ə											
255-8								ə s ə s s ə											
297-8								g ə n ə ə											
299-8								g ə n ə ə											
338-8								m ə m ɨ s											
342-8								m ə n a											
344-8								s ə s ə m											
410-8								s a r ɨ											
540-8								s b a											
550-8								s ə n s ɨ r											
219-8								g ə p a ʒ											
250-8								kʼ ə g ə											
301-8								kʼ ə s ə r a											
74-8								g s ə p ə											
120-8								a n g a											
122-8								ə a s a											
220-8								s ə s a s											
245-8								s ə s ə ə											
300-8								ɨ ɨ n											
341-8								kʼ ə n ə m ə m											
549-8								g ə b a a ə ə											
610-8								m ɨ r ə a r											
643-8								g											
118-8								s ə a ə											
221-8								r ə p ə r ə											
420-8								ʔ ə ɨ a g											
455-8								ʔ m a											
495-8								s g											
498-8								m ə s ə ə ə m											
61-9									d ə m										
63-9									ʔ a f ə m										
107-9									g a m ə ə a										
112-9									d a f ə n a										
331-9									n ə g a s										
377-9									f ə a ə ə ə										
381-9									ʔ a g ə										
417-9									ə z										
451-9									s ə f a										
454-9									ʔ a f ə										
484-9									s ə ʒ ə s										
535-9									ʔ a s ə										
543-9									s ə s										
593-9									ʔ a m j s										
640-9									m a										
1-9									d ə f ə ə										
65-9									f ə ʔ										
163-9									s ə f ə										
212-9									ʔ ə n										
244-9									ʔ a ʒ ə										
248-9									m ə ə a										
293-9									f ə ə z										
373-9									a ə m a ə										
408-9									f ə g a										
414-9									d ə f a j ə ə a										
601-9									ʔ ə ə ə										
642-9									ʔ ə f a s										
60-9									n ə f ə s ə										
209-9									s ə m ə										
242-9									ʔ a m ə s										
415-9									z ə n a f										
490-9									f ə p ɨ										
638-9									s ə n ə										
645-9									a a ə										
75-9									ʔ a m f ə ə										
160-9									d ə ə a										
208-9									ʔ ə n a w ə ə										
214-9									ʔ a f										
218-9									ʔ ə n z ə										
378-9									ʔ a n g ə										
379-9									ʒ ə f ə										
409-9									g ə ə g ə										
497-9									ə n										
598-9									x j ə ə										
646-9									ʔ a x ə										
164-9									f ə f ə										
210-9									ʒ ə a ə ə ə ə										
215-9									ʔ a f ə j ə										
256-9									ə m a										
285-9									m ə d a d										
332-9									ʔ ə g ə g										
380-9									ʔ ə ɨ ɨ										
412-9									s a z ə n										
496-9									s ə g s ə n f ə										
64-9									d a f ə										
67-9									w ə										
169-9									n ə z ə z ə ə										
251-9									f ə z ə										
294-9									m z ə j										
461-9									f ə										
547-9									w ə z a										
597-9									ʔ ə ə ə ə ə										
655-9									m ə j										
7-9									ʔ a ʒ g a										
168-9									ʔ ə m a										
296-9									z ə z ə										
372-9									f ə n f ə										
374-9									f ə a j d ə										
375-9									s ə f										
385-9									w ə f ə										
411-9									ə g a ə										
500-9									ʔ ə m ə g										
541-9									a ə f z n										
6-9									m ə s f a m a										
17-9									ʔ ə a ə ə										
113-9									f ə ɨ ə										
123-9									s ə m ə										
252-9									g ə ʒ ə f ə										
421-9									f ə f ə										
448-9									j ə p a n s ə n ʒ ə										
491-9									d z n g ə										
545-9									x ə n ə										
596-9									n ə g ə										
653-9									f ə ʒ ə										
4-9									g j g ʔ ə										
8-9									a ə f ə s ə										
254-9									z ə m a										
339-9									f ə ə ə										
489-9									f ə ə s z m a										
552-9									z ə										
652-9									ʔ ə ə ə										
119-9									ʔ a n g a f a										
298-9									z ə										
340-9									g a ə ʒ ə										
458-9									d ə n g ə a ə										
459-9									ʔ a ʒ ə ə										
486-9									n ə f ə a ə										
607-9									ʔ ə f w a										
609-9									ʔ ə x a										
10-9									f ə a ə ə										
15-9									ʔ ə n ə										
18-9									n ə j ə ə										
73-9									f ə f ə ə ə										
76-9									m w ə s a										
110-9									d ə ʒ a										
121-9									ə f ə										
167-9									g ə j ə										
255-9									a w ə g ə ə										
297-9									g ə n ə s										
299-9									g ə n ə s										
338-9									ə ə s										
342-9									m ə n a										
344-9									a ə s ə m										
550-9									z ə n z ə g										
612-9									ʔ a ə a										
219-9									g ə p a										
301-9									ʒ ə p ə a										
74-9									g w ə p ə										
120-9									d a n g a										
220-9									f ə w a p										
245-9									ə ə w ə ə										
300-9									x ə n										
341-9									a ə n ə m ə										
610-9									m ə ə a ə										
118-9									s ə n ə										
221-9									p ə p ə ə										
420-9									ʔ ə z a										
61-10										d ə w									
63-10										ʔ aː tʼ a									
107-10										g aː w tʼ aː									
112-10										d aː b ə m aː									
331-10										m ɨ g ħ m									
377-10										b ə kʼ l ə									
381-10										ʔ aː ħ									
417-10										r u ʔ									
451-10										m ə b b									
454-10										ʔ aː ħ ɨ a									
484-10										m ɨ b ɨ m									
535-10										ʔ aː m ɨ r									
543-10										m a tʼ									
593-10										ʔ aː ħ m									
640-10										w aː									
1-10										d ə b ə r ə s									
65-10										tʼ u b									
163-10										m ə tʃʼ a									
212-10										ʔ ħ m									
244-10										ʔ aː r b ə									
248-10										w u l a									
293-10										f ə r ə ħ									
373-10										kʼ ɨ aː r									
408-10										b a r aː a									
414-10										d ə b aː kʼ ə									
601-10										ʔ ə r a b									
115-10										b a w									
209-10										m ɨ b u									
242-10										ʔ aː b ɨ m									
415-10										ʔ ɨ m aː b									
490-10										b ə b									
160-10										ħ ə r ə kʼ									
208-10										ʔ a m kʼ w ə a									
218-10										ʔ a ʔ i									
378-10										ʔ aː t g ə b									
379-10										b ə b ə									
497-10										b ə t									
598-10										b ħ ʔ									
646-10										ʔ aː									
164-10										b ə b a s									
210-10										ʔ ə aː w a g									
256-10										b u b aː									
285-10										ɨ tʼ aː d									
380-10										ʔ a aː u aː									
412-10										m aː ħ a m									
64-10										d aː f a									
169-10										b a r ə ʔ ə w									
461-10										b ə									
547-10										w ʔ aː									
411-10										b ə r a									
541-10										aː ə f a t									
113-10										b u t a									
123-10										s w a s									
491-10										d a t dʒ ə b									
254-10										i a									
339-10										b ə kʼ a l									
602-10										a t									
2-10										b u dʒ a									
213-10										ʔ a r aː tʼ									
647-10										b ə tʼ ə w a									
211-10										w a ħ i									
328-10										ʃ ə b ə b ə									
333-10										a ħ a r									
612-10										ʔ aː r b b									
109-10										dʒ ħ m ħ									
289-10										b i tʼ a									
286-10										tʼ ə s									
418-10										b ə r b r									
615-10										w w									
62-10										f ə b aː s									
288-10										s a ʔ									
416-10										kʼ ə									
456-10										w a m ə ə b ə									
509-10										ʔ a r r a									
5-10										g ə b									
61-11											ə								
63-11											ʔ a f a								
107-11											g a ə r a								
112-11											a b ə n a								
331-11											n a g a s								
377-11											b a ə ə ə								
381-11											ʔ a h								
417-11											r n								
451-11											r ə b a								
454-11											ʔ a h a								
484-11											r a b a r								
535-11											ʔ a ʒ a r								
543-11											r e r t								
593-11											t a a r								
640-11											a								
1-11											ə b ə r ə								
65-11											f a t								
163-11											r ə r ə								
212-11											ʔ ə n								
244-11											ʔ a b ə								
248-11											a r a								
293-11											f ə ə n								
373-11											ə a a r								
408-11											b ə ʔ a a								
414-11											a b a ə								
601-11											ʔ ə r e ʔ								
642-11											n a f a a								
60-11											n ə f ə r ə								
115-11											m ə b a								
209-11											r a a								
242-11											ʔ a a r								
450-11											n ə								
490-11											f ə p a								
638-11											r ɨ n ə								
645-11											ə a r								
75-11											ʔ a b a r								
160-11											p ə r ə ə								
208-11											a n ə e ə a								
214-11											a b								
218-11											a n ʒ a								
378-11											ʔ a n g ə t								
379-11											ʒ ə f ə m								
409-11											g a t ə								
497-11											t ə n								
598-11											t s ə								
646-11											a x ə a								
164-11											b ə b ə								
210-11											ʒ ə x e ə a								
215-11											t a f ʔ b ə								
256-11											t a ə a								
285-11											a t a								
332-11											ʔ ə g a r								
412-11											s a h a n								
496-11											s ə r b ə a b								
64-11											a b ə								
67-11											p a r								
169-11											n ə r ə n ə								
251-11											f h								
294-11											e ə								
461-11											f ə								
547-11											h a n a t								
597-11											m a ə n ə a a								
655-11											a ʔ t								
7-11											a b g a								
168-11											ʔ a a r								
296-11											h ə h a								
372-11											b ə n f ə r								
374-11											b ə h e ə ə								
375-11											r ə b								
385-11											p a f ə t								
500-11											ʔ a m a r								
541-11											ə ə h a n								
6-11											m ə r b a m a								
17-11											ʔ ə x a r								
252-11											n ə b ə b ə								
421-11											b a f ə								
448-11											t ə p a a ə ə n b ə								
449-11											ʔ a ʒ ə m								
491-11											a n g ə t								
545-11											x a n ə								
596-11											n ə g ə								
653-11											b ə r a								
4-11											g a ʔ m ə								
106-11											m ə t a								
254-11											r a a								
339-11											b ə ʔ a r								
460-11											n ɨ a								
489-11											b ə ə r r m a								
652-11											ʔ ə t ə ə								
3-11											t a n ə								
119-11											m a n g a f a								
298-11											h ə a								
340-11											g ə b ə								
458-11											ə n g ə b ə								
486-11											n ə f ə a ə								
607-11											m ə b r a								
609-11											ʔ a x a								
15-11											b a n a a								
18-11											n a ʔ ʔ ə								
73-11											b ə b ə r ə								
76-11											ə n a								
110-11											a b a								
121-11											t a n ə								
167-11											g a j ə								
255-11											ə r ə n ə ə								
297-11											g a n ə r a								
299-11											g a n ə r a								
342-11											ə n a								
344-11											ə ə r ə								
550-11											r ə n n a r								
109-11											t a h								
153-11											h ə t ə t a a								
219-11											g ə p a t								
250-11											p ə t ə								
301-11											b a p ə r a								
594-11											d a								
122-11											ə a p a								
220-11											p ə p a p								
300-11											x a n								
341-11											ə ə n ə ə								
610-11											a r ə a r a								
643-11											t ə								
221-11											r ə p ə r ə a								
61-12												d ə m							
63-12												ʔ a tʼ ɨ m							
107-12												g ə m ə r a							
112-12												d ə b ə n a							
331-12												n ə g w s							
377-12												b ə ə r r							
381-12												ʔ a d							
417-12												r ə z							
451-12												s ə b a m							
454-12												ʔ a r ɨ r							
484-12												s ɨ dː ɨ s m							
535-12												ʔ a s ɨ r							
543-12												s ə s							
593-12												ʔ a m ə s							
640-12												m a a							
1-12												d ə b ə r ə							
65-12												f ə b							
163-12												s ə f ə							
212-12												ʔ ə n							
244-12												ʔ a r b ə							
248-12												m ə r a							
293-12												f ə r ə z							
373-12												ə ɨ m a r							
408-12												b ə r a							
414-12												d ə b a ə							
601-12												ʔ ə r dː							
642-12												n ɨ f a s							
60-12												n ə f ə s ə							
115-12												ʔ ə b							
209-12												s ɨ m ə							
242-12												ʔ a m ɨ s m							
415-12												z ɨ n a b							
450-12												z ə r							
490-12												f ə f a							
638-12												s ə r m							
645-12												a a r							
75-12												ʔ a m b ɨ r							
160-12												d ə r ə							
208-12												ʔ a n ə w ə							
214-12												ʔ a b							
218-12												ʔ ɨ z z ɨ							
378-12												ʔ a g ə b							
379-12												dː ə f ə							
497-12												b ə z							
598-12												ʔ tʃʼ ə dː							
164-12												b ə m ə							
210-12												z ə a a ə							
215-12												ʔ a f b b ə							
256-12												b ə m a							
285-12												m ɨ tʼ a d							
332-12												ʔ ə g ɨ r							
380-12												ʔ ə a w a							
412-12												s ə ə ə n							
496-12												s ə r s ə dː							
64-12												d a f ə							
67-12												tʃʼ ɨ r							
169-12												b ə r ə z ə							
251-12												f ə f							
294-12												m w ə							
461-12												f tʃʼ							
547-12												tʃʼ ɨ z a m							
597-12												ʔ ə m ə ə ə							
655-12												m ɨ f m							
7-12												ʔ a r g a							
168-12												ʔ ɨ m a r							
296-12												z ə a							
372-12												b ə n f ə r							
374-12												b ə r s r							
385-12												tʃʼ ɨ f ə m							
500-12												ʔ ə m ɨ r							
6-12												m ə r b a m a							
113-12												b ə n							
123-12												d ə m ə m							
330-12												a ə r d							
421-12												b ɨ d ə							
448-12												b ə d a w s ə b ə							
449-12												ʔ a ə ə							
491-12												d ɨ n g ə b							
545-12												a ɨ z ə							
596-12												n ə g ə							
653-12												b ə r ə							
4-12												s ɨ r dː ə							
8-12												a ə b ə s							
106-12												m ə x a							
460-12												a d ə							
552-12												z ə							
602-12												m ɨ n							
2-12												b b ə							
3-12												tʃʼ ɨ z ə							
119-12												ʔ a z s a s a							
213-12												ʔ a r a d							
340-12												s tʃʼ ə ə ə							
458-12												d ə z s ə dː ə							
607-12												ʔ ə m tʃʼ a							
609-12												ʔ ə a a							
647-12												b ə f ə w							
10-12												tʼ ɨ ə ə r							
110-12												d ə dː ə							
152-12												ʔ a d o							
211-12												w ə x ə tː							
255-12												ə tʃʼ ə ə ə							
297-12												s ə z ə r							
299-12												s ə z ə r							
328-12												s ə dː ə b ə							
333-12												m ə g ə r							
334-12												ʔ a m b ə b a							
338-12												b ə m ɨ r							
410-12												ə a r ɨ							
540-12												r ə b a							
109-12												g ə n d							
153-12												w ə w ə n ɨ							
289-12												b ə f							
326-12												w ə o							
594-12												g ɨ z							
549-12												m ə tʃʼ a m a s							
643-12												g ə							
62-12												f ə b							
498-12												m ə d ə s ə m							
509-12												k a r							
5-12												g b							
61-13													d ə m						
63-13													ʔ a f ɨ m						
107-13													g a m ə r a						
112-13													d a b ə n a						
331-13													n ɨ g u s						
377-13													b ə kʼ ə ə						
381-13													ʔ a d						
417-13													r z						
451-13													s ə b a						
454-13													ʔ a h ɨ r						
484-13													s ɨ dː ɨ s b						
535-13													ʔ a s ɨ r						
543-13													s ə s						
593-13													ʔ a m s						
640-13													m a a						
1-13													d ə f ə r ə						
65-13													f u						
163-13													s ə h ə						
212-13													ʔ n						
244-13													ʔ a r b ə						
248-13													m r a						
293-13													f ə r ə z						
373-13													kʼ ɨ m a r						
408-13													b ə r a						
414-13													d ə f a ə						
601-13													ʔ ə r						
642-13													n ɨ f a s						
60-13													n ə ʔ ə s ə						
115-13													ʔ ə ʔ a						
209-13													s ɨ m						
242-13													ʔ a m ɨ s b						
415-13													z ɨ r a b						
450-13													z ə r						
490-13													f ə f a						
638-13													s ɨ r ə						
645-13													kʼ a r						
75-13													ʔ a m b						
160-13													d ə r ə kʼ						
208-13													ʔ ɨ n kʼ ʔ ə a						
214-13													ʔ a f						
218-13													ʔ ɨ z ɨ ɨ						
378-13													ʔ a n g ə b						
379-13													dː ə f ə						
409-13													s ə b ə r						
497-13													b ə n						
598-13													ʔ i ə						
646-13													ʔ a b ə						
164-13													b ə f ə						
210-13													ə a a						
215-13													ʔ a f b ə						
256-13													b m a						
285-13													m ɨ d a d						
332-13													ʔ ə n ɨ r						
380-13													ʔ a a u a						
496-13													s ə r s ə a b						
67-13													w ɨ r						
169-13													b ə r ə z ə m						
251-13													f e kʼ						
294-13													m u kʼ						
461-13													f h						
547-13													w ɨ z a						
597-13													ʔ ə m ə e ə						
655-13													m ɨ f b						
7-13													ʔ a r g a						
158-13													kʼ ə m s						
168-13													ʔ ɨ m a r						
296-13													f ə h a						
372-13													ʔ ə a f ə r						
374-13													b ə a o d o						
385-13													w ɨ f ə b						
411-13													m ə r a r						
500-13													ʔ ɨ m ɨ r						
541-13													kʼ ə h ɨ n						
6-13													m ə r ʔ a m a						
17-13													ʔ ə h ɨ r						
123-13													s ə m ə						
252-13													r ə ʔ ə b ə						
330-13													kʼ ə r d						
421-13													b ɨ f ə						
448-13													b ə d a a s ə b ə						
449-13													ʔ a ə						
491-13													d ɨ n g ə b						
545-13													ʔ ɨ z ə						
596-13													ə g ə						
653-13													f ə r ɨ						
4-13													r ɨ ə						
8-13													kʼ ə b ə s o						
290-13													ʔ a g ə z ə						
460-13													ʔ ɨ a						
489-13													b ə ə r h m a a						
552-13													z ɨ						
652-13													ʔ ə b ə d ə						
3-13													ʔ ɨ r ə						
119-13													ʔ a ʔ s a h a						
213-13													ʔ a r a d						
298-13													h b						
340-13													s ə ə ə						
458-13													d ə ʔ s ə dː ə						
459-13													ʔ a s ə						
607-13													ʔ ə ʔ w a						
609-13													ʔ ɨ h a						
647-13													b ə f a						
10-13													f ɨ a s r						
15-13													ʔ ɨ h ɨ m						
18-13													ʔ ɨ ʔ s ə						
73-13													h ə ʔ ə h ə m						
76-13													m ɨ ə s a						
