COGID	Amharic	Argobba	Chaha	Endegagn	Ezha	Geez	Gumer	Gura	Gyeto	Harari	Inor	Kistane	Mesqan	Muher	Silte	Tigre	Tigrigna	Wolane	Zway
121-13													b ɨ dː ə						
152-13													ʔ a d s						
167-13													s ɨ z ə						
255-13													ə z ə r ə ə						
297-13													s z ə r						
299-13													s z ə r						
328-13													s ə dː ə b ə						
334-13													ʔ a a b ə s a						
338-13													m ə m ɨ r						
342-13													m ə r a						
344-13													h ə s ə m						
410-13													ə a r ɨ						
540-13													r b a						
550-13													z ə z z ɨ r						
612-13													ʔ a r b						
153-13													w ə s ə s ɨ						
219-13													s ə h a m						
301-13													dː ə b ə r a						
326-13													m ə						
594-13													g ɨ						
74-13													s w ə f ə						
120-13													d a ɨ s ə						
122-13													h a w a						
154-13													ʔ a f ə r ə						
300-13													h ə ɨ						
610-13													m ɨ h h a						
118-13													s ə ɨ ə						
221-13													h ə s ə ə						
455-13													ʔ ə m a						
495-13													h b						
498-13													m o h ə kʼ ə m						
61-14														d ə m					
63-14														ʔ a d ə m					
107-14														s ə m ə rː					
112-14														d ə m ə s a					
331-14														ʔ ə s w ɨ					
377-14														b ə ə ə ə ə					
381-14														ʔ a d ə					
417-14														ə z					
451-14														s ə b ə m					
454-14														ʔ a rː ə					
484-14														s ə dː ə s m					
535-14														ʔ a s ə rː					
543-14														s ə s m					
593-14														ʔ a m ə s					
640-14														m a a					
1-14														d ə f ə rː ə m					
65-14														d ə b					
163-14														s ə rː ə					
212-14														ʔ ə s					
244-14														ʔ a dː ə					
248-14														m ə rː a					
293-14														f ə ə z					
373-14														ə ə m a rː					
408-14														b ə r ə					
414-14														d ə f a ə s					
601-14														ʔ ə rː dː ʔ					
642-14														ʔ ə f a ɨ					
60-14														ʔ ə f ə s ə m					
115-14														ʔ ə m ə					
209-14														s ə m ə					
242-14														ʔ a m ə s m					
415-14														z ə s a m					
450-14														z ə rː					
490-14														d ə f ə ə					
638-14														s ə ʔ ə					
645-14														ə a rː					
75-14														ʔ a m ʔ ə s					
160-14														d ə ə ə					
208-14														ʔ ə ʔ ə x ə					
214-14														ʔ a f					
218-14														ʔ ə z z ə s					
378-14														ʔ a ʔ g ə m					
379-14														sː ə d ə					
409-14														r ə m ə					
497-14														m ə ʔ					
598-14														ʔ ə d dː					
646-14														ʔ a a					
164-14														b ə ʔ ə m					
210-14														s ə a a ə s					
215-14														ʔ a d ə dː ə					
256-14														m ə m a					
285-14														m ə d a d					
332-14														ʔ ə g ə					
380-14														ʔ ə a w a					
412-14														s ə ə ə s					
496-14														ə rː s ə m dː					
64-14														d a f ə					
169-14														b ə rː ə z ə m					
251-14														f ə d ə					
294-14														m ə ə s					
461-14														d ə d					
547-14														w ə z a m					
597-14														ʔ ə m ə ə ə					
655-14														m ə f m					
7-14														ʔ a rː g a					
158-14														m ə m ə s					
168-14														ʔ ə m a					
296-14														s ə a ə m					
372-14														ʔ ə ɨ f ə rː					
374-14														b ə s s d s s					
385-14														w ə d ə m					
411-14														m ə rː a s					
6-14														m ə rː ʔ a m a					
17-14														ʔ ə a ə					
123-14														s ə m ə					
330-14														m ə rː d					
421-14														b ə z ə					
448-14														m ə d a m s ə sː dː ə					
449-14														ʔ a s ə					
491-14														d ə s g ə m					
545-14														a ə z ə					
596-14														ʔ ə g ə					
653-14														f ə dʒː ə m					
4-14														d ɨ r s ə					
8-14														ə ə b ə dʒː s					
339-14														b ə s ə					
460-14														a s ə a					
489-14														b ə rː s m a					
552-14														z ə					
602-14														m ə s					
652-14														ʔ ə m ə d ə					
119-14														ʔ a r ɨ a sː a					
340-14														ɨ sː ə sː ə					
458-14														d ə r ɨ ə ə ə					
459-14														ʔ a sː					
486-14														ʔ ə f ə ə ə					
607-14														ʔ ə m a a					
609-14														ʔ ə g a					
647-14														m ə f ə					
10-14														d ə ə ə rː					
15-14														ʔ ə ʔ ə m					
18-14														ʔ ə m s					
73-14														sː ə m ə ə ə m					
110-14														d ə rː ə					
121-14														m ə ʔ ə					
152-14														ʔ a d ə					
167-14														ɨ ə z ə					
255-14														ə z ə sː ə ə					
297-14														ɨ ə z ə s					
299-14														ɨ ə z ə s					
328-14														ɨ ə dː ə b ə					
334-14														ʔ a m f ə s a					
338-14														m ə m ə r					
342-14														m ə ʔ a					
344-14														ə ə s ə m					
410-14														ə a rː ə z					
540-14														rː ə b a					
550-14														z ə ʔ z ə					
109-14														g ə s d ə					
153-14														w ə sː ə s ə					
219-14														ɨ ə sː a m					
250-14														sː ə g ə					
289-14														rː ə f s					
301-14														sː ə dʒː ə a					
594-14														g ɨ z					
74-14														ɨ z ə f ə					
122-14														s ə ə					
154-14														dː ə f ə d ə					
220-14														sː ə ə sː					
245-14														s ə s ə ə					
549-14														m ə ə ə a s					
643-14														g ə m					
420-14														ʔ s z ə a					
509-14														x rː					
61-15															d ə m				
63-15															ʔ a f ɨ m				
107-15															g a m ə r a				
112-15															d a m ə n a				
331-15															n ɨ g ə s				
377-15															b ə ə ə ə				
381-15															ʔ a d				
417-15															r ə z				
451-15															s ə b a m				
454-15															ʔ a tʃʼ d r				
484-15															s ɨ b ɨ s t				
535-15															ʔ a s ɨ r				
543-15															s ə s t				
593-15															ʔ a m u s				
640-15															m ə a				
1-15															d ə tʃ ə r ə m				
65-15															f u b				
163-15															s ə tʃʼ ə				
212-15															ʔ ə n				
244-15															ʔ a r b ə				
248-15															m u r a				
293-15															f ə r ə z				
373-15															kʼ ɨ m a r				
414-15															d ə f a a ə				
601-15															ʔ ə r a ʔ				
642-15															n ɨ f a s				
60-15															n ə f ə s ə m				
115-15															b ə b a				
209-15															s ɨ m t				
242-15															ʔ a m ɨ s t				
415-15															z ɨ n a b				
450-15															z ə r				
490-15															f ə f ə				
638-15															s ɨ r ə				
645-15															kʼ a r				
75-15															ʔ a m f r				
160-15															d ə r ə kʼ				
214-15															ʔ a f				
218-15															ʔ ɨ z h ɨ				
378-15															ʔ a n g ə t				
379-15															ʔ ə f ə				
409-15															ə t ə r				
497-15															t ə n				
646-15															ʔ a a ə				
164-15															b ə tʃ ə m				
210-15															h ə ʔ a a				
215-15															ʔ a f ə b ə				
256-15															t ə m a				
285-15															m ɨ tʃʼ a d				
332-15															ʔ ə n d r				
380-15															ʔ ə ʔ ə a				
412-15															s ə tʃʼ ə n				
496-15															s ə n tʃ ə ʃ ʔ				
67-15															w ɨ r				
169-15															b ə r ə z ə a				
251-15															f ə tʃʼ				
294-15															m u ə a				
461-15															f ə				
547-15															w ə z a t				
655-15															m ɨ f t				
158-15															kʼ ə m s				
168-15															ʔ ə m a r				
296-15															z ə h u t				
374-15															f ə tʃʼ o r o				
375-15															s ə b				
385-15															w ɨ f ə t				
541-15															kʼ ə tʃʼ ɨ n				
17-15															ʔ ə h ɨ r				
113-15															b ə n a				
123-15															s ə m ə m				
252-15															r ə h ə b ə				
330-15															kʼ ə r d				
421-15															f ɨ f a				
449-15															ʔ a ə				
491-15															d ɨ n g ə ʃ				
653-15															f ə tʃ ə				
8-15															kʼ ə b ə s o				
106-15															m ə tʃ a				
254-15															h m a t				
290-15															ʔ a g ə z ə				
339-15															b ə o ɨ r				
602-15															m ɨ n				
652-15															ʔ ə ʃ d				
2-15															ʔ n ə m				
3-15															ʔ r ə				
213-15															ʔ ə r a s				
459-15															ʔ a h ə				
211-15															m s eː n				
328-15															s ə tʃ ə b ə				
333-15															m s r				
612-15															ʔ a r b				
109-15															n ə n tʃʼ				
247-15															ʔ ɨ n kʼ ə r ə r ʃ				
615-15															m ʔ				
62-15															f ə l a				
456-15															ʔ ə n o ə b ə				
498-15															m ə tʃʼ ə kʼ ə m				
509-15															ʔ ə r				
61-16																d ə m			
63-16																ʔ a f ɨ			
107-16																g a m ə s			
112-16																d a b ə j a			
331-16																j ɨ g w s			
377-16																b ə kʼ ə ə			
381-16																ʔ a ħ			
417-16																ɨ s			
451-16																s ə b ɨ			
454-16																ʔ a s ɨ			
484-16																s ɨ dː ɨ s			
535-16																ʔ a s ɨ			
543-16																s ə s g			
593-16																ʔ a m ɨ s			
640-16																m a a			
65-16																f ɨ b			
163-16																s ə s ə			
212-16																ʔ ə j			
244-16																ʔ a b			
248-16																m ɨ lː a			
293-16																f ə ə s			
373-16																kʼ ɨ a s			
408-16																b a d ɨ			
414-16																d ɨ b a d			
601-16																ʔ ə s ʔ g			
642-16																ħ ɨ f a s			
209-16																s ɨ mː ɨ			
242-16																ʔ a b ɨ s			
415-16																s ɨ ħ a b			
450-16																z ə			
638-16																s ɨ dː			
75-16																ʔ a m b ɨ ə			
208-16																ʔ ɨ g w ɨ a			
214-16																ʔ a b			
218-16																ʔ ɨ s ɨ ɨ a			
409-16																r ə ə r			
497-16																ə g			
598-16																s w			
646-16																ʔ a n ə			
256-16																ə b a			
332-16																ʔ ɨ r ɨ d			
496-16																w ə s ʔ ə b			
67-16																w ɨ			
655-16																ɨ ʔ			
372-16																f ə n f ə			
375-16																s ə b			
411-16																ɨ s a ə			
500-16																ʔ ɨ ɨ d			
541-16																kʼ ə s ɨ j			
17-16																ʔ ə a ɨ			
113-16																b ɨ ħ a			
252-16																r ə f ə b ə			
330-16																ə lː d			
545-16																a ɨ g ə			
106-16																m ə g a			
254-16																s ɨ a			
460-16																ʔ s a			
602-16																m ɨ ħ			
2-16																s ɨ lː ɨ			
213-16																ħ a s a ʃ e			
298-16																w ɨ a			
647-16																ə b a g			
211-16																m ɨ ʃ ə			
333-16																m ɨ f ɨ r			
612-16																ʔ a s ʔ e			
289-16																lː ɨ b e			
326-16																m ə ə e			
154-16																f a f ə s ə			
247-16																ʔ ɨ j ɨ r a r g			
286-16																s ə gː ɨ r			
418-16																b ə r b ə s ə			
615-16																m w			
288-16																r a ʔ a			
416-16																kʼ ə ɨ a			
456-16																s b j			
61-17																	d ə m i		
63-17																	ʔ a d ɨ m		
107-17																	g ə m ə r ə		
112-17																	d ə b ə jː ə i		
331-17																	n ɨ g u s i		
377-17																	b ə ə ə ə i		
381-17																	ʔ a ħ i		
417-17																	r ə r i		
451-17																	s ə b ɨ b		
454-17																	n a tʃʼ ɨ r i		
484-17																	s ɨ b ɨ s b		
535-17																	ʔ a f ɨ r i		
543-17																	s ə s b i		
593-17																	n ə m ə s		
640-17																	m a n i		
1-17																	d ə b ə r ə n		
65-17																	d ə b		
163-17																	s ə tʃʼ ə i		
212-17																	ʔ ə n i		
244-17																	ʔ a r b ə n		
248-17																	m ə r ə i		
293-17																	fː ə r ə s i		
373-17																	ə ɨ m ə r i		
408-17																	b ə r ə i		
414-17																	d ə b a ħ ə d		
601-17																	ʔ ə r ə b i		
642-17																	n ɨ fː a s i		
60-17																	n ə fː ə s ə n		
115-17																	b ə b ə		
209-17																	s ə b ɨ n		
415-17																	z ɨ r a b i		
450-17																	r ə r i		
638-17																	s ɨ r ə i		
645-17																	ə ə r i		
75-17																	n ə m b ə ə		
214-17																	ʔ a b i		
218-17																	ʔ ɨ w r ɨ n		
409-17																	ʕ ə b ə r ə		
598-17																	k w ə ʔ i		
164-17																	b ə dː ə n		
332-17																	ʔ ə g ɨ r i		
412-17																	s ə h ə n		
496-17																	s ə r f ə n b ə i		
158-17																	ə ə m i s i		
372-17																	k ə n f ə r		
375-17																	s ə b		
411-17																	n ə r ə s i		
500-17																	ʔ ɨ b ɨ r		
541-17																	ə ə tʃʼ ɨ jː n		
113-17																	b ə sː a i		
330-17																	ə ə r d i		
448-17																	q ə d a m i ə n b ə ə		
106-17																	m ə s ə n		
290-17																	ʔ a g ə r ə n		
552-17																	r ə i		
2-17																	b ɨ l ə n		
213-17																	n a r ə f i		
647-17																	b ə ħ ə t i		
211-17																	m ɨ tʃʼ ə b		
334-17																	ʕ a n b ə f a i		
109-17																	g u n tʃʼ ə		
153-17																	w ə m ə f ə i		
289-17																	l ɨ b i		
326-17																	m ə b ə i		
247-17																	ʔ ɨ jː ə ə r ə r i b n		
286-17																	tʃʼ ə g ə r		
418-17																	b ə r b ə r ə n		
615-17																	m ə n		
288-17																	r ə ə ɨ s		
416-17																	a ə ħ ɨ n		
61-18																		d ə m	
63-18																		ʔ a tʃʼ ɨ m	
107-18																		g a m e tʃʼ a	
112-18																		d a b ə n a	
331-18																		n ɨ g e s	
377-18																		b ə kʼ ə a	
381-18																		ʔ a n	
417-18																		r ə z	
451-18																		s ə ʔ a	
454-18																		ʔ a tʃʼ e	
484-18																		s ɨ ə e s	
535-18																		ʔ a s e r	
543-18																		s ə s	
593-18																		ʔ a m e s	
640-18																		m a n	
1-18																		d ə tʃʼ ə r ə	
65-18																		tʃʼ e n	
163-18																		s ə tʃʼ ə	
212-18																		ʔ e n	
244-18																		ʔ a r ʔ	
248-18																		m u tʃʼ a	
293-18																		f ə r ə z	
373-18																		kʼ e m a w	
408-18																		b ə dʒ a ə	
414-18																		d ə b a a	
601-18																		ʔ ə r ə ʔ	
642-18																		n ɨ f a s	
60-18																		n ə f ə s ə	
115-18																		ʔ ə f	
209-18																		s e m e	
242-18																		ʔ a m ɨ s	
415-18																		z ɨ n a b	
450-18																		z ə r	
490-18																		tʃʼ ə tʃʼ e	
638-18																		s ɨ r ə	
645-18																		kʼ a r	
75-18																		ʔ a m ʔ ə ə	
160-18																		d ə r ə kʼ	
208-18																		ʔ e n kʼ ʔ ə ə	
214-18																		ʔ a b	
218-18																		ʔ ɨ z z e n	
378-18																		ʔ a n g ə	
379-18																		ʔ ə tʃʼ ə ə	
497-18																		ə n	
646-18																		ʔ a n ə	
164-18																		b ə tʃ ə	
210-18																		z ə h a n ə	
215-18																		ʔ a tʃʼ t b ə	
256-18																		ə m a	
285-18																		m ɨ t a d	
332-18																		ʔ ə g ɨ	
380-18																		ʔ ə h e a	
412-18																		s a tʃʼ e n	
496-18																		s ə n s ə n ʔ	
64-18																		d a tʃʼ a	
67-18																		w ɨ r	
169-18																		b ə r ə z ə a ə	
251-18																		f e tʃʼ	
294-18																		m e kʼ	
461-18																		tʃʼ z	
547-18																		w ə z a	
597-18																		ʔ ə ʔ ə ə ə	
655-18																		m ɨ ʔ	
7-18																		ʔ a w g a	
158-18																		kʼ ə m e s	
168-18																		ʔ e m a r	
296-18																		z ə h u ə	
374-18																		b ə a a tʃʼ ə	
375-18																		s ə b	
385-18																		w ɨ tʃʼ ə	
411-18																		ə n a s	
541-18																		kʼ ə tʃʼ ɨ n	
17-18																		ʔ ə z ɨ	
113-18																		b ə n ə	
123-18																		ʃ e m aː	
252-18																		e ə ʔ ə b ə	
330-18																		kʼ ə l d	
421-18																		b ɨ ʔ a	
491-18																		d ɨ n g ə t	
653-18																		f ə s ə	
8-18																		kʼ ə b ə s ə	
106-18																		m ə t ə	
254-18																		dʒ e m ə	
290-18																		ʔ a g ə z ə	
339-18																		b ə kʼ ɨ tʃʼ	
489-18																		f ə tʃʼ z ə a	
552-18																		z ə	
602-18																		m ɨ n	
2-18																		ʔ e tʃʼ ə	
3-18																		ʔ e r aː	
213-18																		ʔ a r a s	
459-18																		ʔ a b ə ə	
647-18																		n ə n ai̯ s	
76-18																		m z ə s a	
152-18																		ʔ a tʃʼ ə	
328-18																		s ə ʔ ə b ə	
333-18																		m e f e r	
338-18																		ʔ ə m a a	
612-18																		ʔ a r b	
594-18																		g e n	
247-18																		ʔ ɨ n kʼ ə r ə r	
418-18																		b ə r b ə r eː	
615-18																		m ʔ	
62-18																		f ə l ə	
456-18																		s ə n ə ə ə	
498-18																		e s ə kʼ ə	
509-18																		ʔ ə r e r	
61-19																			ə m
63-19																			ʔ a b ɨ m
107-19																			g a m ə b a
112-19																			a b ə n a
331-19																			ʔ ɨ g ʔ s
377-19																			b a kʼ ə ə
381-19																			ʔ a ə
417-19																			uː z
451-19																			s a b
454-19																			ʔ a n ɨ
484-19																			s ɨ b ɨ s t
535-19																			ʔ a n ɨ
543-19																			s i s
593-19																			b a m eː s
640-19																			m a
1-19																			a b ə ə
65-19																			b uː b
163-19																			s ə tʃ ə
212-19																			ʔ ə b
244-19																			ʔ a b ə
248-19																			m eː tʼ a
293-19																			fː ə ə z
373-19																			kʼ ɨ m a l
408-19																			b a a a
414-19																			d a b a kʼ ə
601-19																			ʔ a b b
642-19																			b ɨ fː o s
60-19																			ʔ ə fː ə s ə
115-19																			b ə b
209-19																			s a m eː
242-19																			ʔ a m ɨ s t
415-19																			z ɨ d a b
450-19																			z ə
490-19																			f ə b i
638-19																			s ɨ tʃʼ ə
645-19																			kʼ a b
75-19																			ʔ a m b ɨ a
160-19																			d ə ə kʼ
208-19																			ʔ ɨ b kʼ ʔ ə a
214-19																			ʔ a b
218-19																			ʔ ɨ ʔ ʔ ɨ
378-19																			ʔ a l g ə t
379-19																			b ə b ə
409-19																			g a t ə
497-19																			b ə l
646-19																			ʔ a b ə
164-19																			b ə b ə
210-19																			b ə b aː ə
215-19																			ʔ a b ʔ b ə
256-19																			i m a
285-19																			m ɨ n a d
380-19																			ʔ a ʔ ʔ
412-19																			s a n a l
496-19																			g a b r ə t b b
64-19																			d a b a
67-19																			ʔ ɨ
169-19																			b ə r ə z ə
251-19																			fː i kʼ ə
294-19																			m uː kʼ
461-19																			b ə
547-19																			ʔ a z a
597-19																			m a m ə a ə a a
7-19																			ʔ a b g a
158-19																			kʼ ə m b s
168-19																			ʔ ɨ m a
296-19																			ʔ ə ʔ aː
375-19																			s ə b
385-19																			ʔ ɨ b ə
500-19																			ʔ ɨ m ɨ
541-19																			kʼ ə tʃ ɨ n
6-19																			m ə b b o m a
113-19																			b u n
123-19																			ʃ i m ə
330-19																			kʼ ə b ə
491-19																			d ɨ n g ə t
106-19																			m ə ʔ a
254-19																			z ɨ m aː
339-19																			b ə kʼ ə l
460-19																			ʔ ɨ
602-19																			m ɨ n
652-19																			ʔ ə b ə
2-19																			b eː n ɨ u
213-19																			ʔ a r a s
298-19																			h a a
459-19																			ʔ a b a
486-19																			l ə b ə aː ə
152-19																			ʔ a n
211-19																			m ɨ s eː t
328-19																			s ə b ə b a
333-19																			m ɨ n ɨ r
540-19																			b b a
594-19																			g ɨ n
154-19																			ʔ a fː ə n a
247-19																			ʔ ɨ n kʼ eː e aː r i t
286-19																			s a e a e
418-19																			b ə e b ə e eː
615-19																			m ʔ
62-19																			f a l a
288-19																			ʔ ɨ r
416-19																			kʼ ə n ɨ
456-19																			e a n ə ə n
509-19																			ʔ ə r
5-19																			g a b s
