COGID	Amami	Hachijo	Kagoshima	Kochi	Kyoto	Miyako	Oki	Sado	Shuri	Tokyo
276-9									a j a u ɴ	
281-9									m u ʃ i ɴ	
304-9									ts u b a	
305-9									h i j	
308-9									h a n a	
309-9									k u ʃ a	
310-9									t u	
311-9									n u ɴ	
342-9									h u k i	
346-9									k u j a ɴ	
347-9									k i j u ɴ	
348-9									h i j u ɴ	
351-9									t u w a ɴ	
361-9									u m u j	
379-9									k u ʃ a j a t a	
394-9									h i d a j	
395-9									m w g ɴ	
400-9									h i b a j u ɴ	
412-9									ʃ a k i j u ɴ	
413-9									ts u k a ʃ a s u ɴ	
414-9									h u j u ɴ	
422-9									h u k u j i j u ɴ	
423-9									k a ɴ g a i j u	
430-9									h a k u ɴ	
435-9									h u k u ɴ	
446-9									ʃ i t a	
447-9									w i b	
458-9									t u ʃ i	
56-9									h u t u	
62-9									i n u	
65-9									k a s a ɴ	
75-9									k a s a	
96-9									m i	
101-9									h a ɴ	
114-9									k u b i	
119-9									k i m u	
134-9									ʃ i ɕ u j u ɴ	
138-9									ʃ w n u ɴ	
146-9									a j u k u ɴ	
161-9									h i ɴ	
171-9									k a iː a ɴ	
182-9									k i h u j i	
196-9									h u j u	
262-9									h i j u h a ɴ	
300-9									h i s u	
313-9									d i ɴ	
350-9									ʃ i h a s	
352-9									h i k a s	
396-9									h u j uː	
401-9									u ʃ u ɴ	
420-9									u h i j u ɴ	
424-9									u t a u ɴ	
442-9									ʃ w m i j u k i j u ɴ	
455-9									i k i h i j u ɴ	
15-9									a j i ɴ	
22-9									n a s	
24-9									m i ɴ n a	
49-9									u n n g u	
89-9									k i	
175-9									a u n a	
183-9									h i	
199-9									a ts uː	
230-9									a n u h ɴ t u	
233-9									a n u h u j u aː a j	
264-9									k i j i	
274-9									n u j i t a	
314-9									m u ʃ i ɴ	
354-9									a j uː ɴ	
376-9									w a j uː ɴ	
415-9									m u ʃ u b u ɴ	
451-9									h u k u j u	
456-9									ts u n a	
59-9									w u	
142-9									t u b u ɴ	
14-10										k o r e
18-10										d a r e
35-10										h i ts o ts u
36-10										h u t a ts u
48-10										n a ŋ a i
60-10										t o r i
63-10										s i r a m i
64-10										k i
67-10										h a
68-10										n e
71-10										tɕ i
76-10										h o n e
83-10										ts u n o
87-10										h a n e
95-10										m i m i
98-10										h a n a
99-10										k u tɕ i
-102-10										s i t a
103-10										ts u m e
110-10										t e
116-10										m u n e
120-10										n o m u
132-10										k i k u
139-10										k o r o s u
140-10										o uː o ŋ u
156-10										t a pː e r u
168-10										ts u k i
169-10										h o s i
170-10										m i z u
173-10										i s i
180-10										k u m o
185-10										h a i
186-10										m o e r u
187-10										m i tɕ i
190-10										a k a i
193-10										k iː r o i
194-10										s i r o i
195-10										k u r o i
216-10										m a r ui a
221-10										n a
239-10										i ts u
252-10										m i dʑ u
253-10										h o dʑ u
254-10										i ts u ts u
266-10										k a z e
267-10										n a ŋ a r e r u
268-10										u m i
272-10										a m e ŋ
276-10										a r a u
281-10										m u s i
304-10										ts u b a
305-10										tɕ i tɕ i
308-10										h a n a
309-10										k u s a
310-10										t o
311-10										n i
342-10										h u k i
346-10										k u r a i
347-10										k i r u
348-10										h i r o i
351-10										t oː i a
361-10										o m o i a a
379-10										k u s a r a
394-10										h i d a r i
395-10										m i ŋ i
400-10										h i pː a r u
412-10										s a k e r u
413-10										ts u k i s a s u
414-10										h o r u
422-10										h u k u r e r u
423-10										k a n ŋ a e r u
430-10										h a k u
435-10										h u k u
446-10										s i t a
447-10										u e
458-10										t o s i
56-10										h i t o
62-10										i n u
65-10										k a w a
70-10										t a n e
75-10										k a w a
96-10										m e
101-10										h a
114-10										k u b i
119-10										k i m o
134-10										s i dʑ o r u
138-10										s i n u u
146-10										a r u k u
161-10										ɕ uː
171-10										k a w a
182-10										k e m u a i
188-10										h a m a
196-10										h o r u
262-10										h i r u m a
300-10										h e s o
313-10										d e
350-10										s e b a i
352-10										tɕ i k a i
396-10										h u r ui s
401-10										o s u
420-10										o tɕ i r u
424-10										u t a u
442-10										s i m e r u k e r u
455-10										i k i t o r u
15-10										a tː e
22-10										n a i
24-10										m i n n a
49-10										o n a ŋ o
78-10										a b u r a n i
89-10										k e
130-10										m i r u
149-10										k u r u
175-10										s u n a
183-10										h i
192-10										a o i
199-10										a ts ui
230-10										a n o h i t o
233-10										a n o h i t o t a r i
250-10										h o k a n o
264-10										k i r i
274-10										n u r e t a
298-10										k e ŋ a w a
303-10										h a r a w a t a
314-10										m o s i
354-10										a ts ui u
369-10										k i r e r u
376-10										w a r ui
415-10										m u s u b u
418-10										n oː
451-10										h o k o r i
456-10										ts u n a
72-10										n i k u
80-10										t a m a ŋ o
104-10										a s i
118-10										s i n z oː
142-10										t o b u
150-10										n e t e r u
204-10										i ui a i
