COGID	MonpaBalemu	MonpaDirang	MonpaDirangDum	MonpaKalaktang	MonpaNamsu	MonpaSangti	MonpaTembang	MonpaTomko
10-1	tʃ a ŋ							
37-1	n a n							
46-1	n a n							
98-1	kʰ a ŋ tʃ i l a							
125-1	b i j a ŋ ɾ a							
162-1	l e i s i							
171-1	s o m l a							
219-1	t a ŋ p u							
247-1	tʃ a ŋ l u							
282-1	l u s p u							
292-1	kʰ a ŋ							
301-1	l i							
354-1	m u m a t i							
363-1	n a m u							
397-1	g a m tʃ i							
406-1	kʰ a m u ŋ							
426-1	m u k p a							
473-1	b i n k a ŋ							
499-1	s a m a n							
526-1	g a s o a							
544-1	kʰ u							
553-1	g o t a ŋ							
599-1	g o i l a m							
608-1	b a n tʃ o							
617-1	j a n							
645-1	a n a							
663-1	s o ŋ o u r							
672-1	t o ŋ p a							
681-1	n i ɾ i							
690-1	m i ŋ							
708-1	tʃ a ɾ i ŋ b u							
717-1	tʃ o k p u							
726-1	s i							
744-1	a p a							
782-1	m i							
791-1	ŋ a							
800-1	ŋ a							
809-1	m o m n a ŋ							
836-1	p a s i							
881-1	l a m							
890-1	ɾ a m a							
899-1	s e r							
926-1	tʃ a m							
944-1	g a ɾ a ŋ							
953-1	a g a ɾ a ŋ							
980-1	g a ɾ o ŋ							
998-1	pʰ a i							
1022-1	kʰ a t u r							
1031-1	b i n a ŋ u l a							
1069-1	tʃ o n a ŋ a a							
1079-1	ʃ i ŋ k a ŋ a							
1098-1	j a ŋ p u a							
1117-1	tʃ u n							
1141-1	ɾ i ŋ b u							
1189-1	m a n							
1198-1	n u							
1208-1	kʰ a l a a							
1217-1	l a n i ŋ u							
1253-1	a m a							
1271-1	n o n a ŋ							
1289-1	m i n							
1316-1	ŋ a ŋ							
1325-1	kʰ a m							
1334-1	s i ŋ o a							
1343-1	b u i n a ŋ							
1361-1	j e n a ŋ							
1370-1	n a m u ŋ							
1388-1	m a n a							
1397-1	t u r							
1406-1	tʃ o ŋ							
1424-1	g a ɾ a ŋ p a r a a							
1433-1	kʰ u m u							
1442-1	l a m							
1451-1	b a l a m							
1468-1	pʰ a k p a							
1477-1	ŋ a s							
1502-1	ŋ a m s u							
1511-1	m u j a ŋ m a							
1529-1	kʰ a l u							
1538-1	s o l o							
1557-1	tʃ o i l u ŋ							
1618-1	i n tʃ a							
1663-1	s u m							
1689-1	ŋ o i							
1698-1	kʰ u ŋ							
1707-1	m o ŋ n a ŋ							
1716-1	ŋ a m u							
1742-1	m u m u							
1751-1	b u ɾ i l a							
1778-1	s a							
1787-1	t u r p u							
1823-1	l e m							
1832-1	g a ɾ m a							
1842-1	l u ŋ							
1860-1	ŋ a m							
1869-1	s u ŋ tʃ a ŋ							
1888-1	s a m p i							
1897-1	s o e							
1932-1	ɾ i n a ŋ s o ŋ l a							
1950-1	s u							
1968-1	t o ŋ p a a							
1978-1	kʰ u t p a							
1987-1	s a m							
2015-1	ŋ a m k a a							
2118-1	m u ŋ i k o l a							
2238-1	ŋ a r k a							
2507-1	t i n u ŋ							
2526-1	l e m							
2535-1	s o a							
2544-1	ʃ i ŋ							
2560-1	s o ŋ n i tʃ i ŋ							
2569-1	kʰ a t u r							
2578-1	n i tʃ i ŋ							
2596-1	d̪ u ŋ							
2615-1	ɾ i							
2663-1	g i t i k							
2690-1	s i k o							
2719-1	ɾ i m i							
2728-1	kʰ o tʃ u ŋ							
2747-1	n i ŋ a							
2756-1	s e r l u							
2774-1	b o n i ŋ							
19-1	n a i i b a							
28-1	n a i i b a							
89-1	g a ŋ p u							
107-1	b i m i							
190-1	b u tʃ i							
229-1	kʰ a							
257-1	s a ŋ a							
338-1	b r u ŋ							
436-1	kʰ u l u							
483-1	n a							
535-1	s o s o							
571-1	g e l e a i							
699-1	tʃ o ŋ p a							
845-1	ɾ o k							
971-1	tʃ i k p u							
1049-1	b u							
1161-1	a m							
1180-1	s o a							
1226-1	l a n i ŋ							
1235-1	n a m n a ŋ							
1280-1	d̪ i ŋ tʃ a							
1352-1	g u							
1379-1	s i							
1415-1	ɾ a							
1636-1	b e tʃ a							
1654-1	l i							
1680-1	kʰ a n a i							
1725-1	tʃ a ŋ tʃ e							
2127-1	s a m a							
2181-1	ʃ i k l o							
2366-1	kʰ o j a k p a							
2672-1	g a g a							
2681-1	kʰ a l a ŋ u							
55-1	tʃ a ɾ i k a							
80-1	t u ŋ m a							
116-1	kʰ u l u							
10-2		dʒ a ŋ						
37-2		n a n						
46-2		n a n						
98-2		kʰ a ŋ tʃ i l a						
125-2		b e a ŋ r a						
162-2		l e i ʃ i						
171-2		g o m ʃ a						
219-2		tʃʰ a ŋ p u						
247-2		tʃʰ a ŋ l u						
282-2		l u s p u						
292-2		kʰ a ŋ						
301-2		l i						
354-2		m u m b a i						
363-2		n a m b u						
397-2		g a m tʃ i						
406-2		kʰ a u						
426-2		m u k p a						
473-2		b i n a ŋ						
499-2		z a m i n						
526-2		g a ʃ a						
544-2		kʰ u						
553-2		g o tʰ a ŋ						
599-2		g o i tʃ a m						
608-2		b a n tʃ o						
617-2		j e n						
645-2		a n a						
663-2		s o ŋ tʰ u						
672-2		t o ŋ p a						
681-2		ɲ i r i						
690-2		b i ŋ						
708-2		tʃʰ a ŋ ɾ i ŋ b u						
717-2		dʒ o k p u						
726-2		s i						
744-2		a b a						
782-2		m i						
791-2		ŋ a						
800-2		ŋ a						
809-2		m o m n a ŋ						
836-2		p u ʃ i						
881-2		l a m						
890-2		ɾ a w a						
899-2		s e r						
926-2		tʃʰ a						
944-2		g a ɾ a ŋ						
953-2		ʃ a r a ŋ						
980-2		n a r u ŋ						
998-2		pʰ a i						
1022-2		g tʃʰ a tʰ u r						
1031-2		b i n a ŋ kʰ u a						
1069-2		tʃ o ŋ a ŋ a						
1079-2		ʃ a l a						
1098-2		j a ŋ b u						
1117-2		tʃ u n						
1141-2		ɾ i ŋ b u						
1189-2		m a n						
1198-2		n u						
1208-2		z a l a						
1217-2		l a ŋ i						
1253-2		a m a						
1271-2		n o w a ŋ						
1289-2		b i ŋ						
1316-2		ŋ a ŋ						
1325-2		kʰ a m						
1334-2		s i ŋ b a						
1343-2		b i n a ŋ						
1361-2		j e n a ŋ						
1370-2		n a g u						
1388-2		m a n b a						
1397-2		tʰ u r						
1406-2		tʃ o ŋ						
1424-2		g a ɾ a ŋ p a a r						
1433-2		ʃ u g u						
1442-2		l a m						
1451-2		b i a m						
1468-2		pʰ a k p a						
1477-2		ŋ a ŋ						
1502-2		ŋ a m tʃʰ u						
1511-2		m u j a ŋ b a						
1529-2		tʃʰ a l u						
1538-2		s u l u						
1557-2		tʃ o i tʃ u ŋ						
1618-2		i ŋ tʃ a						
1663-2		z u m						
1689-2		ŋ o i						
1698-2		kʰ u ŋ						
1707-2		m o ŋ n a ŋ						
1716-2		ŋ a m						
1742-2		m u g i						
1751-2		b u i l a						
1778-2		s a						
1787-2		tʃʰ u ŋ p u						
1823-2		l e m						
1832-2		k a r m a						
1842-2		l u ŋ						
1860-2		ŋ a m						
1869-2		ʃ u ŋ t a ŋ						
1888-2		ʃ a m b i						
1897-2		s e						
1932-2		ɾ i n a ŋ o ŋ a a						
1950-2		tʃʰ u						
1968-2		t o ŋ t a u						
1978-2		tʃʰ u ŋ p a						
1987-2		s a m						
2015-2		ŋ a m tʃ u						
2118-2		m o ŋ ʃ u o ŋ p a						
2238-2		ŋ a r u						
2507-2		tʃʰ i n u ŋ						
2526-2		l e						
2535-2		ʃ a						
2544-2		ʃ i ŋ						
2560-2		s o ŋ n i tʃ i ŋ						
2569-2		kʰ e i tʰ u r						
2578-2		n i tʃ i ŋ						
2596-2		tʃʰ u ŋ						
2615-2		r i						
2663-2		g i t i						
2690-2		s i a						
2719-2		ɾ i tʃ i						
2728-2		g o tʃ u ŋ						
2747-2		ɲ i ŋ u						
2756-2		s e r b u						
2774-2		b u ɲ i ŋ						
19-2		n a i b						
28-2		n a i b a						
89-2		g a ŋ p u						
107-2		tʃ i m i n						
145-2		tʃʰ u ŋ p u						
190-2		p u i						
229-2		kʰ a						
257-2		tʃʰ a ŋ a						
338-2		b r u ŋ						
436-2		tʃʰ u l u						
483-2		w a						
571-2		g e l e n i						
699-2		d o ŋ p a						
845-2		ɾ o k						
971-2		tʃʰ i ŋ p u						
1161-2		a m						
1180-2		ʃ a						
1235-2		n a m n a ŋ						
1280-2		dʒ i ŋ tʃ a ŋ						
1307-2		b e p						
1352-2		g u						
1379-2		s i						
1415-2		r a						
1636-2		b e tʃ a						
1654-2		l i						
1680-2		kʰ a n tʃ a						
1725-2		tʃ a ŋ tʃ e						
2127-2		dʒ a m kʰ u						
2181-2		i l o						
2366-2		j a a						
2672-2		a g a						
2681-2		b a l a ŋ b u						
55-2		d̪ a i b a						
80-2		tʰ u ŋ g a						
116-2		tʰ u i						
154-2		ʃ i						
10-3			d̪ a ŋ					
37-3			n a					
46-3			n a					
98-3			kʰ a ŋ tʃ i l a					
125-3			b i a ŋ ɾ a					
162-3			l e s i					
171-3			z o m p a					
219-3			d̪ a ŋ p u					
247-3			tʃʰ a ŋ l u					
282-3			l u m p u					
292-3			kʰ a ŋ					
301-3			l i					
354-3			z u m b a i					
363-3			ŋ a m b u					
397-3			g a m tʰ i					
406-3			kʰ a u					
426-3			j u k p a					
473-3			pʰ i ŋ tʃ a ŋ					
499-3			z a m i n					
526-3			g a a					
544-3			kʰ u					
553-3			k o t a ŋ					
599-3			g o i tʰ a m					
608-3			b a ŋ tʃ o					
617-3			j a n					
645-3			a n a					
663-3			s o ŋ tʰ u r					
672-3			d̪ o ŋ p a					
681-3			ŋ i r i					
690-3			m i ŋ					
708-3			tʰ a ŋ ɾ i ŋ b u					
717-3			tʃ o k p u					
726-3			s i					
744-3			a p a					
782-3			m i					
791-3			ŋ a					
800-3			ŋ a					
809-3			z o m n a ŋ					
836-3			n i					
881-3			l a m					
890-3			r a m a					
899-3			s e r					
926-3			tʃʰ a					
944-3			g a ɾ a ŋ					
953-3			s i a ɾ a ŋ					
980-3			kʰ a ɾ u ŋ					
998-3			pʰ a i					
1022-3			g j a tʰ u r					
1031-3			b i n a ŋ kʰ u l a					
1069-3			tʃ o n a ŋ b a					
1079-3			ʃ i ŋ i a a					
1098-3			j a ŋ b u					
1117-3			tʃ u n					
1141-3			ɾ i ŋ b u					
1189-3			m a					
1198-3			n u					
1208-3			z a l a					
1217-3			l a ŋ i					
1253-3			a m a					
1271-3			n o a ŋ					
1289-3			m i ŋ					
1316-3			ŋ a ŋ					
1325-3			kʰ a					
1334-3			s i ŋ b a					
1343-3			b u i n a ŋ					
1361-3			j a n a ŋ					
1370-3			n a u					
1388-3			m a ŋ b a					
1397-3			tʰ u r					
1406-3			tʃ o ŋ					
1424-3			g a ɾ a ŋ p a r					
1433-3			ʃ u g u					
1442-3			l a m					
1451-3			b a l a					
1468-3			pʰ a k p a					
1477-3			ŋ a					
1502-3			ŋ a m s u					
1511-3			m u j a ŋ b a					
1529-3			tʃ a l u					
1538-3			s u l u					
1557-3			tʃ o ŋ b u ŋ					
1618-3			i ŋ tʃ a					
1663-3			z u m					
1689-3			ŋ o i					
1698-3			kʰ u ŋ					
1707-3			m o ŋ n a ŋ					
1716-3			ŋ a m					
1742-3			m u u					
1751-3			b u l i l a					
1778-3			z a					
1787-3			tʃʰ u r b u					
1823-3			l a m					
1832-3			kʰ a r m a					
1842-3			l u ŋ					
1860-3			ŋ a m					
1869-3			s u ŋ b a ŋ					
1888-3			z a m b i					
1897-3			s e					
1932-3			ɾ i n a ŋ tʃ o ŋ l a					
1950-3			z u					
1968-3			d̪ o ŋ p a u a					
1978-3			k u k p a					
1987-3			s a m					
2015-3			ŋ a m b o					
2118-3			m u ŋ p a o o					
2238-3			ŋ a r l o					
2507-3			d̪ i n u ŋ					
2526-3			l e					
2535-3			z a					
2544-3			ʃ i ŋ					
2560-3			s o ŋ b i i ŋ					
2569-3			kʰ a tʰ u r					
2578-3			n i tʃ i ŋ					
2596-3			d̪ u ŋ					
2615-3			ɾ i					
2663-3			g i t i					
2690-3			s i a					
2719-3			ɾ i d i					
2728-3			kʰ o tʃ u ŋ					
2747-3			ŋ i ŋ					
2756-3			s a r b u					
2774-3			b o ŋ i ŋ					
89-3			g a ŋ p u					
107-3			tʰ i m i n					
145-3			tʃ u k p u					
190-3			b u tʃ i					
229-3			kʰ a					
257-3			d̪ a ŋ a					
436-3			z u l u					
483-3			dʒ a					
535-3			z o z o					
699-3			d̪ o ŋ p a					
845-3			ɾ o k p					
971-3			tʃ i k p u					
1049-3			b u					
1161-3			a m					
1180-3			s a					
1226-3			l a ŋ i					
1235-3			ŋ a m i ŋ					
1280-3			dʒ i ŋ tʃ a ŋ					
1307-3			d̪ e p p a					
1352-3			g u					
1379-3			s i					
1415-3			ɾ a					
1636-3			b e tʃ a					
1654-3			l i					
1725-3			tʃ a ŋ tʃ a					
2127-3			dʒ a m b o					
2181-3			tʃ i n l o					
2366-3			j a k p o					
2672-3			l a g a					
2681-3			pʰ a l u ŋ b o					
116-3			tʰ u l a					
154-3			ʃ i					
10-4				tʃʰ a ŋ				
37-4				n a n				
46-4				n a n				
98-4				kʰ a ŋ tʃ i a				
125-4				b i a ŋ a a				
162-4				l e i a i				
171-4				s o m tʃ a				
219-4				t a ŋ p u				
247-4				tʃʰ a ŋ l u m				
282-4				l u p u				
292-4				kʰ a ŋ				
301-4				l i				
354-4				m u m b a ŋ i				
363-4				n a m u				
397-4				g a m tʃ i				
406-4				kʰ a m u m				
426-4				l u k p a				
473-4				z i n tʃʰ a ŋ				
499-4				z a m a n				
526-4				g a z m a				
544-4				kʰ u				
553-4				k o t a ŋ				
599-4				g o i tʃʰ a m				
608-4				n a n tʰ o				
617-4				j e n				
645-4				a n a				
663-4				s o tʰ u r				
672-4				t o ŋ p a				
681-4				n i z i				
690-4				m i n				
708-4				tʰ a z i ŋ tʃ u				
717-4				tʰ o k p u				
726-4				s i				
744-4				a a				
782-4				m i				
791-4				n a				
800-4				n a				
809-4				m o m n a ŋ				
836-4				p u tʃ i				
881-4				l a m				
890-4				r a a				
899-4				s e				
926-4				tʃ a m				
944-4				g ă z a ŋ				
953-4				i ă z a ŋ				
980-4				g ă z u ŋ				
998-4				pʰ a i				
1022-4				n i a tʰ u r				
1031-4				b i n a ŋ u a				
1069-4				tʃ o n a ŋ p a				
1079-4				i a a				
1098-4				j a ŋ p u				
1117-4				tʃʰ u n				
1141-4				z i ŋ tʃ u				
1189-4				m a n				
1198-4				n u				
1208-4				z a l a				
1217-4				l a i				
1253-4				a m a				
1271-4				n o n a ŋ				
1289-4				m i n				
1316-4				n a ŋ				
1325-4				kʰ a m				
1334-4				z i ŋ a				
1343-4				b ɲ i n a ŋ				
1361-4				j e n a ŋ				
1370-4				n a u				
1388-4				m a n a a				
1397-4				tʰ u r				
1406-4				tʃ o ŋ				
1424-4				g ă z a ŋ p a r				
1433-4				s u u				
1442-4				l a m				
1451-4				b ă tʃ a m				
1468-4				l a k a a				
1477-4				n a				
1502-4				n a m u				
1511-4				m u a ŋ p a				
1529-4				tʃ a l u				
1538-4				s u u				
1557-4				tʃ o i tʃʰ u ŋ				
1618-4				i n tʃ a				
1663-4				z u m				
1689-4				n o i				
1698-4				kʰ u ŋ				
1707-4				m o ŋ n a				
1716-4				n a m				
1742-4				n u u				
1751-4				p u ʃ i a				
1778-4				tʃ a				
1787-4				tʰ u r kʰ u r				
1823-4				l a m				
1832-4				g a r m a				
1842-4				l u n				
1860-4				n a m				
1869-4				z i tʃʰ a ŋ				
1888-4				s a m tʃ i				
1897-4				s				
1932-4				ɾ i n a ŋ o tʃʰ a m				
1950-4				tʃ u				
1968-4				t o ŋ tʃʰ a u r				
1978-4				k u r p a m				
1987-4				n a m				
2015-4				n a m tʃʰ a m				
2118-4				m o n tʃ o ŋ tʃʰ a				
2238-4				n a r a m				
2507-4				tʰ i n u ŋ				
2526-4				l a				
2535-4				s a				
2544-4				z i ŋ				
2560-4				s o ŋ n i tʃ i ŋ				
2569-4				kʰ a tʰ u r				
2578-4				n i tʃ i ŋ				
2596-4				tʃ u ŋ				
2615-4				ɾ i				
2663-4				g i z i ŋ m				
2690-4				s i				
2719-4				ɾ i tʃ i				
2728-4				g o tʃ u ŋ				
2747-4				n i tʰ u				
2756-4				z e r u				
2774-4				b o ɲ i ŋ				
19-4				n a i b a				
28-4				n a z i b a				
89-4				g a ŋ p u				
145-4				tʰ u k tʃʰ u m m				
229-4				n a				
257-4				kʰ a n a				
338-4				b ɲ u m				
436-4				kʰ u l u				
535-4				s o s o				
571-4				g ă l a n a i				
699-4				tʃʰ o ŋ p a				
971-4				tʃʰ i ŋ p u				
1049-4				u				
1180-4				a tʃ a				
1226-4				l a n i				
1307-4				k e a a				
1352-4				g u				
1379-4				s i				
1636-4				b e tʃ a				
1654-4				l i				
1680-4				kʰ a n tʃʰ a				
1725-4				tʃ a ŋ tʃʰ a m				
2672-4				l a g a				
55-4				kʰ a ɲ i b o				
80-4				tʃʰ u r a				
116-4				tʰ u r u				
10-5					dʒ a ŋ			
37-5					n a n			
46-5					n a n			
98-5					kʰ a ŋ tʃ i l a			
125-5					b e a ŋ ɾ a			
162-5					l e m i			
171-5					s o m ʃ a			
219-5					t a ŋ p u			
247-5					a ŋ l u			
282-5					l u s p u			
292-5					kʰ a ŋ			
301-5					l i			
354-5					m u m b a t i			
363-5					n a m b u			
397-5					g a m tʃ i			
406-5					kʰ a u			
426-5					m u k p a			
473-5					pʰ i n p a ŋ			
499-5					z a m a n			
526-5					g a ʃ a			
544-5					kʰ u			
553-5					g o t a ŋ			
599-5					g o i t a m			
608-5					b a n tʃ o			
617-5					j e n			
645-5					a n a			
663-5					s o ŋ tʰ u r			
672-5					t o ŋ p a			
681-5					n i ɾ i			
690-5					m i ŋ			
708-5					a ŋ r i ŋ b u			
717-5					dʒ o k p u			
726-5					s i			
744-5					a p a			
782-5					m i			
791-5					ŋ a			
800-5					ŋ a			
809-5					m o m n a ŋ			
836-5					b ʃ i			
881-5					l a m			
890-5					ɾ a a			
899-5					s e r			
926-5					tʃʰ a m			
944-5					g a ɾ a ŋ			
953-5					ʃ i a ɾ a ŋ			
980-5					a a ɾ o ŋ			
998-5					pʰ e i			
1022-5					g a tʰ u r			
1031-5					b i n a ŋ kʰ u a			
1069-5					tʃ o a ŋ a			
1079-5					ʃ a a			
1098-5					j a ŋ b u			
1117-5					tʃ u n			
1141-5					ɾ i ŋ b u			
1189-5					m a n			
1198-5					n u			
1208-5					z a l a			
1217-5					l a n i			
1253-5					a m a			
1271-5					n o a ŋ			
1289-5					m i ŋ			
1316-5					ŋ a ŋ			
1325-5					kʰ a m			
1334-5					s i ŋ b a			
1343-5					b u i n a ŋ			
1361-5					j e n a ŋ			
1370-5					n a u			
1388-5					m a n a			
1397-5					tʰ u r			
1406-5					tʃ o ŋ			
1424-5					g a ɾ a ŋ p a r			
1433-5					ʃ u g u			
1442-5					l a m			
1451-5					b a d a m			
1468-5					pʰ a k p a			
1477-5					ŋ a s			
1502-5					ŋ a m u			
1511-5					m u o j a ŋ b a			
1529-5					tʃ a l u			
1538-5					s u l u			
1557-5					tʃ o i p u ŋ			
1618-5					i ŋ tʃ a			
1663-5					z u m			
1689-5					ŋ o i			
1698-5					kʰ u ŋ			
1707-5					m o ŋ n a ŋ			
1716-5					ŋ a m			
1742-5					m u u			
1751-5					b u tʃ i l a			
1778-5					z a			
1787-5					tʃ u r p u			
1823-5					l e m			
1832-5					k a r m a			
1842-5					l u ŋ			
1860-5					ŋ a m			
1869-5					ʃ u p t a ŋ			
1888-5					z a m b i			
1897-5					s e			
1932-5					ɾ i n a ŋ o p l a n			
1950-5					z u			
1968-5					t o ŋ t a			
1978-5					k u t p a n			
1987-5					s a m			
2015-5					ŋ a m kʰ a			
2118-5					m o ŋ a o o ŋ kʰ a n			
2238-5					ŋ a r kʰ ə			
2507-5					tʃ i n u ŋ			
2526-5					l e			
2535-5					a			
2544-5					ʃ i ŋ			
2560-5					s o ŋ b i tʃ i ŋ			
2569-5					kʰ e tʰ u ŋ			
2578-5					n i tʃ i ŋ			
2596-5					d u ŋ			
2615-5					ɾ i			
2663-5					g i t i			
2690-5					s i a			
2719-5					ɾ i d i			
2728-5					k o tʃ u ŋ			
2747-5					n i ŋ			
2756-5					s e ŋ b u			
2774-5					b o n i ŋ			
19-5					n a ŋ tʃ i b a			
28-5					n a ŋ tʃ i b a			
89-5					g a ŋ p u			
107-5					d i m i			
145-5					d u k p u			
190-5					p u tʃ i			
229-5					g a			
257-5					s a ŋ a			
338-5					b r u ŋ			
436-5					z u l u			
483-5					a			
535-5					s o s o			
571-5					g e l e n tʃ i			
699-5					d o ŋ p a			
845-5					ɾ o k			
971-5					tʃ i ŋ p u			
1049-5					b u			
1161-5					a m			
1180-5					ʃ a			
1226-5					l a n i			
1235-5					n a m n i ŋ			
1280-5					dʒ i ŋ p a ŋ			
1307-5					g e p k a			
1352-5					g u			
1379-5					s i			
1415-5					ɾ a			
1654-5					l i			
1680-5					kʰ a n tʃ i			
2127-5					dʒ a m kʰ a			
2181-5					tʃ i l ə n			
2366-5					a kʰ a n			
2672-5					a g a			
2681-5					b a l a ŋ b u			
80-5					d u ŋ g a			
154-5					ʃ i			
10-6						dʒ a ŋ		
37-6						n a n		
46-6						n a n		
98-6						kʰ a ŋ tʃ i l a		
125-6						b i ŋ ɾ a		
162-6						l e i i		
171-6						kʰ o m ʃ a		
219-6						t a ŋ p u		
247-6						tʃʰ a ŋ l u ŋ		
282-6						l u ŋ p u		
292-6						kʰ a ŋ		
301-6						l i		
354-6						z u m p a i		
363-6						n a m b u		
397-6						g a m tʃ i		
406-6						kʰ a u		
426-6						m u k p a		
473-6						pʰ i n a ŋ		
499-6						z a m a n		
526-6						g a s i a		
544-6						kʰ u		
553-6						kʰ o t a ŋ		
599-6						g o tʰ a m		
608-6						b a n tʃ u		
617-6						j a n		
645-6						a n a		
663-6						s o ŋ tʰ u r		
672-6						t o ŋ p a		
681-6						ŋ i ɾ i		
690-6						m i ŋ		
708-6						dʒ a ŋ ɾ i ŋ b u		
717-6						tʃ o k p u		
726-6						s i		
744-6						a b a		
782-6						m i		
791-6						ŋ a		
800-6						ŋ a		
809-6						m o m n a ŋ		
836-6						p a s i		
881-6						l a m		
890-6						r a n a		
899-6						s e r		
926-6						tʃʰ a m		
944-6						g a ɾ a ŋ		
953-6						z j a ɾ a ŋ		
980-6						a a ɾ o ŋ		
998-6						pʰ e i		
1022-6						a a tʰ u r		
1031-6						b i n a ŋ kʰ u		
1069-6						tʃ o n a ŋ		
1079-6						z i ŋ a l a		
1098-6						j a ŋ b u		
1117-6						tʃ u n		
1141-6						ɾ i ŋ b u		
1189-6						m a n		
1198-6						n u		
1208-6						z a l a		
1217-6						l a ŋ i		
1253-6						a m a		
1271-6						n o a ŋ		
1289-6						m i ŋ		
1316-6						ŋ a ŋ		
1325-6						kʰ a m		
1334-6						s i ŋ b a		
1343-6						b o i n a ŋ		
1361-6						j a n a ŋ		
1370-6						n a k u n		
1388-6						m a n b a		
1397-6						tʰ u r		
1406-6						tʃ o ŋ		
1424-6						g a ɾ a ŋ b a r		
1433-6						z u g u		
1442-6						l a m		
1451-6						b a d a m		
1468-6						pʰ a k p a		
1477-6						ŋ a s		
1502-6						ŋ a m s u		
1511-6						m u t̪ j a ŋ b a		
1529-6						tʃ a l u		
1538-6						s o l u		
1557-6						tʃ o u ŋ		
1618-6						i ŋ tʃ a		
1663-6						z u m		
1689-6						ŋ o i		
1698-6						kʰ u ŋ		
1707-6						m o ŋ n a ŋ		
1716-6						ŋ a m tʃ		
1742-6						m u g		
1751-6						p u ʃ i l a		
1778-6						z a		
1787-6						tʃ u r p u		
1823-6						l e m		
1832-6						k a r m a		
1842-6						l u ŋ		
1860-6						ŋ a m		
1869-6						ʃ i t̪ a ŋ		
1888-6						z a m b i		
1897-6						s o e		
1932-6						ɾ i n a ŋ o a		
1950-6						z u		
1968-6						t o ŋ t a kʰ		
1978-6						kʰ u t p a		
1987-6						s a m		
2015-6						ŋ a m kʰ u		
2118-6						m o ŋ o ŋ a		
2238-6						ŋ a r a		
2507-6						tʰ a n u ŋ		
2526-6						l e		
2535-6						z i a		
2544-6						ʃ i ŋ		
2560-6						s o ŋ i tʃ i ŋ		
2569-6						kʰ a tʰ u r		
2578-6						n i tʃ i ŋ		
2596-6						d u ŋ		
2615-6						ɾ i		
2663-6						g i t i		
2690-6						s i		
2719-6						ɾ i d i		
2728-6						k o tʃ u ŋ		
2747-6						n i ŋ		
2756-6						s e r b u		
2774-6						b o ŋ		
19-6						n a i a		
28-6						n a i a		
89-6						g a ŋ p u		
107-6						z i m i n		
145-6						d u ŋ p u		
190-6						p u tʃ i		
229-6						kʰ a		
257-6						t a ŋ a		
338-6						b r u ŋ		
483-6						a a		
535-6						s o s o		
571-6						g e l a i		
699-6						d o ŋ p a		
845-6						ɾ o k o		
971-6						tʃ i k p u		
1049-6						b u		
1161-6						a m		
1226-6						l a ŋ		
1235-6						n a m n a ŋ		
1280-6						dʒ i ŋ a ŋ		
1307-6						g e p u a		
1352-6						g u		
1379-6						s i		
1415-6						ɾ a		
1636-6						b e tʃ a		
1654-6						l i		
1680-6						kʰ a n a		
1725-6						tʃ a ŋ tʃ a		
2127-6						dʒ a m k u n		
2181-6						d̪ i		
2366-6						o j a k b a n		
2672-6						ɾ a g a		
2681-6						b a l a ŋ b u		
55-6						d̪ a ʃ i b a		
80-6						d̪ u ŋ a		
116-6						d̪ u l i		
154-6						ʃ i		
10-7							dʒ a ŋ	
37-7							n a n	
46-7							n a n	
98-7							kʰ a ŋ tʃ i l a	
125-7							b i a ŋ ɾ a	
162-7							l e i a i	
171-7							tʃ o m ʃ a	
219-7							t a ŋ p u	
247-7							tʃ a ŋ l u ŋ	
282-7							l u s p u	
292-7							kʰ a ŋ	
301-7							l i	
354-7							m u m b a i	
363-7							ŋ a m b u	
397-7							g a m i	
406-7							kʰ a u	
426-7							m u kʰ a	
473-7							pʰ i ŋ kʰ a ŋ	
499-7							z a m i n	
526-7							g a ʃ a	
544-7							kʰ u	
553-7							g o t a ŋ	
599-7							g o i kʰ a m	
608-7							b a ŋ tʃ u	
617-7							j e n	
645-7							a n a	
663-7							s o ŋ tʰ u r	
672-7							tʃ o ŋ p a	
681-7							ɲ i ɾ i	
690-7							m i ŋ	
708-7							tʃ a r i ŋ b u	
717-7							tʃ o kʰ u	
726-7							s i	
744-7							a p a	
782-7							m i	
791-7							ŋ a	
800-7							ŋ a	
809-7							m o m a ŋ	
836-7							p i	
881-7							l a m	
890-7							r a ŋ a	
899-7							s e r	
926-7							tʃ a m	
944-7							g a ɾ a ŋ	
953-7							ʃ i a ɾ a ŋ	
980-7							a a r o ŋ	
998-7							pʰ e i	
1022-7							tʃ a tʰ u r	
1031-7							b i n a ŋ kʰ u a	
1069-7							tʃ o ŋ a ŋ a	
1079-7							ʃ i a ŋ a	
1098-7							j a ŋ p u	
1117-7							tʃ u n	
1141-7							ɾ i ŋ b u	
1189-7							m a n	
1198-7							n u	
1208-7							z a l a	
1217-7							l a ŋ i	
1253-7							a m a	
1271-7							n o a ŋ	
1289-7							m i ŋ	
1316-7							ŋ a ŋ	
1325-7							kʰ a m	
1334-7							s i ŋ b a	
1343-7							b u i n a ŋ	
1361-7							j e n a ŋ	
1370-7							n a u	
1388-7							m a ŋ a	
1397-7							tʰ u r	
1406-7							tʃ o ŋ	
1424-7							g a ɾ a ŋ p a r	
1433-7							ʃ u g u	
1442-7							l a m	
1451-7							b a kʰ a m	
1468-7							pʰ a kʰ p a	
1477-7							ŋ a s	
1502-7							ŋ a m u	
1511-7							m u tʃ a ŋ b a	
1529-7							tʃ a l u	
1538-7							s o l u	
1557-7							tʃ o i u ŋ	
1618-7							i ŋ tʃ a	
1663-7							z u m	
1689-7							ŋ o i	
1698-7							kʰ u ŋ	
1707-7							m o ŋ n a ŋ	
1716-7							ŋ a m	
1742-7							m u	
1751-7							b u ʃ i l a	
1778-7							z a	
1787-7							tʃ u r kʰ u	
1823-7							l e m	
1832-7							kʰ a a m a	
1842-7							l u ŋ	
1860-7							ŋ a m	
1869-7							z u p a ŋ	
1888-7							z a m b i	
1897-7							s e	
1932-7							ɾ i n a ŋ s e ŋ kʰ e n	
1950-7							z u	
1968-7							tʃ o ŋ tʃ a ŋ	
1978-7							g u t a	
1987-7							s a m	
2015-7							ŋ a m kʰ ə n	
2118-7							m o ŋ e ŋ e n	
2238-7							ŋ a r kʰ e n	
2507-7							tʃ i ŋ u ŋ	
2526-7							l e n	
2535-7							ʃ a	
2544-7							ʃ i ŋ	
2560-7							s o ŋ a i tʃ i ŋ	
2569-7							kʰ e tʰ u r	
2578-7							n i tʃ i ŋ	
2596-7							d u ŋ	
2615-7							ɾ i	
2663-7							g i t i	
2690-7							s i	
2719-7							ɾ i d i	
2728-7							k o tʃ u ŋ	
2747-7							ɲ i ŋ	
2756-7							s e r b u	
2774-7							b o i ŋ	
19-7							n a i e n	
28-7							n a i e	
89-7							g a ŋ p u	
107-7							d i m i	
145-7							d u ŋ p u	
190-7							pʰ u tʃ i	
