COGID	Amharic	Argobba	Chaha	Endegagn	Ezha	Geez	Gumer	Gura	Gyeto	Harari	Inor	Kistane	Mesqan	Muher	Silte	Tigre	Tigrigna	Wolane	Zway
15-7							a ɨ x ɨ m												
18-7							n ɨ k ə ə												
73-7							ə ə i ə ə ə												
76-7							m w ə s a												
110-7							x a a a												
121-7							ə ɨ ə												
152-7							i a x ɨ												
167-7							g ɨ g ə												
255-7							k w ə n ə												
297-7							g ə n ə												
299-7							g ə n ə												
338-7							m ə m ɨ i												
342-7							m ə n a												
344-7							k ə s ə m												
410-7							k a s ɨ ə												
540-7							n m a												
550-7							z ə n z ɨ s												
153-7							w ə a ə a ɨ a												
219-7							g ə pː a ə												
250-7							a ə ə ə												
301-7							ə a a i a												
326-7							m ə ə												
74-7							g w ə pː												
120-7							x a n g a												
122-7							k a w a												
220-7							ə ə w a ə												
245-7							k ə ə ə ə ə												
300-7							x ɨ n												
341-7							k ə n ə m ə m												
549-7							ə i a a a g ə												
610-7							m ɨ m k a a												
643-7							g a												
118-7							ə ə n ə												
221-7							z ə pː ə i ə												
420-7							a a z a a												
455-7							a ə m a												
495-7							m e ə												
61-8								ə m											
63-8								h a m ɨ m											
107-8								g a m ə t a											
112-8								a m ə r a											
331-8								n ɨ g a s											
377-8								b ə kʼ a ə											
381-8								h a a											
417-8								r ə z											
451-8								s ə b a											
454-8								h a o ɨ r											
484-8								s ɨ h ɨ s											
535-8								h a s ɨ r											
543-8								s ə s											
593-8								h a m ɨ s											
640-8								m a a											
1-8								ə p ə r ə m											
65-8								m ɨ m											
163-8								s ə o ə											
212-8								h e n											
244-8								h a ʃ b ə											
248-8								m ə r a											
293-8								s ə ʃ ə z											
373-8								kʼ ɨ m a											
408-8								b ə a											
414-8								ə b a a											
601-8								h ə r ə m											
642-8								n ɨ s a s											
60-8								n ə z ə s ə m											
115-8								h ə r a m											
209-8								s ɨ m ɨ											
242-8								h a m ɨ s											
415-8								z ɨ o a m											
450-8								z ə ʃ											
490-8								m ə p ə ə m											
638-8								s ɨ n ə											
645-8								a a t											
75-8								h a m b ɨ											
160-8								tʼ ə r ə kʼ											
208-8								h ɨ n a a ə											
214-8								h a b a											
218-8								h ɨ n z ɨ											
378-8								h a n g ə											
379-8								ʒ ə tʼ ə											
409-8								g ə g ə ʃ ə											
497-8								ə n											
598-8								e ɨ e h											
646-8								h a e ə											
164-8								b ə s ə m											
210-8								ʒ ə e a ə ə											
215-8								h a m e b ə											
256-8								ʒ a											
285-8								m ɨ m a											
332-8								h ə g ɨ r											
380-8								h ə a a a											
412-8								s a ə ə n											
496-8								s ə r s ə n b ə											
64-8								a ə											
67-8								w ɨ r											
169-8								n ə z ə z ə m											
251-8								s ə e ə											
294-8								m ə											
461-8								tʼ a											
547-8								w ɨ z a											
597-8								h e m ə n ə ə											
655-8								m ɨ ʃ											
7-8								h a l g a											
158-8								a ə m ɨ s											
168-8								h ɨ m a r											
296-8								ə h a											
374-8								b ə kʼ ə ɨ ə											
385-8								w ɨ tʼ ə m											
500-8								h ɨ m ɨ r											
6-8								m ə r kʼ a m a											
17-8								h ə h ɨ r											
123-8								ʃ ə m ə m											
252-8								n ə h ə b ə m											
421-8								b ɨ z ə											
448-8								kʼ ə tʼ a n s ə n b ə											
449-8								h a ʒ ə											
545-8								e ɨ n ə											
596-8								n ə g ə											
653-8								b ə t ə											
4-8								g ɨ m ə											
8-8								a ə b ə t ə											
254-8								g ɨ m a											
290-8								h a g ə z ə m											
339-8								b ə kʼ ɨ r											
460-8								e ɨ a											
489-8								b ə ə r m m a a											
552-8								z ɨ											
652-8								h a g ə											
3-8								e ɨ n ə											
119-8								h a n g a e a											
298-8								ə ə											
340-8								g w ə n ə											
458-8								ə n g ə a ə											
459-8								h a s ə											
607-8								h ə h w a											
609-8								h ɨ n a											
10-8								m ɨ kʼ a o											
15-8								h ɨ n ɨ m											
18-8								n ɨ h ə											
73-8								z ə h ə ə ə ə											
76-8								m w ə s a											
121-8								g ɨ kʼ ə											
167-8								g ɨ i ə											
255-8								g w ə n ə ə											
297-8								g m n ə r											
299-8								g m n ə r											
338-8								m ə m ɨ r											
342-8								m e n a											
344-8								g ə s ə m											
410-8								g a r e											
540-8								n b a											
550-8								z ə n ɨ ɨ r											
219-8								g ə p a											
250-8								a ə m e											
301-8								kʼ m a ə r a											
74-8								g w ə p e											
120-8								a n g a											
122-8								g a w a											
220-8								z ə w a z											
245-8								a ə w ə r ə											
300-8								n ɨ n											
341-8								g ə n ə m ə m											
549-8								m ə h a n a											
610-8								m ɨ r a a r											
643-8								g a											
118-8								z ə n ə											
221-8								ʒ ə p ə r ə											
420-8								h a z a											
455-8								h e m a											
495-8								m e m											
498-8								m ə h ə kʼ ə m											
61-9									d ə m										
63-9									a tʼ a m										
107-9									g a m ə a										
112-9									d a b ə n a										
331-9									n a g a s										
377-9									b ə a a ə										
381-9									a d										
417-9									g ə z										
451-9									s ə b a										
454-9									a s a g										
484-9									s a b a s										
535-9									a s a g										
543-9									s ə s										
593-9									u a m a s										
640-9									m a a										
1-9									d ə b ə ə										
65-9									tʼ a b										
163-9									s ə ʒ ə										
212-9									w ə n										
244-9									w a g b										
248-9									m ə w a										
293-9									s ə g ə z										
373-9									a a m a										
408-9									b ə g a										
414-9									d ə b a ɨ a										
601-9									ə f ə b										
642-9									o ə n a s										
60-9									n ə f ə s ə										
209-9									s ə m										
242-9									w a ʒ a s										
415-9									z a u a b										
490-9									ə b a										
638-9									s a n ə										
645-9									a a m										
75-9									a m b ə										
160-9									d ə f ə a										
208-9									w a n a w ə										
214-9									w a b										
218-9									w a z z a										
378-9									w a n g ə										
379-9									ʒ ə tʼ ə										
409-9									g ə ə g ə										
497-9									ə n										
598-9									x w ə										
646-9									w a x ə										
164-9									b ə j ə										
210-9									ʒ ə x ə ə ə										
215-9									w a ə b ə										
256-9									ə ʒ a										
285-9									m a a d										
332-9									ə g ə g										
380-9									w a w a										
412-9									s a a n										
496-9									w ə g s ə n b ə										
64-9									d a ə										
67-9									w ə s										
169-9									b ə p ə z ə z ə										
251-9									f ə ʒ										
294-9									m w										
461-9									tʼ ə										
547-9									w ə z a										
597-9									m ə m ə ə d										
655-9									m a										
7-9									w a n g a										
168-9									ə m a f										
296-9									ə ə										
372-9									ə n f ə g										
374-9									b ə b ə ɨ ə										
375-9									s ə b										
385-9									w a tʼ ə										
411-9									ə g a s										
500-9									ə m ə										
541-9									a ə ʒ a n										
6-9									m ə m a m a										
17-9									ə x a										
113-9									b ə g										
123-9									s ə m ə										
252-9									n ə n ə b ə										
421-9									b a z a										
448-9									ʒ ə a n s ə n b ə										
491-9									d a n g ə										
545-9									x a n ə										
596-9									n ə g ə										
653-9									b ə b ə										
4-9									g j g ʒ ə										
8-9									a ə b ə u ə										
254-9									p ɨ m a										
339-9									b ə b a n										
489-9									b ə ə s ə m a										
552-9									z ə										
652-9									ə ə										
119-9									a n g a x a										
298-9									x ə										
340-9									g a n s										
458-9									ə n g ə b ə										
459-9									w a s ə										
486-9									n ə tʼ ə a ə										
607-9									ə u w a										
609-9									ə x a										
10-9									tʼ ə ʔ w p										
15-9									ə x ə m										
18-9									n ə ʒ ə										
73-9									s ə n ə ə ə ə										
76-9									m w ə s a										
110-9									a b a										
121-9									ə ə										
167-9									g ə j ə										
255-9									ʒ w ə ə ə ə										
297-9									g ə n ə s										
299-9									g ə n ə s										
338-9									m ə m ə u										
342-9									m ə n a										
344-9									ʒ ə s ə m										
550-9									g ə n ʒ ə										
612-9									a g b										
219-9									g ə p a										
301-9									ə a p a										
74-9									g w ə p ə										
120-9									a n g a										
220-9									ə w a x										
245-9									ʒ ə w ə s ə										
300-9									x a n										
341-9									ʒ ə n ə m ə										
610-9									m ə p ʒ a p										
118-9									ə n ə										
221-9									ʒ ə p ə p ə										
420-9									ʒ ə p a										
61-10										d ə s									
63-10										ʔ aː tʼ ə									
107-10										a s ə w									
112-10										d aː b ə aː									
331-10										m a a m									
377-10										b ə kʼ w ə									
381-10										ʔ aː									
417-10										r a s									
451-10										m ə b a									
454-10										ʔ aː t ə r									
484-10										m a ʔ ə m									
535-10										ʔ aː m ə r									
543-10										m ə m									
593-10										ʔ aː s a m									
640-10										s a									
1-10										d ə b ə s ə									
65-10										tʼ a b									
163-10										m ə ə ə									
212-10										ʔ ə m									
244-10										ʔ aː r b ə									
248-10										s a w a									
293-10										tʼ ə r ə s									
373-10										kʼ ə s aː w									
408-10										b a r a									
414-10										d ə b aː									
601-10										ʔ ə r b b									
115-10										ʔ ə									
209-10										m ə w a									
242-10										ʔ aː w ə m									
415-10										s a m aː b									
490-10										tʼ ə b ə									
160-10										d ə r ə kʼ									
208-10										ʔ a m kʼ ə a									
218-10										ʔ a ʔ s ə									
378-10										ʔ aː t dʒ ə									
379-10										oː ə tʼ ə									
497-10										ə									
598-10										ə									
646-10										ʔ aː									
164-10										b ə ħ ə									
210-10										oː ə ə									
256-10										a b									
285-10										s ə tʼ aː d									
380-10										ʔ a w									
412-10										m a ə									
64-10										d aː b ə									
169-10										b a r ə s ə s									
461-10										tʼ ə									
547-10										w ə s aː									
411-10										ə r a m									
541-10										kʼ ə ə a m									
113-10										b a m									
123-10										s ə ə									
491-10										d a t dʒ ə tʼ									
254-10										a ə aː									
339-10										b ə kʼ ə ʔ									
602-10										w a m									
2-10										a dʒ a									
213-10										ʔ aː r a									
647-10										ə ə									
211-10										w a m ə									
328-10										m ə b ə b ə									
333-10										s a m a r									
612-10										ʔ aː r b b									
109-10										dʒ ɨi̯ m ə ə									
289-10										w ɨ b									
286-10										ə ə a s									
418-10										b ə r b ə r									
615-10										w a									
62-10										tʼ ə w aː									
288-10										s a ʔ a r									
416-10										kʼ e a									
456-10										ʔ n t b ə b b ə									
509-10										ʔ a r a r									
5-10										ə b m									
61-11											d ə m								
63-11											ʔ a f a m								
107-11											g a m ə m a								
112-11											d a b ə w a								
331-11											n a g a s								
377-11											b ə t ə ə								
381-11											ʔ a t								
417-11											m ə z								
451-11											s ə b a								
454-11											ʔ a w ɨ m								
484-11											s a u a s								
535-11											ʔ a s ɨ m								
543-11											s ə s								
593-11											ʔ a m ə s								
640-11											m a a								
1-11											d ə b ə n ə								
65-11											f ɨ t								
163-11											s ə i ə								
212-11											ʔ e n								
244-11											ʔ a m b ə								
248-11											m ə r a								
293-11											f ə m ə z								
373-11											t a m a								
408-11											b ə ʔ a								
414-11											d a b a a								
601-11											ʔ ə r ə t								
642-11											w ə n a s								
60-11											n ə f ə s ə								
115-11											ʔ ə m a								
209-11											s ə ʒ ə								
242-11											ʔ a ʒ a s								
450-11											z ə m								
490-11											t ə b a								
638-11											s ɨ n e								
645-11											t a n								
75-11											ʔ a m b ɨ								
160-11											d ə m ə t								
208-11											ʔ a n t a a								
214-11											ʔ a b								
218-11											ʔ a n z a								
378-11											ʔ a n g ə t								
379-11											ʒ ə ə								
409-11											g e t ə m ə								
497-11											t ə n								
598-11											x b e								
646-11											ʔ a x ə								
164-11											b ə h ə								
210-11											ʒ ə x a ə ə								
215-11											u a w e b ə								
256-11											ə ʒ a								
285-11											m a t a d								
332-11											ʔ ə g ə r								
412-11											s a x a n								
496-11											s ə m b ə n b ə								
64-11											d a b ə								
67-11											ʔ ɨ r								
169-11											t ə z ə z ə								
251-11											f ə t								
294-11											m a ə								
461-11											f b								
547-11											ʔ ə z a								
597-11											m ə ə n ə ə								
655-11											m ɨ s t								
7-11											ʔ a l g a								
168-11											ʔ a m a r								
296-11											ə x ə								
372-11											ə n f ə m								
374-11											b ə t e ɨ e								
375-11											s ə b								
385-11											ʔ ɨ f ə t								
500-11											ʔ a m ɨ r								
541-11											t ə ʒ ə w								
6-11											m ə r a m a								
17-11											ʔ ə x ɨ r								
252-11											n ə n ə b ə								
421-11											b a z a								
448-11											ʒ ə d a n s ə n b ə								
449-11											ʔ a ʒ ə								
491-11											d a w g ə								
545-11											x a n ə								
596-11											n ə g ə								
653-11											b ə t a								
4-11											g ə w ʒ ə								
106-11											m ə a								
254-11											g ɨ m a								
339-11											b ə t a r								
460-11											x ɨ a								
489-11											b a ə r i a a								
652-11											ʔ a t ə a								
3-11											x a n ə								
119-11											ʔ a n g a e a								
298-11											x ə								
340-11											g a ə n ə								
458-11											d ə n g ə b ə								
486-11											n ə b ə a ə								
607-11											ʔ ə n a a								
609-11											ʔ ɨ x a								
15-11											l ɨ n a								
18-11											n a ʔ ə								
73-11											s ə n ə r ə								
76-11											m a ə s a								
110-11											d a b a								
121-11											t ɨ ə								
167-11											g ɨ j ə								
255-11											g e ə n ə ə								
297-11											g ə n ə r								
299-11											g ə n ə r								
342-11											m e n a								
344-11											g ə s ə m								
550-11											z ə n ɨ a r								
109-11											g a w ʔ								
153-11											ə a ə w ə n								
219-11											g ə p a								
250-11											a ə e								
301-11											ə l ə r a								
594-11											g ə z								
122-11											g a w a								
220-11											z ə o a z								
300-11											x ɨ n								
341-11											ʒ ə n ə m ə								
610-11											m ɨ r ʒ a r								
643-11											g a								
221-11											ʒ ə p ə r ə								
61-12												d ə m							
63-12												ʔ a tʼ ɨ m							
107-12												g a m ə r a							
112-12												d a b ə n a							
331-12												n ɨ g a s							
377-12												b ə a a ə							
381-12												ʔ a d							
417-12												r a z							
451-12												s ə b a							
454-12												ʔ a ʔ ɨ r							
484-12												s ɨ dː ɨ s							
535-12												ʔ a s ɨ r							
543-12												s ə s							
593-12												ʔ a m a s							
640-12												m a n							
1-12												d ə b ə r ə m							
65-12												tʼ a b							
163-12												s ə g ə							
212-12												ʔ ə n							
244-12												ʔ a r b ə							
248-12												m ə a a							
293-12												f ə r ə z							
373-12												a ɨ m a							
408-12												b ə r a							
414-12												d ə b a a							
601-12												ʔ ə r b b							
642-12												n ə f a s							
60-12												n ə f ə s ə							
115-12												ʔ ə m a m							
209-12												s ɨ w ə							
242-12												ʔ a w ɨ s							
415-12												z ɨ n a b							
450-12												z ə r							
490-12												tʼ ə b							
638-12												s ɨ r o							
645-12												a a r							
75-12												ʔ a m b ɨ							
160-12												d ə r ə a							
208-12												ʔ a n a w ə							
214-12												ʔ a b							
218-12												ʔ ɨ g z ɨ							
378-12												ʔ a n g ə							
379-12												z ə ə							
497-12												ə n							
598-12												ə o a							
164-12												b ə g ə							
210-12												z ə a ə ə ə							
215-12												ʔ a tː o b ə							
256-12												ə z a							
285-12												m ɨ tʼ a d							
332-12												ʔ ə g ɨ r							
380-12												ʔ ə a a							
412-12												s a g ə n							
496-12												s ə r b ə g b ə							
64-12												d a b ə							
67-12												tʃʼ ɨ r							
169-12												b ə r ə z ə m							
251-12												f ə g							
294-12												m a ə							
461-12												tʼ a							
547-12												tʃʼ ɨ z a							
597-12												m o m ə ə							
655-12												m ɨ z							
7-12												ʔ a r g a							
168-12												ʔ ɨ m a r							
296-12												ə ʔ a							
372-12												ə n f ə r							
374-12												b ə b ə ɨ ɨ							
385-12												tʃʼ ɨ m ə							
500-12												ʔ ɨ m ɨ r							
6-12												m ə r a m a							
113-12												b ə n							
123-12												m ə m ə m							
330-12												a ə w d							
421-12												b ɨ z a							
448-12												g ə d a w s ə a b ə							
449-12												ʔ a j ə							
491-12												d ɨ n g ə							
545-12												ɨ g ə							
596-12												n ə g ə							
653-12												b ə a ə							
4-12												g ɨ g z ə							
8-12												a ə b ə a ə							
106-12												m ə a							
460-12												ʔ ɨ							
552-12												z ɨ							
602-12												m ə n							
2-12												ʔ ə a ə m							
3-12												ʔ ɨ r ə							
119-12												ʔ a g g a g a							
213-12												ʔ a r a sː							
340-12												g ə ə g ə							
458-12												d ə g g ə g ə							
607-12												ʔ ə g w a							
609-12												ʔ ɨ g a							
647-12												ə a a a							
10-12												tʼ ɨ g a r							
110-12												d a dː a							
152-12												ʔ a d ə							
211-12												w ə sː ə tː							
255-12												a w ə g ə							
297-12												g ə x ə ə							
299-12												g ə x ə ə							
328-12												s ə dː ə b ə							
333-12												m ə g ə r							
334-12												ʔ a m b ə g a							
338-12												b ə m ɨ r							
410-12												a a r o							
540-12												g b a							
109-12												g a n g ə							
153-12												w ə w ə n ə							
289-12												w ə b							
326-12												m ə s a							
594-12												g ə z							
549-12												m ə ʔ a a a g							
643-12												g ə m							
62-12												f ə g a							
498-12												m ə ə ə a ə m							
509-12												ʔ a r							
5-12												g ə b ə							
61-13													d ə m						
63-13													ʔ a d ɨ m						
107-13													g a m ə r a						
112-13													d a b ə n a						
331-13													n ɨ g a s						
377-13													b ə kʼ a ə						
381-13													ʔ a a						
417-13													r a z						
451-13													s ə b a						
454-13													ʔ a n ɨ r						
484-13													s ɨ dː ɨ s b						
535-13													ʔ a s ɨ r						
543-13													s ə s						
593-13													ʔ a m a s						
640-13													m a a						
1-13													d ə b ə r ə m						
65-13													d ɨ b						
163-13													s ə ʔ ə						
212-13													ʔ ə n						
244-13													ʔ a r b ə						
248-13													m a r a						
293-13													f ə r ə z						
373-13													kʼ ɨ m a						
408-13													b a r a						
414-13													d ə b a ɨ a						
601-13													ʔ ə r b						
642-13													ʔ ɨ f a s						
60-13													n ə f ə s ə						
115-13													ʔ ə m a m						
209-13													s ɨ m ɨ						
242-13													ʔ a m ɨ s						
415-13													z ɨ r a b						
450-13													z ə r						
490-13													d ə b a ə						
638-13													s ɨ r ə						
645-13													kʼ a r						
75-13													ʔ a m b ɨ						
160-13													d ə r ə kʼ						
208-13													ʔ ɨ n kʼ a ɨ						
214-13													ʔ a b						
218-13													ʔ ɨ ʔ z ɨ						
378-13													ʔ a n g ə						
379-13													z ə d ə						
409-13													a ə b ə r ə						
497-13													b ə n						
598-13													ʔ ɨ						
646-13													ʔ a ɨ ə						
164-13													b ə r ə						
210-13													z ə ɨ a n						
215-13													ʔ a n b ə						
256-13													b a m a						
285-13													m ɨ d a d						
332-13													ʔ ə g ɨ r						
380-13													ʔ a a a a						
496-13													s ə r s ə a b ə						
67-13													w ɨ r						
169-13													b ə r ə z ə m						
251-13													f ə kʼ ə						
294-13													m a kʼ a						
461-13													m a						
547-13													w ɨ z a						
597-13													ʔ ə m ə ə ə						
655-13													m ɨ s b						
7-13													ʔ a g a						
158-13													kʼ ə m s						
168-13													ʔ ɨ m a r						
296-13													ə ʔ a						
372-13													ə ʔ s ə r						
374-13													b ə b a ɨ ɨ						
385-13													w ɨ m ə b						
411-13													ɨ r a s						
500-13													ʔ ɨ m ɨ r						
541-13													kʼ ə n ɨ n						
6-13													m ə r a m a						
17-13													ʔ ə ɨ ɨ r						
123-13													s ə m ə m						
252-13													r ə r ə b ə						
330-13													kʼ ə r d						
421-13													b ɨ z a						
448-13													n ə d a a s ə a b ə						
449-13													ʔ a z ə						
491-13													d ɨ n g ə b						
545-13													ʔ ɨ d ə						
596-13													g ə g ə						
653-13													b ə b ɨ						
4-13													g ɨ z ə						
8-13													kʼ ə b ə a ə						
290-13													ʔ a g ə z ə						
460-13													ʔ ɨ a						
489-13													b ə ə r i m a a						
552-13													z ɨ						
652-13													ʔ ə b ə a						
3-13													ʔ ɨ r ə						
119-13													ʔ a g g a n a						
213-13													ʔ a r a s						
298-13													ʔ a						
340-13													g ə ə ə						
458-13													d ə g g ə t ə						
459-13													ʔ a s ə						
607-13													ʔ ə g a a						
609-13													ʔ ɨ g a						
647-13													b ə a						
10-13													d ɨ kʼ a r						
15-13													ʔ ɨ d ɨ m						
18-13													ʔ ɨ ʔ ə						
73-13													z ə ə ə ə m						
76-13													m a ə s a						
121-13													b ɨ ə						
152-13													ʔ a d a						
167-13													a ɨ ə						
255-13													a a ə ə ə ə						
297-13													g a d ə ə						
299-13													g a d ə ə						
328-13													s ə dː ə b ə						
334-13													ʔ a m b ə a a						
338-13													m ə m ɨ r						
342-13													m ə r a						
