COGID	Amharic	Argobba	Chaha	Endegagn	Ezha	Geez	Gumer	Gura	Gyeto	Harari	Inor	Kistane	Mesqan	Muher	Silte	Tigre	Tigrigna	Wolane	Zway
61-1	d ə m																		
63-1	ʔ a tʼ ɨ m																		
107-1	g a m ə lː a																		
112-1	d a b ə n a																		
331-1	n ɨ g a s																		
377-1	b ə kʼ ə																		
381-1	ʔ a d																		
417-1	r ə j																		
451-1	s ə b a																		
454-1	ʔ a s ə r																		
484-1	s ɨ kʼ ɨ s t																		
535-1	ʔ a s ɨ r																		
543-1	s ə s a																		
593-1	ʔ a m ɨ s																		
640-1	m a n																		
1-1	d ə b ə r ə																		
65-1	tʼ ə b																		
212-1	ʔ ə n																		
244-1	ʔ a r b ə																		
248-1	m ə lː a																		
293-1	f ə r ə j																		
373-1	kʼ ɨ m a																		
408-1	b ə ʔ a																		
414-1	d ə b a a																		
601-1	ʔ ə rː ə ə																		
642-1	n ɨ f a s																		
60-1	n ə fː ə s ə																		
115-1	ʔ ə m a																		
209-1	s ə m ɨ																		
242-1	ʔ a mː ɨ s t																		
415-1	j ɨ n a b																		
450-1	j ə r																		
490-1	tʼ ə b a																		
638-1	s ɨ r ə																		
645-1	kʼ a m																		
160-1	t ə r ə a																		
208-1	ʔ ɨ n a ə a																		
214-1	ʔ a b																		
378-1	ʔ a n dʒː ə t																		
379-1	j ə t ə																		
409-1	ʔ ə t ə r ə																		
598-1	ə																		
646-1	ʔ a n ə																		
210-1	j ə a ə																		
215-1	ʔ a t b ə a																		
285-1	m ɨ tʼ a d																		
332-1	ʔ ə g ə r																		
380-1	ʔ a n a a																		
412-1	s a ʔ a n																		
64-1	d a ə																		
67-1	w ɨ rː																		
251-1	f ə r																		
294-1	m ɨ a																		
597-1	ʔ ə m ə ə																		
7-1	ʔ a m dʒː a																		
158-1	kʼ ə m i s																		
372-1	ə n f ə r																		
374-1	b ə dʒː ə ə ə																		
375-1	s ə b																		
411-1	a ə r a s																		
541-1	kʼ ə tʃʼ ɨ n																		
6-1	m ə m a m a																		
113-1	b u n a																		
330-1	kʼ ə lː d																		
448-1	kʼ ə d a n s ə n b ə																		
449-1	ʔ a s ə																		
491-1	d ɨ n dʒː ə t																		
596-1	n ə dʒː ə																		
4-1	dʒː ə n j ə																		
8-1	a ə b ə t ə																		
106-1	m ə s a																		
290-1	ʔ a g ə j ə																		
489-1	b ə tʃʼ b b a a																		
602-1	m ɨ n																		
2-1	ɨ lː ə																		
3-1	ʔ ɨ rː ə																		
213-1	ʔ a r a s																		
486-1	n ə fː ə kʼ ə																		
647-1	t ə t a																		
10-1	tʼ ɨ r																		
110-1	tʼ a kʼ a																		
152-1	ʔ a ə																		
211-1	m ɨ s ə t																		
328-1	s ə kʼ ə b ə																		
333-1	m ɨ s ɨ r																		
334-1	ʔ a n b ə s a																		
410-1	a r ə																		
540-1	b a																		
109-1	g ə n tʃʼ ə																		
153-1	w ə w ə ʃː ə																		
250-1	a ə a ə																		
289-1	lː ɨ bː																		
326-1	m ə o																		
594-1	g ɨ j																		
154-1	f ə rː ə s ə																		
245-1	ə a ə ʔ ə																		
247-1	ʔ ɨ n a u r a r i t																		
286-1	tʃʼ ə g ə r																		
643-1	dʒː ə																		
62-1	f ə h a																		
288-1	r ɨ ʔ a s																		
416-1	r ə ʔ ɨ h																		
5-1	g ə b s																		
61-2		d ə m																	
63-2		k a tʼ ɨ m																	
107-2		g a m ə a																	
112-2		d a m ə n a																	
331-2		n ɨ g ə s																	
377-2		b ə ə ə ə																	
381-2		k a d																	
417-2		r ə j																	
451-2		s ə b a																	
454-2		k a tʃ ɨ r																	
484-2		s ɨ k ɨ s																	
535-2		k a s ɨ r																	
543-2		s ə s																	
593-2		k a m ɨ s																	
640-2		m a n																	
1-2		d ə b ə r ə																	
65-2		tʼ ɨ b																	
163-2		s ə g ə																	
212-2		k ə n																	
244-2		k a r b ə																	
248-2		m ə ə a																	
293-2		f ə r ə s																	
373-2		ʃ ɨ m a																	
408-2		b ə rː ə																	
414-2		d ə b a a																	
642-2		n ɨ f a s																	
60-2		n ə f ə s ə																	
115-2		ə m a																	
209-2		s ɨ m ɨ																	
242-2		k a m ɨ s																	
415-2		j ɨ n a b																	
450-2		j ə r																	
490-2		tʼ ə b ə																	
645-2		f a m																	
160-2		d ə rː ə ə																	
208-2		k ɨ n s u ə a																	
378-2		k a n g ə																	
379-2		m ə tʼ ə																	
409-2		tʃː ə d ə r																	
598-2		k ə																	
646-2		k a n ə																	
210-2		u ə w o ə ə																	
215-2		k a b ə a																	
285-2		m ɨ tʼ a d																	
380-2		k ə n ə a																	
412-2		s a ə n																	
496-2		s ə r b ə b ə																	
64-2		d a b ə																	
251-2		f ə j																	
294-2		m ɨ ə																	
597-2		ə ə ə ə ə																	
7-2		k a g a																	
158-2		ʃ ə m i s																	
296-2		ə k ə																	
375-2		s ə b																	
541-2		f ə tʃʼ ɨ n																	
113-2		b ə n a																	
252-2		r ə k ə b ə																	
330-2		s ə d																	
449-2		k a sː ə																	
491-2		d ɨ n g ə																	
545-2		w ɨ ə																	
596-2		n ə dʒː ə																	
4-2		dʒː e n m ə																	
106-2		m ə a																	
254-2		ə ɨ m a																	
290-2		k a g ə z ə																	
602-2		m ɨ n																	
2-2		k ɨ ai̯ ə																	
3-2		k ɨ rː ə																	
213-2		k a r a sː																	
486-2		n ə ə s ə																	
10-2		tʼ ɨ f ə r																	
152-2		k a d o																	
211-2		m ɨ ʃ ə t																	
328-2		s ə d ə b ə																	
333-2		m ɨ s ɨ r																	
334-2		k a n b ə s a																	
540-2		ə b a																	
109-2		g u n tʃʼ																	
250-2		a ə ə																	
289-2		w ɨ b																	
326-2		m ɨ o																	
154-2		ʔ ə fː ə f ə																	
247-2		k ɨ n s ɨ r a rː i t																	
286-2		s ə g ə r																	
418-2		b ə r b ə r ə																	
416-2		f ə ɨ																	
455-2		ə m a																	
456-2		k ə n ə ə ə ə r																	
495-2		ə																	
61-3			t ə m																
63-3			m a b ə m																
107-3			g a m r a																
112-3			t a b ə r a																
331-3			n ə g ə z																
377-3			b ə kʼ ə r																
381-3			m a a																
417-3			r ə z																
451-3			r ə b a																
454-3			m a m ə r																
484-3			r ə b ə z t																
535-3			m a r ə r																
543-3			z ə m ə																
593-3			m a m ə r																
640-3			m a a																
1-3			t ə b ə r ə m																
65-3			b ə t																
163-3			r ə z ə																
212-3			m e n																
244-3			m a ʃ b ə																
248-3			m ə r a																
293-3			l ə ʃ ə z																
373-3			kʼ ə m a																
408-3			b ə a																
414-3			t ə b a a																
601-3			m ə r ə																
642-3			n ə n a r																
60-3			n ə r ə z ə m																
115-3			m ə m a																
209-3			ʃ ə m ə																
242-3			m a m ə r																
415-3			z ə n a b																
450-3			z ə r																
490-3			t ə p ə ə																
638-3			z ə n e																
645-3			kʼ a r																
75-3			m a m b ə																
160-3			t ə r ə kʼ																
208-3			m a n kʼ e ə																
214-3			m a b																
218-3			m ə n z a																
378-3			m a n g ə t																
379-3			ʒ ə m ə																
409-3			g ə t ə ə																
497-3			t ə n																
598-3			e ə e m																
646-3			m a x ə																
164-3			b ə h ə																
210-3			ʒ ə x ə ə ə																
215-3			m a t e b ə																
256-3			t ə ʒ a																
285-3			m ə t a t																
332-3			m ə g ə r																
380-3			m ə x ə a																
412-3			z a h ə n																
496-3			r ə r b ə n b ə																
64-3			t a b ə																
67-3			i ə r																
169-3			n ə z ə z ə m																
251-3			l ə kʼ																
461-3			b b																
547-3			m ə z a t																
597-3			m e m ə n ə																
655-3			m ə ʃ t																
7-3			m a r g a																
158-3			kʼ ə m ə																
168-3			m ə m a r																
296-3			ə x ə																
372-3			kʼ ə n l ə ʃ																
374-3			b ə kʼ ə ə ə																
375-3			r ə b																
385-3			i ə b ə t																
411-3			t ə a ə																
500-3			m ə m a r																
6-3			m ə r kʼ a m a																
17-3			m ə h ə r																
123-3			ʃ ə m ə m																
252-3			n ə n ə b ə																
421-3			b a z ə																
448-3			kʼ ə x a n ə ə n b ə																
449-3			m a ʒ ə																
545-3			x a n ə																
596-3			n ə g ə																
653-3			b ə a ə t																
4-3			g ə ʒ ə																
254-3			g ə m a																
290-3			m a g ə z ə m																
339-3			b ə kʼ ə r																
460-3			x ə a																
489-3			b ə r m ə m a																
552-3			z ə																
652-3			m ə t ə x a																
119-3			m a n g a e a																
298-3			x ə																
340-3			g ə n z ə																
458-3			x ə n g ə e ə																
459-3			m a a ə																
607-3			m ə h a a																
609-3			m ə x a																
647-3			t ə a ə																
10-3			t ɨ kʼ ə r																
15-3			m ə n ə m																
18-3			n ɨ m ə																
73-3			z ə h ə ə ə ə																
76-3			m a ə n a																
110-3			x a b a																
121-3			g ə kʼ ə																
167-3			g ə ə																
255-3			g e ə n ə																
297-3			g ə n ə ə																
299-3			g ə n ə ə																
338-3			b ə m a r																
342-3			m e n a																
344-3			g ə z ə m																
410-3			g a r e																
540-3			n b a																
550-3			z ə n ə a r																
153-3			u ə a ə n ə																
219-3			g ə p a																
250-3			ə u e																
301-3			kʼ ə l a r a																
74-3			g i ə p ə																
120-3			x a n g a																
122-3			g a e a																
220-3			z ə i a x																
245-3			kʼ ə ə ə r ə																
300-3			x a n																
341-3			kʼ ə n ə m ə m																
549-3			g ə h a m a g																
610-3			m ə r a a r																
118-3			z ə n ə																
221-3			x ə p ə r ə																
420-3			m ə z a a																
455-3			m e m a																
495-3			m e g																
498-3			t ə ə ə kʼ ə m																
61-4				d a m															
63-4				ʔ a d ɨ m															
107-4				g a m r ə															
112-4				d a b a r a															
331-4				nː a g a ʃː															
377-4				b a t ə ə															
381-4				ʔ a t															
417-4				s a f															
451-4				ʃː a b a															
454-4				ʔ a w ɨ s															
484-4				ʃː ɨ b ɨ ʃː t															
535-4				ʔ a r ɨ s															
543-4				a t															
593-4				ʔ a m ɨ ʃː															
640-4				m a ə															
1-4				d a b a s a															
65-4				b ɨ b															
163-4				ʃː a b a															
408-4				b a s a															
414-4				d a b a															
601-4				ʔ a s a															
642-4				nː a f a ʃː															
60-4				nː a f a ʃː a															
115-4				ʔ a r ə															
450-4				f a s															
490-4				d a b a ə															
638-4				ʃː ɨ s															
645-4				g a r															
75-4				ʔ a m b ɨ															
160-4				d a s a															
378-4				ʔ a nː g a d															
379-4				u a a															
409-4				g a t a s ə															
497-4				t a nː															
598-4				x ɨ e															
646-4				ʔ a x ə															
164-4				b a h a															
332-4				ʔ a g ɨ s															
380-4				ʔ a x a a															
412-4				ʃː a x a nː															
64-4				d a a															
67-4				i ɨ s															
169-4				b a s a ʃː a ə															
461-4				b a															
547-4				i a f a t															
597-4				ʔ a ə nː a ə															
655-4				m ɨ t															
158-4				i a m b															
168-4				ʔ ɨ m a s															
372-4				a nː f a s															
374-4				b a b a h a															
375-4				ʃː a b															
385-4				i ɨ b a t															
411-4				ə a s ə															
500-4				ʔ ɨ m ɨ s															
541-4				i a b ɨ w															
6-4				m a r ə m a															
17-4				ʔ a x ɨ r															
330-4				g a d															
421-4				b ɨ ʃː ə															
449-4				ʔ ə ə															
545-4				x ɨ nː a															
596-4				nː a g a															
653-4				b a t a t															
4-4				g ɨ g t a															
8-4				t a b a t a															
106-4				m a a															
339-4				b a ɨ r															
489-4				b ə ə r ɨ ə															
652-4				ʔ a t a															
119-4				ʔ a nː g a j a															
340-4				g a ə nː ə															
458-4				d a nː g a b a															
486-4				n a b a g a															
607-4				ʔ a h w ə															
609-4				ʔ ɨ x a															
15-4				ʔ ɨ nː a															
18-4				nː ɨ j ə															
73-4				g a h a ə s															
76-4				m w ə ʃː ə															
110-4				d a b a															
121-4				t ɨ a															
167-4				g ɨ j a															
334-4				ʔ a b a ə a															
342-4				m e nː a															
344-4				t a ʃː a m															
410-4				t a s ɨ															
550-4				ɨ a nː ɨ ɨ r															
612-4				ʔ a s b															
120-4				d a nː g ə															
122-4				t ə w ə															
341-4				t a nː a m ə															
549-4				t a h a nː nː t ə															
610-4				m a r j ə r															
61-5					t ə m														
63-5					ʔ a m ɨ m														
107-5					g a m ə s a														
112-5					t a b ə s a														
331-5					nː ɨ g ɨ s														
377-5					b ə k a s														
381-5					ʔ a a														
417-5					r a z														
451-5					s ə b a														
454-5					ʔ a s ɨ r														
484-5					s ɨ dː ɨ s														
535-5					ʔ a s ɨ r														
543-5					s ə s														
593-5					ʔ a m ə s														
640-5					m a a														
1-5					t ə b ə r ə m														
65-5					m ɨ b														
163-5					s ə e ə														
212-5					ʔ e nː														
244-5					ʔ a r b ə														
248-5					m ə s a														
293-5					f ə r ə z														
373-5					k ɨ m a s														
408-5					b a r a														
414-5					b ə b a a														
601-5					ʔ ə s b														
642-5					ʔ ɨ nː a s														
60-5					nː ə f ə s ə														
115-5					ʔ ə m a m														
209-5					s ə m a														
242-5					ʔ a m ɨ s														
415-5					z ɨ s a b														
450-5					z ə r														
490-5					m ə b ə														
638-5					s ɨ r ə														
645-5					k a s														
75-5					ʔ a m b ɨ s														
160-5					b ə r ə k														
208-5					ʔ a nː k a ə														
214-5					ʔ a b														
218-5					ʔ ɨ nː z ɨ														
378-5					ʔ a nː g ə														
379-5					z ə m ə														
409-5					g ə ə r ə														
497-5					ə nː														
598-5					e ɨ s														
164-5					b ə r ə														
210-5					z ə e a ə s ə														
215-5					ʔ a b e b ə														
256-5					z a														
285-5					m ɨ u a t														
332-5					ʔ ə n ɨ r														
380-5					ʔ a a a a														
496-5					s ə s b ə nː b ə														
64-5					t a b a														
67-5					o ɨ s														
169-5					b ə z ə z ə m														
251-5					f ə k														
294-5					m a ə														
461-5					m ə														
547-5					ʔ a z a														
597-5					m ə m ə ə ə ə														
655-5					m ɨ ʃ														
7-5					ʔ a s t a														
168-5					ʔ ɨ m a s														
296-5					ə ʔ a														
372-5					ə nː f ə r														
374-5					b ə dː ə ɨ ə														
375-5					s ə b														
385-5					o ɨ m ə														
411-5					ə r a ə														
500-5					ʔ ɨ m ɨ s														
6-5					m ə s a m a														
17-5					ʔ ə ʔ ɨ s														
113-5					b ə e														
123-5					ʃ ə m ə														
252-5					r ə r ə b ə														
421-5					b ɨ z a														
448-5					k ə b a nː ə ə nː b ə														
449-5					ʔ a z ə														
545-5					e ɨ nː ə														
596-5					nː ə t ə														
653-5					b ə dː ə														
4-5					g ɨ e ʃ ə														
8-5					k ə b ə l ə														
290-5					ʔ a t ə z ə														
339-5					b ə k ə s														
460-5					ʔ ə a														
489-5					b ə s s ɨ m a														
552-5					z ɨ														
602-5					m ə ʔ														
652-5					ʔ ə t ə a														
3-5					r ɨ nː ə														
119-5					ʔ a nː t a s a														
298-5					ʔ ə														
340-5					t ə nː ə ə														
458-5					n ə nː t ə b ə														
459-5					ʔ a s ə														
486-5					nː ə ə ɲː ə m														
607-5					ʔ ə r a a														
609-5					ʔ ɨ e a														
647-5					ə a														
15-5					ʔ ɨ nː ɨ m														
18-5					nː ɨ k ə														
73-5					z ə r a s ə m														
76-5					m ɨ ə s a														
110-5					n a dː a														
121-5					t ɨ ə														
152-5					ʔ a m a														
167-5					t ɨ ə														
255-5					k ɨ ə nː ə ə														
297-5					t ə nː ə s														
299-5					t ə nː ə s														
334-5					ʔ a m b ə a a														
338-5					m ə m ɨ s														
342-5					m e nː a														
344-5					k ə s ə m														
410-5					k a r e a														
550-5					z ə nː ɨ ɨ s														
612-5					ʔ a r b														
219-5					t ə b a														
250-5					ə e														
301-5					ə mː a s a														
74-5					t ɨ ə t ə														
120-5					n a nː t a														
220-5					ə ə ɨ a ə														
245-5					k ə ə s ə														
300-5					ʔ ɨ nː														
341-5					k ə nː ə m ə m														
549-5					ə ʔ a m a g														
643-5					t ə m														
118-5					ə ə nː ə														
420-5					ʔ a z a a														
455-5					ʔ e m a														
495-5					m e														
61-6						d ə m													
63-6						ʔ ə f ɨ m													
107-6						g ə m ə m													
112-6						d ə b ə n ə													
331-6						n ə g ə s													
377-6						b ə a a ə													
381-6						ʔ ə d													
417-6						r ə z													
451-6						s ə b ə													
454-6						ʔ ə sː ə r													
484-6						s ɨ ʔ ɨ s													
535-6						ʔ a s ə r													
543-6						s ə s													
593-6						ħ ə m ə s													
640-6						m ə n													
1-6						d ə b ə r ə													
163-6						s ə sː ə													
212-6						ʔ ə n													
244-6						ʔ ə r b ə													
248-6						m ə s ə													
293-6						f ə r ə s													
373-6						a ə m a m													
408-6						b ə r ə ə													
601-6						ʔ ə r b b													
642-6						n ə f ə s													
60-6						n ə f ə s ə													
115-6						ħ ə m m													
242-6						ʔ ə m ɨ s													
415-6						z ɨ n ə b													
450-6						ʔ ə r													
490-6						ə b ə													
638-6						s ə r													
645-6						kʼ a m													
75-6						ʔ a m b ə													
208-6						ʔ ɨ n a o ə ə													
214-6						ʔ a b													
218-6						ʔ ə z ʔ ə													
409-6						ʕ ə t ə r ə													
497-6						ə n													
598-6						k ə													
646-6						ʔ ə n ə													
215-6						ʔ ɨ b ə													
256-6						a mː ə													
294-6						m ə a													
655-6						m ə s													
158-6						kʼ ə m ə s													
372-6						k ə n f ə r													
375-6						s ə b													
411-6						ə r ə s													
500-6						ʔ ə m ə r													
541-6						a ə s ə n													
113-6						b ə n													
252-6						r ə k ə b ə													
330-6						kʼ ə m d													
448-6						kʼ ə d a m s ə n b ə													
106-6						m ə ə													
290-6						ʔ a gː ə z ə													
460-6						n ə													
552-6						ʔ ə													
602-6						m ə n													
2-6						k ə l ə m													
298-6						ʔ ə ə													
486-6						n ə ə kʼ ə													
211-6						m ə s ə t													
333-6						m ɨ s ɨ r													
334-6						ʔ a m b ə sː a													
612-6						ʔ ə r b b													
289-6						l ə b													
326-6						m ə ʔ h													
594-6						g ə ə													
154-6						ʔ ə f ə s ə													
286-6						s ə gː ə r													
418-6						b ə r b ə r													
615-6						m ai̯													
288-6						r ə ʔ a ə													
5-6						g ə b ə													
61-7							x m												
63-7							a a m ɨ m												
107-7							g a m e i a												
112-7							x a m ə a a												
331-7							a ɨ g a s												
377-7							m ɨ k a ə												
381-7							a a a												
417-7							i a z												
451-7							s m a ə												
454-7							i a i ɨ ə												
484-7							s ɨ i ɨ s ə												
535-7							a a s ɨ ə												
543-7							s s ə s												
593-7							a a m a s												
640-7							m a a												
1-7							x pː ə i m												
65-7							tʼ a m												
163-7							s ə g												
212-7							a ə a												
244-7							a a i a ə ə												
248-7							m a a ə												
293-7							s ə i ə z												
373-7							k ɨ m a a												
408-7							m a a a												
414-7							x ɨ i a a a												
601-7							a ə i ə ə												
642-7							a ɨ s a s ə												
60-7							a ə i ə s ə m												
115-7							i m a m												
209-7							s ɨ m ə ə												
242-7							a a m ɨ s ə												
415-7							z ɨ i a m												
450-7							z i												
490-7							m ə pː ə												
638-7							s ɨ n ə ə												
645-7							k a i												
75-7							a a m i ɨ												
160-7							x ə i ə k												
208-7							a a a k a												
214-7							a a i												
218-7							a ɨ i z ɨ ə												
378-7							a a n g ə g												
379-7							ʒ ə tʼ ə												
409-7							g ə g ə ə												
497-7							g ə n												
598-7							w ə a												
646-7							i a x a												
164-7							i ə i m												
210-7							ʒ ə x w ə a												
215-7							a a tʼ ə a ə												
256-7							g ə ʒ a												
285-7							m ɨ x a x												
332-7							a ə g ɨ i												
380-7							a a a a a												
412-7							s a x ɨ a												
496-7							s ə a s ə a i ə												
64-7							x a ə												
67-7							w ɨ s												
169-7							a ə z ə z ə m												
251-7							s k												
294-7							m a a												
461-7							tʼ ə												
547-7							w ɨ z a ə												
597-7							m ə m ə n ə												
655-7							m ɨ ə ə												
7-7							a a i g a												
158-7							k m ə s												
168-7							a ɨ m a i												
296-7							ə a i a a												
372-7							a m ə												
374-7							i ə k ə w ɨ												
385-7							w ɨ tʼ ə ə												
411-7							g ɨ a a s												
500-7							i ɨ m ɨ a												
6-7							m ə i a m a												
17-7							a ə x ɨ s												
123-7							ə m m												
252-7							n ə i ə i ə												
421-7							ʒ ɨ z a												
448-7							k ə tʼ a a s ə n ʒ ə ə												
449-7							a a ʒ ə												
491-7							x ɨ a g ə tʼ												
545-7							x ɨ n ə												
596-7							n ə g ə												
653-7							ʒ ə a ɨ ə												
8-7							k m a ə												
254-7							a a m a a ə												
290-7							a a g z m												
460-7							x ə a a												
489-7							i ə ə i i m a a												
552-7							z ɨ												
652-7							a a g ə x												
3-7							i ɨ n ə												
119-7							a a n g a z a												
298-7							x a g												
340-7							g w ə ə ə												
458-7							x ə n g ə a ə												
459-7							a a s ə												
486-7							a ə tʼ ə a ə m												
607-7							a ə i w a												
609-7							a ɨ x a												
10-7							m ɨ k ə i												
