COGID	Amharic	Argobba	Chaha	Endegagn	Ezha	Geez	Gumer	Gura	Gyeto	Harari	Inor	Kistane	Mesqan	Muher	Silte	Tigre	Tigrigna	Wolane	Zway
372-13													f ə z f ə r						
374-13													b ə h o r o						
385-13													m ɨ kʼ ə h						
411-13													m ə r a s						
500-13													ʔ ɨ m ɨ r						
541-13													kʼ ə f ɨ n						
6-13													m ə h z a m a						
17-13													d ə h ɨ o						
123-13													z h ə						
252-13													r ə dː ə b ə						
330-13													kʼ ə d						
421-13													b ɨ f ə						
448-13													d ə z a s ə r d ə r						
449-13													ʔ a n ə						
491-13													d ɨ n g ə b						
545-13													ʔ ɨ d ə						
596-13													z ə g ə						
653-13													b ə h ɨ						
4-13													z ə g ʃ ə						
8-13													d ə b ə o						
290-13													ʔ a g ə z ə						
460-13													ʔ ɨ a						
489-13													b ə ə h ʃ m a a						
552-13													z ɨ						
652-13													ʔ ə b ə a						
3-13													ʔ ɨ r ə						
119-13													z a r n a a						
213-13													ʔ a r a s						
298-13													z z						
340-13													g ə ə ə						
458-13													d ə r n ə h ə						
459-13													ʔ a s ə						
607-13													ʔ ə dː ʔ a						
609-13													ʔ ɨ g a						
647-13													d ə r h ə						
10-13													d ɨ kʼ r						
15-13													m ħ z ə m						
18-13													m ɨ o						
73-13													d ə o ə ə kʼ						
76-13													m a ə s a						
121-13													m ɨ ə						
152-13													ʔ a d ə						
167-13													g ɨ ə						
255-13													z ə d ə						
297-13													z d ə r						
299-13													z d ə r						
328-13													s ə dː ə b ə						
334-13													z a b ə z a						
338-13													m ə m ɨ r						
342-13													m ə r a						
344-13													f ə s ə m						
410-13													f a r ɨ						
540-13													ə b a						
550-13													d ə h z a s						
612-13													ʔ a r b						
153-13													d ə h ə r ə						
219-13													d ə r h						
301-13													z s f a h a						
326-13													m ɨ a						
594-13													g ɨ z						
74-13													z ə r s						
120-13													d a dː g a						
122-13													z a ə a						
154-13													ʔ a f ə r ə						
300-13													d f ɨ						
610-13													m ɨ h i a s						
118-13													ə ə						
221-13													d ə r b ə						
455-13													ʔ ə m a						
495-13													f ə h						
498-13													b o h ə kʼ ə						
61-14														d ə m					
63-14														ʔ a d ə m					
107-14														g a m ə r a					
112-14														d a b ə a a					
331-14														d ə g o ħ					
377-14														b o tʼ a ə					
381-14														ʔ a					
417-14														rː w z					
451-14														s ə b a					
454-14														ʔ a tʼ ə rː					
484-14														d ə ʒ tʼ ə					
535-14														ʔ a g ə rː					
543-14														s ə s m					
593-14														ʔ a m ə ɨ					
640-14														m a a					
1-14														d ə b ə rː ə m					
65-14														d ə b					
163-14														s ə g ə					
212-14														ʔ ə ɲː					
244-14														ʔ a rː b ə					
248-14														m i a					
293-14														f ə rː ə z					
373-14														ʔ ə m a ħ					
408-14														b ə r a					
414-14														d b a g i ħ a					
601-14														ʔ ə r ə					
642-14														i ə f a s					
60-14														d ə f ə dʒː ə m					
115-14														d ə rː a m					
209-14														s ə m ə					
242-14														ʔ a w s ə					
415-14														z a tʼ a ħ					
450-14														z ə rː					
490-14														d ə b ə					
638-14														s ə rː ə					
645-14														f a dː					
75-14														ʔ a m b ɨ r					
160-14														d ə rː ə l					
208-14														ʔ ə ħ tʼ ɲ g a					
214-14														ʔ a b					
218-14														ʔ ə z ə					
378-14														ʔ a r g ə aː					
379-14														ʔ ə dː ə					
409-14														ʔ a sː ə rː					
497-14														d ə dʒː					
598-14														d a ə					
646-14														ʔ a sː ə					
164-14														b ə f ə m					
210-14														z ə m ə ə sː ə					
215-14														d a i tʼ ə ə					
256-14														ʔ ʕ					
285-14														m ə d a d					
332-14														ʔ ə g ə r					
380-14														ʔ ə r a ħ					
412-14														d ħ r ə rː					
496-14														d ə rː b ə ə dʒː ə m					
64-14														d a sː ə					
169-14														b ə z ə z ə m					
251-14														d ə dʒː ə m					
294-14														m ɲ kʼ ħ					
461-14														d tʃ					
547-14														ʔ ə z a rː					
597-14														ʔ ə m ə ə ə					
655-14														m w tʼ kʼ					
7-14														ʔ a ħ g a					
158-14														b ə m ɨ w					
168-14														ʔ ə m a r					
296-14														d m					
372-14														d ə rː f ə rː					
374-14														b o ə g ə					
385-14														d tʼ u ħ m					
411-14														d ə rː a s					
6-14														m ə dʒː z a m a					
17-14														d ə m ə rː					
123-14														s ə m ə					
330-14														l ə dʒː ə					
421-14														b ɨ dʒː ə					
448-14														d ə ə a rː sː ə b ə rː					
449-14														ʔ a z ə m					
491-14														d ə g g ə d					
545-14														ʔ ə tʼ ə					
596-14														dː ə g ə					
653-14														b ə ə ə rː					
4-14														d ə p tʼ ə					
8-14														d ə b o ə a					
339-14														b ə dʒː ə n					
460-14														dː ə ɨ a					
489-14														b ə ħ a					
552-14														z ə					
602-14														m ə g					
652-14														d tʼ sː ə m m					
119-14														ʔ a dː g a z a					
340-14														d ə ə					
458-14														d ə ə dʒː ə ɲː ə					
459-14														ʔ a sː					
486-14														b ə ə ə dʒː ə m					
607-14														d ə a a					
609-14														ʔ ə g a					
647-14														d ə ɲː g ə a					
10-14														d tʃʼ tʼ rː					
15-14														ʔ ə s ə m					
18-14														z ɲ s ə					
73-14														ə sː ə sː ə					
110-14														d ə rː ə					
121-14														m z sː ə					
152-14														ʔ a d ə					
167-14														g ɨ ə					
255-14														d sː ə ə					
297-14														b sː ə rː					
299-14														b sː ə rː					
328-14														ɨ ə dː ə b ə					
334-14														ʔ a m b ə sː a					
338-14														m ə m ɨ r					
342-14														m z a					
344-14														f ə s ə m					
410-14														ʔ a rː ə a					
540-14														ə b a					
550-14														d ə ə g ə rː					
109-14														g ə tʼ d ə					
153-14														w ə w ə z ə					
219-14														b ə rː ħ rː					
250-14														d ə m ɨ					
289-14														d ə dʒː s					
301-14														d a sː a					
594-14														g ɨ z					
74-14														z sː ə rː ə					
122-14														d a a					
154-14														ʔ ə rː ə f ə m					
220-14														a					
245-14														d ə sː ə sː ə					
549-14														d ə m a g rː					
643-14														g ə m					
420-14														ʔ a z a a					
509-14														ʔ a m ə rː					
61-15															d ə m				
63-15															ʔ a tʼ ɨ m				
107-15															g ai̯ m ʃ kʼ ai̯				
112-15															d a b ə n a				
331-15															n ɨ g a s				
377-15															iː ə kʼ mː ai̯				
381-15															ʔ a				
417-15															r ə z				
451-15															s ə b a				
454-15															ʔ a tʃʼ i r				
484-15															s ɨ ʔ ɨ s t				
535-15															ʔ a s ɨ r				
543-15															s ə s t				
593-15															ʔ a m u s				
640-15															m a a				
1-15															d ə b ə r ə				
65-15															tʼ a b				
163-15															s ə tʃʼ ə				
212-15															ʔ ə n				
244-15															ʔ a r b ə				
248-15															ʔ mː tː ai̯				
293-15															f ə r ə z				
373-15															kʼ u m ai̯ ai̯				
414-15															tʃʼ mː b l kʼ mː tʃʼ ai̯				
601-15															ʔ ɨ r a b ə				
642-15															ʔ sː kʼ jː s				
60-15															n ə f ə s ə				
115-15															ʔ ɨ tː ai̯				
209-15															tʃʼ u mː l m				
242-15															ʔ a m ɨ s t				
415-15															z ɨ n a b				
450-15															z ə r				
490-15															tʃʼ tʃ a				
638-15															s ɨ r ə				
645-15															kʼ a l				
75-15															ʔ i m ħ sː ai̯				
160-15															d ə r ə kʼ				
214-15															ʔ a b				
218-15															ʔ ɨ nː p n ai̯				
378-15															ʔ a n g ə t				
379-15															tʃʼ ɲː tʃʼ u				
409-15															ʔ ɨ tʃʼ ə kʼ				
497-15															t ə n				
646-15															ʔ a ʔ ə				
164-15															b ə tʃʼ				
210-15															kʼː ə nː a n n				
215-15															ʔ ɨ l ɨ mː a				
256-15															t ə m a				
285-15															m ɨ tʼ a d				
332-15															ʔ ə g ə r				
380-15															ʔ i nː l ai̯				
412-15															tʃʼ ai̯ nː ɨ r				
496-15															tʃʼ ə nː s ə nː b a				
67-15															w ɨ r				
169-15															ʔ eː r a mː ə ə o				
251-15															f ə kʼ				
294-15															ʔ ħ kʼ ai̯ o				
461-15															tʼ ə				
547-15															w i z a t				
655-15															m ɨ ʃ t				
158-15															kʼ ə m i s				
168-15															ʔ ə m a r				
296-15															ʔ tʃ h a tː				
374-15															tʃʼ l l l tʃ f				
375-15															s ə b				
385-15															ʔ l mː a				
541-15															kʼ ə tʃʼ ɨ n				
17-15															ʔ ə h ɨ r				
113-15															b u n				
123-15															ʃ ə m ə				
252-15															r ə ʔ ə b ə				
330-15															kʼ ə l d				
421-15															b ɨ kʼ a				
449-15															ʔ mː o				
491-15															d ɨ n g ə ʃ				
653-15															mː a kʼ h				
8-15															kʼ ə b ə o				
106-15															m ə ʃ a				
254-15															g i mː ʔ sː				
290-15															ʔ a g ə z ə				
339-15															b ə kʼ ɨ ʔ				
602-15															m i n				
652-15															ʔ a ʃ a nː h a				
2-15															ʔ tʃː mː tʼ				
3-15															ʔ i r ə				
213-15															ʔ a r a ʃ				
459-15															ʔ a s o b				
211-15															m i s eː ʃ				
328-15															s ə d ə b ə				
333-15															m i ʃ i r				
612-15															ʔ a r b				
109-15															g nː tʃʼ				
247-15															ʔ ɨ n kʼ tʃː r a r e t				
615-15															ʔ dʒ				
62-15															tʃʼ ə tʃ aː tʃʼ				
456-15															ʔ ɨ nː t ə n b ə t t				
498-15															m ə tʃʼ ə kʼ ə m				
509-15															ʔ aː r ɨ				
61-16																d ə m			
63-16																ʔ a ɨ m			
107-16																g a m ə ai̯			
112-16																d a mː ə ħ a			
331-16																j ɨ g w s			
377-16																b ə f dʒ ʃ			
381-16																ʔ a ħ			
417-16																r ə z			
451-16																s e b sː lː			
454-16																ʔ a s ɨ r			
484-16																s fː ɨ kʼ tʼ			
535-16																ʔ a s ɨ s			
543-16																s ə ʔ ɨ			
593-16																ʔ a m ɨ s			
640-16																m a a			
65-16																dʒ b d			
163-16																s ə s ə			
212-16																ʔ ə n			
244-16																ʔ a r b ə			
248-16																m ɨ lː a			
293-16																s ə r ə ai̯			
373-16																kʼ ɨ m a			
408-16																b b s ɨ r			
414-16																s ɨ b dʒ f dʒ f			
601-16																s ə l b b			
642-16																ħ ɨ f a s			
209-16																s ɨ mː ɨ			
242-16																ʔ ɨ q ʃ kʼ ɨ d			
415-16																z ɨ n a b			
450-16																z ə r			
638-16																s ɨ f ʃ ai̯			
75-16																ʔ a lː nː nː f			
208-16																ʔ ɨ f f dʒ kʼ a			
214-16																ʔ a b			
218-16																ʔ ɨ f f sː n			
409-16																w kʼ s ə r ə			
497-16																s ə ai̯			
598-16																ʔ u b			
646-16																ʔ a f l			
256-16																w tː sː			
332-16																ʔ ə dʒ kʼ z			
496-16																w ə dʒ b ə ai̯ b ə			
67-16																w ɨ s			
655-16																ʔ ʃ dʒ a d			
372-16																k ə n f ə r			
375-16																s ə b			
411-16																ʔ ə f h z			
500-16																ʔ ɨ f n r			
541-16																kʼ ə s ɨ j			
17-16																ʔ ə j ɨ f			
113-16																b u j a			
252-16																r ə k ə b ə			
330-16																kʼ ə l d			
545-16																ʔ ɨ f ə			
106-16																m ə a			
254-16																l a m b ɨ d			
460-16																ʔ a ʔ a			
602-16																m ɨ ħ			
2-16																k ə l ə m			
213-16																ʔ a r a s			
298-16																ʔ ʔ a			
647-16																ə a			
211-16																m ɨ ʃ ə			
333-16																m ɨ s ɨ r			
612-16																ʔ a s ɨ			
289-16																lː ɨ b			
326-16																m ə ʔ h			
154-16																ʔ ə f ə f ə			
247-16																ʔ ɨ ɨ kʼ ə r a n a s			
286-16																s ə gː ɨ r			
418-16																b ə r b ə r ə			
615-16																m ai̯			
288-16																r ɨ ʔ ɨ s			
416-16																kʼ ə			
456-16																r ə m ə e lː r tʼ ə			
61-17																	d ə m		
63-17																	ħ tʃʼ tsʼ fː m		
107-17																	g a m ə l a		
112-17																	d a b ə n a		
331-17																	n ɨ g w s		
377-17																	b tsʼ fː tʃː f		
381-17																	ʔ a ħ i		
417-17																	r z		
451-17																	s ə b ɨ b		
454-17																	ħ a tʃʼ ɨ r		
484-17																	g f tsʼ ɨ sː ɲ		
535-17																	ʔ a sː ɨ r		
543-17																	sː ə sː		
593-17																	ʔ a m ə s		
640-17																	m a n		
1-17																	d ə b ə r ə		
65-17																	d ɲ b		
163-17																	s ə tʃʼ ə		
212-17																	ʔ ə n		
244-17																	n a r b ə		
248-17																	m tsʼ sː b ʔ		
293-17																	f ə r ə s		
373-17																	ɲ ɲ m a z		
408-17																	b ə r a		
414-17																	d sː fː ɲ f ɲ q u		
601-17																	ʔ ə r ə b		
642-17																	n ɨ f a s		
60-17																	n ə fː ə s ə		
115-17																	d a r m m		
209-17																	g ɲ ɲ ɲ rː		
415-17																	z ɨ n a b		
450-17																	z ə r		
638-17																	s ɨ r ə		
645-17																	fː tʃː r		
75-17																	ħ a m tsʼ tsʼ r		
214-17																	ʔ a b		
218-17																	d ɨ sː fː f ɨ		
409-17																	ʕ a fː ə r		
598-17																	d ə b ʔ		
164-17																	b ə f ə		
332-17																	ʔ ɨ g ɨ r		
412-17																	d ɲ ħ ə n		
496-17																	g ə r kʼ ə fː fː ə ʃ		
158-17																	fː ə m əi̯ s		
372-17																	k ə n f ə r		
375-17																	s ə b		
411-17																	d f r tʃː ɨ x		
500-17																	ʔ ɨ b ɨ r		
541-17																	q ə fː f n		
113-17																	b ə sː a		
330-17																	q ə fː d		
448-17																	fː ə d dʒ ɨ s ə ɨ b ə ħ		
106-17																	m ə s a		
290-17																	ħ a g ə z ə		
552-17																	ai̯ ɨ		
2-17																	h a l u m		
213-17																	n a r a sː		
647-17																	d ə ħ fː jː k		
211-17																	m ɨ sː əi̯ t		
334-17																	ʔ a m b ə s a		
109-17																	g u n tʃʼ ə		
153-17																	d ə sː tsʼ q f n		
289-17																	l ɨ b		
326-17																	m ə b ə		
247-17																	n ɨ n f ə r ə r i əi̯		
286-17																	s ə g ə r		
418-17																	b ə r b ə r ə		
615-17																	m ai̯		
288-17																	r a ʔ a s		
416-17																	r q ħ ai̯ t		
61-18																		d ə m	
63-18																		ʔ a t ɨ m	
107-18																		g a m ə w a	
112-18																		d a b ə n a	
331-18																		n ɨ g u s	
377-18																		b fː kʼ a o s	
381-18																		ʔ a	
417-18																		r ə z	
451-18																		s ə b a	
454-18																		ʔ a n ɨ r	
484-18																		s ɨ ʔ ɨ s	
535-18																		ʔ a s ɨ r	
543-18																		s ə s	
593-18																		ʔ a m a s	
640-18																		m a n	
1-18																		d ə b ə r ə	
65-18																		fː fː b	
163-18																		s ə tʃ ə	
212-18																		ʔ e n	
244-18																		ʔ a r b ə	
248-18																		ʔ fː fː s	
293-18																		f ə r ə z	
373-18																		kʼ ɨ m a w	
408-18																		b ə ʔ a	
414-18																		d ə b a	
601-18																		ʔ ə r b b	
642-18																		n ɨ f a s	
60-18																		n ə f ə s ə	
115-18																		w ə m	
209-18																		s a m a	
242-18																		ʔ a m ɨ s	
415-18																		z ɨ n a b	
450-18																		z ə r	
490-18																		t ə b a	
638-18																		s ɨ r ə	
645-18																		kʼ a l	
75-18																		ʔ a m b ɨ	
160-18																		d ə r ə kʼ	
208-18																		ʔ a kʼ kʼ fː s fː	
214-18																		ʔ a b	
218-18																		ʔ ɨ n sː n o	
378-18																		ʔ a n g ə	
379-18																		h tʃː s u	
497-18																		ə n	
646-18																		ʔ a ʃ s	
164-18																		b ə kʼ a	
210-18																		d ə tʃ a n o	
215-18																		ʔ ɨ fː ʕ b o	
256-18																		ʔ fː z a	
285-18																		m ɨ t a d	
332-18																		ʔ ɨ g ɨ ʃ	
380-18																		ʔ ɨ fː fː f	
412-18																		s a tʃ ɨ n	
496-18																		ʔ ʕ fː s ə s b ə	
64-18																		d a b ə	
67-18																		w ɨ r	
169-18																		b ə r a s ə f ə	
251-18																		f e kʼ	
294-18																		m u kʼ	
461-18																		ʔ ɨ n	
547-18																		w ɨ z a	
597-18																		ʔ u r o eː s ə	
655-18																		ʔ a fː tː	
7-18																		ʔ a w g a	
158-18																		kʼ ə m e s	
168-18																		ʔ ə m a r	
296-18																		ʔ tʃʼ uː a fː n	
374-18																		b ə z ħ s s	
375-18																		s ə b	
385-18																		w ɨ t ə	
411-18																		ʔ fː fː fː s o	
541-18																		kʼ ə tʃ ɨ n	
17-18																		ʔ ɨ ʔ ɨ ʔ	
113-18																		b u n	
123-18																		ʃ s e	
252-18																		r ə f ə b ə	
330-18																		kʼ ə l d	
421-18																		b ɨ kʼ a	
491-18																		d ɨ n g ə t	
653-18																		b ə kʼ ai̯ z	
8-18																		s a b ə e o	
106-18																		m ə t a	
254-18																		dʒ ɨ m a	
290-18																		ʔ a g ə z ə	
339-18																		b ə kʼ ɨ l	
489-18																		b ə r fː p b ɲː	
552-18																		z ə	
602-18																		m ɨ n	
2-18																		d ɨ fː ə	
3-18																		ʔ ɨ r ə	
213-18																		ʔ a r a ʃ	
459-18																		ʔ a tʃː ə	
647-18																		ə a	
76-18																		m w ə s a	
152-18																		ʔ a fː ə	
328-18																		s ə d ə b ə	
333-18																		m ɨ ʃ ɨ r	
338-18																		w ə kʼ ɨ n	
612-18																		ʔ a r b	
594-18																		g fː s	
247-18																		ʔ ɨ n kʼ fː r a r e t	
418-18																		b ə r b ə r eː	
615-18																		m a	
62-18																		f ə l ə	
456-18																		ʔ ə b ə kʼ ɨ ə t ə	
498-18																		b oi̯ tʃ s kʼ ə	
509-18																		ʔ a r ɨ r	
61-19																			d ə m
63-19																			ʔ aː fː i m
107-19																			g i m i kʼ o
112-19																			d aː b ə n aː
331-19																			n i g w s
377-19																			b f kʼ aː l
381-19																			ʔ aː d
417-19																			r a z
451-19																			s a b
454-19																			ʔ aː fː i o
484-19																			s ɨ b ɨ s t
535-19																			ʔ aː s i r
543-19																			s a s
593-19																			ʔ aː m u s
640-19																			m aː a
1-19																			d ə b ə ʃ ə
65-19																			ʔ f b
163-19																			s ə mː i
212-19																			ʔ i n
244-19																			ʔ aː r aː ə
248-19																			ʔ i fː o
293-19																			fː ə r ə s
373-19																			ʔ i m i o
408-19																			b o o aː r
414-19																			d ə b aː kʼ o
601-19																			ʔ a r b b
642-19																			n i f aː s
60-19																			ʔ s fː e s ə
115-19																			ʔ i l i m
209-19																			s a m a
242-19																			ʔ aː m ɨ s t
415-19																			ʔ i d aː ħ
450-19																			z ə r
490-19																			ʔ ə s i
638-19																			ʔ i l aː
645-19																			ʔ aː i
75-19																			ʔ aː m l i ɲ
160-19																			t ə r ə kʼ
208-19																			ʔ aː kʼ fː f i l
214-19																			ʔ aː b
218-19																			ʔ i mː o i ɲ
378-19																			ʔ aː n g ə
379-19																			s e t o
409-19																			ʔ s e s
497-19																			t ə n
646-19																			ʔ aː t ə
164-19																			b ə kʼ ə
210-19																			s ə n a n
215-19																			ʔ aː t s b l
256-19																			ʔ fː mː a
285-19																			ʔ ɨ dʒ o d
380-19																			ʔ aː n o o
412-19																			ʔ o l u
496-19																			ʔ e fː s ə fː s i
64-19																			d a b a
67-19																			ʔ ɨ r
169-19																			ʔ l r l l o m
251-19																			f i kʼ
294-19																			m uː kʼ
461-19																			t ai̯
547-19																			ʔ fː l o l
597-19																			ʔ i m ə l o i
7-19																			ʔ aː l g aː
158-19																			kʼ ə m i s
168-19																			ʔ i m aː r
296-19																			ʔ i ʔ a
375-19																			s ə b
385-19																			ʔ s t f l
500-19																			ʔ i m i ʔ
541-19																			kʼ ə tʃ i n
6-19																			m ə kʼ l o m o
113-19																			b u n
123-19																			ʃ i m ə
330-19																			kʼ ə l d
491-19																			d ɨ n g ə t
106-19																			m ə s a
254-19																			dʒ i m a
339-19																			b ə kʼ i i
460-19																			g i n l
602-19																			m ɨ n
652-19																			ʔ ai̯ l o l dʒ a
2-19																			ʔ i b aː
213-19																			ʔ aː r aː ʃ
298-19																			ʔ ħ l o
459-19																			ʔ a s ə
486-19																			l ə t ə kʼ ə
152-19																			ʔ aː r a
211-19																			ʔ ɨ fː l n
328-19																			s ə d ə b ə
333-19																			ʔ ɨ ʃ fː r
540-19																			ʔ l aː
594-19																			g i n e
154-19																			ʔ ɨː fː ə s s
247-19																			ʔ ɨ n kʼ uː r aː r i t
286-19																			s ɨ ɲ i ɲ
418-19																			b ə r b ə r eː
615-19																			m ai̯
62-19																			f ə l aː
288-19																			ʔ ɨ r
416-19																			kʼ ə ɨ
456-19																			ʔ ə t s t rː ai̯ ai̯
509-19																			ʔ aː r aː
5-19																			ɲ i b s
