COGID	Amharic	Argobba	Chaha	Endegagn	Ezha	Geez	Gumer	Gura	Gyeto	Harari	Inor	Kistane	Mesqan	Muher	Silte	Tigre	Tigrigna	Wolane	Zway
411-7							m ɨ kʼ ɨ s												
500-7							m ɨ m ɨ												
6-7							m ɨ pː k m m ɨ												
17-7							k ʃ x ɨ s												
123-7							eː m a												
252-7							k a k e pː a												
421-7							m kʼ kʼ ʃ												
448-7							k e pː pː pː s a pː k a pː												
449-7							a a ʒ ə												
491-7							m pː d e pː												
545-7							x ɨ s ɨ												
596-7							k a k a												
653-7							k s ə ɨ pː												
8-7							k a k s s												
254-7							k ɨ m tʼ tʼ ɨ												
290-7							a a g z m												
460-7							x ɨ ɨ ɨ												
489-7							tʃʼ w s pː kʼ m m ɨ												
552-7							z ɨ												
652-7							k ʃ pː ɨ x												
3-7							m ɨ s a												
119-7							k ʃ x kʼ nː t												
298-7							k aː tʼ												
340-7							k pː ə g ə												
458-7							k ə k a s a												
459-7							k ai̯ s a												
486-7							k s pː k												
607-7							k ʃ w a												
609-7							m ɨ x ɨ												
10-7							m ɨ s g												
15-7							m ɨ s ɨ m												
18-7							n ɨ k ə ə												
73-7							ʒ a pː e pː ə n												
76-7							m w ə s a												
110-7							x ɨ s ɨ												
121-7							m ɨ k												
152-7							ʔ t s n												
167-7							m ɨ g a												
255-7							k w ə pː ʒ a												
297-7							k s a ə												
299-7							k s a ə												
338-7							k a m ɨ s												
342-7							m ɨ x a												
344-7							k a s a m												
410-7							k mː k ɨ												
540-7							tʃʼ g ʃ												
550-7							k a pː tʼ ɨ s												
153-7							m a pː ɨ s ɨ												
219-7							k ə pː pː												
250-7							k a pː n												
301-7							k s s a												
326-7							m ɨ ə n												
74-7							k w ə pː												
120-7							x a n g a												
122-7							k a w a												
220-7							g ə w a g												
245-7							k a ə a ə a												
300-7							x ɨ n												
341-7							k ə pː pː												
549-7							k a k ɨ m n ə												
610-7							m ɨ s aː d s												
643-7							g ɨ												
118-7							ə ə n ə												
221-7							k ə pː ʒ ə												
420-7							k pː w pː ʔ												
455-7							k m ʕ												
495-7							k a kʼ												
61-8								ə m											
63-8								h a mː ɨ m											
107-8								dʒ ɨ m ɨ r a											
112-8								j r mː ə r a											
331-8								h ɨ dʒ ħ s											
377-8								m t kʼ ħ r p ə											
381-8								ʔ a											
417-8								r ə z											
451-8								s ə b ə											
454-8								h r s ɨ p											
484-8								s ɨ m ɨ s p											
535-8								h a s ɨ r											
543-8								s ə s											
593-8								h a m ɨ s											
640-8								m a a											
1-8								ə b ə r ə m											
65-8								kʼ p ħ											
163-8								s ə p ə											
212-8								h s											
244-8								h a r b ə											
248-8								m ɨ r ɨ											
293-8								ə r ə z											
373-8								kʼ ɨ m a r											
408-8								b ə r a											
414-8								kʼ p b p t r s a											
601-8								h ə p p ʃ											
642-8								h ɨ b p s											
60-8								n ə z ə s ə m											
115-8								h ə p m											
209-8								s ɨ m ɨ											
242-8								h r mː ɨ s p											
415-8								m ɨ ħ r b											
450-8								z ə r											
490-8								kʼ ə p ə ə											
638-8								s ɨ n ə											
645-8								kʼ a r											
75-8								h a m b ɨ r											
160-8								ʒ ə r ə kʼ											
208-8								h ɨ ʃ kʼ r kʼ											
214-8								ʔ a b											
218-8								ʔ ɨ n ɨ ɨ											
378-8								h a dʒ ə p											
379-8								ʒ ə tʼ ə											
409-8								g ə g ə r ə											
497-8								ə n											
598-8								h b b ʔ											
646-8								h a tʼ ə											
164-8								b ə kʼ ə											
210-8								ʒ ə g ə ʃ r ə											
215-8								h ə tʼ tʼ kʼ ʃ p											
256-8								h r mː tʃ											
285-8								m ɨ b ə ɨ											
332-8								h ə g ɨ r											
380-8								h ə g a											
412-8								s a s ə											
496-8								s ə r s ə n b ə											
64-8								a b ə											
67-8								w ɨ r											
169-8								ʒ ɨ p ə p ə p ə											
251-8								kʼ ħ s ə											
294-8								m s tʼ p											
461-8								tʼ a											
547-8								m ɨ s ɨ m											
597-8								h e m ə ɨ ə											
655-8								m ɨ ʃ											
7-8								ʔ a l dʒ a											
158-8								kʼ ə m ɨ s											
168-8								h ɨ m a r											
296-8								ə h a											
374-8								ʒ t ʃ ɨ mː a											
385-8								w ɨ tʼ ə tʼ											
500-8								h ɨ m ɨ r											
6-8								m ə r kʼ a m a											
17-8								ʔ ə ɨ r											
123-8								ʃ ə m ə											
252-8								kʼ ə p ə p ə											
421-8								b ɨ ʃ ə											
448-8								kʼ ə p ə s ə p b ə p											
449-8								h a ʒ ə											
545-8								h ɨ s j w											
596-8								n ə g ə											
653-8								ʒ ə tʼ ɨ p											
4-8								m ɨ r r ə											
8-8								kʼ ə b ə ə											
254-8								kʼ ɨ h t m											
290-8								h a ə z ə m											
339-8								b ə kʼ ɨ r											
460-8								a ɨ a											
489-8								ʒ p ə ʃ p m m a											
552-8								z ɨ											
652-8								h kʼ tʼ ɨ p h ə g											
3-8								m ɨ s b											
119-8								ʔ a n g a z a											
298-8								h ɨ m											
340-8								dʒ r s ʒ p ə											
458-8								ʒ ə tʼ g ə p n											
459-8								h a s ə											
607-8								h ə kʼ w a											
609-8								ʔ ɨ dʒ a											
10-8								m ɨ kʼ tʃʼ p											
15-8								ʔ ɨ n ɨ m											
18-8								h ɨ kʼ i ʔ ə											
73-8								ʒ ə p ə p r p											
76-8								m w ə s a											
121-8								g ɨ kʼ ə											
167-8								g ɨ ə											
255-8								kʼ p ə p ʒ ə											
297-8								dʒ r s ə ə											
299-8								dʒ r s ə ə											
338-8								m ə m ɨ r											
342-8								m e n a											
344-8								kʼ ə s ə m											
410-8								kʼ a r e											
540-8								n e b a											
550-8								z ə n z ɨ r											
219-8								g ə p a											
250-8								s ə p w											
301-8								kʼ s j ə r a											
74-8								g w ə p ə											
120-8								a n g a											
122-8								kʼ a w a											
220-8								ʒ ə w a p ə											
245-8								kʼ ə p ə p ə											
300-8								h ɨ n											
341-8								kʼ ə n ə m ə m											
549-8								m ə p a m kʼ											
610-8								m ɨ r kʼ a r											
643-8								dʒ ə											
118-8								ʒ ə kʼ ə											
221-8								ʒ ə p ə r ʔ											
420-8								ʔ ɨ a ə g											
455-8								ʔ e m a											
495-8								s tʼ g											
498-8								m ə h ə kʼ ə m											
61-9									d ə m										
63-9									ʔ a tʼ ə m										
107-9									g a m ə r a										
112-9									d a b ə r a										
331-9									g ə g w s										
377-9									b ə s ə ə										
381-9									ʕ s b										
417-9									ɲː s s										
451-9									s ə b a										
454-9									z s s e aː										
484-9									s ʕ s s s s										
535-9									ʔ s s ʕ s										
543-9									s ə s										
593-9									ʔ a m w s										
640-9									m a a										
1-9									d ə p ə r ə										
65-9									e s b ə										
163-9									s ə f ə										
212-9									ʔ s										
244-9									ʔ s aː aː ə s										
248-9									x s z										
293-9									aː ə g ə s										
373-9									ʕ ʕ s s r										
408-9									b ə r s										
414-9									əi̯ s b s s s s a										
601-9									ʔ s s u b										
642-9									tʼ ə f a s										
60-9									n ə f ə s ə										
209-9									s ə m ə										
242-9									ʔ a m ə s										
415-9									x s s s b										
490-9									x ə p										
638-9									s ə n ə										
645-9									ʕ s z										
75-9									ʔ ɨ z b s										
160-9									ʒ ə s ə s										
208-9									ʔ s ɲ ʕ s z r										
214-9									ʔ a b										
218-9									x s s s s										
378-9									ʔ a n g ə s										
379-9									z ə tʼ ə										
409-9									g ə ə g ə										
497-9									ə n										
598-9									x s s										
646-9									ʔ a x ə										
164-9									b ə s ə										
210-9									ʒ ə ə ə r										
215-9									x s s s f										
256-9									a m a										
285-9									x f aː s l										
332-9									ʔ ə g ə r										
380-9									ʔ ə s s s										
412-9									x ʕ tʼ ɨ										
496-9									x s s s ə tʼ b ə										
64-9									d a b ə										
67-9									w ə r										
169-9									ʒ ə s ə s ə z										
251-9									f ə s ə										
294-9									m w										
461-9									tʼ a										
547-9									w ə z a										
597-9									ʔ ə ə ə ə ə										
655-9									x s aː s										
7-9									ə s z g a										
168-9									ʔ ɨ z a s										
296-9									x tsʼ z s s										
372-9									ʒ ə s s ə g										
374-9									b ə s ə s aː										
375-9									s ə b										
385-9									w ə tʼ ə tʼ										
411-9									ə g a ə										
500-9									ʔ ə m ə g										
541-9									e ə ɲ tʃʼ s										
6-9									m ə s z a l a										
17-9									ʔ ə x s s										
113-9									b aː ɲː ɨ										
123-9									s ə m ə										
252-9									ʒ ə s ə b ə										
421-9									b s s ə										
448-9									s ə p a r s ə p b ə p										
491-9									əi̯ s ɲ ɲː ə tʼ										
545-9									x ə n ə										
596-9									n ə g ə										
653-9									b ə b ə										
4-9									x ʕ s s ə										
8-9									ʕ s b ə j										
254-9									ɲː ɨ s tʼ tʼ										
339-9									b ə s s z										
489-9									b ə s s s l tʼ										
552-9									z ə										
652-9									ʔ s r ɨ										
119-9									ʔ a n g a f a										
298-9									z s tʼ										
340-9									x ə ə ə										
458-9									ʒ ə n g ə s ə										
459-9									ʔ s s tʼ										
486-9									n ə tʼ ə f ə										
607-9									ʔ ə f w a										
609-9									ʔ ɨ x a										
10-9									tʼ aː aː s										
15-9									x s s s a										
18-9									n ə ʔ ə										
73-9									ʒ ə p ə s r ə										
76-9									m w ə s a										
110-9									a b a										
121-9									ə ə										
167-9									g ə j ə										
255-9									ʕ s r tʼ										
297-9									g ə n ə s										
299-9									g ə n ə s										
338-9									ʒ ə ɲ s										
342-9									m ə n a										
344-9									s ə s ə m										
550-9									f ə n f ə f										
612-9									z s ɲ f ə										
219-9									g ə p a										
301-9									f l ə f a										
74-9									g w ə p ə										
120-9									d a n g a										
220-9									ə w a x										
245-9									s ə w ə g ə										
300-9									x ə n										
341-9									f ə n ə m ə										
610-9									m ə r s a r										
118-9									s ə n ə										
221-9									g ə b ə r ə										
420-9									ʔ ə z a										
61-10										d ə									
63-10										ʔ a tʼ a									
107-10										g a g ə dʒ aː									
112-10										d aː b ə m aː									
331-10										ʔ a g ɲː ʃ									
377-10										b ə kʼ w ə									
381-10										ʔ aː									
417-10										r u z									
451-10										m ə b a									
454-10										ʔ a t ə r									
484-10										ʔ əi̯ ɲ mː ʃ tʼ									
535-10										ʔ a tʼ a r									
543-10										tʼ əi̯ dʒ tʼ									
593-10										ʔ a z ʃ									
640-10										w aː									
1-10										d ə b ə s ə									
65-10										tʼ u b									
163-10										w ə kʼ ə									
212-10										ʔ ə t									
244-10										ʔ a r b ə									
248-10										w jː tʼ aː									
293-10										f ə r ə ʃ									
373-10										kʼ a aː z kʼ									
408-10										b a r a									
414-10										tʼ t b a kʼ uː tsʼ a									
601-10										ʔ ə b ə b									
115-10										ʔ o ɲ ə									
209-10										tʼ ɲː jː ʃ ɲ									
242-10										ʔ z r ʃ ʃ tʼ									
415-10										z a m a b									
490-10										tʼ ə b a									
160-10										d ə r ə kʼ									
208-10										ʔ a ɲ kʼ o kʼ ɲ									
218-10										ʔ a ɲ s tʃʼ ɲ									
378-10										ʔ a g g ə tʼ									
379-10										b o tʼ ə ɲ									
497-10										b ə g									
598-10										ʔ a tʃʼ									
646-10										ʔ aː									
164-10										b ə kʼ ə									
210-10										b e o t kʼ ə									
256-10										b ɲ b ʃ									
285-10										ʔ k tʼ t ə									
380-10										ʔ a w									
412-10										m aː ħ a m									
64-10										d a b ə									
169-10										b ə r ə s ə b ə									
461-10										tʼ ə									
547-10										w b z ə r									
411-10										ə r a m									
541-10										kʼ t z a tʃʼ									
113-10										b u m a									
123-10										tʼ ə ɲ ə									
491-10										ʔ u t g ə tʼ									
254-10										kʼ ə r kʼ tʼ									
339-10										b ə kʼ ə l									
602-10										a t									
2-10										b u dʒ a									
213-10										ʔ a r aː tʼ									
647-10										tʼ ə n o e									
211-10										w ə tʼ i tʼ									
328-10										ʃ ə b ə b ə									
333-10										ʔ a dʒ ɲː r									
612-10										ʔ aː r b b									
109-10										g tʼ l tʼ ə									
289-10										dʒ a b									
286-10										w s g a r									
418-10										b ə r b ə r									
615-10										w w									
62-10										f ə l aː									
288-10										r a dʒ a									
416-10										kʼ ə u									
456-10										ʔ a n b ə n t b e									
509-10										ʔ a r a r									
5-10										g ə b ʃ									
61-11											d ə m								
63-11											ʔ h p p m								
107-11											g a m ə r a								
112-11											d a b ə r a								
331-11											n a g a s								
377-11											t ə h dʒ e a								
381-11											ʔ a h								
417-11											h sː a								
451-11											s ə b a								
454-11											ʔ dʒ u ɨ u								
484-11											kʼ p dʒ p o p								
535-11											ʔ a kʼ dʒ ħ								
543-11											s ə s t								
593-11											ʔ ɨ p dʒ u								
640-11											m a a								
1-11											ə b ə r ə								
65-11											kʼ kʼ t ə								
163-11											tʃʼ ə p a								
212-11											ʔ e n								
244-11											ʔ a m b ə								
248-11											ħ kʼ h dʒ								
293-11											kʼ ə h ə s								
373-11											tsʼ ɨ ɲ dʒ ħ								
408-11											t a h aː m								
414-11											tʃʼ p b dʒ ħ kʼ b a								
601-11											g ɨ p b t								
642-11											x dʒ kʼ u u								
60-11											n ə f ə s ə								
115-11											ʔ ə m a								
209-11											kʼ dʒ dʒ u dʒ								
242-11											ʔ ɨ kʼ tʃʼ kʼ p								
450-11											z ə r								
490-11											f ə t w ə								
638-11											s ɨ n e								
645-11											ħ s ħ								
75-11											ʔ a m b i r								
160-11											f ə r ə f								
208-11											x a ʒ h kʼ s a								
214-11											ʔ a b								
218-11											g p b sː p								
378-11											ʔ a n g ə t								
379-11											ʒ ə p kʼ								
409-11											g a t ə r ə								
497-11											t ə n								
598-11											k a b j								
646-11											ʔ a x a								
164-11											t ə h ə								
210-11											ʒ ə h a ə ʒ a								
215-11											x h p t ə p								
256-11											t k dʒ u								
285-11											x dʒ kʼ p ə								
332-11											ʔ ə g ɨ r								
412-11											s a h i n								
496-11											tʃʼ h b ə p b ə								
64-11											ʔ a b a								
67-11											w ɨ r								
169-11											t ə p ə p ə t								
251-11											kʼ s kʼ								
294-11											x w t ɨ								
461-11											ʒ p								
547-11											x p ɲː a p								
597-11											ʔ t ə n a j								
655-11											x dʒ u o								
7-11											ʔ a l g a								
168-11											ʔ a m a r								
296-11											ʔ ə k a p a								
372-11											f ə n f ə r								
374-11											t e sː tʃʼ b a								
375-11											s ə b								
385-11											x p p ə p								
500-11											ʔ i m i r								
541-11											tsʼ ə h f s								
6-11											m ə r x a m a								
17-11											ʔ ə x ɨ r								
252-11											n ə b ə b ə								
421-11											x dʒ kʼ a								
448-11											g ə p a p a p b ə t								
449-11											ʔ a ʒ ə								
491-11											x j g ə p								
545-11											x a n ə								
596-11											n ə g ə								
653-11											b a ə p p								
4-11											g o dʒ h a								
106-11											m ə m a								
254-11											g m b p								
339-11											b ə g a r								
460-11											d a h p								
489-11											t a b h dʒ kʼ a								
652-11											ʔ h ʒ s d k ə								
3-11											x a n ə								
119-11											ʔ a n g a ʒ a								
298-11											x dʒ t a								
340-11											g a ə n ə								
458-11											d ə n g ə ə								
486-11											n ə f ə f ə								
607-11											ʔ ə f w a								
609-11											ʔ i x a								
15-11											x ə p a p								
18-11											x p p ə								
73-11											ʒ ə p ə s ə j								
76-11											m w ə s a								
110-11											d a b a								
121-11											t a n ə								
167-11											g a j ə								
255-11											ħ p ə t ʒ ə								
297-11											g ə n ə r								
299-11											g ə n ə r								
342-11											m e n a								
344-11											s ə s ə m								
550-11											g ə n kʼ p d								
109-11											g j k h a								
153-11											x e e tsʼ uː								
219-11											g ə p a t								
250-11											x ə t								
301-11											k ə a r a								
594-11											g i g ə								
122-11											s a w a								
220-11											g ə w a g								
300-11											x i n								
341-11											s ə n ə m ə								
610-11											x b kʼ ɨ s ʕ								
643-11											g a								
221-11											g ə p ə r ə								
61-12												d ə m							
63-12												ʔ a tʼ ɨ m							
107-12												g a m ə r a							
112-12												d a b ə n a							
331-12												n ə g w s							
377-12												b ə r f o r							
381-12												ʔ a ə							
417-12												r ə z							
451-12												s ə b a							
454-12												ʔ a f ɨ r							
484-12												s ə dː ə s tː							
535-12												ʔ a s ə r							
543-12												s ə s ə							
593-12												ʔ a m ə s							
640-12												m ə n							
1-12												d ə b ə r ə							
65-12												tʼ w b							
163-12												s ə f ə							
212-12												ʔ ə n							
244-12												ʔ a r b ə							
248-12												m ə r a							
293-12												f ə r ə z							
373-12												ʔ i m ə r							
408-12												b ə r a							
414-12												d tʃʼ b ə ʃː i x ə							
601-12												ʔ ə r b b							
642-12												n ə f a s							
60-12												n ə f ə s ə							
115-12												ʔ ə z ə m							
209-12												m x tː ʃː tː							
242-12												ʔ i m ɨ s sː							
415-12												z ɨ n a b							
450-12												z ə r							
490-12												tʼ ə b ə							
638-12												s ɨ r o							
645-12												a a r							
75-12												ʔ a m b ɨ r							
160-12												d ɨ r o r							
208-12												ʔ ə x ʃː sː sː							
214-12												ʔ a b							
218-12												m ə x z ɨ s							
378-12												ʔ ə g ə s							
379-12												ʔ ə dː ə							
497-12												b o r							
598-12												d ə b ə							
164-12												b ə f ə							
210-12												z o o o o ə							
215-12												ʔ ə sː b o tʃʼ							
256-12												m mː ə							
285-12												m ɨ tʼ a d							
332-12												ʔ ə g ɨ r							
380-12												ʔ ə w a							
412-12												s a g ə n							
496-12												m ə r b o o b o							
64-12												d a b ə							
67-12												tʃʼ ɨ r							
169-12												b ə r ə z ə m							
251-12												f ə f							
294-12												m w ə							
461-12												tʼ ə							
547-12												w ə z a							
597-12												m ə r o ə o o							
655-12												m ɨ sː sː							
7-12												ʔ a r g a							
168-12												ʔ ɨ m a r							
296-12												ə a a							
372-12												d ə n b ə r							
374-12												b aː i x z							
385-12												m x b x sː							
500-12												ʔ ɨ m ɨ r							
6-12												m o sː z a m ə							
113-12												b w n							
123-12												sː ə m ə							
330-12												b ə ɨ o							
421-12												m aː sː i							
448-12												tʼ ə tʃʼ a s s o ə b o tʃʼ							
449-12												ʔ a j ə							
491-12												d ɨ n g ə b							
545-12												m ɨ s o							
596-12												n ə g ə							
653-12												b ə ə							
4-12												g ə ʃː r o							
8-12												b ə b o ə a							
106-12												w ə x a							
460-12												m ə sː sː							
552-12												z ə							
602-12												m ə n							
2-12												w a f sː							
3-12												ʔ ɨ r ə							
119-12												ʔ ə ə g ə a							
213-12												ʔ ə r ə x							
340-12												g w ə g							
458-12												d o ə g ə ɲː o							
607-12												tʃʼ ə dː tʃʼ a							
609-12												ʔ ɨ g a							
647-12												b o sː ɲː o							
10-12												tʼ a sː r							
110-12												d a dː a							
152-12												ʔ a d o							
211-12												w ə sː ə tː							
255-12												ʔ i o o o o							
297-12												g mː ə s							
299-12												g mː ə s							
328-12												s ə dː ə b ə							
333-12												w ə x ə r							
334-12												ʔ a n b ə sː a							
338-12												b ə m ɨ r							
410-12												f a r o							
540-12												ʔ b a							
109-12												g ə n f							
153-12												w ə w ə n ɨ							
289-12												g ə							
326-12												m ə s o							
594-12												g ɨ z							
549-12												m o sː ə m a							
643-12												g ə							
62-12												b ə sː a							
498-12												m o n x ħ ə							
509-12												ʔ a r							
5-12												g ə b ə							
61-13													d ə m						
63-13													ʔ a f ɨ m						
107-13													g a m ə r a						
112-13													d a b ə n a						
331-13													n ɨ g u s						
377-13													b ə kʼ u o						
381-13													ʔ a						
417-13													r a z						
451-13													s ə b a						
454-13													ʔ a n ɨ r						
484-13													s ɨ dː ɨ s b						
535-13													ʔ a s ɨ r						
543-13													s ə s						
593-13													ʔ a m ə s						
640-13													m a a						
1-13													d ə b ə r ə						
65-13													t b						
163-13													s ə f ə						
212-13													ʔ ə n						
244-13													ʔ a r b ə						
248-13													m r a						
293-13													f ə r ə z						
373-13													kʼ ɨ m a r						
408-13													b ə r a						
414-13													d h z a kʼ u u a						
601-13													ʔ ə r b						
642-13													n ɨ f a s						
60-13													n ə f ə s ə						
115-13													ʔ ə m a m						
209-13													d f sː ʃ r						
242-13													ʔ a m ɨ s b						
415-13													z ɨ r a b						
450-13													z ə r						
490-13													d ə r ə						
638-13													s ɨ r ə						
645-13													kʼ a r						
75-13													ʔ a m b ɨ						
160-13													d ə r ə kʼ						
208-13													z a r h i z a						
214-13													ʔ a b						
218-13													ʔ ɨ h z n						
378-13													ʔ a n g ə ɨ						
379-13													ʔ ə dː ə						
409-13													z a b ə r						
497-13													b ə n						
598-13													d ə n						
646-13													d a e						
164-13													b ə f ə						
210-13													z ə f i n						
215-13													z h n b ə						
256-13													b a m a						
285-13													m ɨ d a d						
332-13													ʔ ə g ɨ r						
380-13													ʔ a n a a						
496-13													d ə ħ b ə eː d ə						
67-13													w ɨ r						
169-13													b ə r ə z ə m						
251-13													f ə kʼ ə						
294-13													m u kʼ						
461-13													f h						
547-13													w ɨ z a b						
597-13													ʔ ə m ə ə ə						
655-13													m ɨ tsʼ h						
7-13													ʔ a g a						
158-13													kʼ ə m s						
168-13													ʔ ɨ m a r						
296-13													d ə kʼ ɲː						
