COGID	Amami	Hachijo	Kagoshima	Kochi	Kyoto	Miyako	Oki	Sado	Shuri	Tokyo
204-8								u k r i		
14-9									t u ɴ u	
18-9									t u ɴ u	
35-9									h i k u s u	
36-9									h a b u b u	
48-9									n a g i s u ɴ	
60-9									t a u r i	
63-9									h a j u ɴ i	
64-9									t i	
67-9									h t i	
68-9									n a s u ɴ	
71-9									m w i ɴ u	
76-9									h u ɴ i	
83-9									t u ɴ u	
87-9									h a ɴ n u	
95-9									m u ɴ i	
98-9									h a ɴ u	
99-9									t u dʑ u	
-102-9									t i p s a u	
103-9									t u ɴ u	
110-9									t i	
116-9									m i m i ɴ u	
120-9									m a ts u ɴ	
132-9									t a ts u ɴ	
139-9									ʔ u t u j u u ɴ	
140-9									a n u ɴ u	
156-9									t a p i ɴ u u	
168-9									t u ɴ u	
169-9									h a s u	
170-9									m u ts u	
173-9									s u ɴ u	
180-9									u ɴ u	
185-9									h i b i	
186-9									m a j u ɴ i	
187-9									m u ts u	
190-9									t a h a s n ɴ u	
193-9									t a m u ɴ u	
194-9									h a r s i ɴ	
195-9									k a j s i ɴ	
216-9									n a ts u ts iː ɴ	
221-9									h a r u	
239-9									t u dʑ u	
252-9									m u ts u	
253-9									m u t u	
254-9									t a ts u ɴ u	
266-9									t a ɴ i	
267-9									n a g a j u j u ɴ	
268-9									ʔ u ɴ i	
272-9									ʔ a m i	
276-9									ʔ a n u s u ɴ	
281-9									m a ts u r u	
304-9									t u b s oː b u	
305-9									h tɕ ɴ u	
308-9									h u ɴ i	
309-9									u ɴ u	
310-9									t i	
311-9									m a m i	
342-9									m u dʑ u	
346-9									k a h u s u ɴ	
347-9									t a ts u ɴ	
348-9									h w u n s u ɴ	
351-9									t a r u ɴ	
361-9									ʔ iː k p u s u ɴ i	
379-9									k a t u r iː b u	
394-9									h w a s u ɴ i	
395-9									n a g u ɴ u	
400-9									h w a u j u ɴ	
412-9									n a g i j u ɴ	
413-9									k ʔ k u s u s u ɴ	
414-9									h a ts u ɴ	
422-9									h a k j u j u ɴ u	
423-9									k a n g u j u ɴ u	
430-9									h a ts u ɴ	
435-9									h a ts u ɴ	
446-9									h a p i s a u	
447-9									a u a a u	
458-9									t u dʑ u	
56-9									tɕ a t i	
62-9									t u ɴ u	
65-9									tɕ i iː i	
75-9									h i n ɴ i	
96-9									m u	
101-9									t a u	
114-9									ʔ a m u	
119-9									tɕ a ɴ i	
134-9									m u s u ɴ u	
138-9									m u ts u ɴ	
146-9									ʔ u ts u ɴ u	
161-9									h u ɴ a i	
171-9									tɕ a ɴ i	
182-9									k i ɴ u ɴ u	
196-9									m u ɴ u	
262-9									h ʔ a n s ɴ ɴ i	
300-9									h a g u ɴ i	
313-9									k a m n i	
350-9									h a m s i ɴ	
352-9									h a g s u ɴ	
396-9									h a a s a ɴ i	
401-9									ʔ a ts u ɴ	
420-9									ʔ a ts i j u ɴ u	
424-9									ʔ a ɴ a s u ɴ	
442-9									n i n i u s j u ɴ	
455-9									ʔ a k a s u ɴ i	
15-9									ʔ a j u	
22-9									h a s u i	
24-9									m i m ɕ u	
49-9									ʔ a ɴ n u g i	
89-9									t a	
175-9									n a m u	
183-9									h t i	
199-9									k i ts iː s a ɴ	
230-9									ʔ a s w i a u	
233-9									ʔ a k h u m u s i ɴ	
264-9									s a ɴ i	
274-9									n a g ɴ u s u ɴ ɴ	
314-9									m u ts u ɴ	
354-9									k a u s u ɴ	
376-9									n a a u s a ɴ	
415-9									m u ts u s u ɴ	
451-9									m u b i r u	
456-9									tɕ a ɴ i	
59-9									ʔ i ɕ u	
142-9									k a p u ɴ	
14-10										k o r i
18-10										k o r i
35-10										s o t o k o
36-10										s o t o k o
48-10										m o ŋ a o
60-10										k o r i
63-10										s i r a m i
64-10										k o
67-10										s i
68-10										m a t
71-10										k t t i
76-10										h o k i
83-10										k a r i
87-10										s o n o
95-10										m i m i
98-10										s o r i
99-10										k o k i
-102-10										s a t t o
103-10										s u m i
110-10										k o
116-10										m k k a r i
120-10										m o n u
132-10										k o k u
139-10										k k o r o s u
140-10										k d o o o i
156-10										k o t o r u
168-10										k o k i
169-10										k o m u
170-10										m o k u
173-10										k o k i
180-10										k o m o
185-10										s t a i
186-10										m o t u r o
187-10										m o k i
190-10										k o k a a o
193-10										k o r u a
194-10										m i n a o
195-10										k o r a o
216-10										m o m u n
221-10										m a
239-10										k o k u
252-10										m o k u
253-10										m o k i
254-10										k o ts u i
266-10										k o i
267-10										m o t a r u r u
268-10										k o m i
272-10										k o m i a
276-10										k a n u u
281-10										m o s i
304-10										k o k t a o
305-10										k k a k i
308-10										s a m i
309-10										k o s o
310-10										k o
311-10										s k t i
342-10										m o k i
346-10										k o r a s a
347-10										k o r u
348-10										h k o r a o
351-10										k o s o
361-10										k a t t o r a o
379-10										k o s a n o
394-10										s k o t o r o
395-10										m o ŋ i
400-10										h k o ŋ o r u
412-10										s o k o r u
413-10										k k t a k a t a r u
414-10										k o r u
422-10										h o k a u r i r i
423-10										k o n ŋ u u r i
430-10										k o k u
435-10										s o k u
446-10										m o t a a o
447-10										k n o t u
458-10										k o k u
56-10										h i k o
62-10										k a m a
65-10										k o r i
70-10										k o m i
75-10										k k o i i
96-10										s i
101-10										s o
114-10										k o i
119-10										k a m i
134-10										s a u r u
138-10										s a m a
146-10										k a s o a
161-10										m n o
171-10										k o i o
182-10										k a m o r u
188-10										m o m i
196-10										u u r u
262-10										h k a r a m o
300-10										s o k k o
313-10										k t t i
350-10										s o k a u
352-10										k o k a o
396-10										s a m i
401-10										k a s a
420-10										k a k u r u
424-10										k o t o s u
442-10										s a m e u r u
455-10										k o k o t u o
15-10										k a r u
22-10										s o a i
24-10										s a r r i
49-10										k a a n a t o
78-10										o k o r i
89-10										k o
130-10										s a r a
149-10										k o r i
175-10										s a m o
183-10										s k i
192-10										o o k i
199-10										k a t a t
230-10										k a t a t a k o
233-10										k a a a s a s a a a a a
250-10										k o k u s o
264-10										k a a a
274-10										s a n a t a
298-10										k o n o a o
303-10										k o s a a o o
314-10										s a s i
354-10										k a t a
369-10										k a s a r a
376-10										m a s a
415-10										m a s u u
418-10										s a
451-10										k o k a r i
456-10										k e a
72-10										s i k o
80-10										k o n o k o
104-10										o s i
118-10										s a m k o
142-10										k o t a
150-10										s o t a r i
204-10										u k i i
