COGID	ClassicalNahuatl	JalupaNahuat	MecayapanNahuat	NorthPueblaNahuatl	PajapanNahuat	Pipil	Pochutec	ProtoAztecan	TetelcingoNahuatl
97	j e k + tɬ i							j eː k + tɬ ɨ	
90	t eː n + t o k		t eː n + t o ʔ	t e n + t o k	t eː n + t o k	t eː n + t u k		t eː n + t o k	t i e n + t iː k a
249	p oː k + tɬ i	p uː k + t i	p oː k + t i	p o k + tɬ i	p oː k + t i	p u k + t i		p oː k + tɬ ɨ	p u k + tɬ iː
93	k w a l + l i			k w a l i					k w a l iː
98	x o x o k + t i k		x o x o k + t i ʔ	x o x o k + t i k	x o x o k + t i k				x o x o k + t iː k
99		x u x u i + k				x u x u w i + k			
10	k e ʔ ts o m								k e ts o m a
79	i h w i + tɬ	i j + u h w i + j u		i h w i + tɬ				ɨ w ɨ	
85			t oː p o h		t oː p o h				
288			aː + p a t aː n i		aː h k i a				
268	s iː tɬ a l + i n	s iː t a l	s iː t a l i n	s i tɬ a l i		s iː t a l		s i tɬ a l ɨ + m	s i tɬ a l iː
219		t r a i k			t a + t a w i + k				
183		t eː n	t eː n		t eː n	t eː n	t e n	t eː n + tɬ ɨ	
102			ts o n + k a l		ts o n + g a l	ts u n + k a l			
33	tʃ i tʃ i	tʃ u tʃ u		tʃ i tʃ i		p eː l u			tʃ iː tʃ iː + t u
237	eː w a + tɬ			j e w a j o		eː w a j u		eː w a + tɬ	j e w a j o
188	j o w a l + l i		j o w a l	j o w a l i			o w e l	j o w a l + l ɨ	j o w a l iː
3	eː w a + tɬ			j e w a + j o		eː w a + j u		ɨ w aː + j oː + tɬ	j e w a + j u + tɬ
191	a ʔ m oː		a j aː ʔ	a h m o					a m o
27				i ts + t i k					i ts + t iː k
296	n e n e + p i l + l i	n eː n e p i l		n e n e p i l	n e n e p i l	n e n e p i l	n e n e p i l	n ɨ n ɨ + p ɨ l	n e n e p iː l
218	tʃ iː + tʃ iː l + t i k		tʃ iː l + t i ʔ	tʃ i + tʃ i l + t i k		tʃ iː l + t i k		tʃ iː l + t ɨ + k	tʃ i + tʃ i + l t iː k
143	i s w a + tɬ	i s w a + t	i s w a ʔ		i s w a + t	i s w a + t		ɨ s w a + tɬ	
181	t e p eː + tɬ		t e p eː + ʔ	t e p e + tɬ	t e p eː + t	t e p eː + t		t ɨ p eː + tɬ	t e p i e + tɬ
94		j e k + t i	j eː k + t i		j e k + t i	j eː k		j eː k + tɬ ɨ	
284	t oː n a + t i w	r o n t i n		t o n a l + ts i n + tɬ i	t oː n a t i	t uː n a l	t u n e l		t u n a l iː
233		j u h l u	j oː l		j oː l				
19	tʃ iː tʃ iː w a l		tʃ iː tʃ i w a l	tʃ i tʃ i w a l	tʃ i tʃ i w a l			tʃ iː tʃ iː w a l	tʃ i tʃ iː w a l
239		b w e r a x t i			b e t a x		k w e t e x + t		
25	m i x + tɬ i		m i x + t i	m e x + tɬ i	m iː x + t i	m i x + t i		m i x + tɬ ɨ	m e x + tɬ iː
81			ts o h m i + ʔ		ts o h m i + t				
28	iː ts + t i k	s e s e k	s e s eː ʔ		s e s eː k	s e s e k		s e s e + k	
235	m o + tɬ aː l i aː	m u + r a l i h + t u k	m o + t aː l i a	m o + tɬ a l i a	m o + t aː l i	m u + t aː l i a		m o + tɬ a l ɨ + h a	m o + tɬ ø l iː a
316	n e ʔ + n e m i	n e h + n e m i	n e h + n e m i	n e h + n e m i	n e h + n e m i	n e h + n e m i		n ɨ h + n ɨ m i	n e h + n e m iː
6	i ʔ t e	i h t i		i h t e	i h t i	i h t i		ɨ h t ɨ	i h t e
189		t a + j u w a + k			t a + j o a	t a + j u w a			
324	i s t aː k	i s t aː k	i s t aː ʔ	i s t a k	i s t aː k	i s t a k		i s t aː + k ɨ	tʃ i pː p ø w a k
251	m o + k e ts a		m o + k e ts a	m o + t e l + k e ts a	m o + g e ts a	m u + k e ts a	x + m o + k ts e	k ɨ ts a	m o + k e ts a
4			k w a + k a h l oː + ʔ		b a + g a h l o				
144				x i w i + tɬ			x u t		x iː b iː tɬ
12			t a n + k w a		t a m + b a	t a n + k w a		k ɨ h + ts o m a	
140	tɬ a n + k w a i	t a m + b w a + n	t a n + k w aː + ʔ	tɬ a n + k w a	t a m + b a			tɬ a n + k w a h	tɬ a n + k w a t e
192		t e			a m o	t eː + t e s u			
105	k w aː + tɬ						k w a i + t		
313	tɬ a n + tɬ i	t aː n	t a n + t i	tɬ a n	t a n	t a n		tɬ a n	tɬ a n + k o tʃ
320	aː + tɬ		aː ʔ + t i	a + tɬ	aː + t	aː + t	a + t	aː + tɬ	ø + ts i n + tɬ i
289	k w i tɬ a p i l + l i	b w i r a p i l	k w i t a p iː l	k w i tɬ a p i l	b i t a p i l	k w i tɬ a p i l		k w i tɬ a + p ɨ l	k w iː tɬ a p iː l
84	m i tʃ + i n			m i tʃ i		m i tʃ i n	m i tʃ o m	m ɨ + tʃ ɨ + m	m iː tʃ iː
328	s i w aː + tɬ	s u w a + t	s i w aː + ʔ	s i w a + tɬ	s o aː + t	s i w aː + t		s i	s o w a + tɬ
330	k o s + t i k		k o s t i ʔ	k o s t i k	g o s t i k			k o s + t ɨ + k	k o s t iː k
125	k w aː k w a w + tɬ	k o k o i t	k w aː k w a	k w a k o w	b aː b aː				
107	j oː l + l i	j u h + l u		j o l + o		j u l	n	j oː l	j u l o h + tɬ iː
326	aː k	a i k	aː ʔ	a k i n	aː k		a k	aː k	ø k iː n u
14			p iː s + t i ʔ		p i s + t i k				
221	n e l w a + tɬ		n e l w a + ʔ	n e l w a + tɬ		n e l w a + t		n e l w a + tɬ	n e l w a + j u + tɬ
318	t o + t oː n + k i	t r uː n i k	t o t oː n i ʔ	t o t o n k i	t o t oː n i k	t u t uː n i k		t o + t oː n ɨ + k	t o t u n + k iː
