COGID	Amharic	Argobba	Chaha	Endegagn	Ezha	Geez	Gumer	Gura	Gyeto	Harari	Inor	Kistane	Mesqan	Muher	Silte	Tigre	Tigrigna	Wolane	Zway
6-14														bː ə n bː a bː a					
17-14														ʔ ə bː w n					
123-14														e e bː ə					
330-14														s ə bː bː					
421-14														bː ɨ e ə					
448-14														kʼ ɨ bː a n s ə n bː ə t					
449-14														ʔ a g ə					
491-14														d e e g ə t					
545-14														bː ɨ n bː ɨ					
596-14														n ə g ə					
653-14														bː ə tː ə t					
4-14														g u g ə					
8-14														kʼ ə bː ə x w					
339-14														bː ə kʼ e n					
460-14														bː bː ɨ t a					
489-14														bː w ə r e u bː a					
552-14														z ə					
602-14														bː ʔ ʔ					
652-14														ʔ e tː e t e					
119-14														ʔ a n g a bː a					
340-14														g ə n bː ə					
458-14														bː ə n g ə bː ə					
459-14														ʔ a bː e					
486-14														f ə f ə kʼ ə					
607-14														ʔ ə bː w e					
609-14														ʔ ə bː a					
647-14														ʔ ə t a					
10-14														bː ɨ kʼ bː r					
15-14														ʔ ə ə ə bː					
18-14														n ə kʼ u bː ə					
73-14														bː ə bː ə n ə					
110-14														bː ə e a					
121-14														t ə bː ə					
152-14														ʔ a bː e					
167-14														g ə bː ə					
255-14														kʼ w ə n bː ə					
297-14														g u n ə n					
299-14														g u n ə n					
328-14														ʔ ə d ə d ə					
334-14														ʔ a bː bː ə bː a					
338-14														bː ə bː ɨ n					
342-14														bː e n a					
344-14														kʼ ə s ə bː					
410-14														kʼ a r e m a					
540-14														n e ɲː a					
550-14														bː ə n bː ə n					
109-14														g d d					
61-15															s a m				
63-15															ʔ a əi̯ ɨ j				
107-15															g a m tʃʼ əi̯ a				
112-15															s a b ə n a				
331-15															n i g u s				
377-15															b a kʼ a əi̯ s				
381-15															əi̯ a d				
417-15															r u əi̯				
451-15															s a kʼ a t				
454-15															s a a tʃʼ ɨ r				
484-15															s ɨ s ɨ s t				
535-15															ʔ a əi̯ ɨ r				
543-15															ʃ s s t				
593-15															əi̯ a m əi̯ s				
640-15															m a a				
1-15															s ə b a mː a				
65-15															mː u t a				
163-15															s ə əi̯ a				
212-15															ʔ i n				
244-15															ʔ a r j a t				
248-15															m u əi̯ i				
293-15															f ə r ə əi̯				
373-15															kʼ i m a əi̯				
414-15															kʼ a b a kʼ a tʃʼ a				
601-15															ʔ a r mː əi̯ a əi̯ a				
642-15															h ɨ f a s				
60-15															h a i a s a				
115-15															a a mː a a				
209-15															s u mː u t				
242-15															ʔ a mː ɨ s t				
415-15															əi̯ ɨ əi̯ a s				
450-15															əi̯ a r				
490-15															s o b a				
638-15															s ɨ r mː				
645-15															kʼ a mː				
75-15															əi̯ a m a mː				
160-15															tʃʼ ə r ə kʼ a				
214-15															ʔ a kʼ o t				
218-15															ʔ ɨ j əi̯ ɨ n				
378-15															ʔ a n g ə t				
379-15															a i s ə a				
409-15															h h nː t a kʼ a				
497-15															kʼ ə a				
646-15															ʔ a t ə				
164-15															b ə mː a				
210-15															d a f s n o				
215-15															s a a tʃʼ a b i s				
256-15															kʼ kʼ tʃʼ a				
285-15															m ɨ f a tʃʼ				
332-15															a i a h i h				
380-15															ʔ a kʼ uː a				
412-15															s a h a a				
496-15															kʼ kʼ a i b a kʼ				
67-15															kʼ ɨ r				
169-15															b ɨ r ə mː ə oː ə				
251-15															f i kʼ				
294-15															m mː kʼ a m u kʼ				
461-15															tʃʼ uː				
547-15															w a mː a				
655-15															m h h h				
158-15															kʼ a h i s				
168-15															ʔ a m a r				
296-15															mː a kʼ a				
374-15															h o h h tʃʼ tʃʼ				
375-15															s ə b				
385-15															h h mː a h				
541-15															kʼ ə tʃʼ ɨ n				
17-15															a a h h tʃː				
113-15															b u n a				
123-15															ʃ e h e				
252-15															r ə tʃʼ ə b ə				
330-15															kʼ ə əi̯ f				
421-15															h h h a				
449-15															a a a a				
491-15															d ɨ n f ə f				
653-15															h ə h h h				
8-15															h ə h ə a h				
106-15															m ə t a				
254-15															dʒ i m a t				
290-15															ʔ a ə tʃʼ ə				
339-15															b a a ɨ tʃ				
602-15															m ɨ n				
652-15															a h h a a				
2-15															s u əi̯ ɨ m				
3-15															tʃʼ i mː a				
213-15															ʔ a r a ʃ				
459-15															ʔ a s ə b o				
211-15															ɨ ʃ s t				
328-15															s ə d ə b ə				
333-15															m ɨ s ɨ r				
612-15															uː a r b				
109-15															tʃʼ i tʃʼ a				
61-16																d ə m			
63-16																w ə ə -.+.n.ɨ.ʔ.ɨ.ʃ ə m			
107-16																gː w m ə w ə			
112-16																d ə mː ə w ə			
331-16																w ɨ gː w s -.+.n.ɨ.ʔ.ɨ.ʃ			
377-16																w ə kʼ ə w ə			
381-16																ʔ ə -.+.n.ɨ.ʔ.ɨ.ʃ -.+.n.ɨ.ʔ.ɨ.ʃ d -.+.n.ɨ.ʔ.ɨ.ʃ			
417-16																r w w			
451-16																s ə ə.t t w ə t -.+.n.ɨ.ʔ.ɨ.ʃ			
454-16																w ə w ə r			
484-16																s ə dː ə s t -.+.n.ɨ.ʔ.ɨ.ʃ -.+.n.ɨ.ʔ.ɨ.ʃ			
535-16																ʕ ə ə ə r -.+.n.ɨ.ʔ.ɨ.ʃ			
543-16																w ə -.+.n.ɨ.ʔ.ɨ.ʃ -.+.n.ɨ.ʔ.ɨ.ʃ w t -.+.n.ɨ.ʔ.ɨ.ʃ			
593-16																ə ə m w s			
640-16																m ə n b.h.a			
65-16																ə ə d			
163-16																w e w e			
212-16																ʕ w w			
244-16																w ə r b -.+.n.ɨ.ʔ.ɨ.ʃ t			
248-16																m w w -.+.n.ɨ.ʔ.ɨ.ʃ ʔ ə			
293-16																w e r e w			
373-16																kʼ ə m ə w			
408-16																w ə t ɨ r ə			
414-16																w ə w ɨ w w w ə			
601-16																w r b.h.a b ə t ɨ			
642-16																ɨ -.+.n.ɨ.ʔ.ɨ.ʃ n ə w ə s			
209-16																w ə w -.+.n.ɨ.ʔ.ɨ.ʃ ə -.+.n.ɨ.ʔ.ɨ.ʃ t -.+.n.ɨ.ʔ.ɨ.ʃ			
242-16																w ə w -.+.n.ɨ.ʔ.ɨ.ʃ ə s d -.+.n.ɨ.ʔ.ɨ.ʃ			
415-16																w ə w ə w			
450-16																dː ə r ʔ			
638-16																w ɨ r w b.h.a dː m			
75-16																w ə m w ɨ l.ɨ b.h.a			
208-16																ə ə ə kʼ ə ə ə ə ə			
214-16																ʔ ə w			
218-16																ʔ ə w dː ə w			
409-16																ʕ ə t e r			
497-16																t ə w			
598-16																z ɨ l ʔ ə d			
646-16																ə ə -.+.n.ɨ.ʔ.ɨ.ʃ -.+.n.ɨ.ʔ.ɨ.ʃ t ə -.+.n.ɨ.ʔ.ɨ.ʃ			
256-16																t w w ə			
332-16																ʔ ə ɨ w w r b.h.a			
496-16																-.+.n.ɨ.ʔ.ɨ.ʃ -.+.n.ɨ.ʔ.ɨ.ʃ w w r w ə n w ə t			
67-16																w ə ə b.h.a			
655-16																d ɨ ʔ b.h.a d b.h.a t			
372-16																o e d d e r			
375-16																s e b -.+.n.ɨ.ʔ.ɨ.ʃ -.+.n.ɨ.ʔ.ɨ.ʃ			
411-16																ə ə t ə r ə ʔ ə tʃʼ			
500-16																ʔ ə m m w ə			
541-16																kʼ ə w ə n			
17-16																ə ə ə ə ə			
113-16																b w n ə			
252-16																ə ə j ə ə ə			
330-16																kʼ ə l d			
545-16																d r ə ə b.h.a ə			
106-16																m ə -.+.n.ɨ.ʔ.ɨ.ʃ ʔ b -.+.n.ɨ.ʔ.ɨ.ʃ			
254-16																w ə ə -.+.n.ɨ.ʔ.ɨ.ʃ ə ə -.+.n.ɨ.ʔ.ɨ.ʃ			
460-16																ɨ ʔ ɨ b.h.a			
602-16																m ɨ d			
2-16																-.+.n.ɨ.ʔ.ɨ.ʃ n ə dː ə			
213-16																w r ə dː -.+.n.ɨ.ʔ.ɨ.ʃ			
298-16																m ɨ ʔ ə ə ə			
647-16																ə t ɨ ɨ d d			
211-16																m ɨ dː e t			
333-16																m ɨ b ɨ r			
612-16																ə ə r b			
61-17																	d ə m		
63-17																	ʔ ə sː i m i		
107-17																	g ə m ə l i		
112-17																	d ə mː ə n ə		
331-17																	n i g i i s.i i		
377-17																	b i ə kʼ i ə l i		
381-17																	ʔ ə i i i d i		
417-17																	r ə.n z		
451-17																	s.i ə i i b i sː i		
454-17																	ħ i sː ə r i i		
484-17																	s.i i sː i s.i i i i		
535-17																	ʔ ə sː i r i		
543-17																	sː ə i i s.i i i		
593-17																	w ə m i i s.i		
640-17																	m i ə i i		
1-17																	d ə sː ə sː ə i		
65-17																	sː i i i i		
163-17																	s.i ə d i ə i		
212-17																	ʔ i n		
244-17																	ʔ ə r w i i i sː		
248-17																	m i ə.n l i ʔ ə.n		
293-17																	z ə r ə s.i		
373-17																	kʼ i m ə i		
408-17																	b ə i i r i		
414-17																	d i sː i i i i i		
601-17																	ʔ i r i b i ʔ		
642-17																	n i z ə i		
60-17																	sː ə fː ə sː ə i		
115-17																	i i l ə i m		
209-17																	s.i ə fː i i i i		
415-17																	z i n ə i		
450-17																	z ə r i		
638-17																	i i i i d		
645-17																	kʼ sː sː		
75-17																	ħ d i i l i		
214-17																	ʔ a sː i		
218-17																	ʔ i i dː ə n		
409-17																	ʕ ə t ə r i		
598-17																	i i l ʔ ə w		
164-17																	w ə a i ə i		
332-17																	ʔ i i sː i ə		
412-17																	g a sː ɨ n		
496-17																	i i i i ə n i ə i ʔ i i i		
158-17																	kʼ ə m i		
372-17																	d ə n z ə r		
375-17																	tʃʼ ə w		
411-17																	i i t ə r ʔ ə s		
500-17																	ʔ i w i n		
541-17																	kʼ ə fː i n		
113-17																	b u z a		
330-17																	kʼ ə d d i i		
448-17																	w ə d.i ə m ə n w ə		
106-17																	m ə t a		
290-17																	n a sː ə z ə		
552-17																	d ə		
2-17																	i u dː u m		
213-17																	ħ a r ə fː i i		
647-17																	t ə ħ i ə i ə.n i		
211-17																	m ɨ s i t		
334-17																	d d d b.ʔ.i ə d d		
109-17																	sː s n sː ə		
61-18																		əi̯ ə	
63-18																		tʃʼ ai̯ əi̯ ɨ	
107-18																		g ai̯ tʃʼ əi̯ ai̯	
112-18																		əi̯ ə b ə n ai̯	
331-18																		n ɨ g u s	
377-18																		b kʼ əi̯ n	
381-18																		ʔ ai̯ d	
417-18																		r s əi̯	
451-18																		s a ai̯ t	
454-18																		ai̯ ai̯ n tʃʼ ɨ r	
484-18																		s ɨ s ɨ s tʃʼ	
535-18																		ʔ ai̯ əi̯ ɨ r	
543-18																		ʃ ɨ əi̯ tʃʼ	
593-18																		əi̯ ə əi̯ s	
640-18																		ə n	
1-18																		n ə b ə l ə	
65-18																		oː u tʃʼ	
163-18																		s ə əi̯ ə	
212-18																		ʔ ai̯ n	
244-18																		ʔ ai̯ r ə t	
248-18																		u əi̯ n	
293-18																		əi̯ ə r ə əi̯	
373-18																		kʼ u a n	
408-18																		n ə	
414-18																		n ə b a kʼ tʃʼ ə	
601-18																		tʃʼ ə r n b	
642-18																		n ɨ n ai̯ s	
60-18																		n ə ɨ ə s ə	
115-18																		l ai̯	
209-18																		s u tʃʼ	
242-18																		ʔ ə tʃʼ ɨ s tʃʼ	
415-18																		əi̯ ɨ n ai̯ m	
450-18																		n ə r	
490-18																		s o b ə	
638-18																		s ɨ r əi̯	
645-18																		kʼ a n	
75-18																		əi̯ ai̯ ɨ n	
160-18																		tʃʼ ə r ə kʼ	
208-18																		n n n n n n	
214-18																		ʔ ai̯ b	
218-18																		ʔ ɨ n ɨ n	
378-18																		ʔ a n g ə tʃʼ o	
379-18																		tʃʼ ə ə	
497-18																		n ə n	
646-18																		ʔ a t	
164-18																		b ə tʃʼ ə	
210-18																		tʃʼ ə oː tʃʼ n o	
215-18																		s ɨ n tʃʼ b ə s	
256-18																		n ə	
285-18																		ɨ t a tʃʼ	
332-18																		ʔ ɨ n g ɨ r	
380-18																		ʔ ə tʃʼ u	
412-18																		s a tʃʼ n	
496-18																		s ə n b ə t	
64-18																		w a ə dʒ	
67-18																		w ɨ r	
169-18																		b r ə z ə z ə	
251-18																		s ɨ kʼ	
294-18																		tʃʼ kʼ	
461-18																		t oː	
547-18																		z	
597-18																		g ə ə ə	
655-18																		ɨ n n	
7-18																		a w g ə	
158-18																		kʼ ə m b ɨ tʃʼ	
168-18																		a r	
296-18																		tʃʼ tʃʼ a	
374-18																		ə o tʃʼ o	
375-18																		s ə b	
385-18																		ɨ tʃʼ ə	
411-18																		n r ʔ ai̯ n	
541-18																		kʼ ə tʃʼ ɨ n	
17-18																		ʔ ɨ ɨ	
113-18																		b u n ə	
123-18																		ʃ t m ɨ	
252-18																		r ə e ə b ə	
330-18																		kʼ ə n n	
421-18																		ə	
491-18																		tʃʼ ɨ n g ə tʃʼ	
653-18																		ə	
8-18																		kʼ ə b ə ɨ o	
106-18																		ə eː ə	
254-18																		dʒ m a t	
290-18																		ʔ ə e ə e ə	
339-18																		b ə l	
489-18																		ə	
552-18																		n	
602-18																		ɨ n	
2-18																		n əi̯ u əi̯ ɨ	
3-18																		tʃʼ ɨ r ə	
213-18																		ʔ a r ɨ ʃ i	
459-18																		ʔ a u s o	
647-18																		n ə n ai̯ n	
76-18																		ə	
152-18																		ə ə dʒ dʒ	
328-18																		s ə d ə b ə	
333-18																		ɨ ʃ ɨ r	
338-18																		g ə g	
612-18																		ʔ a r b	
61-19																			r ə g
63-19																			a t i r
107-19																			g uː g i l a
112-19																			r ə r ə g a
331-19																			g i g i s
377-19																			b g r i l i
381-19																			ʔ a r
417-19																			r r r
451-19																			s ə b.ɨ t
454-19																			ʔ a n.ə əi̯ i r
484-19																			s i mː i s t
535-19																			ʔ a r i r
543-19																			s i s t
593-19																			əi̯ a g r s
640-19																			g aː g
1-19																			g aː b ə r ə
65-19																			mː uː b
163-19																			s ə əi̯ i
212-19																			ʔ r r
244-19																			ʔ a r r ə t
248-19																			r r əi̯ r
293-19																			f ə r ə r
373-19																			kʼ i r a r
408-19																			b o r
414-19																			ɲ ə g r r r a
601-19																			ʔ a r r b.ɨ ə
642-19																			g ɨ f a s
60-19																			g ə g ə s ə
115-19																			i l aː i
209-19																			s i r i t
242-19																			ʔ a tʃ i s t
415-19																			r ɨ t ə t
450-19																			r ə r
490-19																			l ə b i
638-19																			s ɨ r g əi̯
645-19																			g g l
75-19																			əi̯ a r r i tʃʼ
160-19																			l ə r ə g
208-19																			ʔ r r g t ə
214-19																			ʔ a g t
218-19																			ʔ i r r i r
378-19																			g a g g ə g
379-19																			i l ə n.e
409-19																			g i t i r ɨ
497-19																			t ə t
646-19																			ʔ a t ə
164-19																			b a mː i
210-19																			ɲ ə ɲ ɲ
215-19																			i g g g a t
256-19																			t t uː a
285-19																			g i ɲ ɲ
380-19																			ʔ a r i s
412-19																			s a ɲ i g
496-19																			r i r s a g b a t
64-19																			ɲ g g ɲ
67-19																			w i r
169-19																			b i r g ə z ə s ə
251-19																			g i
294-19																			g g g
461-19																			uː g
547-19																			w i z g g
597-19																			g i g i g ə g i
7-19																			l g
158-19																			t ə t i s
168-19																			g g g a t
296-19																			i i g w
375-19																			s ə g
385-19																			w i g ə t
500-19																			r o g i t
541-19																			kʼ ə tʃ i n
6-19																			g ə g g g g g
113-19																			b i n
123-19																			uː uː t i
330-19																			tʃʼ ə r tʃʼ
491-19																			ɲ i g ə
106-19																			m ə i a
254-19																			uː t t a t
339-19																			g ə g i l
460-19																			t t a
602-19																			m i n
652-19																			s s t g g g g
2-19																			r u əi̯ i r
213-19																			ʔ a r aːi̯ uː
298-19																			t t t a
459-19																			a s ə s
486-19																			g ə g ə g ə
152-19																			dʒ
211-19																			r ə r i t
328-19																			s ə ɲ ə b ə
333-19																			m ɨ n ɨ r
540-19																			ɲ i
