COGID	Amharic	Argobba	Chaha	Endegagn	Ezha	Geez	Gumer	Gura	Gyeto	Harari	Inor	Kistane	Mesqan	Muher	Silte	Tigre	Tigrigna	Wolane	Zway
642-8								n u a s											
60-8								n ə dʒ ə s ə m											
115-8								ə r a m											
209-8								s ɨ tʃʼ tʃʼ ə											
242-8								ʔ a p ɨ s t											
415-8								tʃʼ ɨ ɨ a ɨ											
450-8								tʃʼ ə r											
490-8								p ə p ə m											
638-8								s ɨ n ə											
645-8								kʼ a r											
75-8								ʔ a m b ɨ r											
160-8								u ə r ə kʼ											
208-8								ʔ ɨ n kʼ w ɨ r											
214-8								ʔ a ɨ											
218-8								ʔ ɨ n z ɨ r											
378-8								ʔ a n g ə t											
379-8								u ə x ə											
409-8								g e t ə r											
497-8								t ə n											
598-8								x w e											
646-8								ʔ a dʒ ə											
164-8								b ə kʼ ə m											
210-8								u ə u ə r a											
215-8								ʔ a ɨ e ɨ ə t											
256-8								u x a											
285-8								m ɨ d a d											
332-8								ʔ ə g ɨ r											
380-8								ʔ ə tʃʼ											
412-8								s ə ʒ ə n											
496-8								w ɨ r s ə n ɨ ə t											
64-8								d a ʃ o											
67-8								w ɨ r											
169-8								n ə z ə z ə m											
251-8								u ə kʼ											
294-8								m ə kʼ											
461-8								u ə											
547-8								w ɨ z a t											
597-8								ʔ e m ə n ə											
655-8								m ɨ u t											
7-8								ʔ a tʃʼ g a											
158-8								kʼ ə m tʃʼ s											
168-8								ʔ ɨ m a r											
296-8								tʃʼ ə x u											
374-8								b ə kʼ m m o											
385-8								w ɨ u ə t											
500-8								ʔ ɨ m ɨ r											
6-8								m ə r k a m a											
17-8								ʔ ə u ɨ r											
123-8								x e m ə											
252-8								n ə m ə m ə m											
421-8								b ɨ m ə											
448-8								kʼ ə u a n s ə n b ə t											
449-8								ʔ a tʃʼ ə											
545-8								u ɨ n m											
596-8								n ə g ə											
653-8								b ə t ɨ t											
4-8								g ɨ u ə											
8-8								kʼ ə m ə t tʃʼ											
254-8								ʒ ɨ m a ə											
290-8								ʔ a a ə tʃʼ ə m											
339-8								b ə kʼ ɨ r											
460-8								u ɨ ɨ											
489-8								b ə r u u m a											
552-8								z ɨ											
652-8								ʔ ə t ə t a											
3-8								tʃʼ ɨ tʃʼ a											
119-8								ʔ a n g a tʃ a											
298-8								dʒ dʒ ɨ											
340-8								g w ə n tʃ ə											
458-8								d ə n g ə u ə											
459-8								ʔ a tʃʼ o											
607-8								ʔ ə k w a											
609-8								ʔ ɨ dʒ a											
10-8								tʃʼ ɨ kʼ tʃʼ r											
15-8								ʔ ɨ u ɨ m											
18-8								n ɨ kʼ ʒ u ə											
73-8								tʃ ə k ə r ə m											
76-8								m w ə s a											
121-8								t ɨ k ə											
167-8								g ɨ u ə											
255-8								kʼ w ə n tʃ ə											
297-8								g u n ə r											
299-8								g u n ə r											
338-8								m ə m ɨ r											
342-8								m e n a											
344-8								kʼ ə s ə m											
410-8								kʼ a r e											
540-8								s ə ɨ a											
550-8								u ə n u ɨ r											
61-9									d ə m										
63-9									d a u b m										
107-9									g b m u r a										
112-9									d a u ə r a										
331-9									n b g w b u										
377-9									u d kʼ u r b										
381-9									d a t										
417-9									r u u										
451-9									u ə u t										
454-9									ʔ a u b r										
484-9									u b d b u t										
535-9									d a u b r										
543-9									u u u t										
593-9									d a m u u										
640-9									m a n										
1-9									d ə p ə r ə										
65-9									u u b										
163-9									u ə u ə										
212-9									b u ɲ										
244-9									d a r u ə t										
248-9									m u r b										
293-9									u ə r ə u										
373-9									kʼ.w b m a r										
408-9									u u r a										
414-9									d b u a kʼ u a										
601-9									d ə r u b										
642-9									n b u a u										
60-9									n ə ʒ ə u ə										
209-9									u z u t										
242-9									d a b b u t										
415-9									u b r a u										
490-9									t o p ə										
638-9									u d n ai̯										
645-9									kʼ a r										
75-9									ʔ a m u ə r										
160-9									u ə r ə kʼ										
208-9									b b n kʼ.w b w r b										
214-9									d a u s										
218-9									s s n u s r										
378-9									d a n g ə t										
379-9									u ə u b ə b										
409-9									g ə t ə r ə										
497-9									t ə n										
598-9									x b r u t										
646-9									b ə x ə										
164-9									u ə u ə										
210-9									u ə x ə r o										
215-9									b a u u u o t										
256-9									t u m a										
285-9									m b d a d										
332-9									ʔ ə g d r										
380-9									b ə x b b										
412-9									b ə ʒ b n										
496-9									w u r u ə n u ə t										
64-9									d a u z										
67-9									w d r										
169-9									n o u ə u ə m										
251-9									u x u										
294-9									m b kʼ.w										
461-9									u ai̯										
547-9									d d u a t										
597-9									ʔ x m b ə x ə										
655-9									m d t										
7-9									b a r g a										
168-9									ʔ m m a r										
296-9									x b u u t										
372-9									u ə n u ə r										
374-9									u ə kʼ u u										
375-9									x ə x										
385-9									w d u ə t										
411-9									w w t ə m w w a p										
500-9									ʔ ə m r										
541-9									b ɨ b b b										
6-9									m ə r u a m a										
17-9									ʔ ə u d r										
113-9									b b b										
123-9									z m ə										
252-9									n ə ʒ ə dʒ ə										
421-9									u d a										
448-9									kʼ.w ə u a n u ə n u ə t										
491-9									b b ə b										
545-9									x ə n u w										
596-9									n ə g ə										
653-9									u ə t ə t										
4-9									g u b ə										
8-9									kʼ.w ə u ə u u										
254-9									ʒ b m a t										
339-9									z ə kʼ b r										
489-9									u ə r u u m a										
552-9									u d										
652-9									ʔ ai̯ t t										
119-9									ʔ a n g a tʃ a										
298-9									x dʒ t										
340-9									g w ə n tʃ ə										
458-9									d ə n g ə u ə										
459-9									ʔ a s u										
486-9									n ə ə ə kʼ ə										
607-9									ʔ ə dʒ w a										
609-9									ʔ ə x a										
10-9									dʒ ə p dʒ r										
15-9									ʔ ə u ə										
18-9									n i u a ə										
73-9									tʃ ə w ə r ə										
76-9									m w ə dʒ a										
110-9									d a ə a										
121-9									t ə u ə										
167-9									g ə x ə										
255-9									kʼ w o n a ə										
297-9									g u ɲ ə r										
299-9									g u ɲ ə r										
338-9									ɲ ə m ə r m										
342-9									m u n a										
344-9									kʼ ə u ə m										
550-9									u ə n u ə r										
612-9									d a g g d ə										
61-10										dʒ e m									
63-10										s aː.m.ə s s m									
107-10										g i m tʃʼ l aː.m.ə									
112-10										dʒ aː.m.ə b ɨ s aː.m.ə									
331-10										s s g s s									
377-10										b ɨ kʼ kʼ s l i									
381-10										s aː.m.ə ħ dʒ									
417-10										s s ɲ									
451-10										s ə b a t.i									
454-10										s aː.m.ə s s s									
484-10										s s s s s t.i									
535-10										s aː.m.ə s s s									
543-10										s s s t.i									
593-10										s aː.m.ə m s s									
640-10										m s a s									
1-10										s ə b e s e ħ.a									
65-10										ɲ s b									
163-10										s e tʃʼ ħ a									
212-10										s s s									
244-10										s aː.m.ə s s aː.m.ə t.i									
248-10										m uː s aː.m.ə									
293-10										s e s e s									
373-10										kʼ uː m aː.m.ə s									
408-10										b ɨ s aː.m.ə									
414-10										d ə b s s uː s a									
601-10										s a s ɲ b									
115-10										kʼ ə l a m									
209-10										s s s s t.i									
242-10										s aː.m.ə s s s t.i									
415-10										i s a s									
490-10										ɲ ɨ b ɨ									
160-10										d e s e kʼ									
208-10										s ɨ s kʼ kʼ s kʼ a ħ									
218-10										s s s oː s s									
378-10										s aː.m.ə s g e ɲ									
379-10										a ɨ ħ.a d e i									
497-10										s a s									
598-10										ħ b s s s									
646-10										s a t.i ə									
164-10										b a tʃʼ s ħ.a									
210-10										d e i s e s oː									
256-10										s s r a									
285-10										s s tʼ aː.m.ə d									
380-10										s a i uː s kʼ									
412-10										s a tʃʼ ɨ s									
64-10										ɲ a ɲ ɲ									
169-10										s a s s a ɲ a ɲ a									
461-10										a s ɲ									
547-10										s s ɲ a s									
411-10										s s s aːi̯ s									
541-10										kʼ ə t.ə.w ɨ									
113-10										b uː s									
123-10										s s s a									
491-10										d ɨ ə g e tʼ									
254-10										s s m a t.i									
339-10										b a s s s									
602-10										m									
2-10										i uː i i m									
213-10										ʔ a r eː i									
647-10										b ə b b ə									
211-10										m uː i t.i									
328-10										s ə d ə b ə ħ.a									
333-10										m ɨ uː r ħ.a									
612-10										ħ aː.m.ə s ħ b									
109-10										g d m d tʼ									
61-11											sː ə m								
63-11											u a ɨ m								
107-11											g ɨ z.ɨ sː a								
112-11											sː a t ə n a								
331-11											n ʔ g w z.ɨ u								
377-11											z.ɨ ɨ kʼ p z.ɨ a								
381-11											u a z.ɨ								
417-11											r u u								
451-11											p ə z.ɨ a t								
454-11											u ʔ u ʔ r								
484-11											p ɨ ʔ ɨ p t								
535-11											u a u ɨ r								
543-11											p p ʔ ʔ p t								
593-11											u a m sː u								
640-11											m w a n								
1-11											sː ə u ə z.ɨ ə n								
65-11											p t								
163-11											p ə p ə								
212-11											u e n								
244-11											u a r t ə ʔ ə z.ɨ								
248-11											u z.ɨ ʔ a								
293-11											u ə r ə u								
373-11											kʼ ɨ a z.ɨ								
408-11											z.ɨ p ʔ r a								
414-11											sː ə t a kʼ p p a								
601-11											p ə p z.ɨ								
642-11											ɨ n u a u								
60-11											n ə p ə u ə								
115-11											k ə z.ɨ a t								
209-11											u ɨ sː w u t								
242-11											p a z.ɨ ʔ ɨ p d								
450-11											sː ə ʔ								
490-11											t u p w ə								
638-11											sː ɨ n ʔ								
645-11											kʼ a sː								
75-11											p a m b ɨ								
160-11											ʔ ə r ə kʼ								
208-11											p ɨ n.ə kʼ z.ɨ r ə								
214-11											sː a sː								
218-11											p ɨ n.ə p ɨ r								
378-11											p a n g ə t								
379-11											p ə ʔ ə								
409-11											g ʔ t ə a								
497-11											t ə n								
598-11											sː w t								
646-11											p a ʔ ʔ a								
164-11											b ə m.ʔ ə ʔ								
210-11											p ə u w ə r ə								
215-11											p a t m.ʔ ə z.ɨ								
256-11											d p p a								
285-11											t ɨ p a p								
332-11											sː ə g ɨ r								
412-11											z a sː ə n								
496-11											ʔ p g p ə n m.ʔ ə d								
64-11											u a p ʔ ʔ p								
67-11											w ɨ r								
169-11											n ə p a p a ə								
251-11											p kʼ ʔ								
294-11											j ə z.ɨ ə ʔ z.ɨ kʼ j j j								
461-11											ə ə ə								
547-11											w ə p a t								
597-11											p g ə m ə n ə								
655-11											m ʔ ʔ d								
7-11											p a u g a								
168-11											p a a r								
296-11											u ə p ʔ p d ə								
372-11											sː ə n sː ə n								
374-11											b ə kʼ p ʔ p								
375-11											ʔ ə								
385-11											w ɨ ə d								
500-11											p a a n								
541-11											ɨ ə ʔ ɨ n								
6-11											m ə ʔ p a m a								
17-11											p ə k ɨ r								
252-11											n.ə ə p ə ə								
421-11											b ʔ ʔ a								
448-11											kʼ ə sː a n p ə n ə d								
449-11											u a u ə m								
491-11											sː ɨ n g ə ɨ								
545-11											ʔ ʔ n u								
596-11											n ə g ə								
653-11											b ə k ə d								
4-11											g ʔ t ə								
106-11											ə ʔ ɨi̯ ʔ								
254-11											p i i ʔ a i ʔ								
339-11											b ə kʼ a r ʔ								
460-11											k a d ʔ								
489-11											b w u r p k a								
652-11											p a n t ə ʔ d a								
3-11											u n ʔ								
119-11											p a n g a dʒ a								
298-11											ʔ p d a								
340-11											g w ʔ n dʒ ə								
458-11											k ə n g ə a ə								
486-11											n ə ə ə kʼ ə ə								
607-11											p ə p w a								
609-11											p a ʔ a								
15-11											p ɨ p ʔ ɨ ʔ ʔ								
18-11											n ʔ kʼ ə								
73-11											dʒ ə p ə r ə								
76-11											m w ʔ p a								
110-11											k a ʔ a								
121-11											d ɨ p ə								
167-11											g ɨ ʔ ə								
255-11											kʼ w ə n.ə p ə								
297-11											g p n.ə ʔ ə r								
299-11											g p n.ə ʔ ə r								
342-11											m e n a								
344-11											kʼ ə p ə m								
550-11											p ə n.ə p ɨ r								
109-11											ə ə ə ə ə								
61-12												bː ə m							
63-12												tʃʼ a bː ɨ m							
107-12												g m m o l a							
112-12												bː a t ə n a							
331-12												n o g m bː t							
377-12												bː o t o l o							
381-12												tʃʼ a t							
417-12												t bː bː							
451-12												t o t a t							
454-12												bː a bː o t							
484-12												t ɨ bː m t t							
535-12												tʃʼ a t ɨ t							
543-12												t t m t t							
593-12												tʃʼ a m t t							
640-12												m a t							
1-12												t ə bː o t o m							
65-12												t o tʃʼ							
163-12												t ə t m m o							
212-12												j o n							
244-12												tʃʼ a t l ə t							
248-12												m kʼ l m o							
293-12												bː ə t ə t							
373-12												bː m m a l							
408-12												bː t o t a							
414-12												t o o a t tʃʼ tʃʼ a							
601-12												tʃʼ ə t tʃʼ bː o							
642-12												n ɨ t a t							
60-12												n ə t ə t ə							
115-12												l ə t m							
209-12												s i sː tʃʼ t							
242-12												j a m ɨ s t							
415-12												bː ɨ n a bː							
450-12												t ə t							
490-12												t o z o m							
638-12												t m z tʃʼ t							
645-12												t a t							
75-12												tʃʼ ə m t tʃʼ t							
160-12												t o t o tʃʼ							
208-12												tʃʼ a n t m t ə							
214-12												tʃʼ a t o							
218-12												tʃʼ m m t s n							
378-12												j a o g o t							
379-12												m ə t o							
497-12												t ə m tʃʼ							
598-12												o t t o t							
164-12												tʃʼ ə m o m							
210-12												lː ə sː tʼ o o							
215-12												j a z a z o t							
256-12												t tʃʼ tʃʼ ə							
285-12												m ɨ sː a kʼ							
332-12												tʃʼ o g m t							
380-12												j a sː j a							
412-12												s ə tʼ o n							
496-12												o tʃʼ t s ə tʃʼ tʃʼ ə t							
64-12												t a t ɲː							
67-12												tʃʼ tʃʼ m m t m							
169-12												tʃʼ o m t ə tʃʼ ə m ə							
251-12												sː tʃʼ z o							
294-12												j m j o z							
461-12												tʃʼ o							
547-12												tʃʼ ə tʃʼ i t							
597-12												j o o m o sː a							
655-12												m tʃʼ t m t							
7-12												j a z g a							
168-12												tʃʼ m m i t							
296-12												tʃʼ o tʃʼ a t a							
372-12												o o n t o t							
374-12												tʃʼ o tʃʼ tʃʼ tʃʼ tʃʼ							
385-12												tʃʼ m tʃʼ ə t							
500-12												tʃʼ tʃʼ m tʃʼ t							
6-12												m o z o a m a							
113-12												bː bː s d							
123-12												tʃʼ t m o m							
330-12												o ə l bː							
421-12												tʃʼ tʃʼ tʃʼ a							
448-12												t o t a o s o n t o t							
449-12												a j o							
491-12												lː ɨ o g o o							
545-12												t ɨ t t							
596-12												t o g o							
653-12												tʃʼ ə a o t							
4-12												g ɨ tʃʼ o							
8-12												z ə tʃʼ ə m z							
106-12												m ə o tʃʼ a							
460-12												t t i t							
552-12												t ə							
602-12												m ɨ ʔ							
2-12												o f bː f m m m							
3-12												z ɨ j o							
119-12												tʃʼ a tʃʼ g a o a							
213-12												f a m f f m m							
340-12												g o o o							
458-12												t o tʃʼ g o t o							
607-12												tʃʼ o o w a							
609-12												tʃʼ m t a							
647-12												t ə a a r o							
10-12												sː ɨ sː sː							
110-12												t a k a							
152-12												j a z z							
211-12												m ə bː s tː							
255-12												dː o a o							
297-12												g dː o o a							
299-12												g dː o o a							
328-12												s ə f ə f ə							
333-12												m ɨ f ɨ m							
334-12												ʔ a n z ə z a							
338-12												dː ə a a							
410-12												t a t a							
540-12												o a							
109-12												g tʼ n tʼ o							
61-13													d ə m						
63-13													ʔ a t ɨ m						
107-13													g a m e n a						
112-13													d a bː ə n a						
331-13													n ɨ g e s						
377-13													bː i kʼ bː r e						
381-13													ʔ a tː						
417-13													r bː bː						
451-13													s ə bː a t						
454-13													ʔ a tʃʼ ɨ r						
484-13													s ɨ bː ɨ s t						
535-13													ʔ a s ɨ r						
543-13													s bː s t						
593-13													ʔ a m bː s						
640-13													m a n						
1-13													d ə bː ə r ə m						
65-13													e bː						
163-13													s ə bː ə						
212-13													ʔ e n						
244-13													ʔ a r bː ə t						
248-13													m tʃʼ n a						
293-13													bː ə r ə bː						
373-13													kʼ i m a n						
408-13													bː bː rː a						
414-13													d e tʃʼ a kʼ bː a						
601-13													ʔ ə r bː d						
642-13													n ə bː a s						
60-13													n ə bː ə s ə m						
115-13													ə n a m						
209-13													s e m tʃʼ t						
242-13													ʔ a m ɨ s t						
415-13													tʃʼ ɨ n a tʃʼ						
450-13													tʃʼ ə r						
490-13													t ə bː ə m						
638-13													s ɨ n e						
645-13													kʼ a n						
75-13													ʔ a m bː ɨ n						
160-13													e ə r ə kʼ						
208-13													ʔ n b b						
214-13													ʔ a bː						
218-13													ʔ ɨ n bː ɨ n						
378-13													ʔ a n g ə t						
379-13													ə ə						
409-13													e t ə rː ə						
497-13													t ə n						
598-13													bː d tː						
646-13													kʼ a tʃʼ ə						
164-13													bː ə bː ə m						
210-13													e ə bː e n e						
215-13													ʔ a t e bː ə t						
256-13													t bː a						
285-13													m ɨ bː a tʃʼ						
332-13													ʔ ə g kʼ r						
380-13													ʔ a tʃʼ e a						
496-13													w bː r s ə n bː ə t						
67-13													w ɨ r						
169-13													ɲː ɨ bː ə bː ə m						
251-13													bː e kʼ ə						
294-13													j m z kʼ						
461-13													e e						
547-13													w ɨ bː a t						
597-13													ʔ ə m ə ɲː ə						
655-13													m ɨ e t						
7-13													ʔ a e g a						
158-13													kʼ ə m tʃʼ s						
168-13													ʔ e m a r						
296-13													tʃʼ ə bː bː t a						
372-13													sː ə n sː ə r						
374-13													bː e kʼ bː e bː						
385-13													w ɨ e ə t						
411-13													t ɨ a d						
500-13													d ɨ m ɨ r						
541-13													b ə kʼ b						
6-13													m ə r bː a m a						
17-13													ʔ ə bː ɨ n						
123-13													e e m ə						
252-13													n ə tʃʼ ə tʃʼ ə						
330-13													s ə e s						
421-13													bː kʼ e a						
448-13													z ə t a n s ə n bː ə t						
449-13													ʔ a e ə						
491-13													b ɨ n g ə t						
545-13													bː ɨ n d						
596-13													n ə g ə						
653-13													bː ə tː e t						
4-13													g d ə ə						
8-13													kʼ ə z ə z z						
290-13													ʔ a e ə tʃʼ ə m						
460-13													bː bː a t						
489-13													bː w ə r bː bː m a						
552-13													bː e						
652-13													ʔ u tː e t a						
3-13													tʃʼ kʼ n e						
119-13													ʔ a n g a bː a						
213-13													ʔ a r a ə						
298-13													bː bː t						
340-13													g ə n bː ə						
458-13													d ə n g ə bː ə						
459-13													ʔ a bː tʃʼ						
607-13													ʔ ə bː w a						
609-13													d ɨ bː a						
647-13													t ə dː ə e ə						
10-13													ə ɨ ə bː r						
15-13													ʔ ɨ bː i m						
18-13													n i kʼ bː bː ə						
73-13													bː ə d ə r ə m						
76-13													m w ə kʼ a						
121-13													t ɨ bː ə						
152-13													ʔ a z z						
167-13													g ɨ bː ə						
255-13													kʼ w ə n bː ə						
297-13													g bː dː ə n						
299-13													g bː dː ə n						
328-13													s ə z ə z ə						
334-13													ʔ a ə z ə z a						
338-13													dː ə m ɨ n						
342-13													m e n a						
344-13													kʼ ə bː ə m						
410-13													kʼ a r d z						
540-13													n e tʃʼ a						
550-13													bː ə n bː ɨ n						
612-13													kʼ a r kʼ						
61-14														bː ə bː					
63-14														ʔ a bː ɨ bː					
107-14														g a bː e bː a					
112-14														bː a bː ə n a					
331-14														n ɨ g bː s					
377-14														bː e kʼ e e bː e					
381-14														ʔ a bː					
417-14														r u z					
451-14														s ə ɨ bː e t					
454-14														ʔ a e bː ɨ r					
484-14														s ɨ bː ɨ s t					
535-14														ʔ a bː ɨ r					
543-14														s bː s t					
593-14														ʔ a bː bː s					
640-14														bː w a n					
1-14														bː ə bː ə n ə bː					
65-14														bː u bː e e e					
163-14														s ə e ə					
212-14														ʔ e n					
244-14														ʔ a r bː ə t					
248-14														bː u bː a					
293-14														bː ə r ə z					
373-14														kʼ ɨ bː a bː					
408-14														bː bː r a					
414-14														bː bː bː a kʼ u bː a					
601-14														ʔ ə r bː bː					
642-14														n ɨ bː a s					
60-14														n ə bː ə s ə					
115-14														ʔ ə n a bː					
209-14														s ə bː e ɨ e t					
242-14														ʔ a bː e s t					
415-14														bː ɨ n a bː					
450-14														z ə rː.ɨ					
490-14														bː ə bː ə e					
638-14														s ɨ n e					
645-14														kʼ a n					
75-14														ʔ a bː bː ɨ n					
160-14														bː ə r ə kʼ					
208-14														ʔ e n kʼ bː n a e					
214-14														ʔ a bː e					
218-14														ʔ ɨ n z e n					
378-14														ʔ a n g ə t					
379-14														e ə bː e ə e					
409-14														g e t ə n ə					
497-14														t ə n					
598-14														bː ɨ ɨ w e tː					
646-14														ʔ a bː e					
164-14														bː ə bː ə e					
210-14														e ə bː w ə n e					
215-14														ʔ a t e bː ə t					
256-14														t u e a					
285-14														bː e bː a bː					
332-14														ʔ ə g ɨ r					
380-14														ʔ ə bː w e					
412-14														s a bː a n					
496-14														w bː n s ə n bː ə t					
64-14														bː a bː e					
169-14														n e ə z ə e ə					
251-14														bː e kʼ					
294-14														bː e kʼ					
461-14														bː e					
547-14														w ɨ z a t					
597-14														ʔ e e bː ə n e					
655-14														bː ɨ e t					
7-14														ʔ a bː g a					
158-14														kʼ ə bː s s					
168-14														ʔ e bː a n					
296-14														bː ə bː u t					
372-14														bː ə n bː ə r					
374-14														bː ə kʼ u e u					
385-14														w e bː ə t					
411-14														t ə r a s					
