COGID	1	10	2	3	4	5	6	7	8	9
2689-1	n a m a									
893-1	a n a a									
1285-1	n w a									
1303-1	ŋ ɔ m a									
2197-1	s a l a									
2828-1	s b á a									
3572-1	s ɔ n i									
1095-1	l i m a									
1755-1	n ɛ									
1789-1	k a l a a ŋ a a									
3207-1	β u l a									
3519-1	t ʊ m a									
3686-1	b i m j a									
4249-1	k ʊ m i									
4451-1	β i s i									
448-1	n ʊ n i									
630-1	β ɛ ɛ l ɛ									
814-1	ŋ ɔ m m ɛ									
1216-1	g á β a									
1228-1	m w a									
1418-1	s i m a j									
1475-1	g j a									
2026-1	t j ɛ									
2775-1	β ʊ m m a									
3397-1	β ɔ l a									
3826-1	β ɔ k a									
4003-1	i β β a									
4040-1	g ɛ n i									
4373-1	l i m i									
4384-1	i n ɔ									
84-1	s l g ʊ									
116-1	β i k a									
181-1	g ɔ ŋ g ɔ ɔ									
419-1	l ɔ g a									
587-1	ɔ ɔ ŋ ɔ ɔ									
660-1	l ɛ l a									
848-1	k a l a									
1083-1	l i l a									
1122-1	β i n a									
1159-1	ɲ a									
1350-1	l j a									
1374-1	n j a n ɔ									
1396-1	s ɔ β u									
1430-1	i s β ɔ									
1666-1	t a n ɔ									
1767-1	k ɔ k ɔ									
1906-1	i ŋ g i l a									
2177-1	ŋ g a h i									
2286-1	l a									
2317-1	β u β a									
2419-1	s ɛ k a									
2750-1	ɛ s b									
3018-1	z i l a									
3275-1	k a á á									
3441-1	s a ŋ ŋ a a									
3464-1	β ɔ n a									
3639-1	t ɛ t ɛ p ɛ l									
3885-1	s u m ɔ									
3981-1	i m a									
4192-1	β i m m a									
4260-1	s w a									
4350-1	l ɛ ɛ l ɔ									
43-1	s i m ʊ									
93-1	k ɔ n ɔ									
200-1	β i									
374-1	l l a a a									
459-1	l ʊ m a									
508-1	β ɔ β u									
528-1	β i l i									
575-1	t a									
871-1	t á m a									
1137-1	s i k ʊ									
1339-1	t j i									
1585-1	a l l									
1712-1	β u l ɔ									
1872-1	p a									
2088-1	β i s a									
2166-1	u m m m b									
2334-1	β i g ɔ									
2393-1	m a ɲ a									
2537-1	l ɔ m ɔ									
2665-1	i ŋ ŋ i i									
2738-1	β ɛ ɛ l ɛ									
2872-1	k ɔ s i									
2893-1	s i k ʊ									
2997-1	g a j s a									
3075-1	g ʊ l ʊ β ɛ									
3675-1	l j ɛ l l ɛ									
4028-1	β w ɛ									
4137-1	m i l a									
4238-1	s s ɔ z i									
4316-1	t a t ʊ									
4429-1	a s z a									
4440-1	β i l i									
4485-1	s ʊ									
4574-1	β j a l a									
4688-1	w ɛ									
143-1	β ʊ									
240-1	ɔ ɔ a a									
388-1	p m z ʊ m a									
401-1	d a									
2689-2		ɲ a m a								
893-2		a n a								
1303-2		ŋ o m a								
2197-2		s a l a								
2828-2		s i n a								
3572-2		s o n i								
1095-2		l i m a								
1789-2		k a l a a k a								
3207-2		v u l a								
3519-2		t u m a								
3686-2		iː i m p a								
4249-2		k u m i								
4451-2		v i s i								
448-2		n o n i								
630-2		v e e l e								
814-2		ŋ o m m e								
1216-2		g a v a								
1228-2		b w a								
1418-2		s i m a w								
1475-2		k j a								
2026-2		t j e								
3826-2		s o k a								
4003-2		iː v p								
4373-2		l i m i								
4384-2		i n o								
84-2		k u u								
116-2		v i k a								
419-2		l o g a								
587-2		o ŋ k o o								
660-2		l e l a								
848-2		k á l a								
1122-2		v i n a								
1159-2		ɲ a								
1350-2		l j a								
1374-2		n a a n e								
1906-2		i ŋ k i l a								
2419-2		s e k a								
2750-2		e e s i								
3441-2		s e e k a								
3464-2		v o n a								
3639-2		t e t e m a								
3981-2		i m a a								
4192-2		v i m m a								
4350-2		l e e l o								
278-2		v a								
3971-2		k á m a								
55-2		p a m a								
43-2		iː i m u								
93-2		k o n o								
459-2		l u m a								
1137-2		s i k u								
1585-2		a a l a								
1872-2		p a								
2166-2		u m m a n								
2872-2		k o s i								
2997-2		g a p n a								
3075-2		k u l u v e								
3675-2		l w i l l e								
4137-2		m i l a								
4238-2		iː s s n á								
4316-2		t á t u								
4574-2		v j a a l a								
3067-2		n t u								
3531-2		a a n k a								
1033-2		k o v o l								
3185-2		v i k k								
794-2		v e k a								
143-2		v u u								
240-2		o g a								
388-2		u u m a								
2689-3			b a m a							
893-3			a n a							
1285-3			n j a							
1303-3			g o m a							
2197-3			s a l a							
2828-3			i i n							
3572-3			s o n i							
1095-3			l i m a							
1755-3			n ŋ							
1789-3			x a l a ŋ k a							
3207-3			f u l a							
3519-3			r u m a							
3686-3			i m b j							
4249-3			x u m i							
4451-3			β i s i							
448-3			n o n i							
630-3			β e e l e							
1216-3			k a β a							
1228-3			b j a							
1418-3			s i m a							
1475-3			k j a							
3397-3			β o l a							
4003-3			i β a							
4040-3			k e n i							
4373-3			l i m i							
4384-3			i n o							
181-3			k o e k o							
419-3			l o k a							
587-3			o ŋ k o							
660-3			l e l a							
1083-3			l i l a							
1350-3			l j a							
1374-3			n j a n o							
1396-3			s o f u							
1666-3			r a n o							
1767-3			k o x o							
1906-3			i ŋ k i l a							
2177-3			g k a n							
2286-3			l a							
2317-3			f u β a							
2750-3			e s i							
3275-3			x a a n							
3464-3			f o n a							
3639-3			r e r e tʰ a l							
3981-3			i m a							
4192-3			f i m m b							
4260-3			s j a							
4350-3			l e e l o							
278-3			β a							
745-3			r á x o							
3971-3			x a m a							
93-3			x o n o							
200-3			β i							
374-3			a l l j a							
508-3			β o f u							
528-3			β i l i							
1137-3			s i x u							
1585-3			a l l							
1712-3			f u l o							
2088-3			β i s a							
2334-3			f i k o							
2393-3			m a β a							
2665-3			i ŋ k i							
2738-3			β e e l e							
3675-3			l j e e l e							
4137-3			m i l a							
4440-3			β i l i							
4574-3			s j a l l							
4688-3			i i ŋ							
2798-3			n j a							
3067-3			n r u							
3531-3			a n i x a							
3767-3			l o							
4632-3			x j s i							
401-3			tʰ a							
2689-4				ɲ a m a						
893-4				a n a						
1285-4				n a a						
3572-4				s ɔ n e						
1755-4				n s						
1789-4				k a l a a g g						
3686-4				e m b m						
4451-4				b e s e						
1216-4				k a b a						
4003-4				e b a						
419-4				l ɔ k a						
1122-4				b e n a						
1430-4				e s b						
1666-4				t a n b ɔ						
1767-4				k ɔ k ɔ						
55-4				n a m a						
94-4				b ɔ k ɔ						
2717-4				g a ŋ g a						
1339-4				t a i						
4632-4				k a b i						
2689-5					ʃ a m a					
893-5					a n n					
1285-5					n j a					
1303-5					g o m					
2197-5					s a l					
2828-5					ʃ i n					
3572-5					s o n i					
1095-5					l i m					
3207-5					f u l a					
3519-5					t u m a					
3686-5					ʃ i m n					
4249-5					k u m i					
448-5					n u n i					
630-5					β e e l e					
814-5					g o m m e e					
1228-5					β j a					
1418-5					s i m a					
2026-5					t j e					
2775-5					β u m p a					
3397-5					β o l					
3826-5					β o k					
4040-5					u e n i					
4373-5					l i m i					
4384-5					i n o					
84-5					s u u l					
116-5					f i k					
587-5					o o g o o					
848-5					k á l					
1159-5					ʃ a					
1350-5					l j a					
1396-5					s o f u					
1430-5					i s o					
1767-5					g o k o					
2286-5					l a					
2317-5					β u β a					
2419-5					s e k a					
2750-5					e f s					
3018-5					ʃ i l					
3275-5					k á n n					
3441-5					s a ŋ g a					
3885-5					s u m o					
4192-5					f i i m p					
4260-5					s j					
4350-5					l e e l o					
278-5					β a					
745-5					t á k o					
3971-5					k a m a					
55-5					b a m					
94-5					β o k o					
2717-5					g a ŋ g a					
4139-5					m i n a					
200-5					β i					
374-5					l j l j					
508-5					β o f u					
528-5					β i l i					
575-5					t					
1137-5					s i k u					
1339-5					t j i i					
1872-5					p a					
2537-5					l o m o					
2738-5					β e e l e					
2872-5					k o s i					
2893-5					s i k u					
3675-5					l j i e l e					
4028-5					j e					
4238-5					i s β β i					
4429-5					β s j					
4485-5					s u					
2798-5					n j a					
3531-5					a a n k g					
3767-5					l o					
4632-5					k p s i					
1033-5					k o s o l					
3185-5					β i k					
1303-6						g ɔ ɔ ɔ				
1755-6						n ɛ				
448-6						ɲ ɔ n i				
1475-6						ɔ s				
3397-6						ɓ ɔ l ɔ				
2286-6						l a				
278-6						ɓ				
2717-6						g ɔ d g ɔ				
4137-6						ɔ i l a				
3767-6						l ɔ				
1033-6						k ɔ s ɔ ɔ				
2689-7							n a m a			
893-7							a n á			
1285-7							n w a			
1303-7							g o m a			
2197-7							s á r a			
2828-7							z i n			
3572-7							s o n i			
1095-7							r i m a			
1755-7							n e			
1789-7							k á r a a g ɣ			
3519-7							t u m a			
3686-7							i m b b			
4249-7							k u m i			
4451-7							v i s i			
814-7							g o m b e			
1216-7							ɣ á v a			
1475-7							ɣ w a			
2026-7							t w e			
2775-7							v u m b			
3826-7							z o k a			
4003-7							i v v			
4040-7							ɣ e n i			
84-7							u u u			
116-7							f i k			
181-7							ɣ o o g ɣ o			
419-7							r o ɣ a			
587-7							o o g o o			
660-7							r e r a			
848-7							k á r a			
1122-7							v i n a			
1159-7							z a			
1374-7							n á á n e			
1396-7							s o v u			
1430-7							i s v			
1906-7							i ɣ ɣ i r a			
2177-7							ŋ g á			
2419-7							s e k a			
3018-7							z i r a			
3275-7							k á á n			
3441-7							s e ŋ g ɣ			
3464-7							v o n a			
3639-7							t e t e b e			
3885-7							s u m o			
4192-7							v i m b n			
745-7							t á k o			
3971-7							k á m a			
55-7							n a m a			
2717-7							ŋ t ŋ g t			
4139-7							m i n a			
93-7							k o n o			
459-7							r u m a			
575-7							t a			
1712-7							v u r o			
2088-7							v i s a			
2166-7							n u u m b a			
2334-7							v i ɣ o			
2393-7							m a n a			
2537-7							r o m o			
2665-7							i g ɣ i			
2997-7							ɣ á w h n			
4028-7							v e			
4316-7							t á t u			
4429-7							v á s a			
4688-7							w i a			
3067-7							n t u			
3185-7							v i i k			
794-7							v e r e k a			
143-7							v u			
388-7							n u b u m			
2689-8								n a m a		
1285-8								n w a		
1303-8								ŋ ô m a		
2197-8								v a r a		
2828-8								ʃ î n a		
3572-8								v ô n i		
1755-8								n e		
1789-8								k á r a a g g		
3207-8								v u r a		
3519-8								t u m a		
3686-8								d m m m a		
4249-8								k u m i		
4451-8								v i v i		
814-8								ŋ ô ô m e		
1228-8								m w a		
2026-8								t w e		
2775-8								v u m m a		
3826-8								v ô k a		
4040-8								g e n i		
181-8								g ô ô g ô o		
660-8								r e r a		
848-8								k á r a		
1083-8								r i r a		
1159-8								n a		
1350-8								r ʝ a		
1396-8								v ô v u		
1666-8								t á n n o		
2177-8								ŋ g a		
2317-8								v u v a		
4260-8								v w a		
745-8								t á k ô		
3971-8								k á m a		
94-8								v ô k ô		
2717-8								ŋ a ŋ g a a		
4139-8								m i n a		
43-8								v i m u		
575-8								t a		
871-8								t á m a		
1339-8								t w i i		
1585-8								a a r a		
1872-8								p a		
2893-8								v i k u a		
4028-8								v w e		
4316-8								t á t u		
4440-8								v i r i		
4485-8								v u		
4688-8								w e		
2798-8								n w a		
794-8								v e r e k a		
2689-9									z a m a	
893-9									a n n	
1285-9									n s a	
1303-9									g o m a	
2197-9									s á l a	
2828-9									z i n a	
3572-9									s o n i	
1095-9									l i m a	
1789-9									k a l a a g g	
3207-9									b u l a	
4249-9									k u m i	
4451-9									b i s i	
630-9									b e e l e	
814-9									g o m b e	
1228-9									b s a	
1418-9									s i m a	
1475-9									g s a	
2026-9									r s e	
2775-9									b ʊ m b a	
3397-9									b o l a	
3826-9									s o k a	
4003-9									i b b	
4040-9									g e n i	
4373-9									l i m i	
4384-9									i n o	
116-9									b i k a	
181-9									g o ŋ g o o	
1083-9									l i l a	
1374-9									n b á n e	
1430-9									i s b	
1666-9									r á n n o	
1767-9									g o k o	
1906-9									i g g i l	
2177-9									g g á b	
2419-9									s e k a	
2750-9									e s z	
3018-9									z i l a	
3441-9									s e ŋ g g a	
3885-9									s u m o	
3981-9									i m a	
4260-9									s s a	
4350-9									l e e l o	
278-9									b a	
745-9									r á k o	
55-9									n a m a	
94-9									b o k o	
4139-9									m i n a	
200-9									b i	
528-9									b i l i	
871-9									r a m a	
2088-9									b i s a	
2166-9									n ʊ ʊ m n a	
2334-9									b i g o	
2393-9									m a n a	
2537-9									l o m o	
2665-9									i k g i	
2738-9									b e e l e	
2872-9									k o s i	
2997-9									g a á z b	
3075-9									g u l u b e	
4238-9									z b s b i	
4429-9									b á s a	
4440-9									b i l i	
4485-9									s u	
4574-9									s w a a l a	
2798-9									n s a	
3067-9									n r u	
3767-9									l o	
4632-9									k p s i	
1033-9									k o b o m	
3185-9									b i i k	
240-9									o o a	
401-9									p a	
2689-10										ɲ a m a
893-10										a n á
1285-10										n̩ w a
2197-10										s a l a
2828-10										s i n̩ a
1095-10										l i m a
1755-10										n̩ f
3207-10										f ʊ l a
3519-10										r ʊ m a
448-10										n ʊ n̩ i
630-10										f ɛ ɛ l ɛ
1216-10										χ a f a
1418-10										f i m a
2775-10										f ʊ m n̩ a
3397-10										f ɔ l a
4373-10										l i m i
4384-10										i n̩ ɔ
84-10										s ʊ ɔ ʊ̀ l
1083-10										l i l a
1122-10										f i n̩ a
2286-10										l a
2317-10										f ʊ f a
3018-10										s i l a
3275-10										χ a ɬʰ n̩
3464-10										f ɔ n̩ a
3639-10										r i r i m a
3885-10										s u m ɔ
3981-10										i m a
94-10										f ɔ χ ɔ
4139-10										m i n a
43-10										s i m ʊ
374-10										a a a a
459-10										l ʊ m a
508-10										f ɔ f u
871-10										r a m a
1712-10										f u l ɔ
2893-10										f i χ ʊ
3075-10										χ u l u f ɛ
3531-10										a n n̩ i χ a
794-10										f i χ a
