COGID	ChorbatBalti	KhapaluBalti	KharmangBalti	RonduBalti	ShigarBalti	SkarduBalti	SkarduPurki
1593	g ɑ ɾ	g ɑ	g ɑ ɾ	g ɑ ɾ	g ɑ ɾ	g ɑ ɾ	g ɑ ɾ
33	p o t̪ ʊ k s̪		t̪ ʊ k s̪		t̪ ʊ k s̪		
172		t̪ʲ o k		t̪ o k		t̪ o k	
1105	l̪ ʈ ɜ n̪ ʊ s̪ i	l̪ t̪ ɜ n̪ u s̪		l̪ t̪ ɜ n̪ u s̪ e	l̪ t̪ ɜ n̪ u s̪ i	l̪ t̪ ɜ n̪ u s̪	l̪ t̪ ɜ n̪ u s̪
1617	s̪ u	s̪ u	s̪ u	s̪ u	s̪ u	s̪ u	s̪ u
1371	d̪ o	d̪ o	d̪ o	d̪ o	d̪ o	d̪ o	
391	g r̪ ɜ x m o	ɖʐ ɜ x m o	g r̪ ɜ x m o	ʐ ɜ x m o	ɖʐ ɜ x m o	ɖʐ ɜ x m o	g r̪ ɜ x m o
1700	n̪ o ŋ o					n̪ o ŋ o	n̪ õ ŋ o
547	ɜ t̪ ɑ	ɜ t̪ ɜ	ɜ t̪ ɑ	ɑ t̪ ɜ	ɑ t̪ ɜ	ɑ t̪ ɜ	ɜ t̪ ɑ
1048	k ɜ k ɑ	k ɜ k ɑ	k ɜ k ɜ	k ɜ k ɜ	k ɜ k ɜ	k ɜ k ɜ	k ɑ ɣ ɑ
1644	b r̪ u s̪ t̪ i ŋ	b ʊ s̪ t̪ r̪ i ŋ	b u s̪ t̪ r̪ i ŋ	b u s̪ t̪ r̪ i ŋ	b u s̪ t̪ r̪ i ŋ	b u s̪ t̪ r̪ i ŋ	b u s̪ t̪ r̪ i ŋ
358	pʰ r̪ u	pʰ r̪ u	pʰ r̪ u		p l̥ u	p l̥ u	pʰ r̪ u
1029	m ɑ ɾ	m ɑ ɾ	m ɑ ɾ	m ɑ ɾ	m ɑ ɾ	m ɑ ɾ	m ɑ ɾ
946	kʰ ɑ	kʰ ɑ	kʰ ɑ				kʰ ɑ
88	ɾ gʲ u k s̪	b gʲ u k s̪	β gʲ ʊ k s̪	b gʲ u k s̪	β gʲ u k s̪	b gʲ u k s̪	
1073	ɾ gʲ ɑ	b gʲ ɜ	β gʲ ɜ	β gʲ ɜ	β gʲ ɜ	b gʲ ɜ	ɾ gʲ ɜ
1159	t̪ r̪ ɜ ŋ		t̪ r̪ ɜ ŋ	t̪ r̪ ɜ ŋ	t̪ r̪ ɜ ŋ	t̪ r̪ ɜ ŋ	ʈ ɑ ŋ
120	z̪ ɛ ɾ s̪	z̪ ɛ ɾ s̪	z̪ ɛ ɾ s̪	z̪ ɛ ɾ s̪	z̪ ɛ ɾ s̪	z̪ ɛ ɾ s̪	z̪ ɛ ɾ s̪
25	z̪ o s̪	z̪ ʊ s̪	z̪ ʊ s̪	z̪ ʊ s̪	z̪ ʊ s̪	z̪ ʊ s̪	z̪ o s̪
473	b i ɜ p ʑ ʊ n̪	b i ɜ m ʑ ʊ n̪	b i ɜ p ʑ ʊ n̪	b i ɜ p dʑ ʊ n̪	b i ɜ p ʑ ʊ n̪	b i ɜ p ʑ ʊ n̪	
455	t̪ʰ ɜ l d u m	t̪ʰ ɜ l d u m	t̪ʰ ɜ l d u m	t̪ʰ ɜ l d u m	t̪ʰ ɜ l d u m		t̪ʰ ɜ l d u m
422	l o x s̪ o	l o x s̪ o	l o x s̪ o	l o x s̪ o	l o x s̪ o	l o x s̪ o	l o x s̪ o
1397	d̪ʲ u	d̪ʲ u		d̪ʲ u	d̪ʲ u	d̪ʲ u	d̪ʲ u
49	ɕ ɪ s̪	ɕ i s̪	ɕ i s̪	ɕ i s̪	ɕ ɪ s̪	ɕ i s̪	ɕ i s̪
1601	g oˑ	g o			g oˑ	g oˑ	g o
1	m i n̪ s̪	m i n̪ s̪	m ɪ n̪ s̪	m i n̪ s̪	m ɪ n̪ s̪	m ɪ n̪ s̪	
1521				ʐ o ŋ	ɖʐ o ŋ	ɖʐ o ŋ	
1136				p ɜ r̪ ɜ k z̪ ɜ	p ɜ ɽ ɑ ɣ z̪ ɑ	pʰ ɜ ɽ ɜ k z̪ ɜ	p ɑ r̪ ɑ z̪ β̞ ɑ
653	z̪ g o k p ɑ	z̪ g o k p ɑ	z̪ g o k p ɜ	z̪ g o k p ɜ	z̪ g o k p ɜ	z̪ g o k p ɜ	z̪ g o k p ɜ
154		s̪ ʊ t̪ ʊ p s̪				s̪ o t̪ ɜ p s̪	t̪ʰ ɜ m p s̪
261	n̪ ɑ q p o	n̪ ɑ q p o	n̪ ɜ q p o	n̪ ɑ q p o	n̪ ɑ q p o	n̪ ɜ q p o	n̪ ɑ q p o
1504	ȵ i s̪	ȵ i s̪	ȵ ɪ s̪	ȵ i s̪	ȵ i s̪	ȵ ɪ s̪	ȵ i s̪
610	ȵʲ ɑ	ȵʲ ɑ	ȵʲ ɑ	ȵʲ ɑ	ȵʲ ɑ	ȵʲ ɑ	ȵʲ ɑ
1545	ŋ ɜ t̪ ɜ ŋ	ŋ ɜ t̪ ɜ ŋ	ŋ ɜ t̪ ɜ ŋ	ŋ ɑ d ɑ ŋ	ŋ ɜ t̪ ɜ ŋ	ŋ ɜ t̪ ɜ ŋ	ŋ ɜ t̪ ɜ ŋ
96	d̪ u k s̪	d̪ u k s̪	d̪ u k s̪	d̪ u k s̪	d̪ u k s̪	d̪ u k s̪	d̪ u k s̪
600	pʰ u	pʰ u					
1405	ɾ i ŋ ɑ	ɾ i ŋ ɑ				ɾ i ŋ ɑ	
1520	g ʊ r̪ o ŋ	g r̪ o ŋ	g ʊ r̪ o ŋ			g ʊ r̪ o ŋ	
618	ɣ ɑ	ɣ ɑ	ɣ ɑ	ɣ ɑ	ɜ ɣ ɑ	ɣ ɑ	
1554		h ɜ f t̪ ɑ	h ɜ f t̪ ɑ	h ɜ f t̪ ɜ		h ɜ f t̪ ɜ	
1380			d̪ i		d̪ i	d̪ i	
836	m i	m i	m i	m i	m i	m i	m i
1488	tɕ o ŋ ɛ s̪	tɕ o ŋ ɜ s̪	tɕ o ŋ ɜ s̪	tɕ o ŋ ɜ s̪	tɕ o ŋ ɜ s̪	tɕ o ŋ ɜ s̪	tɕ o ŋ ɜ s̪
1578		ʈʂ o		ʈʂ o	ʈʂ o	ʈʂ o	
677	lʲ ɜ x m o	lʲ ɜ x m o	lʲ ɜ x m o	lʲ ɜ x m o	lʲ ɜ x m o	lʲ ɜ x m o	lʲ ɜ x m o
17	s̪ k o m s̪	s̪ k o m s̪	s̪ k o m s̪	s̪ k o m s̪	s̪ k o m s̪	s̪ k o m s̪	s̪ k o m s̪
1363	h tɕ u						h s̪ tɕ u
1231	ɾ d u n̪	b d u n̪		β d u n̪	β d u n̪	b d u n̪	ʊ ɾ d u n̪
1440	d̪ ɪ r̪ i ŋ	d̪ ɪ r̪ i ŋ	d̪ ɪ r̪ i ŋ	d̪ ɪ r̪ i ŋ	d̪ ɪ r̪ i ŋ	d̪ ɪ r̪ i ŋ	d̪ ɪ r̪ i ŋ
956			tɕʰ ɪ n̪			tɕʰ ɪ n̪	
1347	s̪ ȵ ɜ m ɜ						ɕ ȵ ɑ ŋ m ɑ
1306	b u	b u	b u	b u	b u	b u	pʰ r̪ u
456					t̪ʰ ɜ l p ʊ ʈ	t̪ʰ ɜ l p ʊ ʈ	
1037	ȵ̊ i ȵ p ɑ	s̪ ȵ ĩ ŋ m ɜ	ɕ ȵ ĩ m ɜ	s̪ ȵ i ŋ m ɜ	ȵ̊ i ȵ m ɜ	s̪ ȵ i ŋ m ɜ	s̪ ŋ i ŋ m ɜ
1577	k r̪ o		k r̪ o				k r̪ o
1415	d̪ o n̪	d̪ ɛ n̪	d̪ e	d̪ o ŋ	d̪ o ŋ	d̪ o ŋ	d̪ e
1379	d̪ʲ u n̪	d̪ʲ u n̪		d̪ʲ u ŋ	d̪ʲ u	d̪ʲ u ŋ	d̪ʲ u
413	ʑ ɜ q	dʑ ɜ q	ʑ ɜ q	ʑ ɜ q	ʑ ɜ q	ʑ ɜ q	ʑ ɜ q
330	g o b i	g o b i	g o b i				g o b i
701	kʰ o	kʰ o	kʰ o	kʰ o	kʰ o	kʰ o	kʰ o
734	ɾ β̞ ɑ	ɾ β̞ ɑ	ɾ β̞ ɑ	ɾ β̞ ɑ	ɾ β̞ ɑ	ɾ β̞ ɑ	ɾ β̞ ɑ
153				kʰ ɜ k t̪ ɜ t̪ s̪	kʰ ɑ k t̪ ɜ t̪ s̪	kʰ ɜ k t̪ ɜ t̪ s̪	
73	ɾ d ɜ p s̪	ɾ d ɜ p s̪	ɾ d ɜ p s̪		ɾ d ɜ p s̪	ɾ d ɜ p s̪	ɾ d ɜ p s̪
1496	ȵ i ɕ u	ȵ i ɕ u	ȵ i ɕ u	ȵ i ɕ u	ȵ i ɕ u	ȵ i ɕ u	ŋ i ɕ u
104	t̪ʰ o ŋ s̪	t̪ʰ õ s̪	t̪ʰ o ŋ s̪	t̪ʰ o ŋ	t̪ʰ o ŋ	t̪ʰ o ŋ s̪	
111	ŋ ĩ t̪ ɑ̃ s̪	ŋ ĩ t̪ õ s̪	ŋ ĩ t̪ ɑ̃ s̪	ŋ ĩ t̪ ɜ̃ s̪	ȵ ĩ t̪ ʔ õ s̪	ȵ ĩ t̪ ɜ̃ s̪	ŋ ĩ t̪ ɑ̃ s̪
174				j ɑ ɾ	j ɑ ɾ	j ɜ ɾ	
572	dz̪ o g u		z̪ o g u				z̪ ɪ g u
1315	t̪ ɑ k s̪ k ɜ n̪	t̪ ɜ x s̪ k ɜ n̪	t̪ ɑ k s̪ k ɜ n̪	t̪ ɑ x s̪ k ɜ n̪	t̪ ɑ x s̪ k ɜ n̪	t̪ ɑ k s̪ k ɜ n̪	t̪ ɑ x s̪ k ɜ n̪
1692	n̪ o n̪ o	pʰ o n̪ o	pʰ o n̪ o	pʰ o n̪ o	pʰ o n̪ o	pʰ o n̪ o	n̪ o n̪ o
488	ɾ gʲ ɛ t̪	b gʲ ɜ t̪	β gʲ ɜ t̪	gʲ ɜ t̪	β gʲ ɛ t̪	gʲ ɛ t̪	ɾ gʲ ɛ t̪
964	m i n̪ t̪ ɜ x	m ĩ n̪ t̪ ɜ x	m i n̪ t̪ ɜ x	m i n̪ t̪ ɜ x	m i n̪ t̪ ɜ x	m ɛ n̪ t̪ ɜ x	m i n̪ t̪ ɜ k s̪
80	p r̪ ɛ t̪ l ɑ	p r̪ ɛ l ɑ			p r̪ ɛ l ɑ		
57	t̪ʰ ũ ŋ s̪	t̪ʰ ũ s̪	t̪ʰ ũ s̪	t̪ʰ ũ ŋ s̪	t̪ʰ ũ s̪	t̪ʰ ũ ŋ s̪	t̪ʰ ũ s̪
189	g ɑ ŋ m ɑ	g ɑ ŋ m ɑ	g ɑ̃ m ɑ	g ɑ̃ ŋ m ɜ	g ɑ ŋ m ɜ	g ɑ ŋ m ɜ	g ɑ ŋ m ɑ
1406		tθʰ o q	tθʰ o q	tθʰ o q	tθʰ o q	tθʰ o q	
947				kʰ ɜ p ɜ k	kʰ ɑ b ɜ k	kʰ ɑ b ɜ k	
781		ɖʐ i		ʐ i	ɖʐ i	ɖʐ i	
365	s̪ ȵ ɛ r̪ m ɜ	s̪ ȵ ɛ r̪ m ɜ	s̪ ȵ ɛ r̪ m ɜ	s̪ ȵ i r̪ m ɜ	ȵ̊ ɛ r̪ m ɜ	s̪ ȵ ɛ r̪ m ɜ	ȵ ɛ r̪ m ɜ
812	j ɜ ŋ m o	j ɜ ŋ m o	j ɑ̃ m o	j ɑ ŋ m o	j ɑ ŋ m o	j ɑ ŋ m o	j ɑ̃ m o
980	kʰ ɜ p	kʰ ɜ p	kʰ ɜ p	kʰ ɜ p	kʰ ɜ p	kʰ ɜ p	
1456	h ɜ s̪ k e	h ɜ s̪ k e	h ɜ s̪ k e	h ɜ s̪ k e	h ɜ s̪ k e	h ɜ s̪ k e	
855	l̪ t̪ i m	l̪ ʈ i m					
328	k ɜ ɽ ɜ m		k ɜ ɽ ɜ m	k ɜ ɽ ɜ m	k ɜ ɽ ɜ m	k ɜ ɽ ɜ m	
1626		n̪ ɜ m ɑ					n̪ ɑ m ɑ
342	g o b i	g o b i	ɸ u l g o b i				pʰ u l g o b i
1057	ɜ ɕ e	ɑ ɕ e	ɜ ɕ e	ɑ ɕ e	ɜ ɕ ɛ	ɜ ɕ e	
481		b ɛ ŋ g ɜ n̪	b ɛ ŋ g ɜ n̪		b ɛ ŋ g ɜ n̪		
496	kʰ r̪ i õ ŋ	t̪ʰ r̪ i m o ŋ		ʈʂ ɪ m o k	t̪ʰ r̪ ɪ m o ŋ	t̪ʰ r̪ ɪ m o ŋ	
828	ɾ i ŋ b o	ɾ i ŋ m o	ɾ ĩ m o	ɾ i ŋ m o	ɾ i ŋ m o	ɾ i ŋ m o	ɾ i ŋ m o
1012	t̪ r̪ o b ɜ ɾ	tɕ o b ɜ ɾ	t̪ r̪ o b ɜ ɾ	t̪ r̪ o b ɑ ɾ	t̪ r̪ o b ɜ ɾ	t̪ r̪ o b ɜ ɾ	t̪ r̪ o b ɑ ɾ
642	m e β̞ ɑ	m e β̞ ɑ	m e β̞ ɑ	m e β̞ ɑ		m e β̞ ɑ	
896	l dð ɑ	l dð ɑ	l dð ɑ	l dð ɑ			l dð ɑ
253	tɕ o ɣ o	tɕ o ɣ o	tɕ o ɣ o	tɕ o ɣ o	tɕ o ɣ o	tɕ o ɣ o	tɕ o ɣ o
245	t̪ʰ u ɾ	t̪ʰ o r̪ u	t̪ʰ u r̪ u	t̪ʰ u r̪ u	t̪ʰ u r̪ u	t̪ʰ u ɾ	t̪ʰ u ɾ̥
279		ʊ ɾ g o	ʊ ɾ g o	ɾ g o	ʊ ɾ g o	ɾ g o	ʊ ɾ g o
65	k o s̪	k o s̪	k o s̪	k o s̪	k o s̪	k o s̪	k o s̪
1609	k ɑ r̪ p o	k ɑ r̪ p o	k ɜ ɕ p o	k ɑ r̪ ɸ o	k ɑ r̪ ɸ o	k ɑ r̪ ɸ o	k ɑ r̪ ɸ o
1561	ɕ e r̪ p ɑ	ɕ ɪ r̪ p ɑ	ɕ ɜ ɕ p ɜ	ɕ ɛ r̪ ɸ ɑ	x ɕ ɛ r̪ ɸ ɜ	x ɕ ɛ r̪ ɸ ɜ	ɕ e r̪ p ɑ
1585	n̪ ɑ m	n̪ ɑ m	n̪ ɑ m	n̪ ɑ m	n̪ ɑ m	n̪ ɑ m	n̪ ɑ m
853		ɪ ɕ ɪ n̪	ɪ ɕ ɪ n̪	ɜ ɕ i n̪	i ɕ ɪ n̪	i ɕ ɪ n̪	
1167	s̪ u r̪ ʊ p	s̪ u r̪ ʊ p	x s̪ ʊ r̪ u p	s̪ u r̪ ʊ p	x s̪ u r̪ ʊ p	s̪ u r̪ ʊ p	
350	bʲ ɜ ŋ o	bʲ ɜ ŋ o	bʲ ɜ ŋ m o	bʲ ɜ ŋ o	bʲ ɜ ŋ o	bʲ ɜ ŋ o	bʲ ɜ ŋ o
447	s̪ k ɜ m b o	s̪ k ɜ m b o	s̪ k ɜ m b o	s̪ k ɜ m b o	s̪ k ɜ m b o	s̪ k ɜ m b o	s̪ k ɜ m b o
743	t̪ʰ r̪ ʊ n̪ m o						ʈʰ o n̪ m o
1676	kʰʲ ɑ ŋ	kʰʲ ɑ ŋ	kʰʲ ɜ ŋ	kʰʲ ɑ ŋ	kʰʲ ɑ ŋ	kʰʲ ɑ ŋ	
1569	tɕ i	tɕ i	tɕ i	tɕ i	tɕ i	tɕ i	tɕ i
989		s̪ ɜ r̪ p ɜ		s̪ ɜ r̪ ɸ ɑ	s̪ ɜ r̪ ɸ ɜ	s̪ ɜ r̪ f ɜ	
1625	z̪ ɜ n̪ z̪ ʊ s̪	z̪ ɜ n̪ z̪ ʊ s̪	z̪ ɜ n̪ z̪ u s̪	z̪ ɜ n̪ z̪ ʊ s̪	z̪ ɜ n̪ z̪ ʊ s̪	z̪ ɜ n̪ z̪ ʊ s̪	
181	pʰ ɪ r̪ o	pʰ i r̪ o	pʰ r̪ i d o	f i t̪ r̪ o	pʰ i r̪ o	pʰ i t̪ r̪ o	pʰ i tʰ o q
1668	j ɑ ŋ	j ɑ ŋ	j ɑ ŋ	j ɑ ŋ	j ɑ ŋ	j ɑ ŋ	j ɑ ŋ
375			k ɜ p ɽ ɑ	k ɜ p ɽ ɜ			
374	r̪ ɜ s̪	ɾ ɜ s̪	ɾ ɜ s̪			ɾ ɜ s̪	ɾ ɜ s̪
897					l z̪ ɑ	l z̪ ɑ	
400			b ɜ l ɜ ŋ			b ɜ l ɜ ŋ	
197	k ɪ m b o q	k i ŋ b o q					
405	b o ŋ o	b o ŋ o	b o ŋ o	b o ŋ o	b o ŋ o	b o ŋ o	b o ŋ o
661	b o ŋ o	b o ŋ o	b o ŋ o	b o ŋ o	b o ŋ o	b o ŋ o	b o ŋ o
780	ɣ r̪ i		ɣ r̪ i				g r̪ i
1239	m o	m o	m o	m o	m o	m o	
1143	m ɑ ɾ̥ p o	m ɑ r̪ p o	m ɜ ɕ p o	m ɑ r̪ ɸ o	m ɑ r̪ ɸ o	m ɑ r̪ ɸ o	m ɑ r̪ p o
310	tɕʰ ɜ q s̪	tɕʰ ɜ q p o	tɕʰ ɜ q	tɕʰ ɜ q p o	tɕʰ ɜ q p o	tɕʰ ɜ q p o	tɕʰ ɜ q p o
214			t̪ʰ ɜ l b ɜ				t̪ʰ ɜ l b ɜ
199				ʈʂ ɪ m o q	ʈʂ ɪ m o q	ʈʂ ɪ m o q	
128	d̪ r̪ u l s̪	d̪ r̪ u l s̪	d̪ r̪ u l s̪	d̪ r̪ u l s̪	d̪ r̪ u l s̪	d̪ r̪ u l s̪	d̪ r̪ u l s̪
152	tɕ ɜ t̪ s̪	tɕ ɜ t̪ s̪	tɕ ɜ t̪ s̪		tɕ ɜ t̪ s̪		
938	ɜ ŋ ɑ						ɜ m ɑ
996	tθʰ ɜ n̪	tθʰ ɜ n̪	tθʰ ɜ n̪	tθʰ ɜ n̪	tθʰ ɜ n̪	tθʰ ɜ n̪	tθʰ ɜ n̪
1348		ʑ ɪ n̪ d o	ʑ ɪ g d o	dʑ i n̪ d o	ʑ ɪ n̪ d o	ʑ ɪ n̪ d o	
1537	ŋ ɑ j ɑ	ŋ ɑ j ɑ	ŋ ɑ j ɑ	ŋ ɑ j ɑ	ŋ ɑ j ɑ	ŋ ɑ j ɑ	
957				dʑʲ ɑ g ɜ t̪	dʑ ɑ g ɜ t̪	dʑ ɑ g ɜ t̪	
329	b ɜ n̪ d	b ɜ n̪ d	b ɜ n̪ d				b ɜ n̪ d
1004	ɾ g u	ʊ ɾ g o	ɾ g u	ʊ ɾ g u	ʊ ɾ g o	ɾ g u	ɾ g u
1448	p ɑ ɣ ɜ n̪	p ɑ ɣ ɜ n̪	p ɑ ɣ ɜ m	p ɑ ɣ ɜ n̪	p ɑ ɣ ɜ n̪	p ɑ ɣ ɜ n̪	p ɑ ɣ ɜ n̪
726	l̪ tɕʰ o	l̪ tɕʰ o	l̪ tɕʰ o	l̪ tɕʰ o	l̪ tɕʰ o	l̪ tɕʰ o	
1684	kʰ i t̪ ɜ ŋ	kʰ i d ɜ ŋ	kʰ ɪ t̪ ɜ ŋ	kʰ i d ɜ ŋ	kʰ i t̪ ɜ ŋ	kʰ i t̪ ɜ ŋ	
482				p ɑ ɣ ɜ n̪		p ɑ ɣ ɜ n̪	
1207	p ɑ j u	p ɑ j u	p ɑ j u	p ɑ j u	p ɑ j u	p ɑ j u	
1660	g o n̪ d e	g u n̪ d e	g ʊ n̪ d e	g ʊ n̪ d e	g u n̪ d e	g u n̪ d e	g ʊ n̪ d e
539	tθʰ ɪ l	tθʰ ɪ l	tθʰ ɪ l	tθʰ ɪ l	tθʰ ɪ l	tθʰ ɪ l	tθʰ ɪ l
1480	j u ŋ	j u ŋ	j u ŋ	j u ŋ	j u ŋ	j u ŋ	j u ŋ
1065	tɕ i k	tɕ ɪ k	tɕ ɪ k	tɕ ɪ k	tɕ i k	tɕ i k	tɕ i k
1215	ts̪ o x s̪ ɑ tθ o x	ts̪ o x tθ o x	ts̪ o q s̪ ɑ tθ o q s̪	ts̪ o x s̪ ɑ tθ o x s̪	ts̪ o q s̪ ɑ tθ o q s̪	ts̪ o q s̪ ɑ tθ o q s̪	ts̪ o q s̪ ɑ tθ o q s̪
564	ɾ ɑ						ɾ ɑ
912	gʲ o x p ɑ	gʲ o x p ɑ	gʲ o x p ɜ	gʲ o x p ɜ	gʲ ʊ x p ɜ	gʲ ʊ k s̪ p ɜ	
1602			g ɜo	g ɜo			
1627	tɕ ʊ ŋ m ɜ	tɕ ʊ ŋ m ɜ					
972	ȵ i m o ɾ	ȵ i m o ɾ	ȵ i m o ɾ	ȵ i m o ɾ	ȵ i ŋ o ɾ	ȵ i m o ɾ	ȵ i m o ɾ̥
173			gʲ ɜ̃ l ɜ				gʲ ɜ̃ l ɜ
1339	ȵ i m ɑ	ȵ i m ɑ	ȵ i m ɑ	ȵ i m ɑ		ȵ i m ɑ	ȵ i m ɑ
431	kʰ i	kʰ i	kʰ i	kʰ i	kʰ i	kʰ i	x i
1701		s̪ t̪ r̪ i ŋ m o	s̪ t̪ r̪ i ŋ m o	s̪ t̪ r̪ i ŋ m o	s̪ t̪ r̪ i ŋ m o	s̪ t̪ r̪ i ŋ m o	
573		s̪ ɛ n̪ m ɜ	s̪ ɛ n̪ m o	s̪ ɛ n̪ m o	s̪ ɛ n̪ m o	s̪ ɛ n̪ m o	
294	b u	b u	b u	p l̥ u	p l̥ u	p l̥ u	pʰ r̪ u
41	õ s̪	õ s̪	õ s̪	õ s̪	õ s̪	o ŋ s̪	õ s̪
1255	t̪ r̪ u k	tɕ u k	t̪ r̪ u kʰ	t̪ r̪ u k	t̪ r̪ u k	t̪ r̪ u k	ʈ u k
1553	ʑ ɜ k ʊ r̪ d u n̪						ʊ ɾ d u n̪
1389	kʰ o ŋ	kʰ o ŋ	kʰ o ŋ	kʰ o ŋ	kʰ o ŋ	kʰ o ŋ	kʰ o ŋ
