COGID	1	10	2	3	4	5	6	7	8	9
2689-1	ŋʰ a m a									
893-1	a ŋʰ a									
1285-1	ŋʰ w a									
1303-1	g ɔ m a									
2197-1	s á l a									
2828-1	z i n a									
3572-1	s ɔ n i									
1095-1	l i m a									
1755-1	ŋʰ ɛ									
1789-1	k a l a ŋ g a									
3207-1	f ʊ l a									
3519-1	t ʊ m a									
3686-1	j i m b a									
4249-1	k ʊ m i									
4451-1	β i s ʊ									
448-1	ʊ ʊ ŋʰ á ŋʰ i									
630-1	β ɛ l ɛ									
814-1	ɔ m b ɛ									
1216-1	k a β a									
1228-1	b w a									
1418-1	s i m i s j a									
1475-1	g w a									
2026-1	t w ɛ									
2775-1	β u m b a									
3397-1	β ɔ l a									
3826-1	s ɔ k a									
4003-1	j β a									
4040-1	g ɛ n i									
4373-1	z i m i									
4384-1	i ŋʰ ɔ									
84-1	s ʊ g ʊ l ʊ									
116-1	f i k a									
181-1	g ɔ ɔ ŋ g a									
419-1	l ɔ g a									
587-1	ɔ ŋ g ɔ									
660-1	l ɛ l a									
848-1	k a l a									
1083-1	l i l a									
1122-1	b i ŋʰ a									
1159-1	n a									
1350-1	l j a									
1374-1	n s a n ɛ									
1396-1	z ɔ f ʊ									
1430-1	i s ɔ									
1666-1	t á n ɔ									
1767-1	g ɔ k ɔ									
1906-1	ʊ ŋ g i l a									
2177-1	g á h i									
2286-1	l a									
2317-1	β ʊ f a									
2419-1	s ɛ k a									
2750-1	a s i									
3018-1	z i l a									
3275-1	k á ŋʰ a									
3441-1	s a a ŋ g a									
3464-1	β ɔ ŋʰ a									
3639-1	t ɛ t ɛ m a l a									
3885-1	s u m ɔ									
3981-1	i m a ŋʰ a									
4192-1	β i m b a									
4260-1	s w a									
4350-1	l ɛ l ɔ									
43-1	z i m ʊ ʊ									
93-1	k ɔ n ɔ									
200-1	β i									
374-1	dʒ l a w a									
459-1	l ʊ m a									
508-1	p ɔ f ʊ									
528-1	β i l i									
575-1	t a									
871-1	t a á m a									
1137-1	s i g ʊ									
1339-1	t w ɛ									
1585-1	a l a									
1712-1	f u l ɔ									
1872-1	p a									
2088-1	β i k a									
2166-1	ɲ u m b a									
2334-1	β i g ɔ									
2393-1	m ɛ n a									
2537-1	l ɔ m ɔ									
2665-1	i ŋ g i									
2738-1	β ɛ l ɛ									
2872-1	k ɔ s i									
2893-1	t i k ʊ									
2997-1	g a n s a									
3075-1	g ʊ l ʊ β ɛ									
3675-1	l l ɛ l ɛ									
4028-1	w ɛ									
4137-1	m i l a									
4238-1	s ɔ s i									
4316-1	t a t ʊ									
4429-1	a s a									
4440-1	β i l i									
4485-1	s ʊ									
4574-1	β β a a l a									
4688-1	w ɛ w ɛ									
143-1	β ʊ									
240-1	ɔ g a									
388-1	p a n ʊ m a									
401-1	d a									
599-1	t a m b i									
649-1	l ɛ ɛ t a									
755-1	g u l a									
836-1	s u u m b i									
969-1	s a									
994-1	t ɛ l ɛ k a									
1006-1	n i g u									
1032-1	k ɔ l ɔ l a									
1043-1	β á l a									
1110-1	t ɛ m a									
1263-1	t á h a									
1273-1	l ɔ ɔ t a									
1329-1	i k a l									
1362-1	g i									
1606-1	ɔ t ɔ									
1617-1	d i k ɔ									
1629-1	k l ʊ									
1744-1	i β a									
1895-1	s a									
1917-1	β ʊ m a									
1969-1	a m a									
1989-1	s a g a									
2037-1	k a t a									
2128-1	ɛ m β ɛ									
2186-1	g a n a									
2483-1	ʊ l ʊ ʊ									
2592-1	l ɔ l a									
2615-1	d a									
2700-1	g a ŋ g a									
2784-1	g ʊ l ʊ									
2797-1	l ɔ m u									
2884-1	m p j a									
2904-1	g ɛ n d a									
2972-1	s ɛ									
3030-1	l i p a									
3148-1	i t a									
3160-1	l u t a									
3261-1	t ɛ t ɛ									
3364-1	s ɔ t a									
3385-1	s i									
3419-1	t ɛ									
3430-1	ʊ n ʊ									
3583-1	n ɔ l a									
3664-1	β ɛ k a									
3706-1	t a n d á t ʊ									
3756-1	s i n s a									
3837-1	h ɔ l ɔ m a									
3865-1	s á s ɛ									
4406-1	t i									
4530-1	l ʊ k a									
4552-1	i n s i									
4621-1	a n ʊ									
2689-2		n a m a								
893-2		a n a								
1303-2		ŋ oː m a								
2197-2		t a l a								
2828-2		s i n a								
3572-2		s oː n i								
1095-2		l i m a								
1789-2		k a l a ŋ g a								
3207-2		a u l a								
3519-2		t u m a								
3686-2		s i m b a								
4249-2		g u m i								
4451-2		v i s u								
448-2		n u n a n i								
630-2		b e l e								
814-2		g oː m b e								
1216-2		g a v a								
1228-2		b w a a								
1418-2		s i m i s j a								
1475-2		g w a								
2026-2		t w e								
3826-2		s oː o k a								
4003-2		i v a								
4373-2		l i m i								
4384-2		i n o								
84-2		s l u u								
116-2		v i k a								
419-2		l o k a								
587-2		o o ŋ g o								
660-2		l e l a								
848-2		ŋ a l a								
1122-2		a i n a								
1159-2		ɲ a								
1350-2		l j a a								
1374-2		n a a n e								
1906-2		iː ŋ g i l a								
2419-2		s e k a								
2750-2		e s i								
3441-2		s e a ŋ g a								
3464-2		w o n a								
3639-2		n e t e m a								
3981-2		e m a								
4192-2		v i m b a								
4350-2		l e e l o								
278-2		v a								
3971-2		g a m a								
55-2		e a m a								
43-2		d i m u								
93-2		g o n o								
459-2		l u m a								
1137-2		s i g u								
1585-2		a tʃ a l a								
1872-2		p a								
2166-2		ɲ u m b a								
2872-2		k o s i								
2997-2		k a s a								
3075-2		g u l u b e								
3675-2		l w i a l e								
4137-2		m i l a								
4238-2		s o s i i								
4316-2		t a t u								
4574-2		f w a a l a								
3067-2		n t u								
3531-2		a n e g a								
1033-2		ŋ o s o l a								
3185-2		v e k a								
794-2		v e g a								
143-2		v u u								
240-2		o g a								
388-2		ɲ u m a								
599-2		t a á m b i								
969-2		i a								
994-2		d e tʃ l a								
1606-2		o t o								
1629-2		l v i								
1895-2		dʒ a								
2592-2		w o l a								
2884-2		p j a								
3148-2		i t a								
3261-2		d e t e								
3583-2		ɲ o a l a								
3837-2		l o l o m a								
4621-2		ɲ i								
1929-2		b u s i								
3940-2		p a l a								
860-2		v i ŋ g a								
2057-2		t i m a								
552-2		a u p a								
959-2		p e p o								
1495-2		v u t a								
2689-3			ɲ a x a							
893-3			a n a							
1285-3			n w a							
1303-3			k o x a							
2197-3			s a l a							
2828-3			l a							
3572-3			s u							
1095-3			l x x a							
1755-3			e							
1789-3			k a l a ŋ g a							
3207-3			w u l a							
3519-3			r u m a							
3686-3			j m b a							
4249-3			x u x							
4451-3			β s u							
448-3			n u n							
630-3			β i l i i							
1216-3			k a β a ɲ a							
1228-3			b w a a							
1418-3			s x a							
1475-3			k w a							
3397-3			β o l a							
4003-3			j b a							
4040-3			k e n i							
4373-3			l x							
4384-3			n o							
181-3			k o ŋ g o							
419-3			l o k a							
587-3			o ŋ g o							
660-3			l e r a							
1083-3			l i l a							
1350-3			l j a							
1374-3			n a e n a							
1396-3			s o f u							
1666-3			r a n u							
1767-3			x u x u							
1906-3			ŋ k l a							
2177-3			ŋ k a p i							
2286-3			l a							
2317-3			β u β a							
2750-3			i s							
3275-3			x a n a							
3464-3			w o n a							
3639-3			e e m e l a							
3981-3			e x a							
4192-3			β m b a							
4260-3			s w a							
4350-3			l i i l o							
278-3			β a							
745-3			t a x o							
3971-3			x a m a							
93-3			k o n o							
200-3			β i							
374-3			dʒ l w a							
508-3			f o f u							
528-3			β i l i							
1137-3			s x u							
1585-3			a r a							
1712-3			f u l o							
2088-3			f i s a							
2334-3			f i k o							
2393-3			x i a							
2665-3			i ŋ k i							
2738-3			β i l i i							
3675-3			l w e l e							
4137-3			m l a							
4440-3			β i l i							
4574-3			w a l a							
4688-3			w e w e							
2798-3			n w a							
3067-3			u							
3531-3			a n e x a							
3767-3			l o							
4632-3			a s i i							
401-3			tʰ a							
649-3			l e e r a							
755-3			k u l a							
1032-3			k o l o l a							
1043-3			β a l a							
1273-3			l o o r a							
1362-3			k i							
1895-3			a							
2615-3			tʰ a							
2784-3			k u l u							
2904-3			k e n d a							
3385-3			s i							
3430-3			u							
3664-3			β e g a							
3756-3			s i n s a							
24-3			dʒ β x a							
542-3			β i l a u x							
564-3			a k a							
928-3			k o l o							
1181-3			f w a							
1241-3			p u n d a							
1607-3			l i l o							
1929-3			β u s							
2852-3			k u f u							
3198-3			o m a a							
3502-3			i i							
3598-3			β i k a							
3698-3			i x a l a							
3735-3			g l u							
3940-3			β a l a							
2689-4				n a m á						
893-4				á n á						
1285-4				n w á						
3572-4				s ɔ n i						
1755-4				n e						
1789-4				k á s á ŋ g						
3686-4				i m b á						
4451-4				b i s i						
1216-4				g b á f á						
4003-4				i b á						
419-4				ɔ g á						
1122-4				b i n a						
1430-4				i s ɔ						
1666-4				l á n ɔ						
1767-4				k ɔ k ɔ						
55-4				ɲ a m a						
94-4				b ɔ k ɔ						
2717-4				ŋ g a						
1339-4				t w i i						
4632-4				k á s i						
2784-4				g o l o						
3160-4				s o dʒ a						
675-4				dʒ e ŋ g a						
860-4				b i ŋ g a						
1151-4				s i						
1631-4				k u n i						
2057-4				t i m a						
2689-5					ɲ a m a					
893-5					a n a tʃ e					
1285-5					ɲ w					
1303-5					n m a					
2197-5					t a l a					
2828-5					l u n a					
3572-5					s oː n u					
1095-5					l i m a					
3207-5					p u l a					
3519-5					t u m a					
3686-5					s e m β					
4249-5					k u m u					
448-5					n u n i					
630-5					β e l e					
814-5					n m β e					
1228-5					β w					
1418-5					s i m a s j a					
2026-5					t w e					
2775-5					β u p β a					
3397-5					β o l o					
3826-5					s oː k					
4040-5					g e n u					
4373-5					d i m i					
4384-5					i n o					
84-5					s u l u l u					
116-5					f i k a					
587-5					o n g o					
848-5					k l a					
1159-5					n a					
1350-5					l j					
1396-5					tʃ oː f u					
1430-5					s u					
1767-5					k o k o					
2286-5					l a					
2317-5					β u p a					
2419-5					s e k a					
2750-5					e ʃ i					
3018-5					t i l a					
3275-5					k a n a					
3441-5					s a n g a					
3885-5					tʃ u m u					
4192-5					β ìì m β a					
4260-5					s w					
4350-5					l e l o o					
278-5					β a					
745-5					t k o					
3971-5					k a m a					
55-5					n a m a					
94-5					β o k o					
2717-5					g a ŋ g a					
4139-5					m u n a					
200-5					β i					
374-5					a w l w a					
508-5					β o p u					
528-5					β i l i					
575-5					t a					
1137-5					ʃ u k u					
1339-5					t w e u					
1872-5					p a					
2537-5					l oː m oː					
2738-5					β e l e					
2872-5					k oː ʃ i					
2893-5					s u k u					
3675-5					l w l e					
4028-5					w e					
4238-5					i ʃ o ʃ i					
4429-5					β a					
4485-5					s u					
2798-5					n w					
3531-5					a n e k a					
3767-5					l o					
4632-5					k ʃ i					
1033-5					k o s o l o					
3185-5					f i k					
649-5					l e e t					
1110-5					t e m					
1263-5					t h					
1273-5					l oː oː l					
1329-5					k a l					
1617-5					d k oː					
1917-5					f u m					
1969-5					m					
2483-5					g l u					
2615-5					d					
2700-5					g a n g a					
2884-5					m p j a					
2972-5					s e					
3030-5					l p					
3261-5					t e l e					
3419-5					t e					
3664-5					β e g					
3706-5					t a n t u					
3865-5					s s e					
4406-5					t i					
4530-5					l u k					
4552-5					n s i					
24-5					l u k a					
542-5					β u l a					
1181-5					f w a					
1241-5					p u n					
1607-5					l u l o					
1929-5					β u ʃ i					
3598-5					β e g					
3698-5					i k l					
3735-5					k u l u					
3940-5					f á l a					
1631-5					k u n u					
2057-5					t i m a					
552-5					w u p a					
959-5					f e f o					
1318-5					k u ŋ g u					
1411-5					β i					
1495-5					w u t a					
1578-5					l w a					
1303-6						ŋ ɔ m a				
1755-6						ɲ e				
448-6						ɲ u ɲ i ɲ				
1475-6						g w a				
3397-6						p ɔ l ɔ				
2286-6						l ɔ				
278-6						f				
2717-6						ŋ g a ŋ g a				
4137-6						m i l a				
3767-6						l ɔ				
1033-6						k ɔ s ɔ l ɔ				
2689-7							ɲ a m a			
893-7							a ɲ a			
1285-7							ɲ w a			
1303-7							ŋ o m a			
2197-7							dʒ a r a			
2828-7							z ɲ a			
3572-7							z o ŋ i			
1095-7							u m a			
1755-7							ɲ e			
1789-7							k u a ŋ g a			
3519-7							t u m a			
3686-7							i m b a			
4249-7							k u m i			
4451-7							v i s i			
814-7							ŋ o m b e			
1216-7							k a v a ɲ a			
1475-7							g w o			
2026-7							t w e			
2775-7							v u m v a			
3826-7							z o k a			
4003-7							i v a			
4040-7							ɣ e ŋ i			
84-7							s u u			
116-7							v i k a			
181-7							ɣ o ŋ g o			
419-7							o k a			
587-7							o ŋ g o			
660-7							e r a			
848-7							k a r a			
1122-7							v i ɲ a			
1159-7							ɲ a			
1374-7							s a n e			
1396-7							z o v u			
1430-7							i tʃ o			
1906-7							ŋ ɣ a			
2177-7							ŋ ɣ u			
2419-7							z e k a			
3018-7							z i a			
3275-7							k a ŋ a ŋ			
3441-7							s e ŋ g a			
3464-7							v o ɲ a			
3639-7							t e d e m a			
3885-7							tʃ u m o			
4192-7							v i m b a			
745-7							t u k o			
3971-7							k a m a			
55-7							ɲ a m a			
2717-7							ŋ k a ŋ k a			
4139-7							m e ŋ a			
93-7							g o o			
459-7							u m a			
575-7							t a			
1712-7							f u o			
2088-7							v i z a			
2166-7							ɲ u m b a			
2334-7							f i ɣ o			
2393-7							m e ɲ a			
2537-7							o m o			
2665-7							i ŋ ɣ i			
2997-7							k a z a			
4028-7							w e			
4316-7							t a t u			
4429-7							v a z a			
4688-7							w e w e			
3067-7							n u			
3185-7							v i d a			
794-7							v i e k a			
143-7							v u			
388-7							p ɲ u m a			
599-7							t a m b i			
836-7							tʃ u m b i			
969-7							i s a			
1110-7							t e m a			
1263-7							t a h a			
1329-7							i k a r a			
1362-7							ɣ i			
1606-7							o o t o			
1629-7							k v i			
1744-7							i v a			
1917-7							v u m a			
1989-7							z a ɣ a			
2037-7							ɣ a t a			
2128-7							ɣ e e m b e			
2186-7							ɣ a ɲ a			
2700-7							ɣ a ŋ g a			
2797-7							o m o			
2904-7							g e e ɲ dʒ a			
2972-7							z e			
3148-7							i t a			
3364-7							o t a			
3419-7							t e			
3430-7							ɲ u			
3583-7							o o a			
3706-7							t a ŋ dʒ a			
3756-7							s ìì ɲ dʒ a			
3837-7							k o m a			
4406-7							t i			
4621-7							a ɲ i			
564-7							a ɣ m a			
928-7							k o o			
1181-7							v w a			
1241-7							p u ŋ d a			
2852-7							k o v u			
3198-7							o m á n a			
3502-7							ŋ e n e			
675-7							t u ŋ k a			
1151-7							z i			
959-7							h e p o			
1411-7							v i			
1495-7							v u t a			
2689-8								n a m a		
1285-8								n w a		
1303-8								g m a		
2197-8								ʝ a r a		
2828-8								ʝ i n a		
3572-8								ʝ ô n		
1755-8								n e		
1789-8								ŋ a r a ŋ g a		
3207-8								w u r a		
3519-8								t u m a		
3686-8								j m b a		
4249-8								k u m i		
4451-8								v i t i		
814-8								g m b e		
1228-8								b w a		
2026-8								t w e		
2775-8								β u m b a		
3826-8								ʝ ô k a		
4040-8								k e n		
181-8								k o ŋ g o		
660-8								r e r a		
848-8								k á r a		
1083-8								r i r a		
1159-8								n a		
1350-8								r j a		
1396-8								ʝ o v u		
1666-8								t a n ô		
2177-8								ŋ g a		
2317-8								p u p a		
4260-8								ʝ w a		
745-8								t á k r		
3971-8								k a m a		
94-8								v o g o		
2717-8								g a ŋ g a		
4139-8								m e n a		
43-8								ʝ i m u		
575-8								t a		
871-8								d a m a		
1339-8								t w e		
1585-8								a r a		
1872-8								p a		
2893-8								ʝ i k u		
4028-8								β w e		
4316-8								t a t u		
4440-8								β r i		
4485-8								ʃ u		
4688-8								w e ŋ w e		
2798-8								n w a		
794-8								v e r e k a		
994-8								t e r k a		
1006-8								n u ŋ k i		
1043-8								β a r a		
1617-8								ʝ k ô		
1969-8								m a m a		
3364-8								t a		
4530-8								r u k a		
928-8								k o r o		
2852-8								k o v u		
675-8								d e ŋ g a		
860-8								v i ŋ g a		
1631-8								ŋ u ɲ a		
552-8								f u p a		
1318-8								k u ŋ g i		
1578-8								r w a		
2689-9									ɲ a m a	
893-9									a n a	
1285-9									ɲ w a	
1303-9									g a m a	
2197-9									s a l a	
2828-9									l i n a	
3572-9									s a n i	
1095-9									l i m a	
1789-9									g a l a ŋ g a	
3207-9									p ʊ l a	
4249-9									g ʊ m i	
4451-9									o ʊ s ʊ	
630-9									b i l e	
814-9									ŋ a m b i	
1228-9									b w a	
1418-9									s i m a	
1475-9									g w a	
2026-9									r w i e	
2775-9									b ʊ m b a	
3397-9									b o l a	
3826-9									dʒ a g a	
4003-9									i o b a	
4040-9									g e nː ʊ	
4373-9									l i m i	
4384-9									i nː g	
116-9									f i g a	
181-9									g a ŋ g g g	
1083-9									l ʊ l a	
1374-9									s a nː	
1430-9									i s a	
1666-9									r a a ʊ o	
1767-9									k ʊ k ʊ	
1906-9									ŋ g i l a	
2177-9									ŋ g a b ʊ	
2419-9									s i g a	
2750-9									i s i	
3018-9									z i l a	
3441-9									s á ŋ g a	
3885-9									r ʊ m a	
3981-9									i m a	
4260-9									s w a	
4350-9									l i e l o	
278-9									b a	
745-9									s a g a	
55-9									ɲ a m a	
94-9									b g k g	
4139-9									m ʊ n a	
200-9									b i	
528-9									b i l i	
871-9									r a m a	
2088-9									b i s a	
2166-9									ʊ m b a	
2334-9									v i g a	
2393-9									a ɲ a	
2537-9									l a m a	
2665-9									i ŋ g i	
2738-9									b e e l e	
2872-9									k o s i	
2997-9									g a s a	
3075-9									g u l u b i	
4238-9									s s i	
4429-9									b a s a	
4440-9									b ʊ l ʊ	
4485-9									s ʊ	
4574-9									s w á l a	
2798-9									n w a	
3067-9									n s ʊ	
3767-9									l o	
4632-9									k á s i	
1033-9									g o s l o	
3185-9									b i g a	
240-9									g a	
401-9									d a	
755-9									g u l a	
836-9									r u m b i	
1006-9									ɲ ʊ ŋ g ʊ	
1744-9									i b a	
1989-9									s a g a	
2037-9									g a r a	
2128-9									g e m b e	
2186-9									g a nː a	
2483-9									g l ʊ	
2592-9									l o l a	
3030-9									l i a	
3160-9									l ʊ r a	
3385-9									s i	
3865-9									s á s i	
4552-9									i nː s i	
564-9									h a m a	
3502-9									i ɲ e	
3598-9									b i g a	
3698-9									i g m a l a	
3735-9									g l ʊ	
1151-9									s a	
1318-9									k ʊ ŋ g ʊ	
1411-9									v i	
2689-10										ɲ a m a
893-10										a n̩ a
1285-10										ɲ w a
2197-10										d a l a
2828-10										d i n̩ a
1095-10										l i m a
1755-10										n̩ ɛ
3207-10										w ʊ l a
3519-10										r u m a
448-10										j ʊ n i
630-10										ʊ ɛ l ɛ
1216-10										χ a ʊ a ɲ a
1418-10										d i m a s j a
2775-10										ʊ ʊ m b a
3397-10										ʊ o l a
4373-10										l i m i
4384-10										i n o
84-10										s ʊ l ʊ l ʊ
1083-10										l i l a
1122-10										pʰ i ɲ a
2286-10										l a
2317-10										f ʊ f a
3018-10										d i l a
3275-10										k a á n̩ a
3464-10										w ɔ n̩ a
3639-10										r e r ɛ m a
3885-10										dʒ ʊ m ɔ
3981-10										i m a
94-10										β a qʰ a
4139-10										m i n a
43-10										d i m u
374-10										l w a
459-10										l u m a
508-10										f o f ʊ
871-10										r a m a
1712-10										f ʊ l ɔ
2893-10										d i qʰ ʊ
3075-10										χ u l ʊ pʰ ɛ
3531-10										a n̩ i qʰ a
794-10										b e k a k a
1032-10										tsʰ o l o l a
2797-10										l ɔ m ɔ
24-10										tʰ ʊ qʰ a
542-10										ʊ i l a ʊ qʰ
1607-10										l i l o
3198-10										l ɔ m a n̩ a
1578-10										l w a
