COGID	ChorbatBalti	KhapaluBalti	KharmangBalti	RonduBalti	ShigarBalti	SkarduBalti	SkarduPurki
980	kʰ ɜ p	kʰ ɜ p	kʰ ɜ p	kʰ ɜ p	kʰ ɜ p	kʰ ɜ p	
400			b ɜ l ɜ ŋ			b ɜ l ɜ ŋ	
1627	tɕ ʊ ŋ m ɜ	tɕ ʊ ŋ m ɜ					
1676	kʰʲ ɑ ŋ	kʰʲ ɑ ŋ	kʰʲ ɜ ŋ	kʰʲ ɑ ŋ	kʰʲ ɑ ŋ	kʰʲ ɑ ŋ	
888				ɕ ɛ r̪ i		ɕ ɛ r̪ i	
33	p o t̪ ʊ k s̪		t̪ ʊ k s̪		t̪ ʊ k s̪		
213	t̪ʰ ɜ l tθ ɪ ɾ	t̪ʰ ɜ l tθ i ɾ		t̪ʰ ɜ l tɕ ɪ t̪	t̪ʰ ɜ l tɕ ɪ t̪	t̪ʰ ɜ l tɕ ɪ t̪	
564	ɾ ɑ						ɾ ɑ
1371	d̪ o	d̪ o	d̪ o	d̪ o	d̪ o	d̪ o	
128	d̪ r̪ u l s̪	d̪ r̪ u l s̪	d̪ r̪ u l s̪	d̪ r̪ u l s̪	d̪ r̪ u l s̪	d̪ r̪ u l s̪	d̪ r̪ u l s̪
330	g o b i	g o b i	g o b i				g o b i
34		s̪ t̪ r̪ ɜ k s̪		s̪ t̪ r̪ ɜ k s̪		s̪ t̪ r̪ ɜ k s̪	
481		b ɛ ŋ g ɜ n̪	b ɛ ŋ g ɜ n̪		b ɛ ŋ g ɜ n̪		
1626		n̪ ɜ m ɑ					n̪ ɑ m ɑ
566			ɾ ɜ b ɜ q	ɾ ɜ b ɜ q	ɾ ɜ b ɜ q	ɾ ɜ b ɜ q	
988	s̪ o ŋ ɑ		s̪ o m ɑ				s̪ o m ɑ
1520	g ʊ r̪ o ŋ	g r̪ o ŋ	g ʊ r̪ o ŋ			g ʊ r̪ o ŋ	
781		ɖʐ i		ʐ i	ɖʐ i	ɖʐ i	
1379	d̪ʲ u n̪	d̪ʲ u n̪		d̪ʲ u ŋ	d̪ʲ u	d̪ʲ u ŋ	d̪ʲ u
1668	j ɑ ŋ	j ɑ ŋ	j ɑ ŋ	j ɑ ŋ	j ɑ ŋ	j ɑ ŋ	j ɑ ŋ
1239	m o	m o	m o	m o	m o	m o	
1553	ʑ ɜ k ʊ r̪ d u n̪						ʊ ɾ d u n̪
1578		ʈʂ o		ʈʂ o	ʈʂ o	ʈʂ o	
88	ɾ gʲ u k s̪	b gʲ u k s̪	β gʲ ʊ k s̪	b gʲ u k s̪	β gʲ u k s̪	b gʲ u k s̪	
172		t̪ʲ o k		t̪ o k		t̪ o k	
399	b ɑ				b ɜ	b ɜ	
496	kʰ r̪ i õ ŋ	t̪ʰ r̪ i m o ŋ		ʈʂ ɪ m o k	t̪ʰ r̪ ɪ m o ŋ	t̪ʰ r̪ ɪ m o ŋ	
80	p r̪ ɛ t̪ l ɑ	p r̪ ɛ l ɑ			p r̪ ɛ l ɑ		
887	ɕ ɛ d i	ɕ ɛ d i	ɕ ɜ d i		ɕ ɛ d i	ɕ ɛ d i	ɕ ɑ d i
144	pʰ u ɾ s̪	pʰ u ɾ s̪	pʰ u ɾ s̪	pʰ u ɾ s̪	pʰ u ɾ s̪	pʰ u ɾ s̪	pʰ u ɾ s̪
456					t̪ʰ ɜ l p ʊ ʈ	t̪ʰ ɜ l p ʊ ʈ	
1105	l̪ ʈ ɜ n̪ ʊ s̪ i	l̪ t̪ ɜ n̪ u s̪		l̪ t̪ ɜ n̪ u s̪ e	l̪ t̪ ɜ n̪ u s̪ i	l̪ t̪ ɜ n̪ u s̪	l̪ t̪ ɜ n̪ u s̪
1348		ʑ ɪ n̪ d o	ʑ ɪ g d o	dʑ i n̪ d o	ʑ ɪ n̪ d o	ʑ ɪ n̪ d o	
1057	ɜ ɕ e	ɑ ɕ e	ɜ ɕ e	ɑ ɕ e	ɜ ɕ ɛ	ɜ ɕ e	
797		x ɛ n̪	xʲ ʊ n̪	xʲ u n̪	x ɛ n̪	xʲ ʊ n̪	
197	k ɪ m b o q	k i ŋ b o q					
329	b ɜ n̪ d	b ɜ n̪ d	b ɜ n̪ d				b ɜ n̪ d
1397	d̪ʲ u	d̪ʲ u		d̪ʲ u	d̪ʲ u	d̪ʲ u	d̪ʲ u
1684	kʰ i t̪ ɜ ŋ	kʰ i d ɜ ŋ	kʰ ɪ t̪ ɜ ŋ	kʰ i d ɜ ŋ	kʰ i t̪ ɜ ŋ	kʰ i t̪ ɜ ŋ	
1135	ɾ z̪ ɜ	ɣ z̪ ɜ	ɣ z̪ ɜ				
455	t̪ʰ ɜ l d u m	t̪ʰ ɜ l d u m	t̪ʰ ɜ l d u m	t̪ʰ ɜ l d u m	t̪ʰ ɜ l d u m		t̪ʰ ɜ l d u m
685	ɾ ɑ l	ɾ ɑ l	ɾ ɑ l	ɾ ɑ l	ɾ ɑ l	ɾ ɑ l	
482				p ɑ ɣ ɜ n̪		p ɑ ɣ ɜ n̪	
1554		h ɜ f t̪ ɑ	h ɜ f t̪ ɑ	h ɜ f t̪ ɜ		h ɜ f t̪ ɜ	
163	ŋ ɑ	ŋ ɑ	ŋ ɑ	ŋ ɑ	ŋ ɑ	ŋ ɜ	ŋ ɑ
65	k o s̪	k o s̪	k o s̪	k o s̪	k o s̪	k o s̪	k o s̪
1701		s̪ t̪ r̪ i ŋ m o	s̪ t̪ r̪ i ŋ m o	s̪ t̪ r̪ i ŋ m o	s̪ t̪ r̪ i ŋ m o	s̪ t̪ r̪ i ŋ m o	
374	r̪ ɜ s̪	ɾ ɜ s̪	ɾ ɜ s̪			ɾ ɜ s̪	ɾ ɜ s̪
853		ɪ ɕ ɪ n̪	ɪ ɕ ɪ n̪	ɜ ɕ i n̪	i ɕ ɪ n̪	i ɕ ɪ n̪	
1380			d̪ i		d̪ i	d̪ i	
279		ʊ ɾ g o	ʊ ɾ g o	ɾ g o	ʊ ɾ g o	ɾ g o	ʊ ɾ g o
73	ɾ d ɜ p s̪	ɾ d ɜ p s̪	ɾ d ɜ p s̪		ɾ d ɜ p s̪	ɾ d ɜ p s̪	ɾ d ɜ p s̪
573		s̪ ɛ n̪ m ɜ	s̪ ɛ n̪ m o	s̪ ɛ n̪ m o	s̪ ɛ n̪ m o	s̪ ɛ n̪ m o	
643			pʰ ɜ x m u l	pʰ ɜ x m u l	pʰ l ɜ x m u l	pʰ ɜ x m ʊ l	
1405	ɾ i ŋ ɑ	ɾ i ŋ ɑ				ɾ i ŋ ɑ	
1577	k r̪ o		k r̪ o				k r̪ o
1339	ȵ i m ɑ	ȵ i m ɑ	ȵ i m ɑ	ȵ i m ɑ		ȵ i m ɑ	ȵ i m ɑ
120	z̪ ɛ ɾ s̪	z̪ ɛ ɾ s̪	z̪ ɛ ɾ s̪	z̪ ɛ ɾ s̪	z̪ ɛ ɾ s̪	z̪ ɛ ɾ s̪	z̪ ɛ ɾ s̪
153				kʰ ɜ k t̪ ɜ t̪ s̪	kʰ ɑ k t̪ ɜ t̪ s̪	kʰ ɜ k t̪ ɜ t̪ s̪	
96	d̪ u k s̪	d̪ u k s̪	d̪ u k s̪	d̪ u k s̪	d̪ u k s̪	d̪ u k s̪	d̪ u k s̪
584		z̪ ɛ r̪ m õ ŋ		z̪ ɛ r̪ m o ŋ	z̪ ɛ r̪ m õ ŋ	z̪ ɛ r̪ m õ ŋ	s̪ ɛ r̪ m õ
1184		h ɜ n̪ d o q	h ɜ n̪ d o q	h ɜ n̪ d o q	h ɜ n̪ d o q	h ɜ n̪ d o q	h ɑ n̪ d o q
1364		ɸ tɕ u	ɸ tɕ u	ɸ tɕ u	ɸ tɕ u	p ɕ tɕ u	
1625	z̪ ɜ n̪ z̪ ʊ s̪	z̪ ɜ n̪ z̪ ʊ s̪	z̪ ɜ n̪ z̪ u s̪	z̪ ɜ n̪ z̪ ʊ s̪	z̪ ɜ n̪ z̪ ʊ s̪	z̪ ɜ n̪ z̪ ʊ s̪	
947				kʰ ɜ p ɜ k	kʰ ɑ b ɜ k	kʰ ɑ b ɜ k	
1159	t̪ r̪ ɜ ŋ		t̪ r̪ ɜ ŋ	t̪ r̪ ɜ ŋ	t̪ r̪ ɜ ŋ	t̪ r̪ ɜ ŋ	ʈ ɑ ŋ
199				ʈʂ ɪ m o q	ʈʂ ɪ m o q	ʈʂ ɪ m o q	
104	t̪ʰ o ŋ s̪	t̪ʰ õ s̪	t̪ʰ o ŋ s̪	t̪ʰ o ŋ	t̪ʰ o ŋ	t̪ʰ o ŋ s̪	
572	dz̪ o g u		z̪ o g u				z̪ ɪ g u
174				j ɑ ɾ	j ɑ ɾ	j ɜ ɾ	
1389	kʰ o ŋ	kʰ o ŋ	kʰ o ŋ	kʰ o ŋ	kʰ o ŋ	kʰ o ŋ	kʰ o ŋ
618	ɣ ɑ	ɣ ɑ	ɣ ɑ	ɣ ɑ	ɜ ɣ ɑ	ɣ ɑ	
1136				p ɜ r̪ ɜ k z̪ ɜ	p ɜ ɽ ɑ ɣ z̪ ɑ	pʰ ɜ ɽ ɜ k z̪ ɜ	p ɑ r̪ ɑ z̪ β̞ ɑ
375			k ɜ p ɽ ɑ	k ɜ p ɽ ɜ			
82				ɾ ɪ l s̪		ɾ ɪ l s̪	
897					l z̪ ɑ	l z̪ ɑ	
343				k ɜ ɽ ɜ m	k ɜ ɽ ɜ m	k ɜ ɽ ɜ m	
1537	ŋ ɑ j ɑ	ŋ ɑ j ɑ	ŋ ɑ j ɑ	ŋ ɑ j ɑ	ŋ ɑ j ɑ	ŋ ɑ j ɑ	
726	l̪ tɕʰ o	l̪ tɕʰ o	l̪ tɕʰ o	l̪ tɕʰ o	l̪ tɕʰ o	l̪ tɕʰ o	
229	tɕ ɜ ŋ m ɛ n̪	tɕ ɜ ŋ m ɛ n̪	tɕ ɑ ŋ m ɛ n̪	tɕʲ ɑ ŋ m ɛ n̪	tɕ ɑ ŋ m ɛ n̪	tɕ ɑ ŋ m ɛ n̪	
946	kʰ ɑ	kʰ ɑ	kʰ ɑ				kʰ ɑ
1456	h ɜ s̪ k e	h ɜ s̪ k e	h ɜ s̪ k e	h ɜ s̪ k e	h ɜ s̪ k e	h ɜ s̪ k e	
921	l̪ ʈ ɜ n̪ ʊ s̪	l̪ t̪ ɜ n̪ u s̪	l̪ ʈ ɜ n̪ ʊ s̪	l̪ t̪ ɜ n̪ u s̪	l̪ t̪ ɜ n̪ ʊ s̪	l̪ t̪ ɜ n̪ u s̪	
939		ɑ ŋ o	ɜ m o	ɑ ŋ o	ɑ ŋ o	ɑ ŋ o	
855	l̪ t̪ i m	l̪ ʈ i m					
328	k ɜ ɽ ɜ m		k ɜ ɽ ɜ m	k ɜ ɽ ɜ m	k ɜ ɽ ɜ m	k ɜ ɽ ɜ m	
701	kʰ o	kʰ o	kʰ o	kʰ o	kʰ o	kʰ o	kʰ o
1700	n̪ o ŋ o					n̪ o ŋ o	n̪ õ ŋ o
136	s̪ o ŋ s̪	s̪ õ s̪	s̪ o ŋ	s̪ o ŋ	s̪ õ s̪	s̪ o ŋ s̪	s̪ o ŋ
473	b i ɜ p ʑ ʊ n̪	b i ɜ m ʑ ʊ n̪	b i ɜ p ʑ ʊ n̪	b i ɜ p dʑ ʊ n̪	b i ɜ p ʑ ʊ n̪	b i ɜ p ʑ ʊ n̪	
154		s̪ ʊ t̪ ʊ p s̪				s̪ o t̪ ɜ p s̪	t̪ʰ ɜ m p s̪
1602			g ɜo	g ɜo			
956			tɕʰ ɪ n̪			tɕʰ ɪ n̪	
742	tθʰ o	tθʰ o	tθʰ o	tθʰ o	tθʰ o	tθʰ o	
214			t̪ʰ ɜ l b ɜ				t̪ʰ ɜ l b ɜ
938	ɜ ŋ ɑ						ɜ m ɑ
642	m e β̞ ɑ	m e β̞ ɑ	m e β̞ ɑ	m e β̞ ɑ		m e β̞ ɑ	
311	tɕʰ ɜ x s̪				tɕʰ ɜ x s̪		
358	pʰ r̪ u	pʰ r̪ u	pʰ r̪ u		p l̥ u	p l̥ u	pʰ r̪ u
