COGID	Bankan_Tey	Ben_Tey	Bunoge	Jamsay	Mombo	Najamba	Nanga	Penange	Perge_Tegu	Tebul_Ure	Tiranige_Diga	Togo_Kan	Tommo_So	Toro_Tegu	Yanda_Dom	Yorno_So
4066-9									k aː aː aː							
4888-9									l i a ɔ ɛ o							
5180-9									j aː i dʒ aː							
5583-9									d oː ɔ dʒ oː							
5981-9									aː aː aː							
25-9									b aː l ɛ ɛ aː r̃ aː							
114-9									t ɔ r oː							
702-9									ɔ g ɔ o i r̃ o							
851-9									g aː							
872-9									aː aː dʒ aː							
952-9									k aː aː u aː							
1941-9									k oː r oː							
2442-9									n i w̃ ɔ							
3448-9									b i n dʒ aː							
3497-9									d ɔ aː aː							
3588-9									k aː r oː							
4101-9									aː aː aː							
4202-9									k i i i ɛ							
4293-9									w ɔ oː ɔ							
4520-9									l aː aː							
4609-9									k aː aː u u g aː							
4740-9									k aː aː aː							
4921-9									n i u b g i							
5982-9									n aː ŋ dʒ aː							
978-9									p aː r ɔ							
1052-9									l aː o dʒ ɛ							
1070-9									o ɔː o							
1942-9									ɛ r							
1989-9									aː aː aː aː							
2145-9									dʒ aː n							
2306-9									oː aː dʒ a							
2456-9									s aː r aː							
2514-9									d ɔː r ɔː							
2666-9									i i w u							
3132-9									t ɔ ɔ g u							
3300-9									oː oː oː							
3774-9									s aː aː aː							
3976-9									ɔː dʒ r aː							
4039-9									b aː j e							
4152-9									k i r ɔ							
4260-9									i i dʒ aː							
4278-9									g aː a dʒ a							
4361-9									d aː g aː							
4570-9									t aː l u							
5673-9									d aː i dʒ aː							
5752-9									b aː							
66-9									n i							
521-9									s o g o							
685-9									s aː aː aː							
744-9									i aː w̃ aː							
1108-9									p j ɔː ɔː							
1745-9									d aː aː o							
2066-9									a aː n dʒ aː							
2216-9									aː aː r j							
2265-9									aː aː aː							
2392-9									o t ɔː r ɔː							
2902-9									a a							
2958-9									a aː w̃							
3197-9									b aː							
3943-9									p i ŋ u							
4219-9									dʒ aː a dʒ a							
4337-9									j o i b ɔ							
5197-9									aː r aː							
5531-9									t aː r aː							
5733-9									r aː							
348-9									k iː iː							
409-9									l aː aː aː							
562-9									r o r r ɛ							
1022-9									p aː r a							
1170-9									d iː n dʒ i							
1238-9									a n a							
1578-9									ɔ ɔ ɔ g							
1612-9									n a a dʒ a							
2288-9									aː l aː							
2334-9									o r o							
2396-9									n iː							
2759-9									a aː							
2978-9									g i w̃ ɔ							
3088-9									k i r e							
3252-9									i i b ɔ							
3287-9									p a a a							
3407-9									aː aː							
3790-9									d ɔ w							
4052-9									b i d ɔ							
4220-9									k aː							
4383-9									k i r e							
4440-9									t aː							
4651-9									d aː w̃ e							
4711-9									o e r u							
4778-9									n i u ɛ w ɔ							
4821-9									t oː							
5228-9									b i n dʒ i							
5272-9									t aː g a							
5319-9									k i r e							
5375-9									l i n u g a							
5465-9									l aː aː o							
5497-9									aː aː							
5641-9									l aː aː							
5692-9									aː l aː							
5715-9									i r a							
389-9									r aː							
448-9									n aː j							
563-9									d e m ɔ							
613-9									w ɔː							
787-9									n aː a a							
915-9									aː							
1126-9									n i							
1208-9									d a w̃ a							
1502-9									d ɛː n u							
1669-9									b i m dʒ i r̃ e							
1969-9									l u g ɛ ɛ ɛ							
1971-9									dʒ a g a r̃ a							
2030-9									s u j̃ ɛ							
2354-9									d aː r aː							
2500-9									a aː							
3011-9									d i i dʒ o u							
3159-9									a a a							
3199-9									d i r u ɔ							
3319-9									d aː n i							
715-10										d u l aː						
1089-10										aː aː i i						
1319-10										aː o m aː						
1398-10										i u g aː u g o						
1557-10										d u aː aː						
1626-10										aː aː o						
1840-10										d aː aː o						
2247-10										g o						
4677-10										d u aː u o ɔː						
5162-10										aː aː l aː aː						
5406-10										d aː aː l aː						
359-10										d aː aː i						
1577-10										d aː aː aː						
2230-10										i o j o						
2533-10										d o o g o						
3605-10										g i o d i						
3866-10										d u j aː						
4822-10										d o o g o						
5254-10										d aː aː oː						
503-10										d o o o j̃						
1356-10										i o j ãː						
1881-10										aː aː aː ɛ e						
2084-10										o o l o						
2420-10										g u o u						
3218-10										d u d ɔː ɛ						
3372-10										aː aː aː aː						
4135-10										d i o i j̃						
4694-10										d aː i u g i						
807-10										g o o g i						
2320-10										g ɛ ɛ aː						
2476-10										d aː g o						
2842-10										d o l o						
3719-10										aː aː						
4081-10										d i i n l o						
4313-10										o o o u ɛ						
4460-10										aː aː o ɛ						
5514-10										o o i d o						
5810-10										g i n o o						
93-10										g i						
260-10										d i n aː						
385-10										j i i b i						
890-10										t aː aː d aː aː aː						
1336-10										d o o						
1703-10										g aː l						
1769-10										t ɛ i b ɛ						
2162-10										p u aː aː						
2635-10										j aː						
2735-10										d aː aː d ɔː ɛ aː						
3031-10										t i g o						
4591-10										d i aː i						
5301-10										p ɛ i i						
5605-10										t i o o j̃						
63-10										g o o o						
296-10										a i i g i						
463-10										d aː aː g aː						
762-10										t o o a u g u g						
1432-10										t i aː i						
1474-10										t i n g i						
2044-10										d i o b i						
2713-10										t u i b ɛ d u aː aː						
3219-10										t a ɛ						
3425-10										o o						
4120-10										g o o oː						
4423-10										d o o o						
4629-10										j u i aː						
4759-10										o i ɔː aː aː						
4904-10										u u u g u						
4960-10										d i ɛ i ɛ						
4980-10										t o g aː						
5059-10										d aː ɛ aː						
5125-10										t o o d u						
5339-10										m o g o						
5549-10										d i i g aː						
5905-10										t i aː o						
5922-10										p aː aː ɛ						
5938-10										d u l u u u l o						
1-10										z aː						
483-10										g o n o						
629-10										g o g iː						
667-10										ɛ ɛ ɛ						
1254-10										t o a d o o o						
1415-10										i m o						
1542-10										o o aː						
1683-10										ɛ aː o o						
1898-10										d aː l ɛ i						
2551-10										ɛ ɛ						
2901-10										t aː i g ɛ						
2957-10										aː aː aː d aː						
3048-10										d aː ɛ ɛ						
3251-10										j o aː ɛ						
3885-10										t o a o						
4402-10										aː aː						
5622-10										g ɛ aː i i i						
43-10										a a r						
135-10										d i ɛ d aː						
221-10										ɛ ɛ aː						
1152-10										d aː aː o						
1374-10										d o o g o						
1452-10										g aː aː aː						
1789-10										o o o u						
1862-10										aː ɛ aː						
2636-10										ɛ g						
2880-10										d aː i d u g aː						
2924-10										m i o i						
3113-10										t i g ɛ						
3136-10										ɛ aː ɛ ɛ						
3572-10										tʃ a aː aː						
3751-10										g aː o						
3811-10										o o						
3959-10										t i a i						
4066-10										d aː aː oː						
4535-10										i aː o						
5180-10										a o i b a						
5583-10										t aː aː g aː						
5981-10										o ɛ aː ɛ						
25-10										t a i iː ɛ i g e						
114-10										d aː j o						
702-10										o t ɛ ɛ i i						
851-10										d ɛ g g						
872-10										o ɛ d a						
2179-10										aː d aː						
2351-10										d i m i						
2442-10										o o o o						
2496-10										aː aː aː						
3448-10										t a m ɛ						
3482-10										j i u i u u g ɛ						
3497-10										m̩ i j aː						
4101-10										a a a e						
4293-10										z ɛ j ɛ						
4520-10										t a g a						
4609-10										t o i a n g o a						
5982-10										g o n o						
196-10										o aː aː						
526-10										t i aː n g i						
931-10										t i i ɛː						
2306-10										a a b a						
2514-10										tʃ j r aː						
2666-10										ɛ ɛ ɛ						
2817-10										ɛ ɛ g ɛ						
3015-10										i i i g o						
3132-10										d o o g o						
3774-10										t ɔ ɔ a						
3905-10										aː aː g						
4334-10										u u i						
4570-10										t ɔ r iː o						
5200-10										iː iː iː						
5318-10										d o ɛ oː						
5532-10										d u l u						
5752-10										g i						
5866-10										m ɛ n n ɛ ɛ						
5887-10										ɛ aː j̃ i						
66-10										g a						
432-10										g o aː e						
685-10										g o n a						
744-10										a ɔ r a						
1124-10										i i ɔː g i						
1237-10										d a ŋ dʒ aː						
1646-10										ɛ g i						
1823-10										ɛ ɛ						
2143-10										aː						
2216-10										a a j̃						
3197-10										gʷ ãː						
3812-10										ɲ ɛ ɛ g ɛ						
3943-10										g u l o						
4024-10										z i j ɛ						
4259-10										g aː aː aː						
4738-10										d ɛ ɛ d i						
5447-10										aː ɛ						
5828-10										aː aː i aː						
5868-10										m i g iː						
245-10										t i i i						
285-10										o o						
998-10										ɛ ɛ						
1172-10										g ɔ l aː						
1578-10										n a ŋ g g						
1668-10										o o u						
2063-10										ɛ ɛ ɛ						
2288-10										ɔ ɔ a						
2978-10										tʃ a j a						
3252-10										m̩ m g ɛ ɔ						
3551-10										t ɛ n ɛː						
3683-10										tʃ u j̃ j̃						
4052-10										t aː g i						
4440-10										g j j̃						
5229-10										g a n dʒ e						
5391-10										g ɔː						
5423-10										ɔ j̃ ɔ						
178-10										d ãː ŋ g u l l						
347-10										tʃ u o o						
568-10										n i ŋ d e g ɛ						
569-10										n i ŋ d e g e						
1204-10										d ɛ ɛ i						
1923-10										g ɛ ɛ						
2109-10										d ɛ d ɛ ɛ						
2268-10										o o o						
2338-10										z i j i						
2619-10										tʃ j j o						
2773-10										d ɛ ɛ ɛ r ɔ						
2999-10										d ɛ ɛ						
3176-10										d ɛ ɛ i						
3199-10										ɛ ɛ ɛ ɛ						
3283-10										ɛ ɛ i						
715-11											d a r ɔː					
1089-11											eː a n a					
1319-11											eː eː m o					
1398-11											j eː r a a a					
1557-11											j a a a					
1626-11											eː a j a					
1840-11											t a a a					
2247-11											g a n					
4677-11											t a a a a o					
5162-11											a eː n a a					
5406-11											t eː a a a					
1577-11											j a a a					
2196-11											a a a a					
2230-11											j a j a					
2533-11											b eː eː b a					
3605-11											k a a d a					
3866-11											t a j a					
4553-11											t a ŋ ŋ n a					
4822-11											k a a u a					
5254-11											d a a a					
503-11											t eː a a u					
1356-11											a a a eː					
1881-11											eː a a a u					
2084-11											eː eː n a a					
2420-11											t a l a					
3218-11											t eː r a l a					
3372-11											eː a a a					
3718-11											k a a a					
4135-11											d a a a u					
807-11											k a a u a					
2320-11											k eː a eː					
2476-11											s eː r õː					
2842-11											d i j a r					
3719-11											ɔː ɔː					
4081-11											d a a u r a					
4313-11											j a aː u e					
4460-11											a eː a a					
5514-11											eː eː a d e					
5810-11											p a n a a					
260-11											t a ŋ a a					
890-11											t eː a b a a a					
1336-11											t eː r a					
1703-11											b eː r					
2735-11											t eː a a e a					
4591-11											t a a a					
63-11											k a r a					
463-11											d eː a b a					
762-11											p eː j a ŋ dʒ a r					
1788-11											s a n a					
2713-11											t eː a b a n dʒ a a a					
3425-11											a a					
4120-11											t eː a a					
4184-11											a a a i					
4423-11											d eː a a					
4759-11											j a i a a					
4980-11											t a dʒ a					
5125-11											p eː eː dʒ eː					
5339-11											d a r a					
5549-11											t a a a a					
5771-11											j a r a r					
5938-11											t a j a a a dʒ a					
1415-11											a ɔː a					
1542-11											u ɔː u u					
1683-11											i eː n ɔː					
2957-11											j eː a d o					
3048-11											b eː j o					
4402-11											ɔː ɔː					
5081-11											p i n i n r i					
6006-11											j a a a					
135-11											d u n u u					
158-11											a t a a a					
650-11											t i j i					
716-11											ɔː ɔː					
1152-11											j eː w ɔ					
1374-11											t eː i i					
1789-11											eː eː l eː					
2083-11											k a n a i					
2618-11											k ɔː l a					
2880-11											p eː n dʒ a r a					
3405-11											d a a a u					
3572-11											d eː a a					
3751-11											j õː a					
3811-11											eː ɔː					
4535-11											j u j u					
4888-11											j a j a a a					
5583-11											k eː ŋ g eː					
5751-11											t a j a					
2179-11											u d u					
2442-11											eː eː l eː					
2496-11											j o e					
4781-11											s ɔː n dʒ a					
196-11											t eː l ɔ					
408-11											j aː a u a					
526-11											d eː eː eː g i					
789-11											t ɔː r ɔː					
978-11											s a a i					
999-11											a a					
1298-11											t ɔː j i a a					
3015-11											j eː n d eː					
3132-11											t u ɔ b u					
3300-11											a a a					
3639-11											t eː ɔː a					
3977-11											j iː n dʒ i					
3978-11											j iː n dʒ o					
4648-11											j a					
5532-11											b eː l i					
432-11											d eː n o					
446-11											p u a g u l a					
1124-11											u j ɔ j u					
1237-11											p eː ɔ dʒ ɔ					
1579-11											j a b a l a					
1748-11											a o					
2774-11											k a a a					
2902-11											j a					
3198-11											j ɛː ɛː ɔ					
3550-11											t i j e a					
3943-11											eː l e					
4219-11											t a a dʒ a					
4259-11											k eː m u					
4611-11											k a l a					
4983-11											s iː ɲ dʒ o					
5656-11											j iː n dʒ i					
5830-11											j ɛː					
285-11											n eː					
1023-11											a a					
1074-11											j uː r a r					
1172-11											dʒ eː eː eː					
1187-11											b a a a					
1205-11											u u					
1454-11											j a l a e					
1524-11											j u w i					
1612-11											t ɔː n n i					
1668-11											p eː n eː					
1841-11											g e					
1970-11											b a j ɔ					
2671-11											u d o					
2977-11											b a m b a					
3287-11											d a a a					
3772-11											j u j u					
4363-11											d a m o					
4442-11											t eː eː i					
4479-11											b a					
5038-11											k a e a g					
5424-11											s a j a					
5793-11											d u a a					
6007-11											t a n a					
347-11											s õː õː õː					
1057-11											tʃ j dʒ a					
1257-11											k a r a ɔ					
1433-11											b a l ɔ					
1501-11											i g e					
1727-11											j ɔː					
1899-11											d ɛː n u					
2067-11											j n d o					
2268-11											d ɛː l ɔ					
2372-11											d a l a					
2599-11											i g a					
2756-11											j a r a					
2775-11											b a r a a i					
2863-11											d i i i					
3254-11											t iː j a a					
3318-11											u u n dʒ i					
715-12												d i r i				
1089-12												j a ŋ i				
1319-12												j i				
1398-12												s i r̃ i o i				
1557-12												b i r i				
1626-12												o a r a				
1840-12												t i r i				
2247-12												k o				
4677-12												k i r a o				
5162-12												a i i i				
5406-12												t a ɔ i				
359-12												b a r a				
1577-12												k o r o				
2196-12												j a r a				
2230-12												s i g o				
2533-12												b a r a				
3605-12												k a i a				
3866-12												t i r i				
4553-12												d a r̃ a				
4822-12												k oː o o				
5254-12												d o r o				
503-12												k i r i				
1356-12												o i r iː				
2084-12												j oː r n a				
2420-12												k a r o				
3218-12												b o r̃ a r o				
3718-12												b a r a				
4135-12												b oː r i				
4694-12												k a ŋ g o				
807-12												k oː o i				
2320-12												k a n o				
2476-12												k i r̃ ɔ				
3719-12												iː a				
4460-12												j i i ɔ				
5514-12												n o ɔ o				
5810-12												b i i i				
93-12												d i				
385-12												k i i i				
890-12												k o ɔ o o o				
1769-12												d a r o				
2162-12												b i r i				
2635-12												r i				
3031-12												d i g a				
4591-12												d o ɔ o				
5301-12												t i r i				
5605-12												t i i i				
63-12												k a ɔ a				
296-12												t oː o g i				
463-12												d o w n o				
762-12												b o o o ɲ o o				
1432-12												t a r i				
1474-12												t i ŋ				
2044-12												t i i i				
2713-12												t a a i ɔ ɔ				
3219-12												b o r o				
4120-12												k o r a				
4184-12												a i r i				
4423-12												t i ŋ i				
4629-12												i i ŋ r i				
4904-12												i t i i i				
4960-12												k o n o o				
4980-12												d oː				
5125-12												b a ɔ o				
5549-12												k oː w o				
5771-12												k ɔ g ɔ o				
5905-12												t i r i				
5922-12												b i r i				
1-12												b a				
629-12												d oː g				
667-12												ɛ r o				
1254-12												b oː i i r ã				
1415-12												ɔ r o				
2551-12												n aː				
2901-12												d i i i				
3885-12												b o r i				
5622-12												b oː i ɛ r i i				
6006-12												b aː r̃ a				
43-12												l a r				
158-12												j t i r i				
194-12												b i				
1789-12												o o o o				
2618-12												k ɔ ɔ a				
3113-12												d o g o				
3136-12												l o o o				
3751-12												k aː aː				
3959-12												t i i i				
4888-12												s a ɔ o n a				
5180-12												s a i i				
5583-12												t oː r̃ ɔ				
25-12												t i ŋ r̃ i ŋ i				
114-12												t o r o				
702-12												oː t ɔ ɛ o ŋ o				
952-12												k a j ɔ r ã				
1941-12												k a r i				
2351-12												t i ŋ ũ				
3448-12												b o r o				
3482-12												j a s a o r e				
3497-12												b r i				
3588-12												b i ŋ i				
4101-12												a i a				
4202-12												k a a u i				
4293-12												s o w o				
4520-12												b a r a				
4609-12												t oː i i i				
4740-12												k oː j i				
4781-12												a a g a				
526-12												k iː r̃ u g iː				
545-12												i r i				
931-12												b a r				
999-12												i i				
1989-12												j ɛ n a				
2145-12												d a				
2306-12												a a iː				
3015-12												ɲ iː o iː				
3300-12												ɔ w ɔ				
3639-12												d a a ɔ				
3774-12												b i r i				
3905-12												n iː g				
3976-12												k d r a				
4039-12												t i ŋ i				
4152-12												k i r̃ o				
4260-12												a i r̃ i				
4334-12												j r o				
4570-12												t ã m ũ i				
5200-12												iː iː iː				
5752-12												t i				
66-12												g o				
744-12												a a w a				
1646-12												iː dʒ i				
1745-12												k a r ɛ				
2066-12												j oː n a				
2958-12												j oː r				
3197-12												t i				
3812-12												k a n g a				
4337-12												l ɔ r̃ i				
5531-12												b i r ã				
5868-12												k i g				
245-12												dʒ iː r̃ i				
1002-12												r a				
1026-12												a a r̃				
1187-12												k ɔ l ɔ				
1238-12												a dʒ a				
1454-12												k ɔ l ɔ g				
1524-12												t u r̃ i				
2288-12												i i i				
2553-12												b a r a				
2759-12												i g i				
2978-12												k o o o				
3088-12												t i i i				
3256-12												a n				
3551-12												b a g a				
4052-12												t i ŋ i				
4220-12												k ã				
4383-12												k i				
4651-12												b i j a				
4821-12												g u				
5228-12												b i i g i				
5319-12												t i ŋ i				
5375-12												l o w e o				
5465-12												l a n o				
5481-12												j a g a				
5641-12												oː e ã				
5692-12												oː oː ã				
5715-12												d a n a				
448-12												n ã i				
567-12												ɲ a n a				
915-12												a				
1057-12												d e r e				
1208-12												k a n a				
1502-12												d a n u				
1669-12												k i ŋ b i r̃ i				
1684-12												k e ũ				
1864-12												k e k e l u				
1969-12												u u g u u ɛ				
2030-12												k i i				
2338-12												dʒ i iː				
3283-12												iː ŋ i				
3325-12												d a ɲ a				
715-13													d a g aː			
1089-13													a a g aː			
1319-13													a ɛ l ɛ			
1398-13													a a k u a g u			
1557-13													k a nː ɛ			
1626-13													a a g u			
1840-13													a nː aː			
2247-13													a g			
4677-13													k a a ɛ a u			
5162-13													a a nː ɛ ɛ			
5406-13													a ɛ aː			
359-13													k a a u l			
1577-13													k a ɛ ɛ			
2196-13													a a ɛ ɛ			
2230-13													a u g u			
2533-13													b a a d aː			
3605-13													k a nː d a			
3866-13													k a nː u			
4553-13													a i r u			
4822-13													k a a d aː			
5254-13													dʒ aː ɛ aː			
503-13													k a nː aː a			
1356-13													a a nː a			
2084-13													a a g l u			
2420-13													a nː u			
3218-13													b a g ɛ u			
3372-13													a aː aː aː			
3718-13													a ɛ ɛ			
4135-13													b a aː aː g			
4694-13													a a g u			
807-13													k a ɛ d ɛ			
2320-13													k a ɛ ɛ			
2476-13													k aː g			
2842-13													a g u g			
3719-13													ɛ aː			
4081-13													a ɛ r aː			
4313-13													a aː a d aː			
4460-13													a a ɛ ɛ			
5514-13													a ɛ ɛ d ɛ			
5810-13													b a g ɛ a			
93-13													d a			
260-13													b aː n ɛ ɛ			
385-13													a a a			
1336-13													k aː nː aː			
1703-13													b aː g			
1769-13													d ɛ ɛ aː			
2162-13													b a ɛ ɛ			
2635-13													a aː			
3031-13													d a g aː			
4591-13													k aː ɛ aː			
5301-13													b ɛ a aː			
5605-13													d a a u			
63-13													a l u			
762-13													b a l a b u l			
1432-13													dʒ a a aː			
1474-13													d a nː d a			
1788-13													s aː aː ɛ			
2044-13													d a a dʒ ɛ			
2713-13													k a a b i m d ɛ ɛ aː			
3219-13													b a u			
3425-13													aː aː			
4120-13													a l u			
4184-13													a a a aː			
4423-13													d ɔ nː u			
4629-13													a u a g a			
4980-13													d a g			
5059-13													b aː a aː			
5125-13													k a ɛ d ɛ			
5339-13													b aː g aː			
5905-13													b aː aː aː			
5922-13													b a nː u			
5938-13													a a a a u b a			
1-13													g aː			
483-13													g aː nː aː			
667-13													ɛ aː aː			
1254-13													dʒ a a dʒ a o a			
1415-13													a g u			
1683-13													ɔ aː aː aː			
2901-13													d aː i dʒ aː			
3251-13													j aː aː aː			
3885-13													dʒ aː nː aː			
4402-13													aː aː			
5081-13													k i a d i g ɛ			
43-13													a aː			
194-13													b aː g			
221-13													aː aː aː			
650-13													s ɛː ɲː ɛ			
716-13													i ɛ			
1374-13													dʒ aː n d aː			
1452-13													g a aː a			
1789-13													u a			
2083-13													k ɛ n ɛ u			
2108-13													a a d d ɛ			
2618-13													k ɛ ɛ u			
2636-13													a a			
2924-13													b aː aː u			
2941-13													b i aː aː			
3113-13													dʒ aː g aː			
3572-13													b aː aː aː			
3811-13													ɛ ɛ			
3959-13													k aː aː aː			
