COGID	Bankan_Tey	Ben_Tey	Bunoge	Jamsay	Mombo	Najamba	Nanga	Penange	Perge_Tegu	Tebul_Ure	Tiranige_Diga	Togo_Kan	Tommo_So	Toro_Tegu	Yanda_Dom	Yorno_So
2230-5					j ãː m o											
3605-5					b o e o											
3866-5					d iː m ɛ											
4553-5					t ãː ŋ ɛ											
4822-5					d o e b o											
5254-5					d ãː e o											
1356-5					e o o j											
1881-5					nʷ ɔː o u											
2084-5					j iː ŋ r ɛ											
2420-5					k ɛ r ɛ											
3218-5					p o e											
3372-5					j iː j ɛ											
3718-5					k iː r ɛ											
4135-5					b ãː ɛ u											
4694-5					d e j u g o											
2476-5					k ɔː											
2842-5					t o m ɛ											
3719-5					e ãː											
4081-5					t o j u g o											
5514-5					nʷ ɔː e d ɛ											
260-5					b ãː n o o											
385-5					d ãː e b e											
890-5					k o o b o o o											
1703-5					b ɛ i											
1769-5					t e e o											
2735-5					t o o u ɛ											
4591-5					t e r o											
5301-5					b o r o											
63-5					k o r o											
296-5					d o o d o											
463-5					d o o o											
762-5					p o o o ŋ g e											
1788-5					j iː											
3219-5					d uː o											
4120-5					d o o o											
4759-5					m ãː o o u											
4960-5					d o o o o											
5059-5					g o j e											
5549-5					d ãː o o											
5771-5					j o g o											
5905-5					d ãː j ɛ											
5938-5					p iː m e e r ɛ											
1415-5					e d e											
1542-5					m i o ɛ											
1898-5					k o u u											
2551-5					o e											
2957-5					m iː n d ɛ											
3048-5					b iː j ɛ											
4402-5					nʷ u											
5081-5					p ɛ j a u u											
6006-5					p ɔː o o											
135-5					t ãː m d u											
194-5					d j e											
716-5					nʷ ɛ											
2083-5					k ɔː ɛ i											
2618-5					g ɔː l e											
2880-5					k o u d u g ɛ											
3113-5					t o m o											
3136-5					o o o o											
3405-5					g iː m ãː											
3572-5					tʃ ɛ ɛ ɛ											
4535-5					j u m u											
5751-5					d iː e ɛ											
851-5					k o m											
2179-5					i b ɛ											
2351-5					d ãː ɛ ɛ											
2496-5					e ãː ɛ											
3448-5					d o e g o											
4781-5					o o ŋ o											
4921-5					j u u u											
196-5					k iː l e											
789-5					g ɛ r ɛː											
931-5					d o r o											
1298-5					b o o ɛ a o											
2145-5					d o a											
3639-5					d iː iː a											
3977-5					s iː n d i											
3978-5					w iː n u											
4260-5					j j d ɛ											
5200-5					e e e											
5532-5					g iː n i											
5866-5					b o b j u ɛ											
432-5					g o o j											
446-5					p u u											
521-5					k oː o l											
1124-5					e e l e											
1237-5					p e m d ɛ											
1579-5					n a b u l a											
1748-5					ɛ ɛ											
2774-5					k a n i											
3198-5					s iː j ɛ											
3339-5					k u m											
3534-5					d ɔː j ɛ											
3550-5					p iː n e											
3684-5					g o j u											
3944-5					t ɛ ɛ ɛ											
4611-5					g ɔ r ɔ											
4738-5					g u n d u											
4983-5					s iː n i											
5447-5					g i b o											
5656-5					s iː n d i											
5830-5					iː ɛː											
1074-5					n o g a											
1170-5					k a d u											
1187-5					k iː r ɔ											
1454-5					s iː l iː											
1841-5					g e											
1970-5					p ɛ l ɛ											
2977-5					g o b ɔ											
3252-5					d u d u											
3301-5					d e b a											
3463-5					b w ɛː											
3498-5					n e											
4363-5					b a m g											
5038-5					k ɔ l ɔ											
5228-5					dʒ o n d u											
5229-5					dʒ o o g e											
5391-5					d u											
5481-5					o o g o											
5793-5					b o m b u ɛ											
5888-5					j eː											
6007-5					p iː n ɛ											
178-5					k uː k g a l e											
568-5					ɲ e n d i l ɛ											
569-5					ɲ e n d i l e											
1257-5					k ɔ j ɛ ɔ											
1433-5					p iː l e											
1501-5					n iː g ɛ											
1684-5					s e e e											
1787-5					j e											
1864-5					k ɔ ɔ											
1923-5					g u r u											
1988-5					k p u d e											
2046-5					g eː n d e											
2067-5					ɛː i d ɛ											
2109-5					g o b o u											
2127-5					w ɔ l ɔ											
2372-5					b ãː											
2599-5					d iː g ɛ											
2756-5					w a l a											
2775-5					p a r iː											
3254-5					p a l a a											
3319-5					k u u u g											
3358-5					n aː											
715-6						eː n										
1089-6						o a n a										
1319-6						o eː iː iː										
1398-6						j eː n a o o										
1557-6						n eː o eː										
1626-6						eː a n eː										
1840-6						eː n a										
2247-6						n eː e										
4677-6						k eː eː eː iː e										
5162-6						o eː n iː eː										
5406-6						eː n d eː										
359-6						aː aː o										
1577-6						n eː o eː										
2196-6						j a iː o										
2230-6						o a iː a										
2533-6						p eː a g eː										
3605-6						a n d a										
4553-6						t a ŋ ŋ uː iː										
4822-6						ɔ a b a										
5254-6						dʒ eː eː eː										
503-6						k a j o o										
1356-6						o a a o										
1881-6						o eː aː iː e										
2084-6						eː eː e i eː										
2420-6						k eː aː eː										
3218-6						k eː b e o eː										
3372-6						o eː a eː										
3718-6						k a o a										
4135-6						s a a a o										
4694-6						a o ŋ g a										
807-6						s a a g o										
2320-6						k ɔ o o										
2842-6						t a b a b										
3719-6						o iː										
4081-6						a a a										
4313-6						j ɔ n ɛ										
4460-6						o a a a										
5514-6						o eː n d eː										
5810-6						s a ŋ o a										
93-6						n o										
890-6						k o o dʒ o o o										
1336-6						n eː n eː										
1703-6						n a										
4591-6						t a a a										
5605-6						dʒ a o o a										
63-6						a o eː										
296-6						o a o g a										
463-6						dʒ a n dʒ o										
762-6						k a o eː ŋ dʒ a l e										
3425-6						a a										
4120-6						a i aː										
4423-6						n a o a										
4759-6						ɔ a n iː iː										
4904-6						o dʒ o o g eː										
4960-6						a o a o										
5125-6						k o n dʒ o										
5339-6						s a g a										
5771-6						o ɛ n ɛ										
5922-6						a o eː										
5938-6						k eː dʒ a a i e aː										
483-6						a n a										
1542-6						a d o										
1683-6						o a a ɛ										
2551-6						o o										
2957-6						eː eː n d eː										
3048-6						b eː iː iː										
4402-6						a a										
5081-6						dʒ i n dʒ a b ɛ										
5622-6						k o o o a o o										
650-6						n a n a										
716-6						sʷ iː										
1152-6						d eː j eː										
1789-6						j eː o eː										
1862-6						a n eː										
2618-6						k i i ɛ										
2880-6						dʒ eː n dʒ iː eː										
2924-6						n a a a										
3136-6						o o o o										
3405-6						p eː iː iː										
3811-6						eː aː										
4535-6						o ɔ iː eː										
4888-6						o o o a o o										
5751-6						t eː iː iː										
2179-6						n d eː										
2442-6						i eː l eː										
3482-6						o a a a i g g eː										
4202-6						k a j a j ɛ										
4781-6						o o n dʒ a										
4921-6						n iː ɛ u iː										
5982-6						dʒ a ŋ i eː										
408-6						j a ɔ b aː										
526-6						k o ɛ i g o										
789-6						i b a										
1298-6						p a j a i b i										
1942-6						j aː										
2666-6						ɛ a a o										
3015-6						j a o d eː										
3905-6						o aː										
3977-6						p ɔ n dʒ iː										
3978-6						p ɔ n d iː										
4152-6						k a j iː n										
4334-6						o o a i										
4648-6						j a										
5200-6						o o e										
5318-6						n a j eː										
5532-6						k eː m o										
5673-6						k a a g a										
5866-6						a b g a a										
66-6						n a										
432-6						s a n										
446-6						k a a g a a										
1579-6						a m b u i i										
1748-6						a a										
1823-6						dʒ o ŋ iː										
2902-6						ɔː a										
3684-6						k i b i										
3812-6						m o o g o										
3943-6						m ɛ r ɛ										
4259-6						p eː l o										
4611-6						n i m ɛ										
4738-6						ɔ n d ɔ										
4983-6						p ɔ n d ɛ										
5447-6						ɔ eː										
5656-6						p ɔ n d iː										
5830-6						sʷ iː										
5868-6						n o b o										
348-6						i n i										
998-6						o o										
1023-6						j a										
1074-6						j a n a b										
1172-6						n a l i										
1205-6						o a										
1668-6						p eː l ɛ										
1841-6						g o										
2063-6						o o o										
2671-6						ɔ gʷ ɔː										
2977-6						k i m b ɛ										
3256-6						o o e										
3287-6						t a i a										
3301-6						g aː b iː										
3498-6						sʷ iː										
4363-6						d a m										
4442-6						t a l ɛ										
4941-6						o a iː										
5228-6						dʒ ɛ g a										
5229-6						a i g eː										
5391-6						d e e										
5793-6						d ɔ ɔ b ɛ										
5888-6						sʷ iː										
1373-6						d d o g a										
1727-6						j a										
1899-6						p i n i										
1923-6						g e i ɛ										
1971-6						j a dʒ i b i										
2046-6						k u d iː										
2109-6						g e ŋ i										
2127-6						u u ɛ ɛ										
2268-6						p eː l eː										
2714-6						d d o o i										
2863-6						p ɔ r ɛ										
2999-6						s ɔ g eː										
3318-6						n ɔ n dʒ ɔː										
715-7							d iː									
1089-7							ɛ aː r									
1319-7							ɛ ɔ									
1398-7							ɛ ɛ n i i i									
1557-7							k iː r iː									
1626-7							aː iː r aː									
1840-7							d iː r a									
2247-7							k iː									
4677-7							k ɛː aː i									
5162-7							ɛ iː n a iː									
5406-7							d ɛː aː iː									
359-7							k ɛː r i									
1577-7							k iː aː iː									
2196-7							ɛː iː i iː									
2230-7							ɛ iː iː									
2533-7							b ɛː r iː									
3605-7							k iː i iː									
3866-7							d aː r iː									
4553-7							t iː ŋ									
4822-7							k iː i b iː									
5254-7							d iː r iː									
503-7							k aː r aː									
1356-7							i iː iː i									
1881-7							u ɛː i i									
3372-7							ɛ iː i iː									
3718-7							b i r iː									
4135-7							d iː r i									
4694-7							k iː r i d iː									
807-7							k ɔ i ɔ									
2320-7							k aː ŋ i									
2476-7							k i g i									
2842-7							d ɛ r ɛ									
3719-7							iː									
4081-7							d iː ɛ n j iː									
4313-7							u ɛː n									
4460-7							aː aː r ɔ									
5514-7							aː ɛ aː aː									
5810-7							b i n i i									
93-7							d iː									
260-7							b iː n i iː									
385-7							t ɛː i b ɛ									
890-7							k aː aː b aː i i									
1336-7							d ɛː g iː									
1703-7							j iː									
1769-7							t ɛː i b iː									
2162-7							b ɛː r iː									
2635-7							aː aː									
2735-7							d aː i d a dʒ a									
3031-7							d ɛː r i									
4591-7							k ɛ r iː									
5301-7							b i r iː									
5605-7							t i i iː									
296-7							t ɛ i dʒ i									
463-7							d i i i									
1432-7							d ɛː r iː									
1474-7							t i n a									
1788-7							j iː r i									
2044-7							d i i b i									
2713-7							k ɛː u b ɛ n d ɛː a ɛ									
3425-7							ɛː iː									
4184-7							i i r ɔ									
4423-7							d ɛː i i									
4629-7							ɛː aː aː j iː									
4759-7							ɛː iː aː iː iː									
4904-7							ɛː l aː i b a									
4960-7							t iː ɛ iː r iː									
5059-7							k i i i									
5125-7							k aː aː dʒ i									
5339-7							d ɛː g ɔ									
5549-7							t iː ŋ iː									
5771-7							aː aː g									
5905-7							t iː r a									
5922-7							b ɛː r i									
1-7							d iː									
483-7							k ɛː s iː									
667-7							ɛː i iː									
1542-7							ɛ iː									
1683-7							ɔ ɔ r									
1898-7							b aː aː i j									
2551-7							i i									
2901-7							t ɛː i d i									
2957-7							u iː ɔ d iː									
3048-7							p iː iː									
3251-7							l ɛː r i									
3885-7							d ɛː r i									
4402-7							j iː									
5081-7							d ɔ n d i r ɛ									
5622-7							b ɛː r i r i i									
6006-7							d iː ŋ iː									
43-7							ɛː aː n									
135-7							t iː n d iː									
158-7							i b i r i									
194-7							j iː r									
221-7							ɛː s iː									
650-7							d ɔ s iː									
1152-7							d iː ŋ iː									
1374-7							k ɛ i d i									
1452-7							b ɛː r i									
1862-7							ɛː s iː									
2083-7							k eː g i ɛ									
2108-7							o i m i									
2880-7							d ɛ ɛ d i dʒ ɛ									
2924-7							d ɔ n ɔ									
2941-7							k iː r a									
3113-7							t i i									
3136-7							ɛ ɛ i									
3405-7							p iː ɔ iː									
3572-7							j ɛː i i									
3751-7							ŋ i									
3959-7							b ɛː a a									
4066-7							k ɛː r iː									
4535-7							l iː iː iː									
5180-7							ɛː ɛː i d i									
5583-7							d aː aː b aː									
5981-7							ɛː ɛː i									
25-7							b aː i i i i r i									
114-7							t i r ɛː									
702-7							aː b aː i i a i									
872-7							ɛː ɛː d ɛː									
1941-7							k i r̃ i									
2179-7							u iː									
2351-7							t iː a									
2496-7							u iː									
3588-7							b i r i									
4202-7							k ɛ r̃ ɛ j̃ i									
4609-7							b aː aː a a i i r									
4921-7							j ɛ m b b iː									
408-7							ɔ ɔ ɔ d ɛ									
526-7							d aː u i g i									
545-7							i r̃ i									
978-7							d i r									
999-7							ŋ ɔ									
1052-7							i i i b i									
1070-7							ɛː u o									
1942-7							ɛː iː									
2456-7							b i r i									
2514-7							d ɛː r i									
2666-7							l i r i									
2817-7							ɛ u d iː									
3300-7							i ŋ i									
3977-7							dʒ ɔ ɔ dʒ i									
3978-7							dʒ ɔ ɔ dʒ i									
4039-7							b i r a									
4152-7							k a r̃ e									
4260-7							i u g i									
4278-7							d u u dʒ i									
4648-7							iː iː									
5752-7							d i									
5866-7							d ɛ g i ɛ ɛ									
5887-7							i a i i									
446-7							g ɛ ɛ b o r ɔ									
1108-7							b u a iː									
1646-7							aː g i									
1748-7							ɔ									
1823-7							k ɔ									
2143-7							m iː									
2392-7							u b a s iː									
2579-7							d iː									
2902-7							ɔ ɔ									
3197-7							k i									
3339-7							b iː r i									
3944-7							t ɛ a ɛ									
4240-7							a o r iː									
4337-7							t i i b									
4738-7							k eː n d ɛ									
4983-7							dʒ ɛ g									
5197-7							ɛː r i									
5447-7							p iː iː									
5656-7							dʒ ɛ g									
5733-7							r iː									
5828-7							ɛ i i i									
5868-7							k ɛ ŋ i									
245-7							k aː i i									
562-7							l i r a a									
1170-7							t u n b a									
1205-7							ɔ iː									
1524-7							k i w o									
2063-7							i ɔ ɛ									
2334-7							u r i									
2671-7							ɔ g i									
3088-7							j i r a									
3252-7							ɛ m b i									
3463-7							l l									
3772-7							t iː ŋ iː									
3790-7							d u o									
4052-7							k i r i									
4383-7							k i d ɛ									
4479-7							d e									
4711-7							i ɛː r i									
4778-7							u u r i r iː									
4941-7							ɔ iː iː									
5038-7							k aː ŋ i i									
5228-7							t ɛ n d ɛ									
5319-7							t i r a									
5424-7							k ɔ ŋ ɔ									
5793-7							p ɛ ɛ g ɛ g									
563-7							j u r e									
684-7							a a r a									
742-7							t a r a									
1126-7							ɛː i									
1204-7							k ɛ r i									
1669-7							b i i b i r i									
2283-7							b eː r i									
2372-7							e i									
2441-7							j iː									
2773-7							k ɛ ɛ ɛ i r i									
2863-7							d ɔ ɔ ɔ									
2999-7							d ɛ g ɛ									
3176-7							m i r ɔ									
3199-7							b ɛ n i i									
3283-7							i r̃ i									
3318-7							l e d e									
3358-7																
715-8								d u n e								
1089-8								n a g								
1319-8								n a j ɛ								
1398-8								n ɔ g u ɔ ɔ								
1557-8								k a j ɔ								
1626-8								a a m ɔ								
1840-8								t a n uː								
2247-8								g a n								
4677-8								k u ɔ a a e								
5162-8								m iː n j ɔ								
5406-8								aː n d ɔ								
359-8								k ɔ a a e								
1577-8								a n ɔ								
2196-8								j a a e								
2230-8								j a n ɔ								
2533-8								b a n b o								
3605-8								k a n d ɔ								
3866-8								o n ɔ								
4553-8								t a ŋ i j e								
4822-8								k u m b ɔ								
5254-8								d ɔː n ɔ								
1881-8								n ɔː m ɔ m e								
2084-8								a a n m ɔ								
2420-8								k ɔː ɔ ɔ								
3218-8								b u n a m ɔ								
3372-8								n a m a								
3718-8								a a a								
4694-8								k ɔ m uː d ɔ								
2320-8								k a n a								
2476-8								k ɔː g uː								
2842-8								d a g u ŋ								
3719-8								a ɔː								
4081-8								d aː m i a a								
4313-8								n u n a e								
5514-8								n ɔː n d ɔ								
385-8								d ɔ n b ɔ e								
1336-8								a g ɔ								
1769-8								d ɔ n d ɔ								
2735-8								ɔː n a ɔ								
3031-8								k n n ɔ								
4591-8								d a n a								
5301-8								k oː n o								
63-8								k a n o								
1788-8								s a j j								
2713-8								o m b a n d o l ɔ								
4120-8								k o n o								
4184-8								m o j e								
4759-8								n aː uː a o								
5059-8								g uː j ɔ								
5771-8								j o g o ŋ								
5938-8								a n u ɔ a ɔ								
629-8								d uː n e								
1415-8								n dʷ o								
1898-8								p u j ɔ e								
2551-8								r uː								
2957-8								m aː n d ɔ								
3048-8								b iː a ɛ								
6006-8								p o r o								
135-8								k o n d ɔ								
716-8								ɔː ɔː								
1152-8								iː m ɔ								
2083-8								k a b n i								
2618-8								k ɔː n a								
2636-8								n uː								
2880-8								aː n d u g ɔ								
2941-8								k ĩː n i								
3405-8								a m ɛ								
3811-8								ɔ ɛ								
4535-8								j aː m ɔ								
4888-8								m a m a n o								
5751-8								t a a ɛ								
851-8								k ɔː g o								
4202-8								k a n a a a								
4781-8								a a n d o								
4921-8								m aː m a b a								
196-8								k u l o								
408-8								u a n b a								
789-8								a a i								
1942-8								a ĩː								
2145-8								t ɔː i								
2456-8								k m m m								
3639-8								t iː ɔː a								
3977-8								m aː n d e								
3978-8								m aː n d e								
4278-8								k ĩː n g ĩː								
5532-8								iː n i								
521-8								g oː b i e								
1124-8								aː j g g o								
1579-8								u a b u a a								
2774-8								k a j i								
3198-8								s ɔː m ɔː								
3534-8								d ɔː n i								
3550-8								b iː n d dʒ a								
3684-8								k i n d a								
3812-8								m n n g n								
4611-8								k iː m ɔ								
4738-8								aː n d ɔ								
4983-8								s aː n d a								
5656-8								m aː n d i								
5830-8								a ɛː								
1026-8								n a g dʒ								
1074-8								u a g u ŋ								
1170-8								a n t ɛ								
1187-8								o r o								
1454-8								s o l e								
1841-8								g e								
1970-8								p u l ɔ								
2671-8								ŋ k o								
2977-8								k iː ŋ b a								
3301-8								i b ɛ								
3463-8								j wː ɛː								
3498-8								sʷ ɛ								
4363-8								d a m i								
4479-8								k a								
5038-8								k iː l o g								
5391-8								ɔ b								
5715-8								k n n i								
5793-8								t iː m b a ŋ								
5888-8								ɔ ɔ								
6007-8								p u n o								
568-8								n ɔ n d ɔ l ɔ								
569-8								n ɔ n d ɔ l e								
1257-8								k o n o l ɔ								
1433-8								p o l e								
1501-8								n iː g e								
1787-8								j aː								
1864-8								k ɔ g u l e								
1923-8								g eː n ɔ								
1988-8								k p a n d e								
2046-8								e n d e								
2067-8								j n d ɛ								
2109-8								k u d ɔ ɛ								
2127-8								n ɔ l ɔ								
2441-8								m m								
2599-8								iː g e								
2756-8								w a l a								
2775-8								p a r iː m i								
3254-8								d iː l u m a								
3358-8								sʷ aː								
715-9									d aː							
1089-9									aː aː r a							
1319-9									aː aː n							
1398-9									i aː r a aː dʒ aː							
1557-9									k aː aː aː							
1626-9									aː aː r aː							
1840-9									k aː aː aː							
2247-9									n aː							
4677-9									k aː aː aː aː							
5162-9									aː aː n o aː							
5406-9									d aː aː dʒ aː							
359-9									k aː aː aː							
1577-9									k oː aː oː							
2196-9									aː aː aː aː							
2230-9									aː aː aː							
2533-9									b aː aː dʒ aː							
3605-9									k aː aː dʒ aː							
3866-9									t aː r aː							
4553-9									d aː t dʒ aː							
4822-9									k aː aː dʒ aː							
5254-9									t oː aː oː							
503-9									k aː aː aː							
1356-9									aː aː aː							
1881-9									o aː aː i							
2084-9									aː aː aː							
2420-9									k aː aː aː							
3218-9									t aː t aː							
3372-9									i aː aː aː							
3718-9									d aː aː aː							
4135-9									b aː aː aː							
4694-9									k aː r dʒ aː							
807-9									k aː i dʒ aː							
2320-9									d aː r oː							
2476-9									k aː ɔ							
2842-9									d aː r aː							
4081-9									d aː i dʒ dʒ aː							
4313-9									aː aː i u							
4460-9									aː aː aː u							
5810-9									b aː aː aː							
93-9									n aː							
260-9									d aː m aː aː							
385-9									n aː i dʒ aː							
890-9									b oː i dʒ i i oː							
1336-9									d aː aː							
1703-9									aː							
1769-9									d aː i dʒ aː							
2162-9									b aː aː aː							
2635-9									aː aː							
2735-9									d aː aː dʒ aː							
3031-9									d aː aː							
4591-9									t aː i aː							
5301-9									b aː aː aː							
5605-9									d aː aː aː							
63-9									d aː aː ɔ							
296-9									n aː aː dʒ aː							
463-9									t oː i dʒ i							
762-9									b i i i ŋ g i							
1432-9									t aː aː aː							
1474-9									d aː r dʒ ɔː							
1788-9									i aː r ɛ							
2044-9									d aː aː dʒ aː							
2713-9									t ɔ i a u ɔ u ɔ							
3219-9									t aː aː							
3425-9									aː aː							
4120-9									k ɔ i ɔ							
4184-9									aː aː r a							
4423-9									d aː aː aː							
4629-9									aː aː i r aː							
4759-9									ɔ i ɔ i ɔ							
4904-9									i g aː i i							
4960-9									t i i o oː							
4980-9									t aː							
5059-9									d aː aː aː							
5125-9									b aː a dʒ aː							
5339-9									p aː aː							
5549-9									t oː ɔ dʒ oː							
5771-9									d aː g a							
5905-9									d aː r aː							
5922-9									b aː aː aː							
1-9									b aː							
483-9									k aː r aː							
629-9									t aː							
667-9									aː r aː							
1254-9									l aː aː s aː aː aː							
1415-9									ɔ dʒ aː							
1542-9									ɔ n i							
1683-9									i aː r a							
1898-9									t aː aː aː							
2551-9									aː aː							
2901-9									t i i aː							
3251-9									j aː aː aː							
3885-9									t aː r aː							
4402-9									aː aː							
5081-9									k i i u e g i							
5622-9									b aː i e r aː aː							
43-9									j aː r							
158-9									o b aː r aː							
194-9									b aː r							
221-9									aː r aː							
716-9									iː iː							
1374-9									d aː ɔ dʒ aː							
1452-9									d aː aː aː							
1789-9									n i w̃ ɔ							
1862-9									aː r aː							
2108-9									aː aː aː							
2618-9									i a a							
2636-9									aː dʒ							
2941-9									k aː r a							
3113-9									d aː g aː							
3136-9									i i i i							
3572-9									p aː r aː							
3811-9									a iː							
3959-9									t aː aː aː							
