COGID	1	10	2	3	4	5	6	7	8	9
2689-1	n a m a									
893-1	a a n d z a									
1285-1	n w a a									
1303-1	n g ɔ m a									
2197-1	s i a l a									
2828-1	ʃ i n a									
3572-1	s ɔ n i									
1095-1	l i m a									
1755-1	z ŋʰ ɛ									
1789-1	k a l a a ŋ g a									
3207-1	k ɛ l a									
3519-1	t ɛ m a									
3686-1	i i m k a									
4249-1	k u m i									
4451-1	z i s i									
448-1	t ɛ á a b ʊ									
630-1	k ɛ ɛ l a									
814-1	k ɔ á ŋ dʒ ɛ									
1216-1	g a g i z a									
1228-1	k w ɛ a									
1418-1	s i m á z i a									
1475-1	k i a									
2026-1	t w i a									
2775-1	k u á ŋ dʒ a									
3397-1	k ɛ l a									
3826-1	s ɔ k a									
4003-1	n i i z a									
4040-1	g ɛ n i									
4373-1	l ɛ n i									
4384-1	i ŋʰ ɛ									
84-1	s u g ɛ l ʊ									
116-1	ʃ i k a									
181-1	g ɔ ɔ n z ɔ									
419-1	l ɔ g a									
587-1	ɔ i n k ɔ									
660-1	l ɔ l a									
848-1	t a l a									
1083-1	l i l a									
1122-1	ʃ i n a									
1159-1	n a									
1350-1	l w ɛ a									
1374-1	n i a a n a									
1396-1	ʃ ɔ β a									
1430-1	i i s ɔ									
1666-1	k a ʊ n ɔ									
1767-1	k ɛ k ɔ									
1906-1	i ŋ g i l a									
2177-1	n g a h i									
2286-1	ŋʰ ŋʰ									
2317-1	β ɛ ɛ a									
2419-1	s ɛ k a									
2750-1	ʊ ɛ s i									
3018-1	s i l a									
3275-1	g a ɛ n a									
3441-1	s a á n g a									
3464-1	ʃ ɔ n a									
3639-1	dʒ ɛ t ɛ m ŋ a a									
3885-1	s ɛ m ɔ									
3981-1	i i m a b a									
4192-1	s i á m z a									
4260-1	s w ɛ a									
4350-1	l ɛ i l z ɔ									
43-1	n ɔ ɔ t a									
93-1	t ɔ n ɔ									
200-1	k i i									
374-1	t a a l d a a									
459-1	l u m a									
508-1	p ɛ ɛ ɛ									
528-1	k ɛ l i									
575-1	t a i									
871-1	k ɛ n a									
1137-1	β ɛ g a									
1339-1	p w l a									
1585-1	ɔ a l a									
1712-1	k u l ɔ									
1872-1	w i i									
2088-1	k i s a									
2166-1	l u i ŋ dʒ a									
2334-1	k i z ɔ									
2393-1	m a n a									
2537-1	l ɔ m ɔ									
2665-1	i i n z i									
2738-1	β ɛ ɛ l a									
2872-1	k a s i									
2893-1	l a w ɛ ʊ									
2997-1	k a i n s a									
3075-1	k ɔ ɔ ɛ b a									
3675-1	l a á a l ʊ									
4028-1	t l ɛ									
4137-1	m ʊ l a									
4238-1	i a s m z i									
4316-1	t a t a									
4429-1	i a s a									
4440-1	k i l i									
4485-1	s ɔ									
4574-1	k a a a l a									
4688-1	n i a l ʊ									
143-1	u i									
240-1	ʊ i g a									
388-1	l ŋ i ʊ m a									
401-1	k a									
599-1	dʒ a i m dʒ i									
649-1	l ɛ ɛ k a									
755-1	k u l a									
836-1	s u i ŋ dʒ i									
969-1	ɔ s a									
994-1	l ɔ ɔ m b a									
1006-1	s ɔ ɔ ŋ g a									
1032-1	l ɔ l ɔ l a									
1043-1	z a l a									
1110-1	t ɛ m a									
1263-1	t a h a									
1273-1	l ɛ ɛ k a									
1329-1	i t a a l a									
1362-1	i i									
1606-1	ɔ i t ɔ									
1617-1	z ʊ k a									
1629-1	s i i a									
1744-1	i k i a									
1895-1	i a									
1917-1	ʃ ʊ m a									
1969-1	n a á n ʊ									
1989-1	s a g a									
2037-1	n k a t a									
2128-1	s a i ŋ dʒ a									
2186-1	g a n a									
2483-1	k a l i									
2592-1	ʊ ɔ l a									
2615-1	p ɛ a									
2700-1	g a á n d a									
2784-1	g ʊ l a									
2797-1	l ɔ m ɔ									
2884-1	a p j l a									
2904-1	dʒ ɛ a n d a a									
2972-1	s ɛ ɛ									
3030-1	l i p a									
3148-1	i t a									
3160-1	ʊ u l a									
3261-1	p ʊ k a									
3364-1	ʃ ɔ t a									
2689-2		ɲ á m a								
893-2		a a k ŋ d a								
1303-2		d tʃ o n a								
2197-2		s tʃ ŋ l a								
2828-2		s á n a								
3572-2		s o n i								
1095-2		l á m a								
1789-2		d j l a a ŋ g a								
3207-2		w u l a								
3519-2		t u m a								
3686-2		l oː ŋ d a								
4249-2		b u m i								
4451-2		v i n i								
448-2		m u b g n i								
630-2		d e l e								
814-2		w o e m b e								
1216-2		d a v n d a								
1228-2		l l a								
1418-2		s i k a n l a								
1475-2		g l a								
2026-2		t á e								
3826-2		w o g a								
4003-2		n oː o k a								
4373-2		dʒ i m i								
4384-2		i m o								
84-2		s e b u l u								
116-2		s i g a								
419-2		l á g a								
587-2		o b ŋ g o								
660-2		l á l a								
848-2		b a l a								
1122-2		v u n a								
1159-2		l tʃ								
1350-2		l l l a								
1374-2		n d a n a								
1906-2		iː n g i l a								
2419-2		s e g a								
2750-2		e e s i								
3441-2		s e e n g a								
3464-2		v á n a								
3639-2		t j t l m n l a								
3981-2		w a o n d a								
4192-2		w i e m d a								
4350-2		l e k l d o								
278-2		p tʃ								
3971-2		d á m a								
55-2		ɲ a m a								
43-2		w oː g m u								
93-2		g o n o								
459-2		l u m a								
1137-2		b i g u								
1585-2		v á l a								
1872-2		p tʃ a								
2166-2		u u m b a								
2872-2		dʒ u s i								
2997-2		d a a n s a								
3075-2		s u l u k o								
3675-2		l l e ŋ l e								
4137-2		v á l a								
4238-2		s d k m s o								
4316-2		t a t u								
4574-2		n l a a l a								
3067-2		n t u								
3531-2		l a k ŋ d a								
1033-2		s j a a a ŋ t a								
3185-2		s i e g a								
794-2		n e e a g a								
143-2		v u u								
240-2		w g g a								
388-2		l a u m a								
599-2		t a a m b i								
969-2		v a								
994-2		g i a a g a								
1606-2		o t o								
1629-2		g á i								
1895-2		d a								
2592-2		l l a								
2884-2		tʃ p l a								
3148-2		i t a								
3261-2		dʒ e t e								
2689-3			p á ɲ a							
893-3			a l a a							
1285-3			l w k							
1303-3			l p á n a							
2197-3			dʒ p a l a							
2828-3			p á ɲ a							
3572-3			s o ɲ i							
1095-3			l e ɲ a							
1755-3			dʒ ɲ u							
1789-3			l n g a							
3207-3			p á l a							
3519-3			tʰ u ɲ a							
3686-3			k ìì l x a							
4249-3			x u ɲ i							
4451-3			i n i							
448-3			p o k a l a							
630-3			dʒ á á l a							
1216-3			k a a							
1228-3			tʰ l á a							
1418-3			dʒ i l k a a							
1475-3			k l a							
3397-3			β o l a							
4003-3			a x a							
4040-3			k e n i							
4373-3			l á l i							
4384-3			i ɲ á							
181-3			r o n g o							
419-3			o k a							
587-3			ìì u l x o							
660-3			ìì l a							
1083-3			l i l a							
1350-3			l l k a							
1374-3			a a n a							
1396-3			s o dʒ u							
1666-3			r a β l o							
1767-3			tʰ o x o							
1906-3			m k i l a							
2177-3			m k a b							
2286-3			l a							
2317-3			β u β a							
2750-3			á k s i							
3275-3			dʒ a a n a							
3464-3			o n a							
3639-3			k ŋ g a							
3981-3			l m n a							
4192-3			p ìì k n d a							
4260-3			s j a a							
4350-3			l i á l a o							
278-3			s a							
745-3			x o x o							
3971-3			x o l a							
93-3			k o ɲ e							
200-3			β i a							
374-3			k a k l j a							
508-3			x e s u							
528-3			β i l i							
1137-3			s e x u							
1585-3			a l a							
1712-3			s u l o							
2088-3			e n e							
2334-3			s e k e							
2393-3			m e n a							
2665-3			ìì m k i							
2738-3			β e j l a							
3675-3			l j á a l a							
4137-3			u l a							
4440-3			b i l i							
4574-3			p l a l a							
4688-3			u u u a							
2798-3			l l a							
3067-3			m k e							
3531-3			á k l a d a							
3767-3			l i							
4632-3			x e n i							
401-3			s a							
649-3			l e j x a							
755-3			tʰ i l a							
1032-3			k o β o l a							
1043-3			tʰ a l a							
1273-3			l o j x a							
1362-3			k e u							
1895-3			s a							
2615-3			x a a							
2784-3			tʰ a l a							
2904-3			k ìì k a a							
2689-4				t i r a						
893-4				l r n dʒ s a						
1285-4				b i w g						
3572-4				t o ɲ a						
1755-4				b ɛ a						
1789-4				t e g ŋ ŋ g a						
3686-4				p o ŋ g a						
4451-4				p i p a						
1216-4				l ɔ n dʒ dʒ a						
4003-4				p o n s a						
419-4				k ɔ g a						
1122-4				k ɔ g a						
1430-4				k dʒ d a						
1666-4				t o ŋ ɲ a						
1767-4				s ɔ r a						
55-4				s ɔ r a						
94-4				b i g a						
2717-4				t g n ŋ g a						
1339-4				t p p g						
4632-4				s ɔ r a						
2784-4				k ɔ e a						
3160-4				s ɔ r a						
2689-5					n a n a					
893-5					a n d d a					
1285-5					l w					
1303-5					p b ŋ n					
2197-5					s b a l					
2828-5					k á n a					
3572-5					k á n i					
1095-5					l i n a					
3207-5					f u l a					
3519-5					t u m a					
3686-5					t n d a					
4249-5					k u n i					
448-5					l u b d l					
630-5					β á l e					
814-5					n u n g a					
1228-5					p j g					
1418-5					s i n g k j					
2026-5					t w					
2775-5					t u n g a					
3397-5					β á l					
3826-5					tʃ u k					
4040-5					e n					
4373-5					l á n i					
4384-5					i n oː					
84-5					t u t u					
116-5					f i p					
587-5					o n k o					
848-5					k u i					
1159-5					n oː					
1350-5					l j k					
1396-5					k ìì f u					
1430-5					i s a					
1767-5					á k					
2286-5					l a					
2317-5					β u k a					
2419-5					s e p					
2750-5					i tʃ s i					
3018-5					s u a					
3275-5					t a l a					
3441-5					s a n d a					
3885-5					t u n					
4192-5					β i n d a					
4260-5					s j					
4350-5					l e l g o					
278-5					ʃ a					
745-5					k a k					
3971-5					k a m a					
55-5					m á m a					
94-5					k u p					
2717-5					t k n d u					
4139-5					m u n					
200-5					β e					
374-5					t o l j a					
508-5					β i f u					
528-5					β á l i					
575-5					t w					
1137-5					β u u					
1339-5					k j					
1872-5					p j p					
2537-5					l u n					
2738-5					β á l					
2872-5					tʃ á s i					
2893-5					k u k p					
3675-5					l j l a					
4028-5					t w					
4238-5					i s a ʃ i					
4429-5					u s					
4485-5					s u					
2798-5					l j					
3531-5					a a l d d a					
3767-5					l i					
4632-5					a ʃ i					
1033-5					p o ʃ g o l					
3185-5					f i g					
649-5					l á l a					
1110-5					t e					
1263-5					t u f					
1273-5					l á l a					
1329-5					a a a					
1617-5					k u k					
1917-5					f u					
1969-5					k u n a					
2483-5					k á l					
2615-5					t a					
2700-5					t a n d a					
2884-5					n p					
2972-5					f e					
3030-5					l á p					
3261-5					tʃ e p e					
1303-6						k d n				
1755-6						l m ɔ				
448-6						k i n d				
1475-6						ɲ ɔ l				
3397-6						k u				
2286-6						s u				
278-6						s u				
2717-6						k i n b ɛ				
4137-6						k u				
3767-6						s u				
1033-6						t t n d n				
2689-7							k á ɲ a			
893-7							ɲ h k a			
1285-7							l			
1303-7							z o m a			
2197-7							z z ɲ r a			
2828-7							z i ɲ a			
3572-7							k o ɲ i			
1095-7							p i ɲ a			
1755-7							ɣ ɲ e			
1789-7							f a r m k a			
3519-7							k u ɲ a			
3686-7							i ŋ k a			
4249-7							k u ɲ i			
4451-7							i ɲ i			
814-7							o m d e			
1216-7							ɣ á z á z a			
1475-7							ɣ ɲ a			
2026-7							p r r k			
2775-7							u m d a			
3826-7							z o k a			
4003-7							h i k a			
4040-7							e ɲ i			
84-7							h u r u			
116-7							tʃ i h a			
181-7							ɣ o n dʒ o			
419-7							o k a			
587-7							o ŋ k o			
660-7							l l a			
848-7							p á a			
1122-7							tʃ i n a			
1159-7							v a			
1374-7							n h n a			
1396-7							k o f u			
1430-7							i ŋ ɲ o			
1906-7							i n ɣ i r a			
2177-7							k h z			
2419-7							z e h a			
3018-7							z i r a			
3275-7							p a n a			
3441-7							s á m k a			
3464-7							tʃ o ɲ a			
3639-7							f e t m k z a			
3885-7							z i m a			
4192-7							f i m z a			
745-7							k a k o			
3971-7							p a m a			
55-7							á m a			
2717-7							s e ŋ d a			
4139-7							i v a			
93-7							k o ɲ o			
459-7							u m a			
575-7							t a			
1712-7							tʃ u a			
2088-7							tʃ i ɲ a			
2166-7							u m k a			
2334-7							tʃ i ɣ e			
2393-7							m e ɲ a			
2537-7							r o m e			
2665-7							i z ɲ k i			
2997-7							h a k z a			
4028-7							k w e			
4316-7							k á t u			
4429-7							tʃ e v a			
4688-7							i k ɲ l a			
3067-7							n ɲ u			
3185-7							z i k a			
794-7							e k m k a			
143-7							s u			
388-7							h á u m a			
599-7							t a m k i			
836-7							s i m dʒ i			
969-7							i s a			
1110-7							t e m a			
1263-7							t u v a			
1329-7							i ŋ g r a			
1362-7							ɣ i i			
1606-7							o o t o			
1629-7							k i k			
1744-7							i ɣ a			
1917-7							tʃ u m a			
1989-7							z u ɣ e			
2037-7							dʒ ɣ t a			
2128-7							ɣ e m dʒ e			
2186-7							ɣ u m a			
2700-7							d á n d a			
2797-7							o m a			
2904-7							g a n z n a			
2972-7							s e			
3148-7							i t a			
3364-7							o k a			
2689-8								ŋ ô n a		
1285-8								ŋ ɛ ɛ a		
1303-8								t k ŋ n a		
2197-8								ʝ k ŋ ɛ i		
2828-8								ɣ ô n a		
3572-8								ŋ ô n u		
1755-8								k ŋ e		
1789-8								β i n m g a		
3207-8								f u ɛ a		
3519-8								k u n a		
3686-8								p u ŋ g a		
4249-8								k u n ɛ		
4451-8								β ɛ n ɛ		
814-8								t ɔ k ŋ b a		
1228-8								k ɛ ɛ a		
2026-8								k ɛ ɛ a		
2775-8								ʝ u k m b a		
3826-8								ʝ ô k a		
4040-8								k ô n ɛ		
181-8								t ɔ k m b a		
660-8								r ô w a		
848-8								k ô n a		
1083-8								w ô ɛ a		
1159-8								r a		
1350-8								r ô k a		
1396-8								ʝ ô β u		
1666-8								t i ŋ g u		
2177-8								m î ɛ d a		
2317-8								k u k a		
4260-8								ʃ ɛ ɛ a		
745-8								k ô k ɛ		
3971-8								k ô n a		
94-8								k u p a		
2717-8								ŋ g u ŋ g a		
4139-8								n ô k a		
43-8								k o d a		
575-8								k u a		
871-8								k ô n a		
1339-8								k i r a		
1585-8								r ô a		
1872-8								p k a		
2893-8								k u k g a		
4028-8								m w u		
4316-8								k ô k u		
4440-8								k ɛ ɛ ɛ		
4485-8								r u		
4688-8								ʝ î ŋ w i		
2798-8								m ɛ ɛ		
794-8								k u p á k a		
994-8								t b a		
1006-8								t u k m b a		
1043-8								r ô m a		
1617-8								r u k a		
1969-8								r u ŋ g a		
3364-8								ʝ ô k a		
2689-9									á n ʊ̀	
893-9									ɲ g g ʊ̀	
1285-9									n ʊ r a	
1303-9									n g e nː ʊ̀	
2197-9									z a l ʊ̀	
2828-9									z á n ʊ̀	
3572-9									z e n ʊ̀	
1095-9									á n a	
1789-9									m u ŋ g a	
3207-9									á n ʊ̀	
4249-9									k e nː ʊ̀	
4451-9									m i n i	
630-9									s á l ʊ̀	
814-9									n u m g e	
1228-9									g l n g	
1418-9									s i n g g g a	
1475-9									k w a	
2026-9									k á r a	
2775-9									s á m g a	
3397-9									s á l a	
3826-9									d á g e	
4003-9									g a	
4040-9									g e n ʊ̀	
4373-9									l i n ʊ̀	
4384-9									i w	
116-9									s á g a	
181-9									p á ŋ g e	
1083-9									i n a	
1374-9									n a e e	
1430-9									i ŋ s e	
1666-9									k u a nː e	
1767-9									g e k ʊ̀	
1906-9									p n g i l a	
2177-9									n g a g g	
2419-9									s á g a	
2750-9									z ʊ̀	
3018-9									s á l a	
3441-9									s á m g e	
3885-9									s á n a	
3981-9									u d g g a	
4260-9									s l n a	
4350-9									l á l g ʊ̀	
278-9									w a	
745-9									g e g ʊ̀	
55-9									d ʊ m e	
94-9									s o g a	
4139-9									m á n a	
200-9									z i	
528-9									s e l ʊ̀	
871-9									k o n a	
2088-9									m i g a	
2166-9									ʊ ɲ g a	
2334-9									z i g a	
2393-9									n á n a	
2537-9									d á m e	
2665-9									u ŋ n g e	
2738-9									s á e l ʊ̀	
2872-9									k á s e	
2997-9									s á m b a	
3075-9									k á a b a	
4238-9									d s o z i	
4429-9									d á s e	
4440-9									m i n i	
4485-9									s e	
4574-9									m a l a	
2798-9									n e a	
3067-9									n g i	
3767-9									l e	
4632-9									k e l ʊ̀	
1033-9									s o s l l a	
3185-9									s á g a	
240-9									u ŋ g a	
401-9									z a	
755-9									g u l a	
836-9									s á m b a	
1006-9									s u ŋ g a	
1744-9									á r a	
1989-9									s á g a	
2037-9									k k g a	
2128-9									k á m b a	
2186-9									k á nː a	
2483-9									k á l e	
2592-9									l a l a	
3030-9									l i g a	
3160-9									l ʊ r a	
2689-10										tsʰ i n a
893-10										o ɔ tsʰ t ɛ
1285-10										tsʰ m a
2197-10										t tsʰ á l i
2828-10										tsʰ e n a
1095-10										tsʰ i m a
1755-10										ɔ ɲ ʊ̀
3207-10										tsʰ i l a
3519-10										tsʰ ɔ n a
448-10										tʰ ɬʰ i
630-10										i i á l i
1216-10										t a tsʰ t t a
1418-10										kʰ i l tsʰ s l a
2775-10										b a tsʰ ʊ t a
3397-10										tsʰ ʊ l u
4373-10										l i r i
4384-10										i ɲ ʊ̀
84-10										χ χ χ ʊ l a
1083-10										tsʰ i l a
1122-10										tsʰ ɔ d u
2286-10										l i
2317-10										tsʰ i f a
3018-10										tsʰ i l a
3275-10										t tsʰ á ɛ i
3464-10										tsʰ ɔ m a
3639-10										t i i tsʰ t a
3885-10										pʰ i d a
3981-10										i tsʰ a
94-10										ʊ a
4139-10										ɔ t a
43-10										t i ŋ d i
374-10										t ɬʰ tsʰ l l a
459-10										tsʰ ɔ d u
508-10										kʰ i d u
871-10										tsʰ ɔ n a
1712-10										b u l u
2893-10										pʰ i ŋ a i
3075-10										χ a l ʊ d u
3531-10										o i á ʊ s a
794-10										b a χ k ʊ
1032-10										kʰ tsʰ ɛ l a
2797-10										l e d u
