COGID	dutch	english	french	german
1469-1	z ɛ n t			
2047-1	w ɑ n ə ə			
2054-1	m ɛ n j ə r			
1375-1	m ɛɪ k l ə m			
760-1	w ɪ n t			
756-1	s n ɑu w			
726-1	m aː d ə r			
1351-1	k l ɛɪ n s + n uː d ə			
1353-1	k l ɛɪ n + h uː d ə			
412-1	v v aː œy + d ə r ə ɔ ə ə ə			
406-1	v v aː œy + d ə r ə ɔ ə ə ə			
1005-1	v v ɑ n + h aː d ə			
1012-1	v v ɔ r + h uː d ə			
1016-1	l ə d ɛɪ aː + r b m t			
1069-1	d aː k			
509-1	v aː l ə			
693-1	v l ɑ n + + + b eː			
2179-1	n ɛ n t			
1753-1	v x ʉ m ə			
1131-1	w ɑu l t			
1198-1	b ɑu ɔ r t			
2032-1	h aː r t			
2241-1	m ɔ ŋ			
2244-1	r ɪ k t			
610-1	k n			
945-1	h aː r t			
1534-1	r aː x			
384-1	m eː ɣ			
1650-1	s ʉ ɔ			
1663-1	h ɑ l t			
2279-1	l ɑu l ə			
471-1	b ɑu x ə			
1385-1	m ɛ d ə			
792-1	r ɔ n			
1111-1	h ɪ n t			
197-1	m eː d ə			
2020-1	l ɛɪ n			
867-1	h uː n d ə r ɑ t			
1970-1	v ɑu l t			
1230-1	m r ɑ k l ə m			
2017-1	s ɛ ʉ ə m			
968-1	m ɛ d ə l t			
1674-1	l ɪ n t			
1671-1	m eː ɣ ə			
829-1	k l ɛɪ m			
1025-1	w ɑ ŋ ə r			
1027-1	z ɛɪ			
1832-1	r ɑu n			
-1816-1	aː m aː w ə			
-335-1	l aː x ə			
1043-1	s t r r m			
423-1	s t eː			
2049-1	m ɪ n t			
2062-1	s t ʉ r m			
2065-1	v aː v ɔ n + + eː k ə			
1368-1	s x eː d ə			
1365-1	d l ɑu w			
754-1	r aː x ə			
768-1	w aː n ə r			
1211-1	v r r			
106-1	l ɑ n			
-98-1	b aː p			
719-1	v aː v ə r			
1341-1	l ɔ n			
-2027-1	k ɪ n t			
-2026-1	n ɛ x ɛɪ			
409-1	v v aː v ə r + m ɑ n ə			
402-1	v v aː v + d ə r ə ə ə ə			
1014-1	v x ə n + d ɔ n t ə r			
1059-1	w iː l			
120-1	s t ɑ l			
2183-1	s t ɛ r t			
2194-1	j k ŋ			
2199-1	k ɑ l k			
2197-1	s t ɔ			
1523-1	h aː j			
1521-1	b eː k			
512-1	m aː r			
2141-1	h aː n			
2147-1	k ɑ n t			
814-1	k r aː w ə			
810-1	b eː n			
1755-1	k h ɪ n t			
1758-1	l ɑ n			
1760-1	r ɔ t			
1620-1	w ɑ ŋ ə			
1282-1	w ɔ l ə ə m			
1136-1	v ɔ k s			
1309-1	l ɛɪ n			
1307-1	n iː ŋ			
1305-1	v l ɑu			
711-1	w ɛ s t			
1442-1	v l øː ɣ			
62-1	m ʉ k			
-73-1	m eː n t ə t			
1810-1	h ɛɪ t			
1805-1	v l ɑu n			
1813-1	h aː uː r			
1811-1	b l ɑ t			
690-1	r eː ts			
2177-1	h aː r t			
246-1	v ə r + ɔ n d + eː ə ə t			
249-1	aː x ɔ n ə l ə t			
1506-1	v aː s r l ɑ n + + l ə ə t			
2242-1	m ɪ n t			
2245-1	w ɔ ŋ			
1196-1	n eː x			
2174-1	s x ɛ l t ə r			
575-1	aː v t ə r + h ɑu ə			
603-1	r ɔ n + + eː k ə			
601-1	h ɪ n t			
615-1	w ɛ ŋ k ə r			
901-1	k l uː ə ə			
608-1	h ɔ k			
596-1	t aː n			
937-1	b b r ɔ s t			
936-1	m aː d ə l			
646-1	j ʉ ŋ			
947-1	r iː v ə r			
1606-1	h ɪ s t			
472-1	m n eː t ə			
1535-1	s m ɪ ɣ ə			
1546-1	s x aː k			
1959-1	s l eː p ə			
694-1	s w ɛ r v ə			
1961-1	k r aː m ə			
323-1	ɛ x l aː v ə			
1885-1	k r ɑu m			
2156-1	v ə r + b r r d ə ə n			
1903-1	w ɛ n k			
525-1	s w ɑ l ə			
276-1	l ɛɪ m ɛɪ			
274-1	d ɑ p			
278-1	b l ɪ n t			
258-1	b ə + d r aː ŋ k ə			
256-1	n œy k ə t			
383-1	eː m ə			
207-1	r ɔ n			
376-1	k r ɪ ŋ k ə			
2009-1	oː v ə			
2003-1	x oː t ə l			
2024-1	w ɑ ŋ ə			
1321-1	k aː p			
1976-1	h ɑ n m			
1243-1	v ə n + ɑ + ɑ n t t			
1265-1	b ɑ l ə			
1261-1	h eː x ə			
655-1	b r ɑ t			
650-1	d aː x			
1532-1	k r aː ɣ ə			
-36-1	m ʉ k			
34-1	b oː n ə			
-1647-1	w eː ɣ ə			
-1615-1	w iː l ə			
125-1	w ɛɪ t			
1659-1	h ɛ n ə			
1661-1	m iː l t			
1676-1	b oː d ə r			
480-1	b ə + d r ə n t			
1466-1	k l aː v ə			
2277-1	w ɑu l			
2271-1	v ɑu l t			
2293-1	r aː n ə r			
624-1	s x ɪ ŋ ə			
628-1	s p ɛ ŋ d ə			
626-1	w eː d ə			
633-1	m aː d ə l m			
1185-1	v oː ɛɪ r + ɔ n d ə r			
1179-1	h ɔ t			
2168-1	k aː m			
1952-1	d ɑ l			
899-1	m aː d ə r			
922-1	b ɛɪ t			
-934-1	l ɛ l k			
916-1	k r ɔ n			
1726-1	w aː l t			
2108-1	v l aː ɣ ə			
1133-1	v ɛ r k			
2114-1	s x aː d ə			
1272-1	r aː x ə			
1979-1	x r ɔ n			
1989-1	h aː j			
-2260-1	v l ɛ ŋ k ə			
70-1	b uː ŋ			
-89-1	v aː n + r + + s t eː t			
-12-1	w ɔ ŋ			
713-1	w ɔ f t			
747-1	n eː m ə l			
308-1	d eː n			
289-1	k ɪ n k ə			
1930-1	b r aː v ə			
1928-1	s p ɑ r ɛɪ t ə			
858-1	d ə r s t r aː k ə			
1577-1	h aː l ə			
908-1	w eː ŋ ə			
648-1	b oː l ə			
1855-1	h eː l ə			
657-1	h eː v ə r			
2058-1	m eː ɣ ə			
949-1	v l ɛɪ + + s n eː n			
1642-1	k ɪ n t			
1640-1	w ɑ l v ə			
1633-1	ɑu l ə			
1630-1	b ɛɪ n			
993-1	k l ɛɪ t			
-2121-1	m ɑu l ə			
1692-1	v eː l ə			
1694-1	k r aː ɣ ə m			
1062-1	h ɛ ŋ k ə			
476-1	s ɛ ɑ ŋ ə			
1051-1	v l aː ɣ ə			
1075-1	b r aː v ə			
135-1	z l aː v ə			
-134-1	d ɛ r v ə			
1839-1	b + ɣ l ə			
1097-1	v r ə + + z aː m ə ə ə ə			
1777-1	w ɔ r k ə			
1434-1	b r aː ŋ ə			
1417-1	m oː d ə			
1424-1	r ʉ x ə			
778-1	p aː t			
790-1	b r ʉ t			
1223-1	b oː d ə l			
1117-1	v oː ɣ ə			
1411-1	h aː x ə			
1407-1	v oː r r + h ɑu d ə			
1390-1	z ɑ l			
2086-1	x oː w ə			
2082-1	v ə r ɑ m + + eː v ə			
576-1	v eː ŋ ə			
579-1	v ɛ r k ə			
581-1	v ə r + l aː l ə			
-1791-1	r ɑ n			
-225-1	b r eː t			
-2284-1	k l ɑ t			
1479-1	j v l ə ə			
847-1	h aː k			
659-1	b oː x ə			
860-1	m ɪ d m			
213-1	r ɛ n t			
1286-1	h aː r			
1293-1	m ɛ s t ə			
474-1	z iː k			
467-1	z ɑ n			
1177-1	d ɑ f			
588-1	v l ɑ k			
584-1	h aː x			
-1153-1	r ɪ n t			
700-1	s w eː l t			
875-1	m oː p ə t			
1559-1	ɑ l			
1565-1	m ɑ l			
1968-1	h ɛ r s t ə			
-350-1	b uː aː r			
1478-1	b oː x ə			
1469-2		s ɛ n		
2047-2		s ɛ f		
2054-2		d ɛ n d		
1375-2		l ɪ f eɪ		
760-2		w ɛ n t		
756-2		s n ɔ r		
726-2		m ʌ d		
1351-2		ɡ r ɪ tʃ + f ɔː t ə n		
1353-2		ɡ r æ b + r ɔː t ə n		
412-2		s p r ɛ d aʊ + t t t t		
406-2		s p r ɛ d aʊ + t t t t		
1005-2		p æ tʃ p r ɔː t ə n		
1012-2		p æ l + r ɛ t ə n		
1016-2		r ɪ r ɑː ɔː t ə r		
1069-2		t ɪ f		
509-2		v iː l ɪ		
693-2		p əʊ æ n + ɔː s ə n		
2179-2		n əʊ s t		
1753-2		f ɔ m		
1131-2		w iː l k		
1198-2		b ɑː k k		
2032-2		f ɔː n		
2241-2		n æ s		
2244-2		l ɪ f		
610-2		l aɪ ɪ		
945-2		f ɔː k		
1534-2		l ɪ f		
384-2		s iː k		
1650-2		s r ɔ ɡ		
1663-2		s aɪ l t		
2279-2		l ɪ n		
471-2		s iː n		
1385-2		s aɪ f t		
792-2		j aɪ f		
1111-2		l əʊ s t		
197-2		s ɪ d		
2020-2		l aɪ n		
867-2		s ɛ n d l̩ k t		
1970-2		f æ l		
1230-2		əʊ r ɑː n		
2017-2		n w æ r		
968-2		w æ l̩ t		
1674-2		l ɛ n t		
1671-2		h v l̩		
829-2		k l aɪ m		
1025-2		m ʌ v		
1027-2		θ aɪ		
1832-2		r æ m		
-1816-2		ʌ s eɪ m		
-335-2		l eɪ ɡ n̩		
1043-2		ʃ k r æ m		
423-2		s t eɪ n		
2049-2		ɡ æ əʊ		
2062-2		s w ɑː m		
2065-2		p ɪ r aɪ n + d ɔː n		
1368-2		s m l d r		
1365-2		d b ə r		
754-2		r eɪ k		
768-2		w aɪ d		
1211-2		f l ə l̩		
106-2		ɡ əʊ		
-98-2		b eɪ p		
719-2		s ʌ d		
1341-2		s əʊ		
-2027-2		t ɛ n t		
-2026-2		n æ v r		
409-2		æ n + s ʌ + aʊ t		
402-2		n + d ɔː d aʊ t t t t t		
1014-2		ɡ æ n + d ɔː t ə n		
1059-2		w aɪ f		
120-2		s b ɔː l̩		
2194-2		ʌ k s		
2199-2		k ɑː l m		
2197-2		s n ɔ f		
1523-2		s əʊ		
512-2		h ɜː		
2141-2		ɡ əʊ		
2147-2		ɡ əʊ n		
814-2		ɡ r ɔ ɪ		
810-2		h s		
1758-2		l iː		
1760-2		r æ k		
1620-2		h		
1282-2		w ɔ l v ɪ n		
1136-2		f ɔː ɡ		
1309-2		l iː		
1307-2		n æ		
1305-2		f l eɪ		
711-2		w əʊ z k		
1442-2		f l əʊ		
62-2		h		
-73-2		p ɪ ŋ k t		
1810-2		h ɔ t		
1805-2		f l ɔ ɡ		
1813-2		h r		
1811-2		f l ɔː t		
690-2		r ɔ t		
2177-2		h əʊ s t		
246-2		ɪ + r r b d ə ə r		
249-2		ɪ əʊ m + l ɪ k		
1506-2		r d t ə r		
2242-2		s ɛ n t		
2245-2		h ɔ n		
2174-2		s s əʊ l d		
603-2		r æ r + d əʊ n		
601-2		s ɛ n t		
615-2		f əʊ ŋ k l̩		
901-2		k l aɪ		
608-2		s ɔ f		
596-2		t ɛ n		
937-2		b ɔ ɔ ɡ t		
936-2		n ʌ v l̩		
646-2		r aɪ		
947-2		r ɪ v ə r		
1606-2		ʃ əʊ v d		
472-2		əʊ l əʊ		
1535-2		s ɛ əʊ d		
1546-2		s n eɪ n		
1959-2		s l əʊ		
694-2		s n ɑː d n̩		
1961-2		ɡ r eɪ k		
323-2		əʊ l l əʊ m		
1885-2		ɡ r eɪ n		
2156-2		ɡ r + d ɔː r d + t ə n		
1903-2		w əʊ n t		
525-2		s w iː l		
276-2		n æ m r		
274-2		d iː p		
278-2		k l aɪ m t		
258-2		b r ɔː t ə n		
256-2		n æ r t		
383-2		eɪ k		
207-2		r iː f		
376-2		ɡ r ɑː d l̩		
2014-2		d		
2009-2		eɪ k		
2003-2		k ɔ v ə l̩		
2024-2		h n		
1321-2		k ɔ p		
1976-2		t ɪ n t		
1243-2		p ɪ r tʃ r + + t ə k		
1265-2		b æ l ɪ		
1261-2		s iː n		
655-2		p r ɔ t		
650-2		d aɪ		
1532-2		ɡ n d		
-36-2		s aɪ d		
34-2		t ɛ n		
-1647-2		h		
-1615-2		w b l ɪ		
125-2		s aɪ d		
1659-2		h eɪ z ɪ r		
1661-2		w ɜː k		
1676-2		k ɔ p ə		
480-2		b m æ k		
1466-2		ɡ r aɪ d		
2277-2		w iː l		
2271-2		v æ l k		
2293-2		l eɪ d		
624-2		s d ɪ n		
628-2		ɡ d ɑː ŋ k l̩		
626-2		r iː n		
633-2		n æ k l̩ t		
1185-2		ɡ r æ n + d ɔː t ə n		
1179-2		h aɪ		
2168-2		k æ m		
1952-2		d aɪ		
899-2		m ʌ d		
922-2		p aɪ t		
-934-2		l ɑː k		
916-2		f r ɔ k		
1726-2		f æ l k		
2108-2		f l əʊ m		
1133-2		f əʊ k		
2114-2		s s l d		
1272-2		r eɪ k		
1979-2		ɡ r eɪ n		
1989-2		h eɪ l		
-2260-2		ɡ r æ n d		
70-2		p ɔ		
-89-2		r r æ d + + + ə t		
-12-2		ʃ aɪ d		
713-2		ʃ ɔ d n̩		
747-2		l ʌ v l̩		
308-2		d aɪ		
289-2		d ɑː d		
1930-2		ɡ r əʊ k		
1928-2		f l əʊ r ɛ d		
858-2		s p r əʊ k ə n		
1577-2		f l z əʊ k		
908-2		r iː k		
648-2		b iː l		
1855-2		ʃ + f iː l		
657-2		h v		
2058-2		h ʌ k l̩		
949-2		əʊ əʊ l d + m m æ n		
1642-2		ɡ əʊ t		
1640-2		f əʊ l v		
1633-2		iː k r		
1630-2		t əʊ		
993-2		ɡ l eɪ n		
-2121-2		r iː l		
1692-2		v iː l		
1694-2		ɡ r eɪ k r		
1062-2		s ɛ l k l̩		
476-2		s l əʊ		
1051-2		f l əʊ		
1075-2		f l əʊ		
135-2		ɡ ɑː d		
-134-2		d ɔ l d		
1839-2		p ɪ z + m æ n		
1097-2		æ n + d ɛ d + aʊ t t t		
1777-2		f əʊ l d		
1434-2		ɡ l eɪ k		
1417-2		m iː d		
1424-2		m eɪ k		
778-2		p ɔ t		
790-2		b ɑː k		
1223-2		k ʌ k l̩		
1117-2		s ʌ v l̩		
1411-2		h iː		
1407-2		p ɪ tʃ + f ɔː l t ə		
1390-2		θ aɪ		
2086-2		m eɪ n		
2082-2		r r æ d + f əʊ t ə n		
576-2		ʃ eɪ k		
579-2		f ɛ l d		
581-2		p æ m b r əʊ k ə		
-1791-2		r iː f		
-225-2		f r ɔ ɡ		
-2284-2		k l əʊ		
1479-2		ʌ s l		
847-2		h əʊ		
659-2		k ɔ d		
860-2		m ʌ d n̩		
213-2		r eɪ k k		
1286-2		f ɔː		
1293-2		w əʊ l d		
474-2		d ɪ k		
467-2		ɡ aɪ		
1177-2		t ɔ f		
584-2		h iː k		
-1153-2		r ɛ n t		
700-2		s w iː l m		
875-2		tʃ ʌ z t		
1559-2		æ l eɪ		
1565-2		h ɔː l		
1968-2		h ɔ l f d		
-350-2		p əʊ t r		
1469-3			ʃ o z ʀ	
2047-3			ʃ o z ʀ	
2054-3			l ɑ̃ s t e	
1375-3			l ə ʀ z e	
760-3			l a z ʀ	
756-3			f ʀ	
726-3			v a s	
1351-3			s s ɑ̃ l b l	
1353-3			s l t t ʀ t	
412-3			s s ɑ̃ s ɑ̃ s ɑ̃ t ʀ ʀ e e	
406-3			s s ɑ̃ s ɑ̃ s ɑ̃ t ʀ ʀ e e	
1005-3			s s t b ʀ	
1012-3			s s t t ʀ t	
1016-3			l ɑ̃ e ə a a ʀ b	
1069-3			t ɑ̃ z	
509-3			f a z	
693-3			s l t a b b l	
2179-3			ʃ ɛ s t	
1753-3			f p i t ʀ	
1131-3			l a	
1198-3			b ə i l	
2032-3			v a	
2241-3			ʃ o z	
2244-3			l ə v e	
610-3			ʀ ɛ z e	
945-3			ʃ ɛ	
1534-3			l ə v	
384-3			v a ɡ	
1650-3			f b u	
1663-3			ʃ o z	
2279-3			l ə v	
471-3			ʃ o t	
1385-3			ʃ o v e	
792-3			ʀ u z	
1111-3			ʃ o s t	
197-3			ʃ o v	
2020-3			ʀ ɑ̃	
867-3			s ɑ̃ t ʀ e	
1970-3			f a i ʀ	
1230-3			s s ɛ a a b	
2017-3			f ʀ ɛ l ʀ	
2183-3			ʃ p ɛ l ʀ	
1521-3			t y ɡ	
1755-3			p ʃ z ʀ	
1760-3			ʀ u t	
1196-3			v a ɡ	
575-3			ɑ̃ e s t t ʀ	
2014-3			l ɑ̃ s t	
1321-3			b u t	
1265-3			b ɔ	
588-3			v ɛ z	
1469-4				k ɪ n
2047-4				ʃ a x
2054-4				f v ŋ t ə r
1375-4				l ai x r r n
760-4				v ɪ n t
756-4				f r au
726-4				m aː f ə r
1351-4				ʃ r ɛ + h ʊ s ə r
1353-4				ʃ l ʏ + m ʊ s ə r
412-4				f z a d ə r t ə t n n n
406-4				f m ʊ d ə r t ə t n n n
1005-4				ʃ ts ɔ + + h au s ə r
1012-4				ʃ ɔ r + m ʊ s ə r
1016-4				v ɛ t iː ɪ n d ə r
1069-4				d a x
509-4				f a l ə n
693-4				ʃ r ɔ n r + ɛ s ə n
2179-4				r ɛ s t
1753-4				f eː ɪ x
1131-4				v a l s
1198-4				b au ai r t
2032-4				h eː r s
2241-4				m iː r ə
2244-4				l ai x n
610-4				v a n ə
945-4				h eː r t
1534-4				r ɛ x ə n
384-4				f ɔy ɡ ə n
1650-4				n oː a t
1663-4				h ɔ x t
2279-4				v oː n ə n
471-4				h a ə n
1385-4				z ai x n
792-4				v a x
1111-4				r a n t
197-4				t ɶː t ə n
2020-4				l oː n
867-4				b ə n t aː l ə n
1970-4				h iː l
1230-4				f ɛ ɛ ɛ r r ə n
2017-4				f l ɪ ə
968-4				v ɪ r ə l t
1674-4				l ɪ n t
1671-4				h aː f ə l
829-4				k l ɪ f t
1025-4				v aː d ə r
1027-4				z iː
1832-4				r au
-1816-4				aː ɡ l ə n
-335-4				r ɛ x ə n ə
1043-4				ʃ t r ɔ m
423-4				ʃ t ai f
2049-4				m a n ə
2062-4				ʃ t a r k
2065-4				h aː m ə r + b a f n n
1368-4				ʃ ɛː d ə r
1365-4				f oː au
754-4				r iː ɡ ə n
768-4				v a f ə n
1211-4				n ɔy ə r
106-4				l a n
-98-4				b ɛ t ə
719-4				f aː f ə r
1341-4				l oː n
-2027-4				k ɪ n t ə
-2026-4				ʃ aː m ɪ l
409-4				ə + ə n t n ɛ n l n n
402-4				f ɪ n d ə n t ə n n n n
1014-4				ʃ ɔ r + t ɪ n s ə r
1059-4				l ɛ t
120-4				ʃ t uː l
2183-4				ʃ t a r
2194-4				eː x ts ə
2199-4				k aː l s
2197-4				ʃ au p
1523-4				h oː f
1521-4				b au x
512-4				m ɛ r ə
2141-4				h ai n
2147-4				h a l s
814-4				k r aː ə n
810-4				ʃ ɪ f ə
1755-4				z a ɔ n t
1758-4				m oː n
1620-4				ɡ ɪ n t
1282-4				v a l b ə n
1136-4				h a l ʃ
1309-4				l ai n
1307-4				n iː t ə
1305-4				f l ai
711-4				v ɛ ɡ pf ə
1442-4				f l iː ʃ t
62-4				m ʏ ts ə
-73-4				m ɛː t t ɪ ts ə
1810-4				h ai t
1805-4				f r au ʃ
1813-4				n ai ə r
1811-4				b l a t
690-4				r ɪ x ə
2177-4				h ɔ f t
246-4				v f r + + l ə l
249-4				a n + t + l ə n
1506-4				f ai r + n h ʊ n r
2242-4				m ɪ n t
2245-4				b a ŋ ə
1196-4				n ʊ x ə n
2174-4				ʃ ɛ l t ə r
575-4				ʊ k m ə n + x x ə n
603-4				aː l ɛ + + k au n ə n
601-4				h ɪ n t
615-4				f ɪ ŋ k ə r
901-4				k l a n r
608-4				f iː t
596-4				k ai n t
937-4				b oː r ai s t
936-4				h au f ə l
646-4				v a ŋ ə
947-4				v ai f ə r
1606-4				h ai k ə n
472-4				ʃ n aː m ə n
1535-4				ʃ v iː d ə n
1546-4				ʃ ɔy ɡ ə n
1959-4				ʃ l iː d ə n
694-4				ʃ ɛ ŋ k ə n
1961-4				d r aː ɡ ə n
323-4				ɔ b l ai b ə n
1885-4				f r au f
2156-4				ɛ r b a l t + n ə n
1903-4				v oː n t n
525-4				ʃ v a ŋ ə r
276-4				l ai m ə
274-4				t oː f
278-4				k l ɪ n t
258-4				ɛ r + b r eː k ə n
256-4				r ɛ x ɪ n
383-4				iː d ə n
207-4				r ai t
376-4				k r ɪ ŋ k ə n
2014-4				r ɛ t r n
2009-4				uː f ə l
2003-4				k au f ə l
2024-4				b ɪ n ə
1976-4				b a ŋ ə n
1243-4				f ɪ l t + + + s ə n
1261-4				h a ɡ ə n
655-4				b r a t
650-4				t oː k
1532-4				ʃ m iː d ə n
-36-4				m ai t ə
34-4				b ai m ə
-1647-4				m ai f ə
-1615-4				v ai l ə
125-4				f iː t
1659-4				h oː l ə ŋ
1661-4				h yː l ə
1676-4				b ɶː t ə r
480-4				ɛ ə + b r eː n t
1466-4				k l iː s ə ŋ
2277-4				v a ŋ ə
2271-4				f ɪ n t
2293-4				l ai s ə n
624-4				ʃ ɛː l ə n
628-4				ʃ p ɛ ŋ d ə l
626-4				v iː n ə n
633-4				m aː d ə n t
1185-4				ʃ b ə n t ʃ ɪ + t ə r
1179-4				h ai t
2168-4				b au l
1952-4				t iː l
899-4				l aː d ə r
922-4				b ai t
-934-4				l ɛ s ə n
916-4				k r ɔ f
1726-4				f iː l t
2108-4				b l ai ɡ ə n
1133-4				f ɛ r ə
2114-4				ʃ ɛː d ə n
1272-4				r ɔy ɡ ə n
1979-4				f r au s
1989-4				h oː
-2260-4				b l ɛ x k ə n
70-4				b ai k ə
-89-4				m ɪ n ə r + + x ə n n
-12-4				b ai t ə
713-4				z ai t ə
747-4				ɡ eː d ə l
308-4				t oː n
289-4				k ɪ ŋ k ə n
1930-4				b r ɛ x ə n
1928-4				ʃ s + l ɛ s ə n
858-4				a ts ə + b r ɛ k ə n
1577-4				a ə + h aː n ə n
908-4				v iː n ə n
648-4				b au ə n
1855-4				a ə + h ai l ə n
657-4				h aː m ə r
2058-4				r oː ɡ ə l
949-4				ɛ r iː + + ʃ b ai n
1642-4				h ɔ l t
1640-4				f a r b ə r
1633-4				aː r ə r
1630-4				t ai n
993-4				f l a t
-2121-4				r aː l ə n
1692-4				f a l ə n
1694-4				d r aː t ə l ə
1062-4				h ɪ ŋ k ə n
476-4				ʃ v a ŋ ə n
1051-4				f l iː ɡ ə n
1075-4				b l aː b ə n
135-4				ʃ m iː b ə n
-134-4				k aː r b ə n
1839-4				v ɛ r + h eː n n
1097-4				f ɛ z a m ə x t n n n
1777-4				f ɛ r ɡ ə n
1434-4				b r ai ɡ ə n
1417-4				v ai t ə n
1424-4				r ɶː t ə n
778-4				ts aː f
790-4				k r aː ɡ ə
1223-4				b ɛ t ə l
1117-4				z au x ə n
1411-4				h a f ə n
1407-4				f ɛ s t + h a l d ə n
1390-4				t iː l
2086-4				ɡ iː ɡ ə n
2082-4				ɛ + ɡ ʊ s ə n
576-4				h iː s ə n
579-4				f ɪ ŋ k ə n
581-4				f ɛ r + r iː k ə n
-1791-4				r au x
-225-4				k r ai t
-2284-4				b l a t
1479-4				v p t ai n ə
847-4				h oː f
659-4				b au t ə l
860-4				m aː ɡ
213-4				r ɛ k t
1286-4				f iː r t
1293-4				v ɛ s t ə n
474-4				d a x
467-4				t a l
1177-4				t iː t
588-4				f l a t
584-4				h ʊ k ə n
-1153-4				r ɪ n t
700-4				ts v ai k t
875-4				k uː z ə n t
1559-4				aː l iː
1565-4				f iː l
1968-4				h ɛ r s t ə
-350-4				b au ə r
1478-4				b au t ə l
