COGID	Amharic	Argobba	Chaha	Endegagn	Ezha	Geez	Gumer	Gura	Gyeto	Harari	Inor	Kistane	Mesqan	Muher	Silte	Tigre	Tigrigna	Wolane	Zway
638-8								s ɨ n e											
645-8								kʼ a											
75-8								ʔ a m b ɨ r											
160-8								tʼ ə r ə kʼ											
208-8								ʔ ɨ n kʼ w kʼ r											
214-8								ʔ a p a											
218-8								ʔ ɨ n z ɨ r											
378-8								ʔ a n g ə t											
379-8								ʒ ə tʼ ə											
409-8								g a t ə r ə											
497-8								t ə n											
598-8								h w e t											
646-8								ʔ a x ə											
164-8								b ə k ə m											
210-8								ʒ ə h w ə r ə											
215-8								ʔ a t e p ə t											
256-8								t u mː a											
285-8								m ɨ d a d											
332-8								ʔ ə g ɨ r											
380-8								ʔ ə h w a											
412-8								s a h ɨ n											
496-8								w ɨ r s ə n p ə t											
64-8								d a p o											
67-8								w ɨ r											
169-8								n ə r ə z ə m ə											
251-8								kʼ ɨ kʼ ə											
294-8								mː w kʼ p											
461-8								tʼ ə											
547-8								w ɨ z a t											
597-8								ʔ e m ə n ə ə											
655-8								m ɨ k t											
7-8								ʔ a g a											
158-8								kʼ ə m ɨ s											
168-8								ʔ ɨ m a r											
296-8								tʃʼ ə h u t											
374-8								b ə kʼ o ʒ o											
385-8								w ɨ tʼ ə t											
500-8								ʔ ɨ m ɨ r											
6-8								m ə r k a m a											
17-8								ʔ ə x ɨ r											
123-8								k e m ə m											
252-8								n ə k ə p ə m											
421-8								b ɨ ʒ a											
448-8								kʼ ə t a n s ə n b ə t											
449-8								ʔ a ʒ ə											
545-8								h ɨ n o w											
596-8								n ə g ə											
653-8								p ə t ɨ t											
4-8								g ɨ n ʃ ə											
8-8								kʼ ə p ə t o											
254-8								dʒ ɨ m a a											
290-8								ʔ a g ə tʃʼ ə m											
339-8								b ə kʼ ɨ r											
460-8								h ɨ t t											
489-8								b w r tʃ tʃʼ mː a a											
552-8								z ɨ											
652-8								ʔ ə t ə e ə											
3-8								h ɨ n ə											
119-8								ʔ a n g a tʃ a											
298-8								h u t											
340-8								g w ə tʃ tʃ											
458-8								d ə n g ə n ə											
459-8								ʔ a s ə											
607-8								ʔ ə k w a											
609-8								ʔ ɨ x a											
10-8								tʼ ɨ kʼ u r											
15-8								ʔ ɨ n ɨ m											
18-8								n ɨ kʼ i i ə											
73-8								tʃ ə k w r r ə											
76-8								m w ə s a											
121-8								t ɨ k ə											
167-8								g ɨ i ə											
255-8								kʼ w ə n tʃ ə											
297-8								g u n ə r											
299-8								g u n ə r											
338-8								m ə m ɨ r											
342-8								m e n a											
344-8								kʼ ə s ə m											
410-8								kʼ a r ɨ a											
540-8								n e p a											
550-8								dʒ ə n dʒ ɨ r											
61-9									d ə m										
63-9									ʔ a tʼ i m										
107-9									g a m ai̯ a										
112-9									d a b ə r a										
331-9									n tʃ g w s										
377-9									b ə kʼ u r ə										
381-9									ʔ a t										
417-9									r u z										
451-9									s ə b a t										
454-9									ʔ a tʃ i r										
484-9									s i d i s t										
535-9									ʔ a s i r										
543-9									s a s t										
593-9									ʔ a m u s										
640-9									m a n										
1-9									d ə p ə r ə										
65-9									tʼ u b										
163-9									s ə tʃ ə										
212-9									ʔ ai̯ n										
244-9									ʔ a r b ə t										
248-9									m u a										
293-9									f ə r ə z										
373-9									kʼ i m a										
408-9									b a a										
414-9									d i b a kʼ u a										
601-9									ʔ ə r b b										
642-9									n i f a s										
60-9									n ə f ə s ə										
209-9									s tʃ m u t										
242-9									ʔ a m i s t										
415-9									z i r a b										
490-9									tʼ ə p w ə										
638-9									s i n ai̯										
645-9									kʼ a										
75-9									ʔ a m p i r										
160-9									tʼ ə r ə kʼ										
208-9									ʔ a n kʼ w tʃ r										
214-9									ʔ a b a										
218-9									ʔ i ɲ w i r										
378-9									ʔ a n g ə t										
379-9									ʒ ə tʼ ə										
409-9									g ə t ə r ə										
497-9									t ə n										
598-9									x w ai̯ t										
646-9									ʔ a x ə										
164-9									b ə k ə										
210-9									ʒ ə x w r r ə										
215-9									ʔ a t ai̯ p b t										
256-9									t u m a										
285-9									m i d a d										
332-9									ʔ ə g tʃ r										
380-9									ʔ a x w a										
412-9									s a x a n										
496-9									w u r s ə n p ə t										
64-9									d a p a										
67-9									w i r										
169-9									n ə w ə z ə p ə										
251-9									f ai̯ kʼ ə										
294-9									m w kʼ p										
461-9									tʼ ai̯										
547-9									w i z a t										
597-9									ʔ ai̯ m g n a										
655-9									m i k t										
7-9									ʔ a g a										
168-9									ʔ i m a r										
296-9									k ə x u t										
372-9									k ə n f ə r										
374-9									b ə kʼ w ʒ ɲ										
375-9									s ə b										
385-9									w i tʼ ə t										
411-9									t ə r a s										
500-9									ʔ i m i r										
541-9									kʼ ə tʃ ɨ n										
6-9									m ə r k a m a										
17-9									ʔ ə x i r										
113-9									b g a										
123-9									k ai̯ m ə										
252-9									n ə k ə b ə										
421-9									b i ʒ a										
448-9									kʼ ə d a n s ə n b ə t										
491-9									d ɨ n g ə t										
545-9									x i n a										
596-9									n ə g ə										
653-9									p ə t i t										
4-9									g i ɲ ʒ ə										
8-9									kʼ ə b ə t a										
254-9									dʒ ɨ m a t										
339-9									b ə kʼ i r										
489-9									p ə r tʃ u m a										
552-9									w i										
652-9									ʔ ai̯ t ai̯ t a										
119-9									ʔ a n g a tʃ a										
298-9									x u t										
340-9									g w n tʃ ə										
458-9									d ə n g ə ɲ ə										
459-9									ʔ a s a										
486-9									n ə tʼ ə kʼ ə										
607-9									ʔ ə k w a										
609-9									ʔ i x a										
10-9									tʼ i kʼ u										
15-9									ʔ i n i m										
18-9									n i kʼ i ə										
73-9									tʃ ə k w r r ə										
76-9									m w ə s a										
110-9									d a t a										
121-9									t i k ə										
167-9									g i j ə										
255-9									kʼ w ə ɲ tʃ ə										
297-9									g u n ə r										
299-9									g u n ə r										
338-9									p ə m i r										
342-9									m ai̯ n a										
344-9									kʼ ə s ə m										
550-9									dʒ ə n dʒ i r										
612-9									ʔ a b										
61-10										l ə b									
63-10										ʔ a tʼ əi̯ b									
107-10										g a r ə l a									
112-10										l a b ə a									
331-10										g i g w ʃ									
377-10										b ə kʼ l kʼ									
381-10										ʔ a tʼ									
417-10										r uː z									
451-10										ʃ ə b a									
454-10										ʔ a tʃʼ i r									
484-10										ʃ i tʼ əi̯ ʃ tʼ									
535-10										ʔ a tʼ əi̯ r									
543-10										r ə w tʼ									
593-10										ʔ a b uː ʃ									
640-10										b a m									
1-10										l ə b ə r ə									
65-10										tʼ ɨi̯ b									
163-10										ʃ ə kʼ ə									
212-10										ʔ ɲ g									
244-10										ʔ a r b o									
248-10										b uː l i									
293-10										f ə r ə tʼ									
373-10										kʼ uː b a l									
408-10										b ə r a									
414-10										l uː b a kʼ l									
601-10										ʔ ə r b b									
115-10										l ə r									
209-10										ʃ uː tʼ uː t									
242-10										ʔ a tʼ i ʃ									
415-10										z i a b									
490-10										tʼ ə b uː									
160-10										tʼ ə r ə kʼ									
208-10										ʔ i g kʼ w kʼ a									
218-10										ʔ i z kʼ i									
378-10										ʔ a g g ə tʼ									
379-10										f ə tʼ ə									
497-10										tʼ ə g									
598-10										f w ɲ ʔ									
646-10										ʔ a tʼ a									
164-10										b ə kʼ o									
210-10										dʒ ə l w o kʼ									
256-10										tʼ uː ɲ a									
285-10										r əi̯ tʼ a l									
380-10										ʔ a l w									
412-10										ʃ a l ə g									
64-10										l a kʼ kʼ									
169-10										b o r ə z ə b									
461-10										tʼ o									
547-10										w a z a									
411-10										tʼ ə r a ħ									
541-10										kʼ ə kʼ i m									
113-10										b uː g a									
123-10										f ə kʼ ə									
491-10										l əi̯ g g ə tʼ									
254-10										f i m aː tʼ									
339-10										b a kʼ a									
602-10										m i g									
2-10										f uː l ɨi̯ ɲ									
213-10										ʔ a r aː l									
647-10										tʼ ə tʼ a tʼ									
211-10										w i s i									
328-10										ʃ ə tʼ ə b ə ħ									
333-10										m i ʃ u r									
612-10										ʔ aː r b b									
109-10										g ɨi̯ m kʼ ə									
61-11											d ə m								
63-11											ʔ a k ɨ m								
107-11											g a m ə a								
112-11											d a b ə r a								
331-11											n ɨ g w sː								
377-11											b ɨ p u r ə								
381-11											ʔ a d								
417-11											r u z								
451-11											sː ə b a d								
454-11											ʔ a p i r								
484-11											sː ɨ ʒ ɨ sː t								
535-11											a sː ɨ r								
543-11											sː ɨ sː t								
593-11											f a m u sː								
640-11											m w a								
1-11											d ə p ə r ə ɨi̯								
65-11											k u w								
163-11											sː ə p ə								
212-11											i n								
244-11											a r p ə ʔ								
248-11											m u a ʔ								
293-11											f ə r ə z								
373-11											p ɨ m a r								
408-11											b ɨ r a								
414-11											d ɨ b a p u i a								
601-11											ə r b p								
642-11											n ɨ f a sː								
60-11											n ə f ə sː ə								
115-11											ə r a m								
209-11											sː ɨ m u t								
242-11											a m ɨ sː t								
450-11											z ə r								
490-11											k ə p w ə								
638-11											sː ɨ n i								
645-11											p a								
75-11											ʔ a m b i r								
160-11											d ə r ə p								
208-11											ʔ a n p w f r								
214-11											a p								
218-11											ʔ ɨ n z i r								
378-11											ʔ a n g ə t								
379-11											ʒ ə k ə								
409-11											g ə d ə r ə								
497-11											t ə n								
598-11											k w k ʔ								
646-11											ʔ a ʔ ə								
164-11											b ə k ə ɨi̯								
210-11											ʒ ə k w ə r ə								
215-11											ʔ a t i b ə d								
256-11											d u m a								
285-11											m i k a d								
332-11											ʔ ə g ɨ r								
412-11											sː a k a n								
496-11											w u r p ə n p ə t								
64-11											d a p i								
67-11											w ɨ r								
169-11											b ə r ə z ə z ə								
251-11											f ɨ p ə								
294-11											m w p p								
461-11											m ə								
547-11											w ɨ z a t								
597-11											ʔ ə r g ɨ ə ə								
655-11											m i k d								
7-11											a g a								
168-11											ʔ ɨ m a r								
296-11											z ə k u d								
372-11											k ə n f ə r								
374-11											b ə k e ʒ i								
375-11											r ə b								
385-11											w ɨ m ə d								
500-11											ʔ a m i r								
541-11											p ə p ɨ n								
6-11											m ə r k a m a								
17-11											ʔ ə k i r								
252-11											n ə k ə b ə								
421-11											b i ʒ a								
448-11											p ə d a n s ə n b ə t								
449-11											ʔ a ʒ ə								
491-11											d ɨ n g ə d								
545-11											k i n ə								
596-11											n ə g ə								
653-11											p ə t a d								
4-11											g i n ʒ ə								
106-11											m ə m a ɨi̯								
254-11											dʒ i m a t								
339-11											b ə p a r								
460-11											k i a d								
489-11											p w r p u z a a								
652-11											ʔ ə t ə d								
3-11											k i n ə								
119-11											ʔ a n g a dʒ a								
298-11											k u d								
340-11											g w ə dʒ ə ə								
458-11											d ə n g ə p ə								
486-11											n ə k ə p ə								
607-11											ʔ ə k w a								
609-11											ʔ i g a								
15-11											ʔ ɨ n a p								
18-11											n a p i ə ə								
73-11											dʒ ə k ə r ə								
76-11											m w ə s a								
110-11											d a t a								
121-11											d ɨ k ə								
167-11											g ɨ z ə								
255-11											p w ə n dʒ ə								
297-11											g u n ə r								
299-11											g u n ə r								
342-11											m ə n a								
344-11											p ə s ə m								
550-11											dʒ ə n dʒ a r								
109-11											g g n p ə								
61-12												d ə m							
63-12												ʔ a mː ɨ m							
107-12												g a m o a							
112-12												d a b ə n a							
331-12												n ɨ g w s							
377-12												b ə kʼ w o							
381-12												ʔ a t							
417-12												r tʃʼ z							
451-12												s ə b a t							
454-12												ʔ a tʃʼ ɨ r							
484-12												s ɨ dː ɨ s t							
535-12												ʔ a s ɨ r							
543-12												s o s t							
593-12												f a m w s							
640-12												m w n							
1-12												d ə b ə r ə m							
65-12												mː w b							
163-12												s ə tʃʼ ə							
212-12												ʔ o n							
244-12												ʔ a r b ə t							
248-12												m w a							
293-12												f ə r ə tʃʼ							
373-12												kʼ ɨ m a							
408-12												b ə r a							
414-12												d ə b a kʼ							
601-12												ʔ ə r o b							
642-12												n ɨ f a s							
60-12												n ə f ə s ə m							
115-12												lː ə r a m							
209-12												s ɨ mː w n							
242-12												ʔ a mː ɨ s t							
415-12												z ɨ n a b							
450-12												z ə r							
490-12												mː o b w							
638-12												s ɨ r o							
645-12												kʼ a							
75-12												ʔ a m f ɨ r							
160-12												dː ə r ə kʼ							
208-12												ʔ ɨ n kʼ w f							
214-12												ʔ a b							
218-12												ʔ ɨ sː z ɨ m							
378-12												ʔ a n g ə t							
379-12												dː ə tʃʼ ə							
497-12												t ə n							
598-12												k w oi̯ t							
164-12												b ə f ə m							
210-12												dː ə k w ə ə							
215-12												ʔ a tː o b ə t							
256-12												t w mː a							
285-12												m ɨ d a d							
332-12												ʔ ə g ɨ r							
380-12												ʔ ə k w a							
412-12												s a k ɨ n							
496-12												w ə r b ə n m o t							
64-12												d a b o							
67-12												w ɨ r							
169-12												b ə r ə z ə m							
251-12												f ɨ kʼ							
294-12												m w kʼ							
461-12												mː o							
547-12												w ɨ z a t							
597-12												ʔ o m ə o o							
655-12												m ɨ dː t							
7-12												ʔ a lː g a							
168-12												ʔ ɨ m a r							
296-12												tʃʼ ə k w t							
372-12												tʃʼ ə n f ə r							
374-12												b o dː o lː o							
385-12												w ɨ mː ə t							
500-12												ʔ ɨ m ɨ r							
6-12												m ə tʃʼ a m a							
113-12												b tʃʼ n							
123-12												lː o m ə m							
330-12												kʼ ə lː d							
421-12												b ɨ dː ə							
448-12												kʼ ə dː a n s o n ə t							
449-12												ʔ a j ə							
491-12												d ɨ n g ə t							
545-12												k ɨ n o							
596-12												n ə g ə							
653-12												f ə t ɨ t							
4-12												g ɨ n dː ə							
8-12												kʼ ə b ə mː o							
106-12												m ə tʃʼ a m							
460-12												k i ɨ t							
552-12												z ɨ							
602-12												m ɨ n							
2-12												f w lː ɨ							
3-12												k ɨ n ə							
119-12												ʔ a n g a k a							
213-12												ʔ a r ai̯ f ɨ							
340-12												g w o f ə							
458-12												d ə n g ə ɲː ə							
607-12												ʔ ə k w a							
609-12												ʔ ɨ k a							
647-12												t ə t a							
10-12												mː ɨ kʼ w r							
110-12												d a dː a							
152-12												ʔ a n o							
211-12												w ə f i tː							
255-12												kʼ w ə o tʃʼ o							
297-12												g tʃʼ n ə r							
299-12												g tʃʼ n ə r							
328-12												s ə dː ə b ə m							
333-12												mː ɨ mː ɨ r							
334-12												ʔ a n b ə sː a							
338-12												m ə m ɨ r							
410-12												kʼ a r ɨ							
540-12												lː ɨ b a							
109-12												g w n tʃʼ o							
61-13													d ə m						
63-13													ʔ a tʃʼ ɨ m						
107-13													g a m e a						
112-13													d a m ə n a						
331-13													n ɨ g w s						
377-13													bː ɨ kʼ u kʼ						
381-13													ʔ a tː						
417-13													r u z						
451-13													s ə bː a t						
454-13													ʔ a tʃʼ ɨ r						
484-13													s ɨ dː ɨ s t						
535-13													ʔ a s ɨ r						
543-13													s e s t						
593-13													ʔ a m u s						
640-13													m a sː n						
1-13													d ə bː ə r ə m						
65-13													tʃʼ u m						
163-13													s ə tʃʼ ə						
212-13													ʔ e n						
244-13													ʔ a r bː ə t						
248-13													m u a						
293-13													rː ə r ə z						
373-13													kʼ ɨ m a r						
408-13													bː ə r a						
414-13													d ə bː a kʼ u a						
601-13													ʔ ə r m						
642-13													n ɨ rː a s						
60-13													n ə f ə s ə m						
115-13													ə r a m						
209-13													s ɨ dː u t						
242-13													ʔ a m ɨ s t						
415-13													z ɨ n a bː						
450-13													z ə r						
490-13													tʃʼ ə bː w ə m						
638-13													s ɨ n e						
645-13													kʼ a						
75-13													ʔ a m bː ɨ n						
160-13													dː ə r ə kʼ						
208-13													ʔ ɨ n kʼ w tʃ n						
214-13													ʔ a bː						
218-13													ʔ ɨ n z ɨ n						
378-13													ʔ a n g ə t						
379-13													dː ə dː ə						
409-13													g e t ə r ə						
497-13													t ə n						
598-13													h w e t						
646-13													ʔ a h ə						
164-13													bː ə k ə m						
210-13													dː ə h w n n ə						
215-13													ʔ a tː e bː ə t						
256-13													t u dː a						
285-13													m ɨ d a d						
332-13													ʔ ə g ɨ r						
380-13													ʔ ə h w a						
496-13													w ə r s ə n bː ə t						
67-13													w ɨ r						
169-13													n ə r ə z ə m						
251-13													f ɨ kʼ						
294-13													m w kʼ bː						
461-13													tʃʼ e						
547-13													w ɨ z a t						
597-13													ʔ e n ə n ə						
655-13													m ɨ k t						
7-13													ʔ a g a						
158-13													kʼ ə m ɨ s						
168-13													ʔ ɨ m a r						
296-13													tʃʼ ə h u t						
372-13													k ə n rː ə r						
374-13													bː ə dː e dː o						
385-13													w ɨ tʃʼ ə t						
411-13													t ɨ r a s						
500-13													ʔ ɨ m ɨ r						
541-13													kʼ ə tʃʼ ɨ n						
6-13													m ə r k a m a						
17-13													ʔ ə h ɨ r						
123-13													k e m ə						
252-13													n ə k ə bː ə						
330-13													kʼ ə d d						
421-13													bː ɨ dː ə						
448-13													kʼ ə dː a n s ə n bː ə t						
449-13													ʔ a ʒ ə						
491-13													d ɨ n g ə t						
545-13													h ɨ n ə						
596-13													n ə g ə						
653-13													bː ə tː ɨ t						
4-13													g ɨ ɲː dː ə						
8-13													kʼ ə bː ə tː e						
290-13													ʔ a g ə tʃʼ ə m						
460-13													h i i t						
489-13													bː w r tʃʼ tʃʼ m a						
552-13													z ɨ						
652-13													ʔ e t ə t a						
3-13													k ɨ n ə						
119-13													ʔ a n g a tʃ a						
213-13													ʔ a r a dː						
298-13													h u t						
340-13													g w ə n tʃ						
458-13													d ə n g ə ɲː ə						
459-13													ʔ a s ə						
607-13													ʔ ə k w a						
609-13													ʔ ɨ h a						
647-13													t ə t i z						
10-13													dː ɨ kʼ u r						
15-13													ʔ ɨ n ɨ m						
18-13													n ɨ kʼ i z ə						
73-13													tʃ ə k ə r ə m						
76-13													m w ə s a						
121-13													t ɨ k ə						
152-13													ʔ a n e						
167-13													g ɨ k ə						
255-13													kʼ w ə n tʃʼ ə						
297-13													g u n ə n						
299-13													g u n ə n						
328-13													s ə dː ə b ə m						
334-13													ʔ a n bː ə dː a						
338-13													m ə m ɨ n						
342-13													m e n a						
344-13													kʼ ə s ə m						
410-13													kʼ a r ɨ						
540-13													ɲː e bː a						
550-13													ʒ ə n ʒ ɨ n						
612-13													ʔ a r b						
61-14														d ə m					
63-14														ʔ a tː ɨ m					
107-14														g a m e a					
112-14														d a bː ə n a					
331-14														n ɨ g w s					
377-14														bː ə kʼ u kʼ m					
381-14														ʔ a tː					
417-14														r u z					
451-14														s ə bː a t					
454-14														ʔ a tʃ ɨ r					
484-14														s ɨ dː ɨ s t					
535-14														ʔ a sː ɨ r					
543-14														s o s t					
593-14														ʔ a m u s					
640-14														m w a m					
1-14														d ə bː ə r ə m					
65-14														tː u					
163-14														s ə tʃ ə					
212-14														ʔ e n					
244-14														ʔ a r a ə t					
248-14														m u a					
293-14														f ə r ə z					
373-14														kʼ ɨ m a					
408-14														bː ə r a					
414-14														d ə bː a kʼ u a					
601-14														ʔ ə r o					
642-14														sː ə f a s					
60-14														n ə f ə s ə					
115-14														ʔ ə r a m					
209-14														s ə dː w t					
242-14														ʔ a ɲː ɨ s t					
415-14														z ɨ n a bː					
450-14														z ə r					
490-14														tː ə bː w ə					
638-14														s ɨ r e					
645-14														kʼ a					
75-14														ʔ a m bː ɨ n					
160-14														dː ə r ə kʼ					
208-14														ʔ ɨ n kʼ w tʃ n					
214-14														ʔ a bː a					
218-14														ʔ ɨ n z ɨ n					
378-14														ʔ a n g ə t					
379-14														dː ə dː ə					
409-14														g e t ə r ə					
497-14														t ə n					
598-14														h w e t					
646-14														ʔ a k ə					
164-14														bː ə k ə m					
210-14														dː ə h w ə n ə					
215-14														ʔ a t e bː ə t					
256-14														t u dː a					
285-14														m ɨ tː a d					
332-14														ʔ ə g ɨ r					
380-14														ʔ ə h w a					
412-14														s a h a sː					
496-14														w ə r sː ə n bː ə t					
64-14														d a bː o					
169-14														m ə r ə z ə o					
251-14														f e kʼ					
294-14														ɲː w kʼ a					
461-14														tː ə					
547-14														w ɨ z a t					
597-14														ʔ e sː ə ə ə					
655-14														m ɨ k t					
7-14														ʔ a g a					
158-14														kʼ ə m e rː					
168-14														ʔ ɨ m a r					
296-14														ʔ ə h u t					
372-14														k ə n f ə r					
374-14														bː ə dː z dː o					
385-14														w ɨ tː ə t					
411-14														t ə r a s					
6-14														m ə n k a m a					
17-14														ʔ ə h ɨ n					
123-14														k e m ə					
330-14														kʼ ə d					
421-14														bː ɨ dː ə					
448-14														kʼ ə d a n s ə n bː ə t					
449-14														ʔ a z ə					
491-14														d e n g ə t					
545-14														h ɨ n o					
596-14														n ə g ə					
653-14														bː ə tː ə t					
4-14														g ɨ dː dː ə					
8-14														kʼ ə bː ə tː o					
339-14														bː ə kʼ e n					
460-14														h e t t					
489-14														bː ə r tʃ u s a					
552-14														z ɨ					
602-14														ɲː e sː m					
652-14														ʔ e t ə e					
119-14														ʔ a n g a tʃ a					
340-14														g w ə tʃ ə					
458-14														d ə n g ə ɲː ə					
