COGID	Amharic	Argobba	Chaha	Endegagn	Ezha	Geez	Gumer	Gura	Gyeto	Harari	Inor	Kistane	Mesqan	Muher	Silte	Tigre	Tigrigna	Wolane	Zway
459-14														ʔ a sː o					
486-14														sː ə tː ə kʼ ə					
607-14														ʔ ə k w a					
609-14														ʔ ɨ h a					
647-14														t ə t a m					
10-14														dː ɨ kʼ u r					
15-14														ʔ ɨ n ɨ m					
18-14														n ɨ kʼ e ə					
73-14														tʃ ə k ə n ə					
110-14														d a tː a					
121-14														t ɨ k ə					
152-14														ʔ a t o					
167-14														g ɨ k ə					
255-14														kʼ w ə n tʃ ə					
297-14														g u n ə n					
299-14														g u n ə n					
328-14														rː ə dː ə a ə m					
334-14														ʔ a sː bː ə sː a					
338-14														m ə m ɨ n					
342-14														m e n a					
344-14														kʼ ə s ə m					
410-14														kʼ a r e a					
540-14														n e bː a					
550-14														f ə n tʃ ɨ n					
109-14														g w sː tʃ ə					
61-15															tʃː ə mː				
63-15															ʔ a mː ɨ mː				
107-15															g a mː eː a				
112-15															tʃː a b ə n a				
331-15															n ɨ g u s				
377-15															b ə kʼ u kʼ				
381-15															ʔ a tː				
417-15															r u z				
451-15															s ə b a t				
454-15															ʔ a tʃʼ i r				
484-15															s ɨ tʃː ɨ s t				
535-15															ʔ a s ɨ r				
543-15															ʃ o ʃ t				
593-15															ʔ a mː u s				
640-15															mː a n				
1-15															tʃː ə kʼ ə r ə				
65-15															mː u b				
163-15															s ə tʃʼ ə				
212-15															ʔ eː n				
244-15															ʔ a r b o t				
248-15															mː u l a				
293-15															f ə r ə z				
373-15															kʼ ɨ mː a				
414-15															tʃː u b a kʼ u				
601-15															ʔ ə r b b				
642-15															n ɨ f a s				
60-15															n ə f ə s ə				
115-15															l ə r a				
209-15															s ɨ mː u t				
242-15															ʔ a mː ɨ s t				
415-15															z ɨ n a b				
450-15															tʃʼ ə r				
490-15															tʼ o kʼ ə				
638-15															s ɨ r eː				
645-15															kʼ a				
75-15															ʔ a mː h i				
160-15															mː ə r ə kʼ				
214-15															ʔ a b				
218-15															ʔ ɨ z tʃʼ i n				
378-15															ʔ a n g ə t				
379-15															tʃː ə tʃʼ ə				
409-15															g a t ə r ə				
497-15															t ə n				
646-15															ʔ a ʔ ə				
164-15															b ə tʃʼ ə				
210-15															tʃː ə ʔ o n				
215-15															ʔ a mː eː b ə t				
256-15															t u mː a				
285-15															mː ɨ tʼ a tʃː				
332-15															ʔ ɨ g ɨ r				
380-15															ʔ a ʔ u a				
412-15															s a h i n				
496-15															u ə r b ə t ə tː				
67-15															w ɨ r				
169-15															b ɨ r ə z ə b				
251-15															f i kʼ				
294-15															mː u kʼ kʼ				
461-15															mː o				
547-15															w ɨ z a t				
655-15															b ɨ f t				
158-15															kʼ ə m i s				
168-15															ʔ ɨ b a r				
296-15															ʔ ə h u t				
374-15															b o kʼ o f o				
375-15															s ə b				
385-15															w ɨ mː ə t				
541-15															kʼ ə tʃʼ i n				
17-15															ʔ ɨ h ɨ				
113-15															b u n a				
123-15															ʃ eː b ə				
252-15															r ə tʃʼ ə b ə				
330-15															kʼ ə l ʔ				
421-15															b ɨ l a				
449-15															ʔ a tʃʼ ə				
491-15															tʃː ɨ n g ə t				
653-15															b ə tː i t				
8-15															kʼ ə b ə tː o				
106-15															mː ə ʃ a				
254-15															f i mː a t				
290-15															ʔ a g ə tʃʼ ə				
339-15															b ə kʼ ɨ				
602-15															m ɨ n				
652-15															ʔ o t ə tː				
2-15															f u l u m				
3-15															f i r ə				
213-15															ʔ a r a ʃ				
459-15															ʔ a s o				
211-15															mː ɨ ʃ eː t				
328-15															s ə tʃː ə b ə				
333-15															m ɨ s ɨ r				
612-15															ʔ a r b				
109-15															g u n tʃʼ i				
61-16																d ə m			
63-16																ʔ a o ɨ m			
107-16																gː a m ə a			
112-16																d a b ə n a			
331-16																n ɨ gː w s			
377-16																b ə kʼ l kʼ			
381-16																ʔ a b			
417-16																r ɨ z			
451-16																s ə b a			
454-16																ʔ a f ɨ r			
484-16																s ɨ dː ɨ s t			
535-16																ʔ a ʔ ɨ r			
543-16																s o w w			
593-16																ʔ a m ɨ s			
640-16																m w n			
65-16																o ɨ b			
163-16																s ə f ə			
212-16																ʔ ai̯ n			
244-16																ʔ a r b ɨ b			
248-16																m w a a			
293-16																f ə r ə w			
373-16																kʼ ɨ m m			
408-16																b ɨ a a			
414-16																d ə b a kʼ ʃ m			
601-16																ʔ ə r kʼ b			
642-16																n ɨ f a s			
209-16																s ɨ mː ɨ n			
242-16																ʔ a m ɨ s w			
415-16																z ɨ a b			
450-16																z ə r			
638-16																s ɨ r ai̯ e			
75-16																ʔ a m b f			
208-16																ʔ ɨ n kʼ w kʼ a			
214-16																ʔ a b g			
218-16																ʔ ɨ z w b			
409-16																gː a t ə r			
497-16																w ə n			
598-16																k w mː ʔ			
646-16																ʔ a ħ kʼ			
256-16																w ə mː a			
332-16																ʔ ɨ gː ɨ			
496-16																w ə r b ə n b			
67-16																w ɨ r			
655-16																b ɨ f w			
372-16																f ə n f ə r			
375-16																s ə b			
411-16																w ə r a ə			
500-16																ʔ ɨ m ɨ			
541-16																kʼ ə f ɨ n			
17-16																ʔ ɨ k ɨ			
113-16																b ɨ n a			
252-16																r ə f ə b ə			
330-16																kʼ ə lː d			
545-16																f ɨ g ɨ			
106-16																m ə tʃʼ ʕ a			
254-16																f b m ʕ ɨ			
460-16																ʔ ai̯ ʔ a			
602-16																m ɨ n			
2-16																k ɨ lː ɨ m			
213-16																ʔ ʕ r kʼ dː a			
298-16																f ʃ w ɨ			
647-16																w ə t a t			
211-16																m ɨ lː ə t			
333-16																m ɨ mː ɨ r			
612-16																ʔ ʕ r b b			
61-17																	d ə m		
63-17																	ʔ a tʼʲ ɨ m		
107-17																	g a m ə a		
112-17																	d a b ə n a		
331-17																	n ɨ g w sː		
377-17																	b ə q l o		
381-17																	ʔ a n i		
417-17																	r u z		
451-17																	sː ə b ɨ n		
454-17																	f a q ɨ r		
484-17																	sː ɨ tʼʲ ɨ sː t		
535-17																	ʔ a sː ɨ r		
543-17																	sː o sː t i		
593-17																	f a m u sː		
640-17																	m a n		
1-17																	d ə kʼ ə r ə		
65-17																	tʼʲ u b		
163-17																	sː ə tʃʼ ə		
212-17																	ʔ ə n		
244-17																	ʔ a r b ə t		
248-17																	m u l ɨ		
293-17																	f ə r ə w		
373-17																	q u m a		
408-17																	b ə r a i		
414-17																	d u b a kʼ u a		
601-17																	ʔ ɨ r ui̯ b		
642-17																	n ɨ f a sː i		
60-17																	n ə f ə sː ə		
115-17																	f a r m		
209-17																	sː ə mː u n		
415-17																	z ɨ a b		
450-17																	z ə r i		
638-17																	sː ɨ r ə i		
645-17																	kʼ a		
75-17																	f a m b ə r		
214-17																	ʔ a b i		
218-17																	ʔ ɨ n w ə		
409-17																	g a t ə r i		
598-17																	k w l ʔ i		
164-17																	b ə q ə i		
332-17																	ʔ ɨ g ə r		
412-17																	sː a f ɨ n		
496-17																	sː ə r b ə n b ə		
158-17																	kʼ ə m i sː i		
372-17																	k ə n f ə r		
375-17																	s ə b		
411-17																	t ə r a sː i		
500-17																	ʔ ɨ b ɨ r		
541-17																	q ə tʃʼ ɨ n		
113-17																	b u n a		
330-17																	kʼ ə l d		
448-17																	q ə d a n i ə n b ə t		
106-17																	m ə s a		
290-17																	f a g ə tʼʲ ə		
552-17																	tʼʲ ɨ		
2-17																	k u l u m		
213-17																	ʔ a r a sː i		
647-17																	t ə q a t		
211-17																	m ɨ tʃʼ ɨ t		
334-17																	n a n b ə sː a		
109-17																	g u n tʃʼ ə		
61-18																		d ə m	
63-18																		ʔ a tʃʼ ɨ m	
107-18																		g a m eː a	
112-18																		d a b ə n a	
331-18																		n ɨ g u s	
377-18																		b ə kʼ i kʼ	
381-18																		ʔ a n	
417-18																		r u tʃʼ	
451-18																		s ə b a t	
454-18																		ʔ a tʃʼ ɨ r	
484-18																		s ɨ tʃː ɨ s t	
535-18																		ʔ a s ɨ r	
543-18																		ʃ tʃʼ ʃ t	
593-18																		ʔ a m u s	
640-18																		m a n	
1-18																		tʃː ə kʼ ə r ə	
65-18																		tʃʼ u b	
163-18																		s ə tʃʼ ə	
212-18																		ʔ eː n	
244-18																		ʔ a r b ə	
248-18																		m u l a	
293-18																		f ə r ə tʃʼ	
373-18																		kʼ ɨ m a	
408-18																		b a r a	
414-18																		tʃː u b a kʼ	
601-18																		ʔ ə r tʃʼ b	
642-18																		n ɨ f a s	
60-18																		n ə f ə s ə	
115-18																		l ə aː b	
209-18																		s ɨ m u n	
242-18																		ʔ a m ɨ s t	
415-18																		tʃʼ ɨ n a b	
450-18																		tʃʼ ə r	
490-18																		tʃʼ ə kʼ ə	
638-18																		s ɨ r o	
645-18																		kʼ a	
75-18																		ʔ a m b ɨ aː	
160-18																		tʃː ə r ə kʼ	
208-18																		ʔ ɨ n kʼ u kʼ aː	
214-18																		ʔ a b	
218-18																		ʔ ɨ n tʃʼ ɨ aː	
378-18																		ʔ a n g ə t	
379-18																		tʃː ə tʃʼ ə	
497-18																		t ə n	
646-18																		ʔ a n ə	
164-18																		b ə kʼ ə	
210-18																		tʃː ə l w n aː	
215-18																		ʔ a n eː b ə i	
256-18																		t u n a	
285-18																		m ɨ tʃː a d	
332-18																		ʔ ɨ g ɨ aː	
380-18																		ʔ ə l u	
412-18																		s a f ɨ n	
496-18																		s ə aː b ə n b ə	
64-18																		tʃː a kʼ oi̯	
67-18																		w ɨ r	
169-18																		b ɨ r ə tʃʼ ə b ə	
251-18																		f ɨ kʼ	
294-18																		m u kʼ kʼ	
461-18																		tʃʼ kʼ	
547-18																		w ɨ z a t	
597-18																		ʔ eː n g eː ə	
655-18																		b ɨ ʃ t	
7-18																		ʔ a g a	
158-18																		kʼ ə m ɨ s	
168-18																		ʔ ɨ m a r	
296-18																		ʔ ə f u t	
374-18																		b ə kʼ o l oi̯	
375-18																		s ə b	
385-18																		w ɨ tʃʼ ə t	
411-18																		t ɨ r a r	
541-18																		kʼ ə tʃʼ ɨ n	
17-18																		ʔ ə l ɨ aː	
113-18																		b u n a	
123-18																		ʃ e m ə	
252-18																		r ə f ə b ə	
330-18																		kʼ ə l d	
421-18																		b ɨ ʃ ə	
491-18																		d ɨ n g ə t	
653-18																		b ə t ɨ w	
8-18																		kʼ ə b ə tʃː oi̯	
106-18																		m ə t a	
254-18																		f ɨ m a t	
290-18																		ʔ a g ə tʃʼ ə	
339-18																		b ə kʼ ɨ	
489-18																		b ə aː tʃʼ tʃʼ b a	
552-18																		tʃʼ ɨ	
602-18																		m ɨ n	
2-18																		f u l u m	
3-18																		f ɨ l ə	
213-18																		ʔ a r a ʃ	
459-18																		ʔ a r tʃʼ	
647-18																		t ə t ai̯ t	
76-18																		b w ə r a	
152-18																		ʔ a n oi̯	
328-18																		s ə d ə b ə	
333-18																		m ɨ ʃ ɨ r	
338-18																		b ə b ɨ aː	
612-18																		ʔ a r b b	
61-19																			d ə m
63-19																			f aː mː i m
107-19																			g aː m i aː
112-19																			d aː b ə n aː
331-19																			n i g w s
377-19																			b i kʼ w k
381-19																			ʔ aː mː
417-19																			r uː z
451-19																			s a b aː t
454-19																			f aː g i r
484-19																			s i tʃʼ i s t
535-19																			ʔ aː s i r
543-19																			s i s t
593-19																			f aː m u s
640-19																			m aː n
1-19																			d ə b ə ə
65-19																			mː u b
163-19																			s ə tʼ ɨ
212-19																			ʔ i n
244-19																			ʔ aː r b ə
248-19																			m u aː
293-19																			f ə r ə z
373-19																			kʼ i m aː
408-19																			b a r aː
414-19																			d ə b aː kʼ u l o
601-19																			ʔ ɨ r b i
642-19																			n i f aː s
60-19																			n ə f ə s ə
115-19																			aː r o m
209-19																			s i mː i t
242-19																			ʔ aː mː i s t
415-19																			z i aː b
450-19																			z ə r
490-19																			mː ə b w
638-19																			s i r i
645-19																			kʼ aː
75-19																			f aː m b i
160-19																			mː ə r ə kʼ
208-19																			ʔ i n kʼ w i ə
214-19																			ʔ aː b
218-19																			ʔ i l ʔ i
378-19																			ʔ aː n g ə t
379-19																			z ɨ mː ə
409-19																			g i t ɨ r
497-19																			t ə l
646-19																			ʔ aː d ə
164-19																			b ə kʼ ə
210-19																			d ə f w n s
215-19																			ʔ aː mː i b ə
256-19																			t uː mː aː
285-19																			m i mː aː d
380-19																			ʔ aː f w o
412-19																			s aː f i n
496-19																			w i r s ə l b ə t
64-19																			ʔ aː b oi̯
67-19																			w i r
169-19																			b ɨ r ə z ə kʼ
251-19																			f i kʼ
294-19																			m w kʼ kʼ
461-19																			mː ai̯
547-19																			w i z o t
597-19																			ʔ i n ə ə
7-19																			ʔ aː g aː
158-19																			kʼ ə m i s
168-19																			ʔ i m aː r
296-19																			j i f aː t
375-19																			s ə b
385-19																			w i mː ə t
500-19																			f i m i r
541-19																			kʼ ə tʼ i n
6-19																			m ə kʼ aː m o
113-19																			b u n kʼ
123-19																			ʃ i m ə
330-19																			kʼ ə l d
491-19																			d i n g ə t
106-19																			m ə t aː
254-19																			dʒ i m aː t
339-19																			b ə kʼ i
460-19																			f i ʔ a
602-19																			m i n
652-19																			f i t ə i
2-19																			f u l i m
213-19																			ʔ aː r aː ʃ
298-19																			j u t
459-19																			ʔ aː s ə
486-19																			l ə mː ə kʼ ə
152-19																			ʔ aː n oi̯
211-19																			m ɨ r i t
328-19																			s ə d ə b ə
333-19																			m ɨ mː ɨ r
540-19																			l i b aː
