COGID	Achang	Bela	Lashi	Maru	Phon	WrittenBurmese	Zaiwa
436	tsʰ a m ³	x a m ³				tsʰ a m	
435	kʰ j a m ⁵⁴		kʰ ɔ ʔ ⁵²	kʰ o ʔ ⁵⁴		k a	kʰ ɔ ʔ ⁵
576						h m aː	h a ⁵
141	tsʰ a ŋ ³		tsʰ a ŋ ²	tsʰ a ⁵³		tsʰ a ŋ	
375	ŋ a̰ m ⁵³		m j e ³²	m i t ³			m ɪ t ³
109	pʰ ə ³			pʰ œ i ³²	pʰ u	p a	
560	b ɔ ³¹		b ɔ ⁵¹	b o ³			b ɔ ³¹
367	k a̰ ḭ ʔ ⁵³			g e ʔ ⁴²			g ə ³
349	d u k ⁴²		d o k ³	d au t ⁴²			
493	j i ⁵		j i ³	ɣ i ³⁵			β w i ⁴
130	dʒ j æ p ⁴²		g j æ p ³	ɣ e ʔ ³			
559	j ɔ m ³		j ɛ m ²³	ɣ a m ³			v u m ³
176	g u ŋ ³¹		g o ŋ ⁵²			k a ŋ	
431	g u ŋ ⁴³		g o ŋ ³¹	g au ŋ ³¹		kʰ j w iː	g u ŋ ³
555			j o ŋ ³	j æu ŋ ⁴		l j a ɲ	ɹ a ³
32	t ḭ ³²	p i ³	b i ³²				
138	l j a̰ ŋ k ⁵³		j a̰ ŋ k ⁵³				
551	d w a m ³					t u m	
533			m au ²			h m au ŋ	m a ³²
432	b a t ³¹			b ḛ t ʔ ⁵⁴			
126		n a ʔ ⁵²	n ɔ̃ ʔ ³				ŋ ɔ ³
129					kʰ w e ⁵⁵		kʰ w i ³²
43	l a̰u ⁵¹		l au ⁵¹				l au ⁵³
482	x j ɔ ³		ʃ o ⁴²		j a ʔ ⁵⁵	r a	ʃ ɔ ⁵³
543	j a m ³		j æ̰ m ³			r a m	
369			d w ɛ m ³²	d u k ⁵	tʰ u ³¹		t a̰u ³¹
320				d z o ³²		ʔ a ŋ	d z a ŋ ³¹
459	kʰ a t ⁵²		kʰ a̰i ʔ ⁵¹				kʰ a t ⁵⁴
34		ɣ i ³	g e ⁵¹	ɣ i t ⁴			ʔ ʊ̰ t ⁵
345			g i ³	kʰ i ⁵⁴			g i ³¹
344				m ø ʔ ⁵⁴	m j e ʔ ³¹	m w a t	m ʊ t ³²
488	j a m ⁵		j æ̰ m ⁴			ʔ ə	ʔ a̰ m ³¹
245		p au ⁵²	b j e ³¹	b au ³¹			b w i ³²
196		k j ɛ ²³	kʰ j æ p ⁵³				kʰ j æ p ⁵
554	dʒ ṵ a̰ t ⁵⁴		dʒ w e ʔ ⁵³				
111			k o̰ k ⁵⁴		k o ʔ ⁵⁵		
541			pʰ j ə k ⁵³	j a k ³		p r a ɲˀ	pʰ j ɪ k ⁵
105	m i ⁵		m ɯ̃ ⁵²				
385				n a ⁵²		ŋ a mˀ	
502	b u ³		b o ³	b o ³	p a ³¹	p aː	
530	s ai k ⁵⁴		s ə k ⁵³	s a k ⁵		s a ts	s ɪ k ⁵⁴
232	p ṵ ʔ ⁵⁴		b u ʔ ⁵³	b au ³			b u ³
226	tʃʰ o ʔ ⁵³		tʃʰ o ŋ ⁵³			tsʰ au ŋˀ	tʃʰ ə ⁵
297				pʰ o ʔ ⁴			pʰ ə ³
492	g ɔ ⁵		g ɔ ³	g au ŋ ³			
536	d e ³		d u ³¹	d au ³		t u	ts ṵ ŋ ⁵³
558		j e ³	ɹ ɛ ⁵³				j ɔ̰ ⁴⁵
115	dʒ ɔ ³		d z ə ⁴³				
423	j au ³¹		j au ³¹	j o̰ k ⁵		k j aˀ	ʔ ʊ̰ t ⁵
202	n j e ŋ ³¹			n j ɛ n ³¹			
110	s a n ³		s ɨ ⁵		ʃ e ʔ		tʃʰ ɪ ŋ ⁵³
134				dʒ au ŋ ⁵¹			dʒ u ŋ ⁵³
354	dʒ ei ³		dʒ e ⁴³				
427	b w a ³¹		b oe ʔ ³				
140		sʰ a ²³		ʃ ɪ ⁴			ʃ ɔ ⁴³
240			tʃʰ a m ⁵⁴	tʃʰ e ⁴²			tʃʰ a m ³²
208	n o ŋ ⁵		n o ŋ ⁴⁵			n au k	
434						t w i k	tʰ w i ⁵³
318			d z ɔ ³				dʒ ɔ ⁵³
484	kʰ j ɨ ŋ ⁵⁴		kʰ ə ŋ ⁵³	kʰ i ŋ ⁵⁴			
519	h ai ³		h ɛ ³		h ai ŋ ⁵⁵		
392	n o̰ ³		n j ɔ̃ ³¹	m j a ŋ ³			
293						pʰ j a	pʰ j ɔ ⁵³
514	w i ³⁴					w a	
287			d w a ŋ ³¹			t a ŋ	d ɔ ŋ ³¹
454	d z w i ³		d z ɨ ²¹	d z ø i ⁵			d z w i ⁵³
373	tʃʰ u ŋ ⁵			tʃʰ æu ŋ ⁴³		tsʰ w i	
334	h j æu ⁵	k j a̰ ⁵²	ʃ au ⁵				w ɔ ⁴
405	j a p ³¹			j e ʔ ³	ɹ e ʔ ⁵⁵	r a p	j a̰ p ³¹
565				ŋ a ³⁴			ŋ ɔ t ³²
361	d j ɔ ʔ ³¹		j ɔ̰ ʔ ³²	j ɔ ʔ ³²		h l j a k	j ɔ ʔ ³²
221	g w e ³		g w e ⁵³				
258	ʔ u ŋ ³	ʔ a	ʔ a ³		ʔ ə		
437			n j æ̃ m ⁵⁴	m j æ ṵ k ⁵³		h ɲ a p	
466						h l ai	l u m ⁵³
59			g j ɛ m ⁵³	dʒ a m ⁴			
368				h o k ⁵⁴		h a ts	
63		kʰ i ³	g a m ³¹	g e ⁴¹			g a m ⁵³
172	kʰ u ŋ ⁵		kʰ o ŋ ⁵		k ə		kʰ u ŋ ³¹
351	d j ɛ ⁵		p j a̰ ʔ ⁵³	pʰ ø ⁵		p r a ts	
479					j ɔ ŋ ⁵⁵	h r a ts	
268	pʰ ɔ ʔ ³¹			pʰ o ³			
535	b a ŋ ³¹		b a ŋ ³¹	b o ³⁴		p aˀ	b ɔ ³
260			n o ŋ	m ḭ ⁴²		m iˀ	
101			pʰ j u ²¹	pʰ j u ⁵¹	pʰ j u ⁵⁵		pʰ j u ⁵¹
74			ʃ i ⁵		s i ³¹		ʃ ɪ ³
267	s ai n ⁴³			s a ŋ ²¹			
310	k j ɔ̰ p ⁵³					tsʷ a p	dʒ ɔ p ⁵⁴
247			f w e ʔ ⁵³	f a k ⁵			
520		tʃʰ ḛ ³	d z i ⁵¹	tʃʰ e ⁴¹			ʃ i ⁵³
207	j u k ⁴³		g j ɛ t ⁴			r i t	
33	dʒ ei ⁴²				tsʰ i ⁵⁵	r e	
549	dʒ a m ³		dʒ æ m ⁵⁴				
311			b ai n ⁴	p ḛ n ²			
85						h b i n	pʰ ɛ n ³
517		ts õ ²³	dʒ a ŋ k ⁵³	dʒ a ³⁴		r a ŋ	dʒ a̰ ŋ ⁵³
420			m j ũ ³	m j u ŋ ⁵⁴		m j aːu	
158	b au ³				p u ³¹	p w iː	b au ³¹
13	k a n ²			g e n ⁴			g a n ²
457	b ai ʔ ³¹		b ə k ²	b a k ³²		p a ts	
114	n j æ̰ ṵ ʔ ⁵²		n j au k ⁵³				
31	d z o̰ ŋ ³²	ts a ŋ ³	ts o̰ ŋ ³²				
412	t a̰u ⁵			t o̰ k ⁵⁴			
155			dʒ ɛ ⁵				d z u ŋ ³
433			j ø k ³			r w i k	
424			n j ɛ ²¹	n a ⁴³			m j w i ²¹
573	h a ŋ k ⁵⁴	kʰ a k ³	h a ŋ ⁴				
117				kʰ a ²	k ə	k j aː	
288	b ai ʔ ⁴¹					p au k	
37			l ai ³²	l ai ³²		l ai	l ai ³¹
88	n j ṵ k ³⁵		m j o k ⁵⁴	m j æu ʔ ³²			m j u ʔ ⁵³
160		k o ŋ ⁵²	g a ŋ ³²	g a ³²			g ɔ ŋ ³²
15			g w ɛ m ³			k r w iː	g u m ⁵³
305	kʰ j a ʔ ⁵³		kʰ j a ʔ ⁵³				kʰ a p ³²
17			p a ŋ ⁵³	b a ʔ ²¹			
243	j ei ³¹		j e ⁵¹		ɹ i	r e	
298						ts au ŋ	dʒ ɔ ŋ ³⁴
374		k j ḛ ʔ ³	kʰ oi ⁴³			k j u	
444				j a ⁴		p r a	p j a̰ ŋ ⁵³
14			l æ̰ p ⁵³			h l j a p	l a̰ p ⁴
234	k a̰ ŋ ³		g a ŋ k ⁵²	k a̰u ŋ ⁴			
503	tsʰ ɨu ³		tsʰ u ³²	tsʰ au ³²		tsʰ u	tsʰ u ⁴³
299		p ṵ ⁵²		b au ²			b u ³¹
379	kʰ j ɛ n ³		kʰ j e ⁴³	kʰ ɪ n ⁴³		kʰ j ai	kʰ ɪ n ⁴²
407	s u ⁵	ts o̰ ²³	s ɔ ⁴	s u ⁵			s ɔ ⁵²
328			d z ə ŋ ⁵¹	ts a̰ ŋ ⁴¹			d z i ŋ ⁵
355				tʃʰ ɔ ³			tʃʰ ɪ ³²
118				m j a ŋ ³²			m ɔ ³
280	kʰ au ³		g o ŋ ⁵¹	kʰ au ŋ ²	kʰ ə		
304				k a̰ ŋ ³²		kʰ a ɲ	
504	g j i ⁵		g i ⁴				g i ⁴³
378	n j ḛ k ⁵²		m j ɛ̰ ʔ ⁵²	m ḭ t ⁵⁴		m eˀ	m ḭ ⁵³
377	t ɔ̰ ⁴⁵		d ɔ ³⁴	t o̰ ʔ ⁵			t ɔ̰ ⁵⁴
462		p ḛ ʔ ²³	p j æ̰ p ³¹				b j ɔ ʔ ³
353	ts a̰u ⁵		d z au ⁵³	d z o̰ ʔ ⁵⁴	sʰ o ³¹		d z au ³²
449	ts ṵ ʔ ⁵²		d z u ³²	d z a̰u ⁴		tsʰ u	dʒ ɔ ʔ ⁵⁴
446	l a̰ p ⁴²		l æ̰ p ³²	l ḛ ʔ ⁵⁴			l a̰ p ⁵⁴
472	ʔ ai ⁵³	j ḭ ²³	ʔ ə k ⁵³		h ai ʔ ³¹		ʔ i ⁴⁵
104	l a ³		l a ²				l u m ⁴
25	j ɔ ³¹		j ɔ ⁴²				
455	l ɨ̰ ṵ ³	l i ²³	l u ³²				
230	l u k ⁵⁴		l o ʔ ³²	l au ʔ ³			
53			dʒ ɔ ʔ ³	dʒ o ʔ ³²			
537			g ə ⁵	g ə ²		kʷ a	
222			tʃʰ æ p ⁵³	tʃʰ ɛ ʔ ⁴³			
123			n ɔ̃ ʔ ³¹				n ɔ ʔ ³²
490			dʒ i t ⁵				dʒ ɪ̰ t ⁵
161	s o t ⁵			s ai t ⁵			s ʊ t ⁵
96		n a k ⁵²	n o k ³²				n u ʔ ³⁵
175					p j a ⁵⁵	p r a	
564	l a ³					p r au ŋ	l a ŋ ³
450	ŋ æ̰ ʔ ³¹		ŋ e ⁴	ŋ a ⁴⁵			n j ɛ̰ ⁵³
343	j w a t ⁴²		j oi ʔ ²	v w e ³⁴			
81			b æ m ³¹	p ḛ ⁴²		p a m	b a n ⁵³
259	w ɛ ³¹		j ḛ ʔ ⁵³	j ɪ p ²	j i ³¹		
188	m i ³²	m au ŋ ²³	m ɨ ³				m au ³
164	dʒ a ŋ ³			dʒ a̰ ³²			dʒ a ŋ ³²
358	ʃ ɛ t ³¹		ʃ ɛ ³¹	ʃ ɛ ³¹	ʃ e t		ʃ e ³¹
203	ʔ a m ³		ʔ æ m ³	ʔ e ³²			ʔ a m ⁵
487	ŋ a n ⁵		ŋ ãɪ ²⁴				
262	l ə ³					l eː	
131	ŋ a t ³¹		ŋ ai t ³	n a ³²			ŋ a t ³²
400	n a n ³¹	n e ²³	n ãɪ ⁴	n ɪ n ⁵⁴			n a̰ n ³
575	tʃʰ a ³		tʃʰ ɛ ⁵³				dʒ u ŋ ⁵²
561	n ṵ k ⁵³		n ə ŋ ²	n e ⁵		n a n	n j ɔ̰ m ⁵³
381	dʒ ɛ t ⁵⁴			dʒ i t ⁵			
406	tʰ u k ⁵³		tʰ o ʔ ⁵³	tʰ au k ⁵⁴		tʰ au k	tʰ u ʔ ⁴³
440			d z o ŋ ⁴	d z a̰u ʔ ⁵³		ts w i k	
390	j ɔ̰ ³²	j a ⁵²	j ɔ ²¹	j o ³⁵			j ɔ ⁵¹
36			b a ŋ ²³	b a ŋ ³		p a ŋ	b a ŋ ³
386	s w a n ³		s oe ³				
410	w a ŋ ³¹		w a ŋ ³¹	w a ³²	v ɹ o ⁵⁵	w a ŋ	
156	m a n ³¹				m i ³¹	m iˀ	
236			tʰ u ŋ ⁴	tʰ au ŋ ²	tʰ a ŋ ³¹		tʰ a ŋ ⁴³
26		m a ²³		m ɔ ³⁵			m a ³
387		ŋ w ɛ̰ ʔ		ŋ ḭ ʔ ⁵			ŋ a̰ p ⁵⁴
40	tʰ ɔ m ⁵		tʰ ø m ⁵	tʰ a m ³²		h r w a mˀ	
545	dʒ w ɛ ʔ ⁵²		dʒ ø m ³²	dʒ o ⁵		tsʷ a t	
182	n ɔ̰ ³¹		n ɔ̃ ³	n ɔ ³		h n a	
16	j æ t ²¹		j ø p ³			r i p	v ʊ p ³
296	m i ³¹		m ḛ ḭ ⁵¹	m ai ³²			
527	tʃʰ ɔ ʔ ⁵⁴		tʃʰ ɔ ʔ ⁵³				tʃʰ a ⁵
429	tsʰ a ʔ ⁴¹		dʒ oi ʔ ⁵			s w eː	
497						t u t	d ɔ t ⁵⁴
339				l a p ³²			l ʊ p ³
219	m a n ⁵		m oi ⁴⁵	m a̰ ḭ t ⁵			m u n ³⁴
107	w ɔ m ³		w ø m ²				
67	n j ɛ t ³²				m j ai ʔ ³¹	m r a ts	m ɪ t ⁴³
121	l ai ³⁴		l a ³			h lʷ a	l ə ³
162			j ɛ m ³			ʔ i m	
366	g j ɔ ⁵		g j ɔ ³	g j ɔ ³²			
513			g o ŋ ⁵	k au ŋ ³			
512	j ɔ ⁴²		j u ⁴²	j o ³²		j a	j ɔ ³¹
41	b ɔ p ⁴³		b ø p ²¹	b a p ³²			b ɔ ³
398	j ɔ ³		j ɔ ³²		j a ³¹	j aː	j ɔ ⁵³
569	kʰ a ⁴		kʰ a ²⁴	kʰ ø ⁵		k aˀ	kʰ ə t ⁴³
254		ɣ ɛ ⁵²	j e ⁴	ɣ e ²			
113	g au ³⁴		k au ²			k au ŋ	
518	n i ³				n e ³¹	n iː	
269		l o ŋ ³			l o ⁵⁵	l a ŋ	l a ŋ ⁵³
9	dʒ w e ⁴⁵			tʃʰ e ⁴³			
563	dʒ ɛ t ³¹		dʒ e ⁴⁵	dʒ i t ⁵³	sʰ i ³¹		dʒ ɪ t ³²
396	m ɛ ³	m a̰ ³	m ə ³	m ə ²			
441	x j ɔ ⁵						h ɔ ⁵³
363	t a̰ ḭ ʔ ⁵³	t ḭ ²³	d a ŋ ²				d a ŋ ⁴³
370			d e ʔ ³²	d a ⁴³			
515	d a n ³		d ai n ³	d ɪ n ⁴		t a ɲ	d i ŋ ⁴
191	k ṵ k ⁵⁴		g o k ⁵³			k a m	k ṵ ʔ ⁵
474	n j ei ³	m i ⁵²	m j e ⁴		ɲ i ³¹		m i ³²
98			g ɔ ʔ ⁵²	k o̰ ʔ ⁵⁴	k ə		
99	h u ⁵		h ø ⁵	h au ³			h u ³
393	kʰ u ŋ ³					h au k	kʰ ɔ k ³²
56	l u k ³²		l o ʔ ³⁴	l au k ³²			l ʊ p ³
359				n a̰ ḭ t ⁵⁴			n ʊ̰ t ⁵
108				d z o ³¹			d z a ŋ ³¹
326	pʰ ə ³					pʰ aˀ	b j ɔ ³
566			g j ɛ ³¹	k j ɛ̰ t ⁵³			
68		k i ⁵²	g i ²	g i ²			
21		k a ŋ ³	g j o t ⁵²	g a ³¹			g j ɔ ⁴
290	dʒ ei ³¹		g e ⁵	g i t ³			g i ⁴³
508	b u ³¹		b ɔ ⁴			p a k	
204	tʃʰ a m ⁵		tʃʰ æ m ⁴			ts eˀ	tʰ a ŋ ⁵³
438	tʰ au ⁵		tʰ au ⁴	tʰ o ʔ ⁵		tʰ w iː	tʰ au ⁵²
317	m ɔ t ⁴²		m oi ʔ ³				
10			w ɔ ⁵¹		w a ʔ ⁵⁵	r w a	
95	b ɛ ⁵					p a	
276	d j ɛ n ³¹	p w i ³	b j e ŋ ⁵³	b j ɪ n ²¹			
357	s ɔ ʔ ⁵³		s ɔ ʔ ⁵³	s ɔ ʔ ⁵⁴		s a k	s ɔ ʔ ⁵⁴
49	h w i ⁵		h ḛ i ⁴²				h w i ³
388	g j u k ⁴²		g j o k ³²	g j æu ʔ ⁴³		k r au k	g j u ʔ ³²
48	ʃ ə ⁴³		ʃ o ⁵³			tʰ u mˀ	tʃʰ ɔ ³²
324	j a p ⁴²		j æ p ³				v a p ⁵
382	d a p ³¹			d e ³²			
528	l au ʔ ³¹	l u ²³		l a̰ k ⁵³			
571			m ɔ ²¹			h m a	
453	m u ⁵		m ɔ ⁵	m au ²⁵		h m uˀ	m u ⁵
414	l a ŋ ³	l õ ⁵²	l a ŋ ²			l uˀ	l a ŋ ⁵³
266	j ɛ̰ n ⁴		j o k ³	j a̰ m ³²			j a̰ ŋ ³
231	tʃʰ a p ⁵⁴				tsʰ i ʔ ⁵⁵	tsʰ a ts	
249	j ḛ ḭ ⁵		j ḛ ⁵	ʔ ḭ t ⁵			ʔ i ³
73	dʒ ei ⁵⁴			dʒ i t ⁴⁵		ts eˀ	dʒ i ⁴
572	d j e ³			d au ⁵¹			
452				m i ⁴			m i ³
529	ʔ a ³		ʔ a ³	ʔ a ²		ʔ ə	ʔ ə ³
178						k au k	g ɔ k ⁴
261	ʃ a ŋ ³				s ə	s aː	ʃ a ŋ ⁵³
448	dʒ au ʔ ³¹	ts a̰ ʔ ⁵²	dʒ a ʔ ⁵³	d z ɔ ³²			d z a ŋ ³
102	l a ³		l a ²				
5	m ṵ ⁵	m ə ⁵²	m ɔ ⁵³				m ɔ ⁴
153	l a̰ ŋ ³		l a̰ ŋ ³⁴	l a̰ ³			l a̰ ŋ ⁵³
451			s ai ⁵²	s e ʔ ⁵⁴		s e	s a t ⁵⁴
505	l a m ³¹	l ẽ ²³	l æ̰ m ³¹	l e ²			l a m ³²
282	l ṵ ³				ɹ i ³¹	l a m	
416	d ɨu ⁴³						d u n ⁵³
553	tʰ a n ³		tʰ ãɪ ²				tʰ a n ³²
327	j æu ŋ ⁵					j au ŋ	
177	g au ⁵		g au ⁵		k o ³¹		
365	t a̰ ḭ ⁵³		d e ʔ ³¹	d a ⁴³			t a̰ ḭ ⁵³
467			tʃʰ j ɛ ²	tʃʰ i ⁴			
418	g j ɔ ⁴³	k j a ²³	g j ɔ ⁴	g j o ⁵		k j aˀ	
445	l a̰ ŋ k ⁴²					h l au ŋ	
399	k j ɛ̰ n ³		g j ẽ ŋ ³²	g ɪ n ⁴¹		kʰ r a ts	g i n ³¹
534				n o ʔ ³⁴	ɲ o ⁵⁵		
194	l ɔ t ⁴³		l oi ʔ ³²				
229	pʰ ə ⁵		b w e ⁵³	p a̰ t ⁵		p u	
383			ʔ a ²				ʔ a ²
439		l w i ²³	l ə̰ ŋ ³²			k r a ɲ	
54					s e ⁵⁵	s a m	ʃ a m ⁵⁴
291	dʒ ə̰ ³	tsʰ i			tʰ o ⁵⁵		tsʰ ə ⁵⁴
323				kʰ j u m ⁴³		kʰ a p	
415	tʰ ə ʔ ⁵³		tʰ ɨ ʔ ⁴²	tʰ au ŋ ⁴			
303	l ṵ ⁵		l o ⁴			l u m	
531	tsʰ au ⁵		tsʰ au ³	tsʰ o ʔ ⁵⁴			
491					n e ³¹	n a	
223			kʰ j o ŋ ⁴	kʰ æu ŋ ⁴²		kʰ j w i ŋ	
372			m au ʔ ³¹	m o̰ k ⁵⁴			m a̰u ⁵²
