COGID	ChorbatBalti	KhapaluBalti	KharmangBalti	RonduBalti	ShigarBalti	SkarduBalti	SkarduPurki
456					t̪ʰ ɜ l p ʊ ʈ	t̪ʰ ɜ l p ʊ ʈ	
294	b u	b u	b u	p l̥ u	p l̥ u	p l̥ u	pʰ r̪ u
1626		n̪ ɜ m ɑ					n̪ ɑ m ɑ
120	z̪ ɛ ɾ s̪	z̪ ɛ ɾ s̪	z̪ ɛ ɾ s̪	z̪ ɛ ɾ s̪	z̪ ɛ ɾ s̪	z̪ ɛ ɾ s̪	z̪ ɛ ɾ s̪
1037	ȵ̊ i ȵ p ɑ	s̪ ȵ ĩ ŋ m ɜ	ɕ ȵ ĩ m ɜ	s̪ ȵ i ŋ m ɜ	ȵ̊ i ȵ m ɜ	s̪ ȵ i ŋ m ɜ	s̪ ŋ i ŋ m ɜ
989		s̪ ɜ r̪ p ɜ		s̪ ɜ r̪ ɸ ɑ	s̪ ɜ r̪ ɸ ɜ	s̪ ɜ r̪ f ɜ	
391	g r̪ ɜ x m o	ɖʐ ɜ x m o	g r̪ ɜ x m o	ʐ ɜ x m o	ɖʐ ɜ x m o	ɖʐ ɜ x m o	g r̪ ɜ x m o
173			gʲ ɜ̃ l ɜ				gʲ ɜ̃ l ɜ
742	tθʰ o	tθʰ o	tθʰ o	tθʰ o	tθʰ o	tθʰ o	
197	k ɪ m b o q	k i ŋ b o q					
153				kʰ ɜ k t̪ ɜ t̪ s̪	kʰ ɑ k t̪ ɜ t̪ s̪	kʰ ɜ k t̪ ɜ t̪ s̪	
1456	h ɜ s̪ k e	h ɜ s̪ k e	h ɜ s̪ k e	h ɜ s̪ k e	h ɜ s̪ k e	h ɜ s̪ k e	
1159	t̪ r̪ ɜ ŋ		t̪ r̪ ɜ ŋ	t̪ r̪ ɜ ŋ	t̪ r̪ ɜ ŋ	t̪ r̪ ɜ ŋ	ʈ ɑ ŋ
136	s̪ o ŋ s̪	s̪ õ s̪	s̪ o ŋ	s̪ o ŋ	s̪ õ s̪	s̪ o ŋ s̪	s̪ o ŋ
65	k o s̪	k o s̪	k o s̪	k o s̪	k o s̪	k o s̪	k o s̪
1676	kʰʲ ɑ ŋ	kʰʲ ɑ ŋ	kʰʲ ɜ ŋ	kʰʲ ɑ ŋ	kʰʲ ɑ ŋ	kʰʲ ɑ ŋ	
1553	ʑ ɜ k ʊ r̪ d u n̪						ʊ ɾ d u n̪
853		ɪ ɕ ɪ n̪	ɪ ɕ ɪ n̪	ɜ ɕ i n̪	i ɕ ɪ n̪	i ɕ ɪ n̪	
310	tɕʰ ɜ q s̪	tɕʰ ɜ q p o	tɕʰ ɜ q	tɕʰ ɜ q p o	tɕʰ ɜ q p o	tɕʰ ɜ q p o	tɕʰ ɜ q p o
1364		ɸ tɕ u	ɸ tɕ u	ɸ tɕ u	ɸ tɕ u	p ɕ tɕ u	
1389	kʰ o ŋ	kʰ o ŋ	kʰ o ŋ	kʰ o ŋ	kʰ o ŋ	kʰ o ŋ	kʰ o ŋ
797		x ɛ n̪	xʲ ʊ n̪	xʲ u n̪	x ɛ n̪	xʲ ʊ n̪	
1397	d̪ʲ u	d̪ʲ u		d̪ʲ u	d̪ʲ u	d̪ʲ u	d̪ʲ u
618	ɣ ɑ	ɣ ɑ	ɣ ɑ	ɣ ɑ	ɜ ɣ ɑ	ɣ ɑ	
73	ɾ d ɜ p s̪	ɾ d ɜ p s̪	ɾ d ɜ p s̪		ɾ d ɜ p s̪	ɾ d ɜ p s̪	ɾ d ɜ p s̪
584		z̪ ɛ r̪ m õ ŋ		z̪ ɛ r̪ m o ŋ	z̪ ɛ r̪ m õ ŋ	z̪ ɛ r̪ m õ ŋ	s̪ ɛ r̪ m õ
1379	d̪ʲ u n̪	d̪ʲ u n̪		d̪ʲ u ŋ	d̪ʲ u	d̪ʲ u ŋ	d̪ʲ u
1363	h tɕ u						h s̪ tɕ u
1348		ʑ ɪ n̪ d o	ʑ ɪ g d o	dʑ i n̪ d o	ʑ ɪ n̪ d o	ʑ ɪ n̪ d o	
213	t̪ʰ ɜ l tθ ɪ ɾ	t̪ʰ ɜ l tθ i ɾ		t̪ʰ ɜ l tɕ ɪ t̪	t̪ʰ ɜ l tɕ ɪ t̪	t̪ʰ ɜ l tɕ ɪ t̪	
328	k ɜ ɽ ɜ m		k ɜ ɽ ɜ m	k ɜ ɽ ɜ m	k ɜ ɽ ɜ m	k ɜ ɽ ɜ m	
1135	ɾ z̪ ɜ	ɣ z̪ ɜ	ɣ z̪ ɜ				
229	tɕ ɜ ŋ m ɛ n̪	tɕ ɜ ŋ m ɛ n̪	tɕ ɑ ŋ m ɛ n̪	tɕʲ ɑ ŋ m ɛ n̪	tɕ ɑ ŋ m ɛ n̪	tɕ ɑ ŋ m ɛ n̪	
781		ɖʐ i		ʐ i	ɖʐ i	ɖʐ i	
1617	s̪ u	s̪ u	s̪ u	s̪ u	s̪ u	s̪ u	s̪ u
422	l o x s̪ o	l o x s̪ o	l o x s̪ o	l o x s̪ o	l o x s̪ o	l o x s̪ o	l o x s̪ o
342	g o b i	g o b i	ɸ u l g o b i				pʰ u l g o b i
25	z̪ o s̪	z̪ ʊ s̪	z̪ ʊ s̪	z̪ ʊ s̪	z̪ ʊ s̪	z̪ ʊ s̪	z̪ o s̪
189	g ɑ ŋ m ɑ	g ɑ ŋ m ɑ	g ɑ̃ m ɑ	g ɑ̃ ŋ m ɜ	g ɑ ŋ m ɜ	g ɑ ŋ m ɜ	g ɑ ŋ m ɑ
311	tɕʰ ɜ x s̪				tɕʰ ɜ x s̪		
1488	tɕ o ŋ ɛ s̪	tɕ o ŋ ɜ s̪	tɕ o ŋ ɜ s̪	tɕ o ŋ ɜ s̪	tɕ o ŋ ɜ s̪	tɕ o ŋ ɜ s̪	tɕ o ŋ ɜ s̪
1627	tɕ ʊ ŋ m ɜ	tɕ ʊ ŋ m ɜ					
1255	t̪ r̪ u k	tɕ u k	t̪ r̪ u kʰ	t̪ r̪ u k	t̪ r̪ u k	t̪ r̪ u k	ʈ u k
49	ɕ ɪ s̪	ɕ i s̪	ɕ i s̪	ɕ i s̪	ɕ ɪ s̪	ɕ i s̪	ɕ i s̪
17	s̪ k o m s̪	s̪ k o m s̪	s̪ k o m s̪	s̪ k o m s̪	s̪ k o m s̪	s̪ k o m s̪	s̪ k o m s̪
767	ɜ ɕ i p ɑ	ɜ ɕ i p ɑ	ɜ ɕ i p ɑ	ɜ ɕ i p ɜ	ɜ ɕ i p ɑ	ɜ ɕ i p ɜ	
946	kʰ ɑ	kʰ ɑ	kʰ ɑ				kʰ ɑ
996	tθʰ ɜ n̪	tθʰ ɜ n̪	tθʰ ɜ n̪	tθʰ ɜ n̪	tθʰ ɜ n̪	tθʰ ɜ n̪	tθʰ ɜ n̪
1347	s̪ ȵ ɜ m ɜ						ɕ ȵ ɑ ŋ m ɑ
1521				ʐ o ŋ	ɖʐ o ŋ	ɖʐ o ŋ	
938	ɜ ŋ ɑ						ɜ m ɑ
743	t̪ʰ r̪ ʊ n̪ m o						ʈʰ o n̪ m o
1440	d̪ ɪ r̪ i ŋ	d̪ ɪ r̪ i ŋ	d̪ ɪ r̪ i ŋ	d̪ ɪ r̪ i ŋ	d̪ ɪ r̪ i ŋ	d̪ ɪ r̪ i ŋ	d̪ ɪ r̪ i ŋ
1282	ts̪ u n̪ tθ e	ts̪ u n̪ tθ e	ts̪ u m tθ e	ts̪ u n̪ tθ e	ts̪ u n̪ tθ ɛ	ts̪ u n̪ tθ e	ts̪ u m tθ e
358	pʰ r̪ u	pʰ r̪ u	pʰ r̪ u		p l̥ u	p l̥ u	pʰ r̪ u
957				dʑʲ ɑ g ɜ t̪	dʑ ɑ g ɜ t̪	dʑ ɑ g ɜ t̪	
1065	tɕ i k	tɕ ɪ k	tɕ ɪ k	tɕ ɪ k	tɕ i k	tɕ i k	tɕ i k
496	kʰ r̪ i õ ŋ	t̪ʰ r̪ i m o ŋ		ʈʂ ɪ m o k	t̪ʰ r̪ ɪ m o ŋ	t̪ʰ r̪ ɪ m o ŋ	
980	kʰ ɜ p	kʰ ɜ p	kʰ ɜ p	kʰ ɜ p	kʰ ɜ p	kʰ ɜ p	
939		ɑ ŋ o	ɜ m o	ɑ ŋ o	ɑ ŋ o	ɑ ŋ o	
661	b o ŋ o	b o ŋ o	b o ŋ o	b o ŋ o	b o ŋ o	b o ŋ o	b o ŋ o
642	m e β̞ ɑ	m e β̞ ɑ	m e β̞ ɑ	m e β̞ ɑ		m e β̞ ɑ	
506	tɕ u s̪ tɕ ɪ k	tɕ u s̪ tɕ ɪ k	tɕ u s̪ tɕ ɪ k	tɕ u s̪ tɕ ɪ k	tɕ u s̪ tɕ i k	tɕ u s̪ tɕ i k	tɕ u s̪ tɕ i k
1207	p ɑ j u	p ɑ j u	p ɑ j u	p ɑ j u	p ɑ j u	p ɑ j u	
482				p ɑ ɣ ɜ n̪		p ɑ ɣ ɜ n̪	
828	ɾ i ŋ b o	ɾ i ŋ m o	ɾ ĩ m o	ɾ i ŋ m o	ɾ i ŋ m o	ɾ i ŋ m o	ɾ i ŋ m o
1577	k r̪ o		k r̪ o				k r̪ o
1684	kʰ i t̪ ɜ ŋ	kʰ i d ɜ ŋ	kʰ ɪ t̪ ɜ ŋ	kʰ i d ɜ ŋ	kʰ i t̪ ɜ ŋ	kʰ i t̪ ɜ ŋ	
1057	ɜ ɕ e	ɑ ɕ e	ɜ ɕ e	ɑ ɕ e	ɜ ɕ ɛ	ɜ ɕ e	
1380			d̪ i		d̪ i	d̪ i	
9	l̪ t̪ o k s̪	l̪ t̪ o k s̪	l̪ t̪ o k s̪	l̪ t̪ o k s̪	l̪ t̪ o k s̪	l̪ t̪ o k s̪	l̪ t̪ o k s̪
1239	m o	m o	m o	m o	m o	m o	
245	t̪ʰ u ɾ	t̪ʰ o r̪ u	t̪ʰ u r̪ u	t̪ʰ u r̪ u	t̪ʰ u r̪ u	t̪ʰ u ɾ	t̪ʰ u ɾ̥
111	ŋ ĩ t̪ ɑ̃ s̪	ŋ ĩ t̪ õ s̪	ŋ ĩ t̪ ɑ̃ s̪	ŋ ĩ t̪ ɜ̃ s̪	ȵ ĩ t̪ ʔ õ s̪	ȵ ĩ t̪ ɜ̃ s̪	ŋ ĩ t̪ ɑ̃ s̪
685	ɾ ɑ l	ɾ ɑ l	ɾ ɑ l	ɾ ɑ l	ɾ ɑ l	ɾ ɑ l	
1	m i n̪ s̪	m i n̪ s̪	m ɪ n̪ s̪	m i n̪ s̪	m ɪ n̪ s̪	m ɪ n̪ s̪	
1496	ȵ i ɕ u	ȵ i ɕ u	ȵ i ɕ u	ȵ i ɕ u	ȵ i ɕ u	ȵ i ɕ u	ŋ i ɕ u
374	r̪ ɜ s̪	ɾ ɜ s̪	ɾ ɜ s̪			ɾ ɜ s̪	ɾ ɜ s̪
343				k ɜ ɽ ɜ m	k ɜ ɽ ɜ m	k ɜ ɽ ɜ m	
600	pʰ u	pʰ u					
1578		ʈʂ o		ʈʂ o	ʈʂ o	ʈʂ o	
1405	ɾ i ŋ ɑ	ɾ i ŋ ɑ				ɾ i ŋ ɑ	
1432	s̪ u m	s̪ u m	s̪ u m	s̪ u m	x s̪ u m	s̪ u m	s̪ u m
1415	d̪ o n̪	d̪ ɛ n̪	d̪ e	d̪ o ŋ	d̪ o ŋ	d̪ o ŋ	d̪ e
253	tɕ o ɣ o	tɕ o ɣ o	tɕ o ɣ o	tɕ o ɣ o	tɕ o ɣ o	tɕ o ɣ o	tɕ o ɣ o
88	ɾ gʲ u k s̪	b gʲ u k s̪	β gʲ ʊ k s̪	b gʲ u k s̪	β gʲ u k s̪	b gʲ u k s̪	
1700	n̪ o ŋ o					n̪ o ŋ o	n̪ õ ŋ o
447	s̪ k ɜ m b o	s̪ k ɜ m b o	s̪ k ɜ m b o	s̪ k ɜ m b o	s̪ k ɜ m b o	s̪ k ɜ m b o	s̪ k ɜ m b o
154		s̪ ʊ t̪ ʊ p s̪				s̪ o t̪ ɜ p s̪	t̪ʰ ɜ m p s̪
1167	s̪ u r̪ ʊ p	s̪ u r̪ ʊ p	x s̪ ʊ r̪ u p	s̪ u r̪ ʊ p	x s̪ u r̪ ʊ p	s̪ u r̪ ʊ p	
80	p r̪ ɛ t̪ l ɑ	p r̪ ɛ l ɑ			p r̪ ɛ l ɑ		
181	pʰ ɪ r̪ o	pʰ i r̪ o	pʰ r̪ i d o	f i t̪ r̪ o	pʰ i r̪ o	pʰ i t̪ r̪ o	pʰ i tʰ o q
1406		tθʰ o q	tθʰ o q	tθʰ o q	tθʰ o q	tθʰ o q	
82				ɾ ɪ l s̪		ɾ ɪ l s̪	
1668	j ɑ ŋ	j ɑ ŋ	j ɑ ŋ	j ɑ ŋ	j ɑ ŋ	j ɑ ŋ	j ɑ ŋ
1215	ts̪ o x s̪ ɑ tθ o x	ts̪ o x tθ o x	ts̪ o q s̪ ɑ tθ o q s̪	ts̪ o x s̪ ɑ tθ o x s̪	ts̪ o q s̪ ɑ tθ o q s̪	ts̪ o q s̪ ɑ tθ o q s̪	ts̪ o q s̪ ɑ tθ o q s̪
144	pʰ u ɾ s̪	pʰ u ɾ s̪	pʰ u ɾ s̪	pʰ u ɾ s̪	pʰ u ɾ s̪	pʰ u ɾ s̪	pʰ u ɾ s̪
768	d̪ ɑ x p o	d̪ ɑ x p o		d̪ ɜ x p o	d̪ ɑ x ɸ o	d̪ ɜ x p o	d̪ ɑ k p o
473	b i ɜ p ʑ ʊ n̪	b i ɜ m ʑ ʊ n̪	b i ɜ p ʑ ʊ n̪	b i ɜ p dʑ ʊ n̪	b i ɜ p ʑ ʊ n̪	b i ɜ p ʑ ʊ n̪	
1012	t̪ r̪ o b ɜ ɾ	tɕ o b ɜ ɾ	t̪ r̪ o b ɜ ɾ	t̪ r̪ o b ɑ ɾ	t̪ r̪ o b ɜ ɾ	t̪ r̪ o b ɜ ɾ	t̪ r̪ o b ɑ ɾ
1537	ŋ ɑ j ɑ	ŋ ɑ j ɑ	ŋ ɑ j ɑ	ŋ ɑ j ɑ	ŋ ɑ j ɑ	ŋ ɑ j ɑ	
199				ʈʂ ɪ m o q	ʈʂ ɪ m o q	ʈʂ ɪ m o q	
972	ȵ i m o ɾ	ȵ i m o ɾ	ȵ i m o ɾ	ȵ i m o ɾ	ȵ i ŋ o ɾ	ȵ i m o ɾ	ȵ i m o ɾ̥
174				j ɑ ɾ	j ɑ ɾ	j ɜ ɾ	
41	õ s̪	õ s̪	õ s̪	õ s̪	õ s̪	o ŋ s̪	õ s̪
1136				p ɜ r̪ ɜ k z̪ ɜ	p ɜ ɽ ɑ ɣ z̪ ɑ	pʰ ɜ ɽ ɜ k z̪ ɜ	p ɑ r̪ ɑ z̪ β̞ ɑ
1585	n̪ ɑ m	n̪ ɑ m	n̪ ɑ m	n̪ ɑ m	n̪ ɑ m	n̪ ɑ m	n̪ ɑ m
531	t̪ʰ ɜ q r̪ i ŋ	t̪ʰ ɜ x r̪ i ŋ	t̪ʰ ɜ q r̪ i ŋ	t̪ʰ ɜ q r̪ i ŋ	t̪ʰ ɑ ɣ r̪ i ŋ	t̪ʰ ɜ q r̪ i ŋ	t̪ʰ ɑ q r̪ i ŋ s̪
261	n̪ ɑ q p o	n̪ ɑ q p o	n̪ ɜ q p o	n̪ ɑ q p o	n̪ ɑ q p o	n̪ ɜ q p o	n̪ ɑ q p o
400			b ɜ l ɜ ŋ			b ɜ l ɜ ŋ	
564	ɾ ɑ						ɾ ɑ
279		ʊ ɾ g o	ʊ ɾ g o	ɾ g o	ʊ ɾ g o	ɾ g o	ʊ ɾ g o
104	t̪ʰ o ŋ s̪	t̪ʰ õ s̪	t̪ʰ o ŋ s̪	t̪ʰ o ŋ	t̪ʰ o ŋ	t̪ʰ o ŋ s̪	
1520	g ʊ r̪ o ŋ	g r̪ o ŋ	g ʊ r̪ o ŋ			g ʊ r̪ o ŋ	
947				kʰ ɜ p ɜ k	kʰ ɑ b ɜ k	kʰ ɑ b ɜ k	
1561	ɕ e r̪ p ɑ	ɕ ɪ r̪ p ɑ	ɕ ɜ ɕ p ɜ	ɕ ɛ r̪ ɸ ɑ	x ɕ ɛ r̪ ɸ ɜ	x ɕ ɛ r̪ ɸ ɜ	ɕ e r̪ p ɑ
455	t̪ʰ ɜ l d u m	t̪ʰ ɜ l d u m	t̪ʰ ɜ l d u m	t̪ʰ ɜ l d u m	t̪ʰ ɜ l d u m		t̪ʰ ɜ l d u m
163	ŋ ɑ	ŋ ɑ	ŋ ɑ	ŋ ɑ	ŋ ɑ	ŋ ɜ	ŋ ɑ
726	l̪ tɕʰ o	l̪ tɕʰ o	l̪ tɕʰ o	l̪ tɕʰ o	l̪ tɕʰ o	l̪ tɕʰ o	
573		s̪ ɛ n̪ m ɜ	s̪ ɛ n̪ m o	s̪ ɛ n̪ m o	s̪ ɛ n̪ m o	s̪ ɛ n̪ m o	
1602			g ɜo	g ɜo			
1073	ɾ gʲ ɑ	b gʲ ɜ	β gʲ ɜ	β gʲ ɜ	β gʲ ɜ	b gʲ ɜ	ɾ gʲ ɜ
481		b ɛ ŋ g ɜ n̪	b ɛ ŋ g ɜ n̪		b ɛ ŋ g ɜ n̪		
1593	g ɑ ɾ	g ɑ	g ɑ ɾ	g ɑ ɾ	g ɑ ɾ	g ɑ ɾ	g ɑ ɾ
329	b ɜ n̪ d	b ɜ n̪ d	b ɜ n̪ d				b ɜ n̪ d
57	t̪ʰ ũ ŋ s̪	t̪ʰ ũ s̪	t̪ʰ ũ s̪	t̪ʰ ũ ŋ s̪	t̪ʰ ũ s̪	t̪ʰ ũ ŋ s̪	t̪ʰ ũ s̪
1652	l o	l o	l o	l o	l o	l o	l oˑ
897					l z̪ ɑ	l z̪ ɑ	
1545	ŋ ɜ t̪ ɜ ŋ	ŋ ɜ t̪ ɜ ŋ	ŋ ɜ t̪ ɜ ŋ	ŋ ɑ d ɑ ŋ	ŋ ɜ t̪ ɜ ŋ	ŋ ɜ t̪ ɜ ŋ	ŋ ɜ t̪ ɜ ŋ
701	kʰ o	kʰ o	kʰ o	kʰ o	kʰ o	kʰ o	kʰ o
1143	m ɑ ɾ̥ p o	m ɑ r̪ p o	m ɜ ɕ p o	m ɑ r̪ ɸ o	m ɑ r̪ ɸ o	m ɑ r̪ ɸ o	m ɑ r̪ p o
888				ɕ ɛ r̪ i		ɕ ɛ r̪ i	
855	l̪ t̪ i m	l̪ ʈ i m					
812	j ɜ ŋ m o	j ɜ ŋ m o	j ɑ̃ m o	j ɑ ŋ m o	j ɑ ŋ m o	j ɑ ŋ m o	j ɑ̃ m o
214			t̪ʰ ɜ l b ɜ				t̪ʰ ɜ l b ɜ
1609	k ɑ r̪ p o	k ɑ r̪ p o	k ɜ ɕ p o	k ɑ r̪ ɸ o	k ɑ r̪ ɸ o	k ɑ r̪ ɸ o	k ɑ r̪ ɸ o
1184		h ɜ n̪ d o q	h ɜ n̪ d o q	h ɜ n̪ d o q	h ɜ n̪ d o q	h ɜ n̪ d o q	h ɑ n̪ d o q
413	ʑ ɜ q	dʑ ɜ q	ʑ ɜ q	ʑ ɜ q	ʑ ɜ q	ʑ ɜ q	ʑ ɜ q
1701		s̪ t̪ r̪ i ŋ m o	s̪ t̪ r̪ i ŋ m o	s̪ t̪ r̪ i ŋ m o	s̪ t̪ r̪ i ŋ m o	s̪ t̪ r̪ i ŋ m o	
